id,created_at,favorite_count,retweet_count,url,text
1566262126179545088,2022-09-04 03:09:25+00:00,8,0,https://twitter.com/i/web/status/1566262126179545088,GBPUSD 1000 Anyone
1566261846155223041,2022-09-04 03:08:18+00:00,2,0,https://twitter.com/i/web/status/1566261846155223041,I pushed this thinking off before but I can see the logic
1566261662461464577,2022-09-04 03:07:34+00:00,10,0,https://twitter.com/i/web/status/1566261662461464577,25x the size of the US housing market and people are refusing to pay the mortgage because prices are falling This is going to hurt
1566238905870852096,2022-09-04 01:37:09+00:00,0,0,https://twitter.com/i/web/status/1566238905870852096,Thanks
1566195302750556160,2022-09-03 22:43:53+00:00,8,0,https://twitter.com/i/web/status/1566195302750556160,SFIX I remember this IPO they were the rage lots of FOMO in the apparel industry Now look The pitch book is still online find it and compare to actual
1566194199027798017,2022-09-03 22:39:30+00:00,18,0,https://twitter.com/i/web/status/1566194199027798017,MDT any insight here Seems interesting Thought it was too expensive at 115 but might need to check in again Thanks all
1566191380333883393,2022-09-03 22:28:18+00:00,0,0,https://twitter.com/i/web/status/1566191380333883393,WHYUNO Their plan is the build a brand identity for the outdoorsman I think that space has maintained a premium for some time and might be interesting long term
1566185446614319104,2022-09-03 22:04:43+00:00,3,0,https://twitter.com/i/web/status/1566185446614319104,grow Co I need to make a new video Well see how it shacks out
1566062396694622208,2022-09-03 13:55:46+00:00,5,0,https://twitter.com/i/web/status/1566062396694622208,callputwri Co Wait for them to look expensive
1566060553474154496,2022-09-03 13:48:26+00:00,0,0,https://twitter.com/i/web/status/1566060553474154496,Co Lots of the factors listed were known last year when the company released their capital investment plan however the company has slot 85B in value over the last year At some point the slow growth CAPEX competition is priced in and progress on their plan could surprise
1566055767236481024,2022-09-03 13:29:25+00:00,6,0,https://twitter.com/i/web/status/1566055767236481024,A good read on the state of the US labor market The Labor Shortage Will Get Worse and May Last for Decades
1566051702825816065,2022-09-03 13:13:16+00:00,1,0,https://twitter.com/i/web/status/1566051702825816065,Co The company makes 10B in free cash and can afford the capital upgrades coming The 4x has already discounted the CAPEX investment and slow growth Its a cheap company
1566045377928712192,2022-09-03 12:48:08+00:00,0,0,https://twitter.com/i/web/status/1566045377928712192,Co There is no 1 metric that will tell you to invest or not Its simply an indication and yes you need factor in capex
1565892137283031041,2022-09-03 02:39:13+00:00,85,6,https://twitter.com/i/web/status/1565892137283031041,INTC 35B of annual EBITDA last three year avg always profitable 10B Free cash flow Yielding 7 Yes heavy investment is need but they can pay for it Only 4x EV EBITDA Priced for fire sale Co should take private Unreal
1565890863787495425,2022-09-03 02:34:09+00:00,12,1,https://twitter.com/i/web/status/1565890863787495425,UPWK 22B market cap after falls of 60 and STILL 500x free cash flows of only 4MM thats it 4 million not worth being public negative Net Income and EBITDA for many years Yet still giving away 50MM annual stock based comp
1565888826370715648,2022-09-03 02:26:03+00:00,29,1,https://twitter.com/i/web/status/1565888826370715648,SHOP collapse and might be reasonable However lost 200MM in 6 mo 2022 spending 750MM on stock based comp FY 2022 guidance SGampA cuts are needed like SNAP Plus side customers and revenue still growing Need to review this one
1565510408185663490,2022-09-02 01:22:21+00:00,52,1,https://twitter.com/i/web/status/1565510408185663490,NVDA still 40x EV EBITDA more run to fall
1565307448981786625,2022-09-01 11:55:52+00:00,0,0,https://twitter.com/i/web/status/1565307448981786625,ouch well California is calling for rolling blackouts during peak times So our price hasnt moved much recently we just dont have any energy But seriously I think the blackouts are in less populated parts of the state
1565164451568881664,2022-09-01 02:27:39+00:00,5,0,https://twitter.com/i/web/status/1565164451568881664,Deviation
1564996704767598593,2022-08-31 15:21:05+00:00,12,0,https://twitter.com/i/web/status/1564996704767598593,This should be good for TCNNF Nothing like drugs and alcohol during a recession
1564991391540776965,2022-08-31 14:59:58+00:00,8,0,https://twitter.com/i/web/status/1564991391540776965,stocks are experiencing a Market Multiple Contraction as equity capital is removed from the system Wonderful companies will fall in value even as earnings grow dividend louisvuitton hennessy tagheuer dior TiffanyAndCo
1564978333430951937,2022-08-31 14:08:05+00:00,2,0,https://twitter.com/i/web/status/1564978333430951937,Transactions are slower in the real estate market and price discover takes longer The slow down and bottom will takes years
1564976984244989955,2022-08-31 14:02:43+00:00,0,0,https://twitter.com/i/web/status/1564976984244989955,agreed its not what it once was but is it worth more than its current price
1564768698807726081,2022-08-31 00:15:04+00:00,1,0,https://twitter.com/i/web/status/1564768698807726081,No not for this one
1564758096286584832,2022-08-30 23:32:56+00:00,52,7,https://twitter.com/i/web/status/1564758096286584832,WBD is projecting 12B of EBITDA in fy 2022 thats 7x EV EBITDA At a 60 conversation rate its 72B in free cash or 23 free cash yield at current price Might take a year or so to get there but Im in no rush
1564752487319343105,2022-08-30 23:10:39+00:00,35,4,https://twitter.com/i/web/status/1564752487319343105,Amazing brand with growing revenue of 15 YoY good Ebitda and strong free cash flow selling for sub 10x EV EBITDA Oh and net debt is Zero Ya thank you Yeti value
1564750070091698177,2022-08-30 23:01:03+00:00,0,0,https://twitter.com/i/web/status/1564750070091698177,news say nothing while speaking
1564744102331068417,2022-08-30 22:37:20+00:00,2,0,https://twitter.com/i/web/status/1564744102331068417,Japan has a population growth problem
1564743304595382272,2022-08-30 22:34:09+00:00,1,1,https://twitter.com/i/web/status/1564743304595382272,OR V MA AXP PYPL just saying its coming
1564742940940873728,2022-08-30 22:32:43+00:00,12,0,https://twitter.com/i/web/status/1564742940940873728,Posted HANES HBI Cash Flow 1 Pager Attractive long term capital appreciation potential with a 6 dividend yield while you wait Should cash flows return in a few years the free cash flow yield is 14 Check out the full profile here
1564742185907396609,2022-08-30 22:29:43+00:00,2,0,https://twitter.com/i/web/status/1564742185907396609,ristovski yes definite long term capital appreciation potential here AND you collect a 6 dividend while you wait
1564730843276251136,2022-08-30 21:44:38+00:00,1,0,https://twitter.com/i/web/status/1564730843276251136,working on the 1 pager now
1564730789001981952,2022-08-30 21:44:26+00:00,4,0,https://twitter.com/i/web/status/1564730789001981952,ristovski the commentary seems to be around inflation and a high level of international sales with a strong dollar weaking top line USD revenue growth But that seems short sighted to me
1564729487509442561,2022-08-30 21:39:15+00:00,1,0,https://twitter.com/i/web/status/1564729487509442561,The drop in cash is from an inventory investment should rebound when the inventory sells through
1564728023991013377,2022-08-30 21:33:26+00:00,6,0,https://twitter.com/i/web/status/1564728023991013377,Most of the TTM fall in Hans Brand free cashflow is an investment in inventory and no one time in nature Cash should rebound as this inventory is sold through 10Q 6 mo 540MM INVESTMENT highlighted
1564726181148049408,2022-08-30 21:26:07+00:00,1,0,https://twitter.com/i/web/status/1564726181148049408,What was last full year
1564723252651446272,2022-08-30 21:14:29+00:00,51,4,https://twitter.com/i/web/status/1564723252651446272,Again 18 free cash yield I get that retail sales might fall this year but this is Calvin Klein and Tommy Hilfiger Lets check my math here CFO CAPEX market cap
1564722163570970624,2022-08-30 21:10:09+00:00,27,0,https://twitter.com/i/web/status/1564722163570970624,Ok this is getting nuts Im getting 18 free cash yield Can someone check my quick math CFO CAPEX market cap
1563917667106377728,2022-08-28 15:53:22+00:00,10,0,https://twitter.com/i/web/status/1563917667106377728,Double your AND make 6 dividend while you wait ATampT post HBO spinoff is an attractive value stock StockMarket ValueInvesting MONEY retirement growth
1563915274054615040,2022-08-28 15:43:52+00:00,1,0,https://twitter.com/i/web/status/1563915274054615040,DGI Looks like a value stock to me
1563306139676160007,2022-08-26 23:23:23+00:00,1,0,https://twitter.com/i/web/status/1563306139676160007,DGI its now cheaper than its been in 10 years
1563300149979254784,2022-08-26 22:59:35+00:00,19,1,https://twitter.com/i/web/status/1563300149979254784,Dow down 1000 points The Shiller PE ratio says we have a long way to go
1563183132479594496,2022-08-26 15:14:35+00:00,0,0,https://twitter.com/i/web/status/1563183132479594496,
1563008975506812928,2022-08-26 03:42:33+00:00,3,0,https://twitter.com/i/web/status/1563008975506812928,Reducing fertilizer output lowers acreage yield and increases food prices the cycle continues
1562990678862225408,2022-08-26 02:29:51+00:00,5,0,https://twitter.com/i/web/status/1562990678862225408,So apparently an old fashioned is 20 at a nice restaurant in Los Angeles
1562452773320347656,2022-08-24 14:52:24+00:00,0,0,https://twitter.com/i/web/status/1562452773320347656,Just not sure when
1562452728072114181,2022-08-24 14:52:13+00:00,0,0,https://twitter.com/i/web/status/1562452728072114181,I think we are over due
1562428164009127947,2022-08-24 13:14:37+00:00,5,1,https://twitter.com/i/web/status/1562428164009127947,The man who called the Great Financial Crisis is calling for another one and owns only 1 stock investing stocks marketcrash savings cash stocks GOAT
1562425799369584640,2022-08-24 13:05:13+00:00,8,1,https://twitter.com/i/web/status/1562425799369584640,Global leverage as a to GDP is larger now then at the Great Financial Crisis we learned nothing from all the free money Holding cash is an option on the future never feel you have to be 100 invested
1562421677392142336,2022-08-24 12:48:50+00:00,2,0,https://twitter.com/i/web/status/1562421677392142336,Global risk Who fills the gap
1561556454854733824,2022-08-22 03:30:45+00:00,0,0,https://twitter.com/i/web/status/1561556454854733824,Slowly
1561468767967649792,2022-08-21 21:42:19+00:00,9,0,https://twitter.com/i/web/status/1561468767967649792,The down market is presenting us with opportunities Check out the summary just published to the cash flow club
1561031350060126209,2022-08-20 16:44:11+00:00,0,0,https://twitter.com/i/web/status/1561031350060126209,Agreed We have not been allowed to have a natural business cycle with every slow down receiving greater amounts of stimulus which does not allow the younger generation to buy assets at reduced prices
1561022667800514560,2022-08-20 16:09:41+00:00,0,0,https://twitter.com/i/web/status/1561022667800514560,However if you buy assets that produce cashflow and are essential to the economy then their real value grows with the increasing monetary base defending your capitals purchasing power How is that giving up property rights
1561013239818792960,2022-08-20 15:32:13+00:00,0,0,https://twitter.com/i/web/status/1561013239818792960,Its the purchasing power thats changing not your rights to ownership
1560597146868412423,2022-08-19 11:58:48+00:00,5,0,https://twitter.com/i/web/status/1560597146868412423,Inflation less property right Then deflation more property rights No I dont think your argument holds Thanks for playing
1560592934260486144,2022-08-19 11:42:04+00:00,0,0,https://twitter.com/i/web/status/1560592934260486144,callputwri DGI Thanks for sharing Thats incredible
1560359258763300865,2022-08-18 20:13:32+00:00,0,0,https://twitter.com/i/web/status/1560359258763300865,McHaggis DGI Thats what I thought And there is a lag between the futures price and the eventual spot price More to come unfortunately
1560358450575462400,2022-08-18 20:10:19+00:00,1,0,https://twitter.com/i/web/status/1560358450575462400,DGI Thats very helpful thanks
1560304759352897537,2022-08-18 16:36:58+00:00,1,0,https://twitter.com/i/web/status/1560304759352897537,ldev DGI Interesting Maybe a lagging increase
1560304398428819456,2022-08-18 16:35:32+00:00,1,0,https://twitter.com/i/web/status/1560304398428819456,Action21 DGI Indeed Ive seen that clip He called that one
1560297215289020417,2022-08-18 16:06:59+00:00,0,0,https://twitter.com/i/web/status/1560297215289020417,Action21 DGI Moms dirty secret was Russian energy
1560296711796297728,2022-08-18 16:04:59+00:00,1,0,https://twitter.com/i/web/status/1560296711796297728,all case dependent CRM for example paid 28B in SBC on CFO of 60B last FY Adjusted CFO is 32B a 46 reduction That seems excessive to me
1560294627432747008,2022-08-18 15:56:42+00:00,1,0,https://twitter.com/i/web/status/1560294627432747008,Action21 DGI for what its worth Texas power prices spike during a bad winter a ice storm and a few power companies poorly hedged went BK when customers couldnt pay the for power they used
1560293732854812673,2022-08-18 15:53:09+00:00,20,2,https://twitter.com/i/web/status/1560293732854812673,Love the pic Adjusting the CFO to remove the stock based comp is an eye opener FYI
1560292946351570944,2022-08-18 15:50:01+00:00,1,0,https://twitter.com/i/web/status/1560292946351570944,VC DGI thanks
1560292022086340608,2022-08-18 15:46:21+00:00,3,0,https://twitter.com/i/web/status/1560292022086340608,The French economy is not loving this Example a EUR 50 monthly electricity bill in 2020 is now EUR 1400 monthly Thats going to kill consumer spending Anyone in EUR can confirm this Whats the mood on the ground inflation DGI
1560290223270965248,2022-08-18 15:39:12+00:00,7,0,https://twitter.com/i/web/status/1560290223270965248,This is getting good Whats the over under on 30 drop in realestate prices from the top Ill take the over Crash interestrates
1560287256685920256,2022-08-18 15:27:25+00:00,8,0,https://twitter.com/i/web/status/1560287256685920256,oh man I needed a laugh today Thanks
1559918484498157568,2022-08-17 15:02:03+00:00,8,0,https://twitter.com/i/web/status/1559918484498157568,If youre lucky enough to increase your income with inflation youll also move into a new tax bracket because the IRS doesnt adjust the income tax brackets for inflation So not only are you defined your purchasing power from food energy and house but also the tax man
1559915089586597890,2022-08-17 14:48:33+00:00,4,0,https://twitter.com/i/web/status/1559915089586597890,
1559914646366130176,2022-08-17 14:46:48+00:00,7,0,https://twitter.com/i/web/status/1559914646366130176,LOW lowes posted mixed Q2 earnings after an ATH 2021 watch for margin compression and slowing sales growth as the realestate market slows The ATH EBITDA margin is a big risk to current investors cashflow
1559912910230818818,2022-08-17 14:39:54+00:00,7,1,https://twitter.com/i/web/status/1559912910230818818,QSR owns 30000 Burgerking TimHortons popeyes Firehouse restaurants Learn how to value a multilocation business and generate strong cashflow dividends StocksToBuy Growth investingnews
1559688040641048576,2022-08-16 23:46:21+00:00,3,0,https://twitter.com/i/web/status/1559688040641048576,To be fair to BBBY cash flow from operations isnt what it once was they are not on strong footing
1559565904106496006,2022-08-16 15:41:01+00:00,3,0,https://twitter.com/i/web/status/1559565904106496006,it continues
1558443529004879873,2022-08-13 13:21:06+00:00,1,0,https://twitter.com/i/web/status/1558443529004879873,Charter Communications CHTR checking that revenue growth box stocks investing cashflow chartercommunications
1557890989733253120,2022-08-12 00:45:30+00:00,1,0,https://twitter.com/i/web/status/1557890989733253120,As a general comment I prefer ROIC more than ROE Looking at the total capital invested in the business is more valuable than only the common equity
1557756662068391938,2022-08-11 15:51:44+00:00,0,0,https://twitter.com/i/web/status/1557756662068391938,
1557755004269735936,2022-08-11 15:45:09+00:00,8,1,https://twitter.com/i/web/status/1557755004269735936,americanexpress AMEX AXP Stock Review I looked at 20 years of historical data and 3 market downturns Check out this stalwart of cash generation dividend stock investing cashflow
1557349589576888328,2022-08-10 12:54:10+00:00,1,0,https://twitter.com/i/web/status/1557349589576888328,Many other cheaper retails plays than this one
1557205573120061440,2022-08-10 03:21:54+00:00,7,0,https://twitter.com/i/web/status/1557205573120061440,Speechless
1556957344675897344,2022-08-09 10:55:32+00:00,2,0,https://twitter.com/i/web/status/1556957344675897344,An army
1556739255401168902,2022-08-08 20:28:55+00:00,1,0,https://twitter.com/i/web/status/1556739255401168902,adding to inflation
1555007920860979201,2022-08-04 01:49:13+00:00,3,0,https://twitter.com/i/web/status/1555007920860979201,Crazy times
1554910153836793863,2022-08-03 19:20:44+00:00,9,1,https://twitter.com/i/web/status/1554910153836793863,Charter Communications CHTR has growing earnings buying back shares and seems undervalued a possible Trifecta
1553379085681709056,2022-07-30 13:56:49+00:00,2,0,https://twitter.com/i/web/status/1553379085681709056,
1552827135433158656,2022-07-29 01:23:33+00:00,2,0,https://twitter.com/i/web/status/1552827135433158656,Yes
1552825635814330368,2022-07-29 01:17:36+00:00,0,0,https://twitter.com/i/web/status/1552825635814330368,so frustrating
1552299610646884352,2022-07-27 14:27:22+00:00,0,0,https://twitter.com/i/web/status/1552299610646884352,He showed up on my feed and had to call out the hypocrisy
1552090994543185921,2022-07-27 00:38:24+00:00,1,0,https://twitter.com/i/web/status/1552090994543185921,did you buy those shorts with USD or Bitcoin
1552090511820804096,2022-07-27 00:36:29+00:00,4,0,https://twitter.com/i/web/status/1552090511820804096,I like both companies
1552083743220740096,2022-07-27 00:09:35+00:00,1,0,https://twitter.com/i/web/status/1552083743220740096,wow
1550841181252173825,2022-07-23 13:52:05+00:00,1,0,https://twitter.com/i/web/status/1550841181252173825,Completely disconnected from reality
1550619029991145472,2022-07-22 23:09:20+00:00,9,1,https://twitter.com/i/web/status/1550619029991145472,I couldnt resist
1550618479799123968,2022-07-22 23:07:09+00:00,5,1,https://twitter.com/i/web/status/1550618479799123968,Snap had revenue of 1000 million of revenue in the March Q and paid the employees 275 million in stock based comp Thats 275 of REVENUE in Stock Comp for the math challenged On top of their salaries SNAP is headed for BK and restructuring
1550372427250552832,2022-07-22 06:49:25+00:00,3,0,https://twitter.com/i/web/status/1550372427250552832,
1548869553928622080,2022-07-18 03:17:32+00:00,0,0,https://twitter.com/i/web/status/1548869553928622080,Exactly
1548777303852740608,2022-07-17 21:10:58+00:00,2,0,https://twitter.com/i/web/status/1548777303852740608,Thanks Where do they get weekly sales data The per store data looks good a little softer but still good
1547744415992537092,2022-07-15 00:46:39+00:00,9,1,https://twitter.com/i/web/status/1547744415992537092,Inflation is a tax
1547744012844408835,2022-07-15 00:45:03+00:00,7,3,https://twitter.com/i/web/status/1547744012844408835,look what one persons policy started and lasted more than a decade
1547423298455277568,2022-07-14 03:30:38+00:00,3,0,https://twitter.com/i/web/status/1547423298455277568,
1547298705509781504,2022-07-13 19:15:33+00:00,3,0,https://twitter.com/i/web/status/1547298705509781504,Peloton PTON Dumpster fire or Deep Fkn Value diviend stock investing markecrash
1547283048089018369,2022-07-13 18:13:20+00:00,1,0,https://twitter.com/i/web/status/1547283048089018369,
1546953886304374786,2022-07-12 20:25:22+00:00,0,0,https://twitter.com/i/web/status/1546953886304374786,Hahahah
1546524676037349376,2022-07-11 15:59:50+00:00,7,0,https://twitter.com/i/web/status/1546524676037349376,Learn to buy cash flow in the stock market Build your own cashflow portfolio by learning to pick the very best stocks dividend stock investings learntoinvest money marketcrash
1546523425887334400,2022-07-11 15:54:52+00:00,9,0,https://twitter.com/i/web/status/1546523425887334400,PTON is repricing their stock options because employees include that as part of their comp and wont work otherwise therefore excluded stock comp from EBITDA is ridiculous Its an expense treat it as such
1546517414086471681,2022-07-11 15:30:59+00:00,6,0,https://twitter.com/i/web/status/1546517414086471681,Be your own bank give me a break The govt can take your Bitcoin just like they banded gold ownership back in the day
1546326568888193025,2022-07-11 02:52:38+00:00,9,1,https://twitter.com/i/web/status/1546326568888193025,Its amazing how well airplanes are made and what they can withstand and still fly Looks like no one was hurt Thankfully BA
1546324003433766912,2022-07-11 02:42:26+00:00,7,0,https://twitter.com/i/web/status/1546324003433766912,Bravo
1546323530437890048,2022-07-11 02:40:33+00:00,4,3,https://twitter.com/i/web/status/1546323530437890048,excellent perspective Thanks for sharing
1546321865961906176,2022-07-11 02:33:56+00:00,4,0,https://twitter.com/i/web/status/1546321865961906176,
1546172068093239297,2022-07-10 16:38:42+00:00,3,0,https://twitter.com/i/web/status/1546172068093239297,Amazing how fast that GDP number turned south 23 months and boom Rioting
1545034109818249216,2022-07-07 13:16:51+00:00,0,0,https://twitter.com/i/web/status/1545034109818249216,declining revenue and EBITDA with a possible global recession coming The company is trading at 9x EV EBITDA current but has traded as low as 57x range in 2012 post last down turn thats about 125 assuming 10B of EBITDA fwd Id wait for a better price then buy
1544903022911770625,2022-07-07 04:35:58+00:00,0,0,https://twitter.com/i/web/status/1544903022911770625,nope
1544901526459559936,2022-07-07 04:30:01+00:00,0,0,https://twitter.com/i/web/status/1544901526459559936,Please California is much higher then that
1544706409261985792,2022-07-06 15:34:41+00:00,4,0,https://twitter.com/i/web/status/1544706409261985792,Cisco CSCO is a consistent cash machine selling for 30 less than a year ago Check out this value stock stock cashflow
1542179170020515840,2022-06-29 16:12:21+00:00,0,0,https://twitter.com/i/web/status/1542179170020515840,Thanks for watching A appreciate the value investing support
1542178696169000960,2022-06-29 16:10:28+00:00,12,3,https://twitter.com/i/web/status/1542178696169000960,PayPal PYPL Usage slows margins fall and multiples contract The compounding effect in reverse What do we do now stockmarketcrash Fed dividend cashflow
1542168008713326593,2022-06-29 15:28:00+00:00,1,0,https://twitter.com/i/web/status/1542168008713326593,No one saw this coming Im completely shocked
1541952443101065216,2022-06-29 01:11:25+00:00,1,0,https://twitter.com/i/web/status/1541952443101065216,lots of good names in here
1541811873221251072,2022-06-28 15:52:50+00:00,7,0,https://twitter.com/i/web/status/1541811873221251072,25 gross margin is way too low 731 million in operating overhead in 9 months thats their entire gross profit Massive cuts to the org chart are coming
1541810734060797952,2022-06-28 15:48:19+00:00,9,1,https://twitter.com/i/web/status/1541810734060797952,First look isnt strong 718 million coming due in 12 months with 900 million in cash and oh ya theyre burn rate last quarter was 1677 million in only 3 Months Thats 18 million cash burn daily These guys needs an equity raise more dilution coming
1541807659929653248,2022-06-28 15:36:06+00:00,11,0,https://twitter.com/i/web/status/1541807659929653248,peloton pton now 50 lower than prepandemic levels Deeeeeeep value or a more loses to comedividend cashflow stock growth turnaround
1540330461959901184,2022-06-24 13:46:14+00:00,0,0,https://twitter.com/i/web/status/1540330461959901184,This should be net of debt
1540033001802694658,2022-06-23 18:04:14+00:00,0,0,https://twitter.com/i/web/status/1540033001802694658,Job Day to day is anyones guess
1539636060946255872,2022-06-22 15:46:56+00:00,18,2,https://twitter.com/i/web/status/1539636060946255872,alphabet Google GOOG GOOGL Monster Revenue EBITDA and Cash Flow Growth a reasonable price 13x EV EBITDA might be time to buy the dip on this Cash Machine dividend cashflow lorenz
1539635071539245057,2022-06-22 15:43:00+00:00,17,1,https://twitter.com/i/web/status/1539635071539245057,Zillow Z Stock price full round trip prepost covid
1539440851293614080,2022-06-22 02:51:15+00:00,0,0,https://twitter.com/i/web/status/1539440851293614080,6 12 free cash flow yield buying back a lot of stock and very little debt A good start
1539275821264752640,2022-06-21 15:55:28+00:00,0,0,https://twitter.com/i/web/status/1539275821264752640,fiat food clothing and shelter bitcoin find a seller to turn into fiat to buy food clothing and shelter
1539273351092240384,2022-06-21 15:45:39+00:00,7,0,https://twitter.com/i/web/status/1539273351092240384,DOCU stock chart full round trip PrePost Covid
1539273105406709760,2022-06-21 15:44:41+00:00,5,0,https://twitter.com/i/web/status/1539273105406709760,DOCU CEO stepped down today hes doing fine
1539050452876001281,2022-06-21 00:59:56+00:00,1,0,https://twitter.com/i/web/status/1539050452876001281,delusional
1537892237484339207,2022-06-17 20:17:36+00:00,1,0,https://twitter.com/i/web/status/1537892237484339207,Nope
1537861569949728769,2022-06-17 18:15:45+00:00,4,1,https://twitter.com/i/web/status/1537861569949728769,Anyone looked at REV do they make any cash
