id,created_at,favorite_count,retweet_count,text
1440505412407627784,2021-09-22 02:37:08+00:00,4,0,It s been a year since this video and the stock has doubled I love free cash flow and a solid management team Great job team MGA
1440504289982496769,2021-09-22 02:32:40+00:00,9,0,GOLD Barrick trades at 5x EV EBITDA and mints free cash with strong upside if inflation isn t transitory Worth another look
1440501584685715465,2021-09-22 02:21:55+00:00,0,0,Or you can buy the stock TSN solid return since my review in Dec inflation tysonfoods
1440500356752891916,2021-09-22 02:17:02+00:00,3,0,FEX coming down in price 240 shr is good but 216 shr is better
1440319459974008834,2021-09-21 14:18:13+00:00,2,0,Not wise Stocks have significant volatility when the Fed is running the market and a 3 old back is too small 50 would be reasonable
1439979978485952513,2021-09-20 15:49:15+00:00,7,1,Lending on an asset that can drop 50 in days is a pending margin call disaster
1439972924765601793,2021-09-20 15:21:13+00:00,2,1,So basically the Fed runs the stock market not the ecomony adamsmith is rolling in his grave Fed can t even spell laissez faire
1439053409114484742,2021-09-18 02:27:23+00:00,2,0,patten I haven t sold concerned yes but haven t sold
1439042283932848133,2021-09-18 01:43:11+00:00,4,0,Excellent
1438991050043904003,2021-09-17 22:19:36+00:00,2,1,Not good
1438308986235678721,2021-09-16 01:09:19+00:00,1,1,High payout at the expense of the underlying business dividends aren t everything
1438308063606296577,2021-09-16 01:05:39+00:00,2,0,Maybe it s time to look at XOM instead of CVX
1438296949136900098,2021-09-16 00:21:29+00:00,2,0,CitiGroup C is set up to beat the SPY This stock could double your money investing investment money stock business cashflow WFC JPM GS BAC PNC
1437933286743953408,2021-09-15 00:16:25+00:00,10,0,Oh that s awesome I actually laughed out loud
1437917999353065473,2021-09-14 23:15:40+00:00,5,0,
1437912105441640448,2021-09-14 22:52:15+00:00,7,0,Global GDP is about 80T So the world is leveraged 3 75x
1437781144892813323,2021-09-14 14:11:52+00:00,0,0,He looks fantastic happy 112 wow
1437772094448685056,2021-09-14 13:35:54+00:00,5,1,Reopening How long are we going to talk about reopening Mu is another variation coming When does this become the new normal covid inflation china stock growth
1437649758244409349,2021-09-14 05:29:47+00:00,3,1,Good chart and video Consider that housing price is so high because the supply of houses for sale is 1 3 of what it was several years ago
1437645312131096578,2021-09-14 05:12:07+00:00,4,1,5x the size of Lehman but does China have the CDS market which magnified the Lehman collapse
1436694618565857288,2021-09-11 14:14:24+00:00,3,0,Wow
1436069396653363215,2021-09-09 20:49:59+00:00,1,0,No Surprise here
1436047700189859853,2021-09-09 19:23:46+00:00,10,0,If you remove all the inflating items from the inflation index then inflation is flat Wow that s brilliant Thanks
1435754752051073025,2021-09-08 23:59:42+00:00,10,0,TWTR Strong Revenue and Free Cash Flow Great job on the rebound Can the stock go higher How much is too much to pay for this growing stock stocks investing cashflow
1434921306005200896,2021-09-06 16:47:53+00:00,7,0,Vertical moves in stocks or indices like this are generally not a good sign of a rational market and in my experience revert to the mean StockMarket Investment
1434584073960185860,2021-09-05 18:27:51+00:00,1,2,
1433811444798136320,2021-09-03 15:17:42+00:00,0,0,The vacation homes turn into AirBnB rentals what s the problem
1433792004308148230,2021-09-03 14:00:27+00:00,4,1,Do you think Zillow will allow their algorithm to drop the RE price before they can sell their inventory in a downturn
1433602634095546368,2021-09-03 01:27:57+00:00,0,0,Good comment I need to take a look
1433447310533427207,2021-09-02 15:10:45+00:00,248,20,FDX had a massive year during lock down with monster Revenue amp Cashflow growth Will this continue or revert to the mean Is FedEx a Buy or a Value Trap What you must know stocks Markets invest cashflow fedex finance money
1433424495142850561,2021-09-02 13:40:06+00:00,0,0,That s a nice piece of history Very cool
1433264577509146627,2021-09-02 03:04:38+00:00,4,0,Interesting
1432728818410610696,2021-08-31 15:35:43+00:00,7,0,ADP stock continues to touch new new highs on mostly market multiple expansion with single digit earnings growth A bargain at 9 7x overpriced at 22 2x Watch that downside risk StocksToBuy cashflow investing money ADP
1431294110304899072,2021-08-27 16:34:42+00:00,14,4,I hate you inflation you destroyer of purchasing power Old version 2 64 oz New Version 2 22 for the same price PG is pushing through their supply chain costs with new packaging What was that Powell Transitory you say
1430965597022478342,2021-08-26 18:49:19+00:00,10,1,Big fan of conditional formatting in excel
1430889706514911236,2021-08-26 13:47:45+00:00,20,2,Wait a minute most of APPL gains have been from an earnings multiple expansion single digit to near 20x vs modest earnings growth I d say the Fed has created more shareholder value the any CEO ever
1430735537241935875,2021-08-26 03:35:08+00:00,287,13,Z zillow has a 2 2T TAM how far can this stock run Strong Revenue EBITDA and Cashflow growth great start cashflow Investing101 stocks realestate Barton
1430680688013955075,2021-08-25 23:57:11+00:00,1,0,I reviewed them A monster company with sticky revenue
1430196305918263302,2021-08-24 15:52:25+00:00,0,0,Yes It s an important goal I agree but I m saying too many people media only focus on EPS and EPS growth but there is a better enterprise to be talked about Cheers
1429853613455646737,2021-08-23 17:10:41+00:00,0,0,Ya the monitory and soon fiscal stimulus is distorting asset prices The Treasury s buying of 120B per month of US bonds has a huge impact The Fed is buying about 50 of all 10year treasuries issued by the US right now If when that stops will cause a realignment of prices
1429831975318134784,2021-08-23 15:44:42+00:00,2,0,Incredible
1429820426692169728,2021-08-23 14:58:49+00:00,1,0,I doubled my position on the way down Done for now
1428207194768515074,2021-08-19 04:08:24+00:00,3,2,Check out this Bloomberg post Covid shutting down china ports Continued pricing pressure Consumer goods can t go from containers to bulk and are stuck Winter fashion is going to be late this year writedowns
1428153152100986880,2021-08-19 00:33:39+00:00,2,0,I ve used many over the years Yahoo Finance GuruFocus Macrotrends FinBox to name a few
1428150839034609668,2021-08-19 00:24:28+00:00,10,1,ADP Revenue EBITDA FCFE Growth and Low Debt But it s growth if fully priced in High single digit IRR over the next 10 years cashflow StockMarket money invest learntoinvest
1428144216362741764,2021-08-18 23:58:09+00:00,298,4,MSFT is crushing cash can they keep it up What s this cash machine worth A 10 Year Look at FCFE investing Microsoft stocks money cashflow lorenz
1428002729985642497,2021-08-18 14:35:56+00:00,1,0,Oops
1427479162609045532,2021-08-17 03:55:28+00:00,1,0,I don t turn my portfolio very frequently so it s not going to be very exciting I like looking for new investments and that s what the channel is about
1427478607195115568,2021-08-17 03:53:15+00:00,3,0,Stanley Druckenmiller USC Marshall 2021 Keynote Speech via
1427335792993587222,2021-08-16 18:25:46+00:00,4,0,If China takes Taiwan do you stay invested in either country s stock market
1427110410537238533,2021-08-16 03:30:10+00:00,11,0,Transitory inflation is still inflation Even if CPI doesn t remain at 5 annually for years the price of my deodorant isn t going back down and I ll pay this price or higher for the rest of my life inflation PG fed
1426743823233818628,2021-08-15 03:13:29+00:00,6,0,Great lessons here
1426445024686841861,2021-08-14 07:26:10+00:00,0,0,What are the issues
1426323555550072832,2021-08-13 23:23:30+00:00,8,0,Incredible
1426253960051109895,2021-08-13 18:46:57+00:00,0,0,Oh interesting
1425905939236806658,2021-08-12 19:44:02+00:00,1,0,ya looks like an interesting buy What s the growth strategy for their brands Are to moving to a digital subscription platform
1425904365898895361,2021-08-12 19:37:47+00:00,530,18,SBUX valued at pre pandemic levels yet a return to normal is far from here Why this company s cashflow is too expensive StocksToWatch Markets cashflow learntoinvest
1425578441852608514,2021-08-11 22:02:41+00:00,2,0,Negative interest rates turn finance upside down Apparently a rock is an investment
1425571618709938183,2021-08-11 21:35:34+00:00,4,0,No Then you lower your standard of livening
1425554621104234499,2021-08-11 20:28:01+00:00,9,2,If your pay doesn t increase by 5 5 this year then you are paying for this Fed experiment
1425549585573769217,2021-08-11 20:08:01+00:00,3,0,6 in 2022 doesn t sound transitory to me
1425182361386323970,2021-08-10 19:48:48+00:00,8,1,True but we closed the economy from Covid and sales fell
1424519616605261974,2021-08-08 23:55:17+00:00,548,24,Texas Instruments TXN EPS vs EBITDA growth which is worth more Why many companies can t grow their enterprise earnings and most use debt share buybacks to prop up EPS investing stocks wallstreetbets
1424451835830497282,2021-08-08 19:25:57+00:00,1,1,Nope
1424095045586620419,2021-08-07 19:48:11+00:00,1,0,ass 420 They ve been estimating a decline for this year after the Covid jump in sales and I think investors are short sighted
1423519263680172037,2021-08-06 05:40:14+00:00,2,0,The higher shipping rates are due to Covid holding times at ports We are now 1 5 years into Covid with another variant getting stronger I think the risk of a delay of return to normal is under appreciated
1423518584077053953,2021-08-06 05:37:32+00:00,3,0,Private equity is on pace for a record year 1 trillion in deal flow That s a lot of Jack
1423498449744392195,2021-08-06 04:17:32+00:00,0,0,Excellent example Let the reshoring of US mfg begin
1423495589908467720,2021-08-06 04:06:10+00:00,3,1,Continued pricing pressure beyond 2022
1422635870629289984,2021-08-03 19:09:57+00:00,1,0,Thanks
1421669724937756674,2021-08-01 03:10:50+00:00,1,1,Sounds about right
1421668393967525890,2021-08-01 03:05:33+00:00,5,0,Great Interview I like INTC as well
1421303165719175168,2021-07-31 02:54:15+00:00,1,0,Too funny
1421184659149316097,2021-07-30 19:03:21+00:00,23,2,FB crushed earnings again I love a cash machine yes I m posting this on Twitter and understand the irony stocks investing cashflow GrowthMindset YOLO
1421183750927310851,2021-07-30 18:59:45+00:00,14,0,Over priced with no growth and increasing debt See how this dividend aristocrat needs a change CAT stocks investing Money
1420954566258950147,2021-07-30 03:49:03+00:00,1,0,So price increase is no longer inflation If interest rates are negative then I guess down can really be up
1420866955813130243,2021-07-29 22:00:55+00:00,1,0,
1420383088639504385,2021-07-28 13:58:12+00:00,10,1,A monster
1420178043239161856,2021-07-28 00:23:25+00:00,1,0,Ya that global deflationary trends are stronger then believed
1420107251793027073,2021-07-27 19:42:07+00:00,0,0,Ya I understand with BABA im already in and might cost average with this reduction
1420106986390126592,2021-07-27 19:41:04+00:00,2,0,Total is risky hence the discount
1420104556915003393,2021-07-27 19:31:25+00:00,6,0,I m watching it Seems like a good risk adjusted return
1418564312012967938,2021-07-23 13:31:02+00:00,0,0,Inflation is both the amount of money in supply and the speed at which it s used
1418369724035989507,2021-07-23 00:37:48+00:00,8,0,Did the velocity of money just bottom inflation stocks Fed
1418231741219688450,2021-07-22 15:29:31+00:00,5,1,Another monster jump If you don t think this is inflation then what is it
1418014054614925313,2021-07-22 01:04:30+00:00,0,0,has 0 revenue growth over the last 10 years weak EBITDA debt up 50 and a dividend that should be cut cashflow stocks market Investment
1417682856856354816,2021-07-21 03:08:27+00:00,0,0,Fantastic
1417531879184498692,2021-07-20 17:08:31+00:00,0,0,No video I posted the historical cash flows to my Twitter account
1417148504514826241,2021-07-19 15:45:07+00:00,5,0,27x sales Crazy
1417142915428544512,2021-07-19 15:22:54+00:00,4,0,Great article by Thomas Sonderman China reunification of Taiwan and possible global control of semiconductor is a risk to the internet of things revolution
1416935347754135552,2021-07-19 01:38:06+00:00,54,1,Global trade but those trades don t settle in the RMB They settle in USD
1416783190220414982,2021-07-18 15:33:29+00:00,1,0,Not sure Here s an article about the change showing housing at 45 of CPI in 1980
1416781790908272640,2021-07-18 15:27:56+00:00,1,0,Hahahah nice
1416511834991915009,2021-07-17 21:35:13+00:00,3,0,Game changer
1416510704044056577,2021-07-17 21:30:43+00:00,1,0,Hilarious
1416510006199943169,2021-07-17 21:27:57+00:00,2,0,Their list of demands includes a 20 min wage I thought the ask was for 15 But why stop at 20 if you re asking why not ask for 100 000 yr
1416401867475542016,2021-07-17 14:18:15+00:00,11,1,2 of 2 in the past 12 months the CPI has increased 5 4 and the 23 increase in existing house prices isn t part of that Randall Forsyth at Barron s quoting Joseph Carson at AllianceBernstein barrons inflation stock
1416401273012690949,2021-07-17 14:15:53+00:00,10,1,CPI of the 1970s included house prices while the current index doesn t illustration of how significant including and not including house price inflation can be In 1979 the CPI rose 11 3 and that included a 14 increase in the price of existing house 1 of 2
1416121720247881734,2021-07-16 19:45:03+00:00,0,0,They ve been growing for a long time Cell phone tower ownership Let me a REIT But they have 19B in debt and only 3B of CFO or EBITDA
1415859000717889540,2021-07-16 02:21:05+00:00,4,0,She was late calling the last house crisis despite being in San Francisco Fed an epicenter Let s hope she gets it right this time
1415485306661314565,2021-07-15 01:36:10+00:00,2,0,How about a cashflow hedge against XOM and CVX Two companies that will print cash as oil rises to 100 bbl valueinvesting exxonmobil chevron stocks stockmarket investing markets oil
1415441212887093248,2021-07-14 22:40:57+00:00,4,0,The calls are getting loader Love what you own
1414993005279285251,2021-07-13 16:59:56+00:00,2,1,patten Just read the footnote on those 45 000 vans for ELMS Those are not purchase orders and are not actual commitment to purchase Anyone can post a FB ads and get people to raise their hand as potential customers
1414935748130738181,2021-07-13 13:12:25+00:00,10,0,How about a paying customer first
1414934681108156424,2021-07-13 13:08:10+00:00,8,1,HOLD For what kind of upside Even the company is selling shares into this demand How can you look at the other investments out there and tell people to hold AMC reckless
1414932940471951363,2021-07-13 13:01:15+00:00,0,0,FAAMG are wonderful companies A rising tide lifts all boats and if we ever have another contraction the bubble like companies will be shown
1414802183019712515,2021-07-13 04:21:40+00:00,2,1,Crazy
1414594564275412994,2021-07-12 14:36:40+00:00,4,0,This is a problem
1414390973933649924,2021-07-12 01:07:40+00:00,2,0,Crazy
1414346290276696065,2021-07-11 22:10:07+00:00,7,1,Excellent chart and a real concern
1414213969300967426,2021-07-11 13:24:19+00:00,1,0,I don t know how big that risk is The the CCP appeared to be liberalizing their system with property rights labor mobility and large wealth creation over the last 20 30 years So does that trend continue or stop I guess it continues but I m not certain
1414025362422386694,2021-07-11 00:54:52+00:00,3,0,Very sad
1413712877257564162,2021-07-10 04:13:10+00:00,0,0,I do not
1413651200298287109,2021-07-10 00:08:05+00:00,12,0,It s called inventory financing and it s not new
1413500237910470667,2021-07-09 14:08:12+00:00,8,1,Higher minimum wage will mean fewer employees with more automation and outsourcing
1413154148825006085,2021-07-08 15:12:58+00:00,1,0,We agree A solid company
1413151521307463681,2021-07-08 15:02:32+00:00,24,2,JD has strong cash flow double digital annual revenue growth at a reasonable price Strong ecommerce play in China StocksToWatch investing China ecommerce cashflow
1412494312747585541,2021-07-06 19:31:01+00:00,1,0,Ya I got behind But had a great 4th
1412138864806825984,2021-07-05 19:58:36+00:00,0,0,Might be the jump the shark moment for the market
1411871749285695491,2021-07-05 02:17:10+00:00,6,0,What are the top zombie companies
1411104285648048129,2021-07-02 23:27:33+00:00,2,0,ashish Thank all That s a good group of relational thinking investors
1411026872608038913,2021-07-02 18:19:56+00:00,0,0,The Feb is buying bonds in massive quantity which is suppressing bond yields There is no price discovery in the bond market hence not free The bond market used to check the government spending read about the bond vigilantes but no longer
1410791264392409091,2021-07-02 02:43:43+00:00,1,0,I would normally say no But POTUS is thinking about forgiving student debt so I guess anything is possible
1410720293895622665,2021-07-01 22:01:42+00:00,4,1,An amazing visual Thanks for sharing
1410626154269011968,2021-07-01 15:47:38+00:00,1,0,Ponzi
1410624044618043399,2021-07-01 15:39:15+00:00,1,0,Action21 You are correct Last true economic cycle was before Greenspan Managed economies fail eventually in revolutionary style not a pleasant thought
1410609251077148676,2021-07-01 14:40:27+00:00,0,0,So much money in the system it is being returned to the fed
1410608651933413383,2021-07-01 14:38:05+00:00,5,0,33 owned by the Fed Are we ever going back to a free market
1410247140941582337,2021-06-30 14:41:34+00:00,0,0,I thought SPACs had to IPO for 200MM How did MCAFU get gone How much sponsor equity was contributed Thanks
1410096338608398336,2021-06-30 04:42:20+00:00,8,0,Can I get this as a poster for my office
1409531022333530119,2021-06-28 15:15:58+00:00,12,0,Can t raise any more debt Time for the dilution
1409527325020999680,2021-06-28 15:01:16+00:00,2,0,Action21 Hempton That s possible too With the dividend and share buybacks I think they ll outperform the SPY even at a lower growth rate
1409526890117820419,2021-06-28 14:59:33+00:00,1,0,Hempton That increase isn t new and yet intc has consistently grown their EBITDA
1409523548511608833,2021-06-28 14:46:16+00:00,30,2,INTC A Monster Cash Machine Can I interest you in a 9 FCF yield excellent BS share buybacks and consistent growth Hempton stocks wallstreetbets money Intel
1409224985676337156,2021-06-27 18:59:53+00:00,1,0,The pain to fix this is hard to imagine
1409224810517962761,2021-06-27 18:59:11+00:00,1,0,We no longer allow our economy to naturally cool but continue to re energize again amp again There are hundreds of businesses that should t exist but are kept alive with cheap That has a lower inefficient return and our economy grows more slowly as a result
1409207334698688516,2021-06-27 17:49:45+00:00,9,0,The Fed has intervened at each downturn for the last 30 years with decreasing effectiveness What if one day that stops working
1408779946206674952,2021-06-26 13:31:27+00:00,7,1,Charlie and I agree Check out How did Domino s beat Google IPO up 5 000
1408501117831434240,2021-06-25 19:03:29+00:00,6,0,incredible
1408500643191422977,2021-06-25 19:01:36+00:00,5,0,Is the stock still for sales Did I miss it
1408051802335977480,2021-06-24 13:18:04+00:00,6,0,I had a wonderful time in HK it sad to see the CCP afraid of a newspaper
1407378571258064896,2021-06-22 16:42:53+00:00,1,0,Well negative interest rates make savings decrease so I guess anything is possible
1407363575899856900,2021-06-22 15:43:18+00:00,3,0,Called it
1407342746172592137,2021-06-22 14:20:32+00:00,0,0,stone Deducted No Only issued shares
1407335225139646468,2021-06-22 13:50:39+00:00,1,0,Only excess cash is used in EV
1407124362356920365,2021-06-21 23:52:45+00:00,50,2,MU is fully priced and doesn t yield enough free cash flow The market is given 100 credit to mgmt s strong growth forecast investing stocks cashflow
1406320370727022596,2021-06-19 18:37:59+00:00,0,0,Got to love what you own might be stuck in the stock for a long time
1405745119853088768,2021-06-18 04:32:08+00:00,4,2,Amazing chart Very concerning
1405281476933865473,2021-06-16 21:49:47+00:00,1,0,Credit spreads
1405178940667228160,2021-06-16 15:02:21+00:00,6,0,Total debt leverage is back to 2007 levels the mix has changed with more senior debt but overall leverage is too high Increased interest rates will hammer EPS
1404462496732221440,2021-06-14 15:35:27+00:00,0,0,oops
1403801562040791043,2021-06-12 19:49:08+00:00,0,0,Compare this with average income for an affordability metric That s the measure of a housing bubble
1403717835528957953,2021-06-12 14:16:26+00:00,2,0,The annual free cash flow is a big part of the IRR The company can buy back shares make acquisitions or dividend it out
1403524265069080584,2021-06-12 01:27:15+00:00,40,1,nintendo is a great company Double Digit Revenue Growth No Debt Strong Free Cash Flow and Cheaply Priced I like this stock StockMarket marketing investing cashflow
1403187744168288256,2021-06-11 03:10:02+00:00,0,0,sounds like you need to work half the time
1402996182268342275,2021-06-10 14:28:50+00:00,0,0,Venezuela leading the pack
1402849348065501185,2021-06-10 04:45:22+00:00,1,0,EBITDA is truer in this case Merchant Payable is a timing issue The 3 5 B of delayed merchant payable is 33 of all revenue Meaning they got the cash from sales but didn t have to pay their merchants in the same period Normalize and CFO will be less by 3 5B
1402848627710578691,2021-06-10 04:42:31+00:00,1,0,It s 2 issues 1 Sales and marketing is too high and causing a loss of EBITDA they are banking on growth to cover the SG amp A 2 They are delaying paying their merchants check Merchant Payable on the BS and CF its a factor of their rapid growth but that will come due
1402824590045290496,2021-06-10 03:07:00+00:00,1,0,It s a good deal and will focus management and cash flow into growing the 5G infrastructure Cutting the dividend was the right move Look for early demonstrations of the new CEO s abilities before buying T
1402653225547878401,2021-06-09 15:46:03+00:00,49,3,BABA is on sale Time for another look Strong Free Cash Flow Low Debt Market Dominance and Non USD money stocks investing cashflow
1402651044077658112,2021-06-09 15:37:23+00:00,5,0,VZ has a solid free cash flow yield and doesn t need much growth to produce market beating returns money investing StocksToWatch
1402649911611461642,2021-06-09 15:32:53+00:00,1,0,Lots of upside for BRK growth low debt and well priced investing money not Bitcoin
1402448539196674052,2021-06-09 02:12:42+00:00,0,0,You are confusing wealth with income
1401922873376198657,2021-06-07 15:23:54+00:00,12,0,samsungelectronics is a wonderfully profitable company and tons of cash and no debt Mgmt has had some issues recently hopefully they ll get through it
1401755863216312328,2021-06-07 04:20:15+00:00,0,0,Tidbits I think for a variety of reasons there is more upside in oil
1401724665635115009,2021-06-07 02:16:17+00:00,0,0,The implication here is that spending will fall next year as we return to normal operations
1400475857420881923,2021-06-03 15:33:58+00:00,1,0,very concerning singlename lovewhatyouown
1400284072253870081,2021-06-03 02:51:53+00:00,0,0,Seems normal to me
1400283073703383041,2021-06-03 02:47:55+00:00,0,0,Hahahaha
1400244750918176774,2021-06-03 00:15:38+00:00,26,1,ETSY is a cash flow machine Great Job Team etsy stocks stockmarkets cashflow wallstreetbets
1397213853197471744,2021-05-25 15:31:56+00:00,4,0,Fed and potus are handing money out to close the wealth gap but costs are rising faster than wages
1397169869854887941,2021-05-25 12:37:09+00:00,0,0,Ya I launched it And it s been very well received
1395926262900674561,2021-05-22 02:15:30+00:00,0,0,Jim Cramer Good chart
1395225776367095808,2021-05-20 03:52:01+00:00,20,0,Strong free cashflow low debt fast growing at a reasonable price This WeedLovers is on fire Thanks kim trulieve cashflow stocks investing
1395015914316189701,2021-05-19 13:58:06+00:00,0,0,Oops
1395015292292534274,2021-05-19 13:55:38+00:00,0,0,You re assuming wage growth will be faster than inflation
1394808144526671878,2021-05-19 00:12:30+00:00,1,0,Action21 Thanks for the like Greatly appreciate the support
1394096744674205696,2021-05-17 01:05:39+00:00,1,0,cash flows are a complete guess
1393973853123092480,2021-05-16 16:57:20+00:00,1,0,Worth a read
1393865372462247940,2021-05-16 09:46:16+00:00,0,0,Cycles Could you add a few more lines maybe some green and red That s the ticket
1393862601151451136,2021-05-16 09:35:15+00:00,0,0,This is well said
1393699097970823177,2021-05-15 22:45:33+00:00,1,0,Causing income inequality
1393663645263958016,2021-05-15 20:24:40+00:00,12,1,This analysis requires a 20x price to sales multiple and only gets to a 15 discount to current market price PLTR Nope
1393062618630262785,2021-05-14 04:36:24+00:00,1,0,I liked Tyson Foods months ago Half to see that working out
1393060073396572160,2021-05-14 04:26:17+00:00,3,1,This dude makes his money on the SPAC IPO He doesn t need it to grow after that
1392868251449782277,2021-05-13 15:44:04+00:00,11,0,1999 was about the top of US coal consumption Good job
1392625193919475715,2021-05-12 23:38:14+00:00,8,0,Look to GOOG for value during market downturns ValueInvesting StockMarket StocksToWatch
1392505859331084288,2021-05-12 15:44:03+00:00,13,0,Goog continues to crush cash with no debt and no share dilution notYOLO This stock still looks good StockMarket Check out my video launching today 1pm PST
1392504586955464712,2021-05-12 15:38:59+00:00,0,0,CGC WEED canopygrowth cash burn increases with scale funded by debt and equity dilution still not cheap enough stocks wallstreetbets
1392502281753354244,2021-05-12 15:29:50+00:00,0,0,do you have a chart showing stock sensitivity to interest rates 17 had a similar rate rise and the market melted now same higher taxes Much lower EPS Thanks
