id,created_at,favorite_count,retweet_count,url,text
1410608651933413383,2021-07-01 14:38:05+00:00,5,0,https://twitter.com/i/web/status/1410608651933413383,33 owned by the Fed Are we ever going back to a free market
1410247140941582337,2021-06-30 14:41:34+00:00,0,0,https://twitter.com/i/web/status/1410247140941582337,I thought SPACs had to IPO for 200MM How did MCAFU get gone How much sponsor equity was contributed Thanks
1410096338608398336,2021-06-30 04:42:20+00:00,8,0,https://twitter.com/i/web/status/1410096338608398336,Can I get this as a poster for my office
1409531022333530119,2021-06-28 15:15:58+00:00,12,0,https://twitter.com/i/web/status/1409531022333530119,Cant raise any more debt Time for the dilution
1409527325020999680,2021-06-28 15:01:16+00:00,2,0,https://twitter.com/i/web/status/1409527325020999680,Action21 Hempton Thats possible too With the dividend and share buybacks I think theyll outperform the SPY even at a lower growth rate
1409526890117820419,2021-06-28 14:59:33+00:00,1,0,https://twitter.com/i/web/status/1409526890117820419,Hempton That increase isnt new and yet intc has consistently grown their EBITDA
1409523548511608833,2021-06-28 14:46:16+00:00,30,2,https://twitter.com/i/web/status/1409523548511608833,INTC A Monster Cash Machine Can I interest you in a 9 FCF yield excellent BS share buybacks and consistent growth Hempton stocks wallstreetbets money Intel
1409224985676337156,2021-06-27 18:59:53+00:00,1,0,https://twitter.com/i/web/status/1409224985676337156,The pain to fix this is hard to imagine
1409224810517962761,2021-06-27 18:59:11+00:00,1,0,https://twitter.com/i/web/status/1409224810517962761,We no longer allow our economy to naturally cool but continue to re energize again amp again There are hundreds of businesses that shouldt exist but are kept alive with cheap That has a lowerinefficient return and our economy grows more slowly as a result
1409207334698688516,2021-06-27 17:49:45+00:00,9,0,https://twitter.com/i/web/status/1409207334698688516,The Fed has intervened at each downturn for the last 30 years with decreasing effectiveness What if one day that stops working
1408779946206674952,2021-06-26 13:31:27+00:00,7,1,https://twitter.com/i/web/status/1408779946206674952,Charlie and I agree Check out How did Dominos beat Google IPO up 5000
1408501117831434240,2021-06-25 19:03:29+00:00,6,0,https://twitter.com/i/web/status/1408501117831434240,incredible
1408500643191422977,2021-06-25 19:01:36+00:00,5,0,https://twitter.com/i/web/status/1408500643191422977,Is the stock still for sales Did I miss it
1408051802335977480,2021-06-24 13:18:04+00:00,6,0,https://twitter.com/i/web/status/1408051802335977480,I had a wonderful time in HK it sad to see the CCP afraid of a newspaper
1407378571258064896,2021-06-22 16:42:53+00:00,1,0,https://twitter.com/i/web/status/1407378571258064896,Well negative interest rates make savings decrease so I guess anything is possible
1407363575899856900,2021-06-22 15:43:18+00:00,3,0,https://twitter.com/i/web/status/1407363575899856900,Called it
1407342746172592137,2021-06-22 14:20:32+00:00,0,0,https://twitter.com/i/web/status/1407342746172592137,stone Deducted No Only issued shares
1407335225139646468,2021-06-22 13:50:39+00:00,1,0,https://twitter.com/i/web/status/1407335225139646468,Only excess cash is used in EV
1407124362356920365,2021-06-21 23:52:45+00:00,49,2,https://twitter.com/i/web/status/1407124362356920365,MU is fully priced and doesnt yield enough free cash flow The market is given 100 credit to mgmts strong growth forecast investing stocks cashflow
1406320370727022596,2021-06-19 18:37:59+00:00,0,0,https://twitter.com/i/web/status/1406320370727022596,Got to love what you own might be stuck in the stock for a long time
1405745119853088768,2021-06-18 04:32:08+00:00,4,2,https://twitter.com/i/web/status/1405745119853088768,Amazing chart Very concerning
1405281476933865473,2021-06-16 21:49:47+00:00,1,0,https://twitter.com/i/web/status/1405281476933865473,Credit spreads
1405178940667228160,2021-06-16 15:02:21+00:00,6,0,https://twitter.com/i/web/status/1405178940667228160,Total debt leverage is back to 2007 levels the mix has changed with more senior debt but overall leverage is too high Increased interest rates will hammer EPS
1404462496732221440,2021-06-14 15:35:27+00:00,0,0,https://twitter.com/i/web/status/1404462496732221440,oops
1403801562040791043,2021-06-12 19:49:08+00:00,0,0,https://twitter.com/i/web/status/1403801562040791043,Compare this with average income for an affordability metric Thats the measure of a housing bubble
1403717835528957953,2021-06-12 14:16:26+00:00,2,0,https://twitter.com/i/web/status/1403717835528957953,The annual free cash flow is a big part of the IRR The company can buy back shares make acquisitions or dividend it out
1403524265069080584,2021-06-12 01:27:15+00:00,41,1,https://twitter.com/i/web/status/1403524265069080584,nintendo is a great company Double Digit Revenue Growth No Debt Strong Free Cash Flow and Cheaply Priced I like this stock StockMarket marketing investing cashflow
1403187744168288256,2021-06-11 03:10:02+00:00,0,0,https://twitter.com/i/web/status/1403187744168288256,sounds like you need to work half the time
1402996182268342275,2021-06-10 14:28:50+00:00,0,0,https://twitter.com/i/web/status/1402996182268342275,Venezuela leading the pack
1402849348065501185,2021-06-10 04:45:22+00:00,1,0,https://twitter.com/i/web/status/1402849348065501185,EBITDA is truer in this case Merchant Payable is a timing issue The 35 B of delayed merchant payable is 33 of all revenue Meaning they got the cash from sales but didnt have to pay their merchants in the same period Normalize and CFO will be less by 35B
1402848627710578691,2021-06-10 04:42:31+00:00,1,0,https://twitter.com/i/web/status/1402848627710578691,Its 2 issues 1 Sales and marketing is too high and causing a loss of EBITDA they are banking on growth to cover the SGampA 2 They are delaying paying their merchants check Merchant Payable on the BS and CF its a factor of their rapid growth but that will come due
1402824590045290496,2021-06-10 03:07:00+00:00,1,0,https://twitter.com/i/web/status/1402824590045290496,Its a good deal and will focus management and cash flow into growing the 5G infrastructure Cutting the dividend was the right move Look for early demonstrations of the new CEOs abilities before buying T
1402653225547878401,2021-06-09 15:46:03+00:00,49,3,https://twitter.com/i/web/status/1402653225547878401,BABA is on sale Time for another look Strong Free Cash Flow Low Debt Market Dominance and Non USD money stocks investing cashflow
1402651044077658112,2021-06-09 15:37:23+00:00,5,0,https://twitter.com/i/web/status/1402651044077658112,VZ has a solid free cash flow yield and doesnt need much growth to produce market beating returns money investing StocksToWatch
1402649911611461642,2021-06-09 15:32:53+00:00,1,0,https://twitter.com/i/web/status/1402649911611461642,Lots of upside for BRK growth low debt and well priced investing money not Bitcoin
1402448539196674052,2021-06-09 02:12:42+00:00,0,0,https://twitter.com/i/web/status/1402448539196674052,You are confusing wealth with income
1401922873376198657,2021-06-07 15:23:54+00:00,12,0,https://twitter.com/i/web/status/1401922873376198657,samsungelectronics is a wonderfully profitable company and tons of cash and no debt Mgmt has had some issues recently hopefully theyll get through it
1401755863216312328,2021-06-07 04:20:15+00:00,0,0,https://twitter.com/i/web/status/1401755863216312328,Tidbits I think for a variety of reasons there is more upside in oil
1401724665635115009,2021-06-07 02:16:17+00:00,0,0,https://twitter.com/i/web/status/1401724665635115009,The implication here is that spending will fall next year as we return to normal operations
1400475857420881923,2021-06-03 15:33:58+00:00,1,0,https://twitter.com/i/web/status/1400475857420881923,very concerning singlename lovewhatyouown
1400284072253870081,2021-06-03 02:51:53+00:00,0,0,https://twitter.com/i/web/status/1400284072253870081,Seems normal to me
1400283073703383041,2021-06-03 02:47:55+00:00,0,0,https://twitter.com/i/web/status/1400283073703383041,Hahahaha
1400244750918176774,2021-06-03 00:15:38+00:00,26,1,https://twitter.com/i/web/status/1400244750918176774,ETSY is a cash flow machine Great Job Team etsy stocks stockmarkets cashflow wallstreetbets
1397213853197471744,2021-05-25 15:31:56+00:00,4,0,https://twitter.com/i/web/status/1397213853197471744,Fed and potus are handing money out to close the wealth gap but costs are rising faster than wages
1397169869854887941,2021-05-25 12:37:09+00:00,0,0,https://twitter.com/i/web/status/1397169869854887941,Ya I launched it And its been very well received
1395926262900674561,2021-05-22 02:15:30+00:00,0,0,https://twitter.com/i/web/status/1395926262900674561,JimCramer Good chart
1395225776367095808,2021-05-20 03:52:01+00:00,19,0,https://twitter.com/i/web/status/1395225776367095808,Strong free cashflow low debt fast growing at a reasonable price This WeedLovers is on fire Thanks kim trulieve cashflow stocks investing
1395015914316189701,2021-05-19 13:58:06+00:00,0,0,https://twitter.com/i/web/status/1395015914316189701,Oops
1395015292292534274,2021-05-19 13:55:38+00:00,0,0,https://twitter.com/i/web/status/1395015292292534274,Youre assuming wage growth will be faster than inflation
1394808144526671878,2021-05-19 00:12:30+00:00,1,0,https://twitter.com/i/web/status/1394808144526671878,Action21 Thanks for the like Greatly appreciate the support
1394096744674205696,2021-05-17 01:05:39+00:00,1,0,https://twitter.com/i/web/status/1394096744674205696,cash flows are a complete guess
1393973853123092480,2021-05-16 16:57:20+00:00,1,0,https://twitter.com/i/web/status/1393973853123092480,Worth a read
1393865372462247940,2021-05-16 09:46:16+00:00,0,0,https://twitter.com/i/web/status/1393865372462247940,Cycles Could you add a few more lines maybe some green and red Thats the ticket
1393862601151451136,2021-05-16 09:35:15+00:00,0,0,https://twitter.com/i/web/status/1393862601151451136,This is well said
1393699097970823177,2021-05-15 22:45:33+00:00,1,0,https://twitter.com/i/web/status/1393699097970823177,Causing income inequality
1393663645263958016,2021-05-15 20:24:40+00:00,12,1,https://twitter.com/i/web/status/1393663645263958016,This analysis requires a 20x price to sales multiple and only gets to a 15 discount to current market price PLTR Nope
1393062618630262785,2021-05-14 04:36:24+00:00,1,0,https://twitter.com/i/web/status/1393062618630262785,I liked Tyson Foods months ago Half to see that working out
1393060073396572160,2021-05-14 04:26:17+00:00,3,1,https://twitter.com/i/web/status/1393060073396572160,This dude makes his money on the SPAC IPO He doesnt need it to grow after that
1392868251449782277,2021-05-13 15:44:04+00:00,11,0,https://twitter.com/i/web/status/1392868251449782277,1999 was about the top of US coal consumption Good job
1392625193919475715,2021-05-12 23:38:14+00:00,8,0,https://twitter.com/i/web/status/1392625193919475715,Look to GOOG for value during market downturns ValueInvesting StockMarket StocksToWatch
1392505859331084288,2021-05-12 15:44:03+00:00,13,0,https://twitter.com/i/web/status/1392505859331084288,Goog continues to crush cash with no debt and no share dilution notYOLO This stock still looks good StockMarket Check out my video launching today 1pm PST
1392504586955464712,2021-05-12 15:38:59+00:00,0,0,https://twitter.com/i/web/status/1392504586955464712,CGC WEED canopygrowth cash burn increases with scale funded by debt and equity dilution still not cheap enough stocks wallstreetbets
1392502281753354244,2021-05-12 15:29:50+00:00,0,0,https://twitter.com/i/web/status/1392502281753354244,do you have a chart showing stock sensitivity to interest rates 17 had a similar rate rise and the market melted now same higher taxes Much lower EPS Thanks
1392499996889554944,2021-05-12 15:20:45+00:00,1,0,https://twitter.com/i/web/status/1392499996889554944,Rates have doubled in the last 2 months Im not sure our YOLO equity market can handle another doubling to 3 Bad for bonds and stock So much for negative correlation stocks
1392498017941352451,2021-05-12 15:12:53+00:00,17,2,https://twitter.com/i/web/status/1392498017941352451,
1391609481574850566,2021-05-10 04:22:09+00:00,0,0,https://twitter.com/i/web/status/1391609481574850566,300 to 1500 Wow might be a little much
1390530725921783812,2021-05-07 04:55:34+00:00,0,0,https://twitter.com/i/web/status/1390530725921783812,Oh we needed that
1390524863006216199,2021-05-07 04:32:16+00:00,0,0,https://twitter.com/i/web/status/1390524863006216199,Good Co
1390524829321728000,2021-05-07 04:32:08+00:00,0,0,https://twitter.com/i/web/status/1390524829321728000,Compound rate over that time
1390302490986389507,2021-05-06 13:48:39+00:00,0,0,https://twitter.com/i/web/status/1390302490986389507,I want that photo as a bumpersticker
1390189513033408512,2021-05-06 06:19:43+00:00,0,0,https://twitter.com/i/web/status/1390189513033408512,Yes
1390101694126592000,2021-05-06 00:30:45+00:00,55,5,https://twitter.com/i/web/status/1390101694126592000,Lost 4 for every 1 of Revenue How do you lose money selling drugs astounding WeedLovers WEED CGC cashflow StockMarket wallstreetbets
1389643881478639617,2021-05-04 18:11:34+00:00,1,0,https://twitter.com/i/web/status/1389643881478639617,Hey thanks Im a sub to your channel Learned a lot that helped me start my own finance channel
1389609766553485314,2021-05-04 15:56:00+00:00,16,1,https://twitter.com/i/web/status/1389609766553485314,Can I interest you in a Gold Mine with a 6 year payback gold Revenue amp Earnings Growth Do Debt Well Priced lovewhatyouown
1389608175641370632,2021-05-04 15:49:41+00:00,1,0,https://twitter.com/i/web/status/1389608175641370632,Leverage in the CAPM This is from modern portfolio theory Garbage thanks but the principal of leverage to an expected return is correct Buy Strong and Stable Cash Flow Lovewhatyouown
1389606681957462020,2021-05-04 15:43:45+00:00,0,0,https://twitter.com/i/web/status/1389606681957462020,What A dog cant get in on this action Please
1389606509210836998,2021-05-04 15:43:04+00:00,12,0,https://twitter.com/i/web/status/1389606509210836998,How about an ATM machine with an 8 year payback Revenue amp Earnings Growth Low Debt and Strong Cash Flow Tip Borrowed money under reasonableaffordable terms will magnify this simple investment Think CAPM stocks Not YOLO
1389603040106188806,2021-05-04 15:29:16+00:00,4,0,https://twitter.com/i/web/status/1389603040106188806,Classic Valuing Investing with above market expected returns Rational Investing anyone stocks StocksToWatch investing ValueInvesting
1389425230548856834,2021-05-04 03:42:43+00:00,0,0,https://twitter.com/i/web/status/1389425230548856834,Print money stocks go higher
1389363621696729093,2021-05-03 23:37:55+00:00,1,0,https://twitter.com/i/web/status/1389363621696729093,This person is impersonating me on my channel by adding a to their YouTube Account Please STOP THIS NOW They are soliciting Whats App calls and this needs to end Ive asked you repeatedly to stop this with no answer Help
1388589129059864577,2021-05-01 20:20:21+00:00,6,0,https://twitter.com/i/web/status/1388589129059864577,The SampP 500 are global companies Comparing them to US GDP doesnt seem right Maybe the new metric is global GDP
1388539944679792644,2021-05-01 17:04:55+00:00,2,0,https://twitter.com/i/web/status/1388539944679792644,The latter for sure
1387761646832021506,2021-04-29 13:32:14+00:00,0,0,https://twitter.com/i/web/status/1387761646832021506,Its an open question Im trying to understand it myself Printing could be driving the drop in V Which means the economy could come back but P doesnt rise meaningfully
1387627960807481344,2021-04-29 04:41:01+00:00,4,1,https://twitter.com/i/web/status/1387627960807481344,How can we have inflation if velocity of is falling
1387627665750777858,2021-04-29 04:39:51+00:00,9,1,https://twitter.com/i/web/status/1387627665750777858,Velocity of money has been falling for 20 years
1387621951561080839,2021-04-29 04:17:08+00:00,2,0,https://twitter.com/i/web/status/1387621951561080839,Great article The decline in the velocity of money and increase in deposits is holding back inflation
1387598253479264258,2021-04-29 02:42:58+00:00,0,0,https://twitter.com/i/web/status/1387598253479264258,Interesting
1387431510718910467,2021-04-28 15:40:24+00:00,10,0,https://twitter.com/i/web/status/1387431510718910467,My favorite is CoinBase insiders selling their stock for good old fashion USD while investors sell for fake What a business model
1387258496802910209,2021-04-28 04:12:54+00:00,4,0,https://twitter.com/i/web/status/1387258496802910209,Corporations pay tax on their income and then we pay tax on dividends received Tax tax tax
1387098330153426944,2021-04-27 17:36:27+00:00,1,0,https://twitter.com/i/web/status/1387098330153426944,wallach Pull multiple 10ks from the sec website
1386880897060794380,2021-04-27 03:12:27+00:00,0,0,https://twitter.com/i/web/status/1386880897060794380,Nice
1386705603863605249,2021-04-26 15:35:54+00:00,7,0,https://twitter.com/i/web/status/1386705603863605249,Check out my Cash Flow Investing Course Learn how to buy cash flowing assets in the stock market This is classic valuing investing StockMarket cashflow wallstreetbets investing
1386136024670081025,2021-04-25 01:52:36+00:00,4,0,https://twitter.com/i/web/status/1386136024670081025,That College isnt worth it 400k at 10yr for 40 year 20 yr old retires at 60 18 million Thats the opportunity cost of spending money on college
1385789866529628161,2021-04-24 02:57:05+00:00,9,0,https://twitter.com/i/web/status/1385789866529628161,This is a paid ad for doge Dogecoins NFT bitcoin bitcoin I dont believe you can advertise stock investments why are these allowed Seems like a pump and dump scheme to me Good luck boys
1385258373969453063,2021-04-22 15:45:07+00:00,1,0,https://twitter.com/i/web/status/1385258373969453063,Wait Did the CCP just promote free markets
1385256759380430849,2021-04-22 15:38:42+00:00,6,0,https://twitter.com/i/web/status/1385256759380430849,DOCU Love the revenue growth but is 100 in profit too much to ask I thought scaling meant becoming profitable 6 years and waiting wallstreetbets cashflow ValueInvesting StocksToBuy
1385254937089634306,2021-04-22 15:31:28+00:00,19,0,https://twitter.com/i/web/status/1385254937089634306,Call me old fashioned but I remember when scaling meant becoming profitable Apparently not DOCU wallstreetbets StockMarket ValueInvesting
1384887123581440013,2021-04-21 15:09:54+00:00,0,0,https://twitter.com/i/web/status/1384887123581440013,Interesting
1384758090013167621,2021-04-21 06:37:10+00:00,0,0,https://twitter.com/i/web/status/1384758090013167621,Thanks
1384742379349897217,2021-04-21 05:34:45+00:00,9,0,https://twitter.com/i/web/status/1384742379349897217,This stock Fcks FB Great Value Reasonable Price and Tonnes yes metric of cash StockMarket wallstreetbets ValueInvesting
1384740487081259011,2021-04-21 05:27:14+00:00,12,0,https://twitter.com/i/web/status/1384740487081259011,The MGA review I did is living up to the hype Great job team Keep it up Had it at 50
1384673776386809859,2021-04-21 01:02:08+00:00,1,0,https://twitter.com/i/web/status/1384673776386809859,I thought China wasnt printing money Thats why they are seeing large capital inflows
1384673333606637570,2021-04-21 01:00:23+00:00,0,0,https://twitter.com/i/web/status/1384673333606637570,Atwater Great Did you hand draw that chart Hahaha But like to point
1384639225253941248,2021-04-20 22:44:51+00:00,0,0,https://twitter.com/i/web/status/1384639225253941248,Day to day no one knows
1384638995766734848,2021-04-20 22:43:56+00:00,1,0,https://twitter.com/i/web/status/1384638995766734848,They say this deep in the 10k but their most recent investor presentation says profitable in 2021 What garbage
1384532741505490944,2021-04-20 15:41:43+00:00,23,2,https://twitter.com/i/web/status/1384532741505490944,Its amazing what leadership can do New CEO in 2015 fantastic turnaround with large upside Congratulation Sir BMY ValueInvesting StockMarket wallstreetbets
1384531350925975552,2021-04-20 15:36:12+00:00,16,1,https://twitter.com/i/web/status/1384531350925975552,Growth at all cost Theyll be profitable with scale The industry is in its infancy How many more sales lines do we need to hear before we realize that this business might never be profitable Uber Losses actually increased with scale ValueInvesting
1384529580866764800,2021-04-20 15:29:10+00:00,11,0,https://twitter.com/i/web/status/1384529580866764800,K has been flat for almost a decade At what point does this become a takeover target At the very least change the management
1384527351057317893,2021-04-20 15:20:18+00:00,0,0,https://twitter.com/i/web/status/1384527351057317893,thanks for subscribing to my YouTube channel Any interest in collaborating and talking stocks
1384512066451492874,2021-04-20 14:19:34+00:00,16,0,https://twitter.com/i/web/status/1384512066451492874,thanks for the shout out on your channel I really appreciate the support
1384001570564497410,2021-04-19 04:31:02+00:00,0,0,https://twitter.com/i/web/status/1384001570564497410,Sounds about right
1383996973544394752,2021-04-19 04:12:46+00:00,0,0,https://twitter.com/i/web/status/1383996973544394752,JimCramer Crazy
1383587839024132101,2021-04-18 01:07:01+00:00,4,0,https://twitter.com/i/web/status/1383587839024132101,Finally some logic Thank you
1383272887029665792,2021-04-17 04:15:30+00:00,2,0,https://twitter.com/i/web/status/1383272887029665792,Ya Strong company RE comes with a lot of debt but otherwise looks good
1383269228363456515,2021-04-17 04:00:58+00:00,2,0,https://twitter.com/i/web/status/1383269228363456515,About time
1383269226949931015,2021-04-17 04:00:58+00:00,1,0,https://twitter.com/i/web/status/1383269226949931015,
1383235223572279296,2021-04-17 01:45:51+00:00,12,0,https://twitter.com/i/web/status/1383235223572279296,Zero Revenue and earnings growth for almost a decade at K Its time for a change PrivateEquity
1382912844136554497,2021-04-16 04:24:49+00:00,3,0,https://twitter.com/i/web/status/1382912844136554497,Charts charts charts
1382904321075912705,2021-04-16 03:50:57+00:00,2,0,https://twitter.com/i/web/status/1382904321075912705,Yes Amazing comment
1382903839783718915,2021-04-16 03:49:03+00:00,1,0,https://twitter.com/i/web/status/1382903839783718915,Oops
1382733059238207496,2021-04-15 16:30:25+00:00,0,0,https://twitter.com/i/web/status/1382733059238207496,can adjust this for asset values rather then CPI Id be interested to see the difference as inflation isnt in CPI currently
1382732660708044800,2021-04-15 16:28:50+00:00,2,0,https://twitter.com/i/web/status/1382732660708044800,I think predicting something to the moon is the definition of a bubble
1382732397410623488,2021-04-15 16:27:48+00:00,6,0,https://twitter.com/i/web/status/1382732397410623488,You better love what you own You might have to own it for a decade
1379937778838818817,2021-04-07 23:22:59+00:00,13,0,https://twitter.com/i/web/status/1379937778838818817,Strong upside for a strong stock BMY bristolmyerssquibb valueinvesting cashflow investing notbitcoin
1378139160670728192,2021-04-03 00:15:55+00:00,1,0,https://twitter.com/i/web/status/1378139160670728192,Yes
1378137784997703680,2021-04-03 00:10:27+00:00,1,0,https://twitter.com/i/web/status/1378137784997703680,Or just take a picture of it
1377697898431836161,2021-04-01 19:02:30+00:00,2,0,https://twitter.com/i/web/status/1377697898431836161,A deflationary force battling against the inflationary Fed and US stimulus
1377467669968904193,2021-04-01 03:47:39+00:00,10,0,https://twitter.com/i/web/status/1377467669968904193,GIS is a solid stock but cant grow because of too much debt and a high dividend ValueInvesting barronsonline JimCramer wallstreetbets
1376739967582396417,2021-03-30 03:36:01+00:00,1,0,https://twitter.com/i/web/status/1376739967582396417,You mean for ALL or in general ALL has a short duration portfolio which will mature and rest rather quickly at the new higher rates
1375237841085730817,2021-03-26 00:07:06+00:00,1,0,https://twitter.com/i/web/status/1375237841085730817,There is interest rate risk if rates rise the bond portfolio will fall in value
1375237651373121538,2021-03-26 00:06:21+00:00,0,0,https://twitter.com/i/web/status/1375237651373121538,Supply on top of supply what were you saying about a price decline
1375236794980003841,2021-03-26 00:02:57+00:00,0,0,https://twitter.com/i/web/status/1375236794980003841,Amazing
1375089054203531268,2021-03-25 14:15:53+00:00,2,0,https://twitter.com/i/web/status/1375089054203531268,wallach The 177 should be 117 My issue before filming The long term value is the same so possible IRR is actually higher than Im showing I added an UPDATE to the description on the channel to clarify Thanks for watching
1374918271074398208,2021-03-25 02:57:15+00:00,16,1,https://twitter.com/i/web/status/1374918271074398208,You are in good hands ALL cashflow ValueInvesting
1374577505596624900,2021-03-24 04:23:10+00:00,1,0,https://twitter.com/i/web/status/1374577505596624900,So youre telling me theres a chance
1374221026649804804,2021-03-23 04:46:39+00:00,0,0,https://twitter.com/i/web/status/1374221026649804804,Good chart
1374214105528102913,2021-03-23 04:19:09+00:00,1,0,https://twitter.com/i/web/status/1374214105528102913,Thats not lbs but diamond hands weighing them down Hahahaha
1373793639747383299,2021-03-22 00:28:22+00:00,1,0,https://twitter.com/i/web/status/1373793639747383299,Awesome Thanks
1373474184660094979,2021-03-21 03:18:58+00:00,1,0,https://twitter.com/i/web/status/1373474184660094979,Thanks
1372698534865113094,2021-03-18 23:56:48+00:00,2,0,https://twitter.com/i/web/status/1372698534865113094,Next week its a good one
1372698442103808007,2021-03-18 23:56:26+00:00,0,0,https://twitter.com/i/web/status/1372698442103808007,So youre saying theres a correction coming
