id,created_at,favorite_count,retweet_count,url,text
1568972407897051136,2022-09-11 14:39:06+00:00,235,18,https://twitter.com/i/web/status/1568972407897051136,Semis despised by institutions but loved by retail Problematic I would say that these are very heavily related to the shutdown in China and to depart now after this tremendous decline could be illadvised But they could retest lows The worst declines in semis
1568940446436442113,2022-09-11 12:32:06+00:00,1257,81,https://twitter.com/i/web/status/1568940446436442113,My goal this week how much lower can tech go on selloff to where people trust it again HUGE week
1568940288231542784,2022-09-11 12:31:28+00:00,364,21,https://twitter.com/i/web/status/1568940288231542784,Gearing up for one of our biggest weeks ever our west Having studied what people are saying about the market i think there is a belief again that last week was just a spike in a bear market The question is though especially with tech have we seen the lows
1568331354072567809,2022-09-09 20:11:47+00:00,826,25,https://twitter.com/i/web/status/1568331354072567809,goodnight
1568298875227873280,2022-09-09 18:02:44+00:00,637,23,https://twitter.com/i/web/status/1568298875227873280,The Days grow Short
1568242657889243136,2022-09-09 14:19:20+00:00,269,7,https://twitter.com/i/web/status/1568242657889243136,i did not draft the GOAT
1567975773952217088,2022-09-08 20:38:50+00:00,969,26,https://twitter.com/i/web/status/1567975773952217088,almost ready
1567944000190939136,2022-09-08 18:32:35+00:00,204,4,https://twitter.com/i/web/status/1567944000190939136,early version of Marco Polo
1567571774774169600,2022-09-07 17:53:29+00:00,434,10,https://twitter.com/i/web/status/1567571774774169600,just a great show
1567565698343337992,2022-09-07 17:29:21+00:00,390,9,https://twitter.com/i/web/status/1567565698343337992,rare storm
1567128906729398274,2022-09-06 12:33:41+00:00,1126,24,https://twitter.com/i/web/status/1567128906729398274,insanely gorgeous
1567128065091977219,2022-09-06 12:30:21+00:00,487,16,https://twitter.com/i/web/status/1567128065091977219,Bear market forgotten for a few
1566896184270127105,2022-09-05 21:08:56+00:00,805,14,https://twitter.com/i/web/status/1566896184270127105,goodnight
1566789515846553603,2022-09-05 14:05:04+00:00,307,12,https://twitter.com/i/web/status/1566789515846553603,dont get pigeonholed
1566786284735037441,2022-09-05 13:52:14+00:00,3941,60,https://twitter.com/i/web/status/1566786284735037441,Italia
1566786149892456450,2022-09-05 13:51:42+00:00,660,11,https://twitter.com/i/web/status/1566786149892456450,and finally the clock tower
1566779408844742658,2022-09-05 13:24:55+00:00,406,15,https://twitter.com/i/web/status/1566779408844742658,defend these walls
1566778838390112256,2022-09-05 13:22:39+00:00,378,8,https://twitter.com/i/web/status/1566778838390112256,Certaldo by day
1566740720630878208,2022-09-05 10:51:11+00:00,793,12,https://twitter.com/i/web/status/1566740720630878208,under a scalding Tuscan sun
1566173819697565698,2022-09-03 21:18:31+00:00,399,10,https://twitter.com/i/web/status/1566173819697565698,under the Tuscan moon
1565465703645417474,2022-09-01 22:24:43+00:00,796,35,https://twitter.com/i/web/status/1565465703645417474,they like an oversold market
1565272015363313664,2022-09-01 09:35:04+00:00,677,34,https://twitter.com/i/web/status/1565272015363313664,Nvidia and AMD have been falling for a long time Not saying buy am saying watch our 1020 Morning Meeting
1565247739570561028,2022-09-01 07:58:36+00:00,418,23,https://twitter.com/i/web/status/1565247739570561028,I am actually surprised that Nasdaq is down only 1 given the surprise sanctions out government put on techs in China
1565127465592315904,2022-09-01 00:00:41+00:00,396,15,https://twitter.com/i/web/status/1565127465592315904,Full workup on Nvidia coming to club members Very convoluted story
1565091559930232834,2022-08-31 21:38:00+00:00,215,12,https://twitter.com/i/web/status/1565091559930232834,Oscillator not as negative as i would like Good ideas on oil and gas tonight And how the tightening ends
1565052585966555136,2022-08-31 19:03:08+00:00,659,35,https://twitter.com/i/web/status/1565052585966555136,We are going down to minus ten on the SampP Oscillator for certain
1565040755206504448,2022-08-31 18:16:07+00:00,87,3,https://twitter.com/i/web/status/1565040755206504448,Instant gold
1564988002794979329,2022-08-31 14:46:30+00:00,287,7,https://twitter.com/i/web/status/1564988002794979329,Correction Bens dog is named Riggins like the coach not the president Bark rescue dogs pictured
1564967845380997120,2022-08-31 13:26:24+00:00,597,37,https://twitter.com/i/web/status/1564967845380997120,Government should be looking into endless coin creation Insane
1564965696865550337,2022-08-31 13:17:52+00:00,450,19,https://twitter.com/i/web/status/1564965696865550337,Bye Bye Snap Memesters have you thought of SNAP
1564953589126242307,2022-08-31 12:29:45+00:00,146,9,https://twitter.com/i/web/status/1564953589126242307,BYE BYE BED BATH Nah we just need to see if they can get any branded merchandise that Target didnt get Time for Cohen to get back in Maybe ask his three board guys
1564942701656776705,2022-08-31 11:46:29+00:00,176,10,https://twitter.com/i/web/status/1564942701656776705,Memesters Buy Buy Baby for Bupkis
1564940876757041154,2022-08-31 11:39:14+00:00,117,4,https://twitter.com/i/web/status/1564940876757041154,Van Morrisons borthday
1564932589932187648,2022-08-31 11:06:19+00:00,111,8,https://twitter.com/i/web/status/1564932589932187648,Bed Bath can we hold this one at Ten Can they do it How many divisions do they have
1564927896665423872,2022-08-31 10:47:40+00:00,76,5,https://twitter.com/i/web/status/1564927896665423872,Right now the Braveheart Main Wall Street Bets people besides seething at me who has actually tried to bail you out at much higher prices is drawing a line at 12 How many stores have they been to Target bought the branded stuff in front of them
1564927001013764099,2022-08-31 10:44:06+00:00,95,8,https://twitter.com/i/web/status/1564927001013764099,I am sure Ryan Cohen is very worried that BBBY might sell stock on the backs of his departed warriors who are discovering the Red Seas full potential
1564926825981263874,2022-08-31 10:43:24+00:00,197,9,https://twitter.com/i/web/status/1564926825981263874,Today is a crucial day for the really funny memes to do the opposite of Jim Cramer and buy more BBBY even as savior Ryan Cohen with 3 board members he didnt talk to bailed at better prices than his beloved investment
1564926542664400902,2022-08-31 10:42:17+00:00,111,8,https://twitter.com/i/web/status/1564926542664400902,At least Gamestop had cash even as it has no raison detre
1564926425399959552,2022-08-31 10:41:49+00:00,330,18,https://twitter.com/i/web/status/1564926425399959552,My wonderful trashtalking Meme friends will discover just how poorly the BBBY management is doing today They will counter with emojis of funny stars and rockets while they realize they dont know what they are doing
1564920098028224512,2022-08-31 10:16:40+00:00,2100,149,https://twitter.com/i/web/status/1564920098028224512,We are now very oversold on traditional SampP Oscillator Historically bad level to sell
1564919899230699521,2022-08-31 10:15:53+00:00,45,3,https://twitter.com/i/web/status/1564919899230699521,Jay Powell not a fan of endless startups that cause the dreaded job hop that drives wages up
1564919747417985029,2022-08-31 10:15:17+00:00,236,13,https://twitter.com/i/web/status/1564919747417985029,In New York we had a tremendous immigrant population who wanted entry level jobs Its been two years They never came back
1564919524876603395,2022-08-31 10:14:24+00:00,92,2,https://twitter.com/i/web/status/1564919524876603395,Were rank and file everywhere simply underpaid You have to wonder where these people went and why they were able to stop working The savings rate isnt that high Does these jobs that were so integral now seem nominal and superfluous
1564909656442642433,2022-08-31 09:35:11+00:00,282,24,https://twitter.com/i/web/status/1564909656442642433,Why doesnt Angela Merkel come out and condemn Putin for his criminality I found myself wistful for Gorbachev who while not a great man recognized the need to stop running an Evil Empire Putin wants to reestablish it on the backs of Ukraine and Gazprom Hes winning
1564758962725130241,2022-08-30 23:36:23+00:00,5471,645,https://twitter.com/i/web/status/1564758962725130241,The Fed is telling you to sell the cryptos and the nfts and the ipos and the SPACs before they take your lifes savings No more nonsense
1564733286555029504,2022-08-30 21:54:21+00:00,57,3,https://twitter.com/i/web/status/1564733286555029504,Do you know Golem How about Old Golem You are about to learn something
1564732202390274050,2022-08-30 21:50:03+00:00,398,21,https://twitter.com/i/web/status/1564732202390274050,Why crypto is like Seinfeld at 6
1564605649912217607,2022-08-30 13:27:10+00:00,165,12,https://twitter.com/i/web/status/1564605649912217607,As the person who created FAANG and recommended it for ages i sure hope you shorted me What a silly name you have What was your mother thinking
1564557494302679042,2022-08-30 10:15:49+00:00,51,2,https://twitter.com/i/web/status/1564557494302679042,Upcoming super spreader event coronation of Xi
1564557302002335748,2022-08-30 10:15:03+00:00,1605,70,https://twitter.com/i/web/status/1564557302002335748,note to followers GET OUT OF MY FACE unless you are constructive as you are an unfriendly free fire zone today
1564557150029893632,2022-08-30 10:14:27+00:00,117,4,https://twitter.com/i/web/status/1564557150029893632,Having been homeless and penniless i resent your series of silly second grade emos Unless you are in second grade then i applaud you and give you a gold star
1564556699889029121,2022-08-30 10:12:39+00:00,427,18,https://twitter.com/i/web/status/1564556699889029121,You are a firstclass sellout to your country
1564556498788810753,2022-08-30 10:11:52+00:00,188,12,https://twitter.com/i/web/status/1564556498788810753,crush Russia
1564556386062811136,2022-08-30 10:11:25+00:00,75,5,https://twitter.com/i/web/status/1564556386062811136,Muuuux you are hilariously stupid
1564556288981405696,2022-08-30 10:11:02+00:00,60,1,https://twitter.com/i/web/status/1564556288981405696,Google it start with 1938
1564556187475083266,2022-08-30 10:10:37+00:00,47,2,https://twitter.com/i/web/status/1564556187475083266,First i loved to go to Johnny Rockets when my kids were in 5th grade I liked the stupid birthday cheer you did Second you dont even watch or read you lunkhead or you would know thats not true Why not terminate your intellectual vacation Typical meme moron Go home
1564555085220298752,2022-08-30 10:06:15+00:00,94,7,https://twitter.com/i/web/status/1564555085220298752,if the Europeans can break the momentum of higher energy prices then there will not be a Munich sellout of Ukraine But Ukraine lacks the latest weapons and Russia is a sanctuary making it an unfair fight
1564521648673415169,2022-08-30 07:53:23+00:00,168,12,https://twitter.com/i/web/status/1564521648673415169,Did the Russians misjudge our ability to help get enough natural gas to Europe often by switching where the cargo is going That could make for a different catalyst come winter I thought Putin might just be playing for time until the winter
1564520854402260992,2022-08-30 07:50:13+00:00,99,3,https://twitter.com/i/web/status/1564520854402260992,Tremendous remorse when you get up Like why did i pick all of those real young guys But then again Kelce Lamb Chase I mean not bad
1564424836964917251,2022-08-30 01:28:41+00:00,88,1,https://twitter.com/i/web/status/1564424836964917251,had to have an Eagle somewhere
1564424750637748224,2022-08-30 01:28:20+00:00,57,1,https://twitter.com/i/web/status/1564424750637748224,
1564424706824044545,2022-08-30 01:28:10+00:00,184,2,https://twitter.com/i/web/status/1564424706824044545,The 2022 Skidaddy Squad
1564285856457932801,2022-08-29 16:16:25+00:00,282,34,https://twitter.com/i/web/status/1564285856457932801,I am not comfortable that the MEMEstersBBBY Weber are running But i do think that the tape changed but the narrative hasnt Way too many bears
1564285324452323329,2022-08-29 16:14:19+00:00,1260,98,https://twitter.com/i/web/status/1564285324452323329,Even as people keep talking about the selloff as we told people in the Investing Club it is time to buy Or was this morning And we did
1564242179811336197,2022-08-29 13:22:52+00:00,54,4,https://twitter.com/i/web/status/1564242179811336197,oh the pain
1564241330217406467,2022-08-29 13:19:29+00:00,383,27,https://twitter.com/i/web/status/1564241330217406467,Its a total out of body experience
1564236482549776387,2022-08-29 13:00:14+00:00,50,3,https://twitter.com/i/web/status/1564236482549776387,all good but the Chinese
1564236287367938050,2022-08-29 12:59:27+00:00,58,4,https://twitter.com/i/web/status/1564236287367938050,guess the company
1564197227165253637,2022-08-29 10:24:14+00:00,662,36,https://twitter.com/i/web/status/1564197227165253637,We are mimicking the worst market as always
1563941603030568965,2022-08-28 17:28:29+00:00,2135,58,https://twitter.com/i/web/status/1563941603030568965,cup runneth over
1563917596461875200,2022-08-28 15:53:05+00:00,551,42,https://twitter.com/i/web/status/1563917596461875200,It is true that energy costs are up big in Europe But why doesnt anyone consider that Europes problems are our Opportunities which is truth
1563917328059957248,2022-08-28 15:52:01+00:00,235,23,https://twitter.com/i/web/status/1563917328059957248,There are many gluts out there but until their is a glut in employees Chairman Powell will not be done It turns out there is only one peak inflation number that matters employment I would think that the percentage unemployed has to go to 45 before this war is over
1563916759555530753,2022-08-28 15:49:46+00:00,631,48,https://twitter.com/i/web/status/1563916759555530753,Remember our 4 am futures will mimic the WORST overseas decline whether it be Italy or China or Japan or UK
1563916444563300356,2022-08-28 15:48:31+00:00,1590,111,https://twitter.com/i/web/status/1563916444563300356,The inevitability of a huge second day decline even after a horrendous first day is a standard aspect of this market
1563902929827991552,2022-08-28 14:54:49+00:00,144,9,https://twitter.com/i/web/status/1563902929827991552,Why is it so difficult to sign in to Fantasy Sites I am a member of the Huddle and i cant get in and the darned site sends me to a lawyer for help who then reveals that she was actually working for No Huddle I think this site is run by USA Today Is it a scam
1563545115259351040,2022-08-27 15:12:59+00:00,539,10,https://twitter.com/i/web/status/1563545115259351040,picked to Pink
1563527292261122052,2022-08-27 14:02:10+00:00,440,15,https://twitter.com/i/web/status/1563527292261122052,picked to Clapton and Van
1563509135949172737,2022-08-27 12:50:01+00:00,717,54,https://twitter.com/i/web/status/1563509135949172737,We must keep at it until the job is done Fed Chief Powell finally goes all in We are in a By Any Means Necessary fight against embedded inflation and i am grateful he sees it like that
1563280289484652545,2022-08-26 21:40:40+00:00,95,7,https://twitter.com/i/web/status/1563280289484652545,Cheers
1563162330758017032,2022-08-26 13:51:56+00:00,171,21,https://twitter.com/i/web/status/1563162330758017032,The SEC Chairman cracking down on Chinese securities but i could not get him to talk about the 3 most recent facades of companies that are trading However Dollarbase coin of David and mine will not be registered
1563106891755991040,2022-08-26 10:11:38+00:00,102,8,https://twitter.com/i/web/status/1563106891755991040,When will the conventional retailers avail themselves of all the unconventional help that Silicon Valley offers when it comes to staffing
1562931031090466816,2022-08-25 22:32:50+00:00,27,1,https://twitter.com/i/web/status/1562931031090466816,you deserve more respect from a rival team
1562930896675950597,2022-08-25 22:32:18+00:00,115,9,https://twitter.com/i/web/status/1562930896675950597,Big piece coming up on Marvell which i think is doing very well Have to like those WSM and WDAY numbers
1562834379076169730,2022-08-25 16:08:46+00:00,68,7,https://twitter.com/i/web/status/1562834379076169730,Setting you up with all you need to know to understand todays tape Check out a recap of our Morning Meeting
1562816292184522753,2022-08-25 14:56:54+00:00,651,50,https://twitter.com/i/web/status/1562816292184522753,Hey Victor in California is Canopy Growth a meme stock
1562813081243516930,2022-08-25 14:44:08+00:00,59,1,https://twitter.com/i/web/status/1562813081243516930,Watch our Morning Meeting at 1020 to get the full skinny on this day
1562788740753268736,2022-08-25 13:07:25+00:00,58,3,https://twitter.com/i/web/status/1562788740753268736,Oz Fetterman Jensen Sloot
1562742296449130497,2022-08-25 10:02:52+00:00,56,2,https://twitter.com/i/web/status/1562742296449130497,So much this morning check last nights club bulletins if you want a heads up on Nvidia and Rough night for them but remember what i said the other daywe are trading off the weakest markets worldwide and they are strong today
1562734888398508033,2022-08-25 09:33:26+00:00,300,11,https://twitter.com/i/web/status/1562734888398508033,Its seems logical that perhaps Cathie Wood comes back and buys Nvidia even if it is too early because early means nothing to her
1562560900389027841,2022-08-24 22:02:04+00:00,234,14,https://twitter.com/i/web/status/1562560900389027841,Now this is a wild show
1562438204464123904,2022-08-24 13:54:31+00:00,198,8,https://twitter.com/i/web/status/1562438204464123904,great show now Morning Meeting then Halftime
1562423986280992770,2022-08-24 12:58:01+00:00,220,5,https://twitter.com/i/web/status/1562423986280992770,we are on in two minutes
1562393818833784832,2022-08-24 10:58:08+00:00,295,18,https://twitter.com/i/web/status/1562393818833784832,the market is sick of people saying ai and machine learning and data analysis it is incredible how much those terms are hatedMight as well say they are selling anthracite coal
1562392788742053888,2022-08-24 10:54:03+00:00,91,4,https://twitter.com/i/web/status/1562392788742053888,Nvidiasmall club name and we are telling investors what to do in the investing clubs Morning Meeting at 1020 Signup and get it
1562392476358709248,2022-08-24 10:52:48+00:00,135,16,https://twitter.com/i/web/status/1562392476358709248,Of course futures going down and semis weaker Dont forget we have the much hated Salesforce and Snowflake coming up No demand for these stocks yesterday Too much talk about AI and the use of data which we are ALL SICK OF
1562362027901075456,2022-08-24 08:51:49+00:00,92,5,https://twitter.com/i/web/status/1562362027901075456,Studying Nordstrom and Toll A lot to unpack so to speak
1562223952243884032,2022-08-23 23:43:09+00:00,265,6,https://twitter.com/i/web/status/1562223952243884032,and the blue sky with it
1562223796014030848,2022-08-23 23:42:32+00:00,446,12,https://twitter.com/i/web/status/1562223796014030848,like a crayola bolt
1562223414017830913,2022-08-23 23:41:01+00:00,416,9,https://twitter.com/i/web/status/1562223414017830913,its a twofer
1562223283302703106,2022-08-23 23:40:30+00:00,300,10,https://twitter.com/i/web/status/1562223283302703106,pot of gold in Summit NJ
1562216666343546882,2022-08-23 23:14:12+00:00,866,14,https://twitter.com/i/web/status/1562216666343546882,meal in itself
1562183910532042757,2022-08-23 21:04:02+00:00,160,9,https://twitter.com/i/web/status/1562183910532042757,really booking tonightnew idea and 20012008 comparisons
1562071114834219009,2022-08-23 13:35:50+00:00,248,12,https://twitter.com/i/web/status/1562071114834219009,INTEL trying so hard to get out of its rut Five year low
1562021614396530689,2022-08-23 10:19:08+00:00,330,27,https://twitter.com/i/web/status/1562021614396530689,Heres how you can tell a mean mercurial market Last week we wanted oil down because we were worried about inflation This week we want it up because of recession fears Not sustainable thinking
1562010151569309696,2022-08-23 09:33:35+00:00,126,9,https://twitter.com/i/web/status/1562010151569309696,Watch retailers here today for a rebound led by Walmart which has fallen hard since great q Pick up some PANW on weakness if there is any
1561986434579447808,2022-08-23 07:59:20+00:00,335,20,https://twitter.com/i/web/status/1561986434579447808,Meme hangover and Jackson Hole both hurting market Memester cleanout brutal
1561985986502004736,2022-08-23 07:57:34+00:00,94,11,https://twitter.com/i/web/status/1561985986502004736,Semis and software as anything are just horrendous stocks even as many of the companies themselves like Palo Alto are doing incredible well At least PANW has a buyback and a split Retail wont budge without a split
1561817304303820800,2022-08-22 20:47:17+00:00,462,25,https://twitter.com/i/web/status/1561817304303820800,Palo Alto with a monster quarter i like everything i hear On tonight
1561713119340236800,2022-08-22 13:53:17+00:00,60,2,https://twitter.com/i/web/status/1561713119340236800,Yes Target cleared all of its inventory and you need to subtract that from the bottom line as Brian said on the call
1561712326608404480,2022-08-22 13:50:08+00:00,132,8,https://twitter.com/i/web/status/1561712326608404480,Last week AMAT TGTLOW HD FL DE all good
1561712168109752320,2022-08-22 13:49:30+00:00,141,3,https://twitter.com/i/web/status/1561712168109752320,making sales check your email
1561702573454901248,2022-08-22 13:11:23+00:00,1083,53,https://twitter.com/i/web/status/1561702573454901248,talking positive about Meme stocks
1561699505908621315,2022-08-22 12:59:11+00:00,86,5,https://twitter.com/i/web/status/1561699505908621315,Comments negative VFC UPS and feels like Nvidia
1561678452633247746,2022-08-22 11:35:32+00:00,375,32,https://twitter.com/i/web/status/1561678452633247746,Remember you get your APE today which is weighing on the normal stock Mother of All Short Squeezed to get stock up to buy Regal
1561668383254450177,2022-08-22 10:55:31+00:00,48,5,https://twitter.com/i/web/status/1561668383254450177,I understand this The tug is the market versus individual stocksso many companies are doing so well
1561668155927314432,2022-08-22 10:54:37+00:00,422,33,https://twitter.com/i/web/status/1561668155927314432,AMC down because of Cineworld and Regal but will rally the Ape troops Surprised they are bailing
1561655029676888066,2022-08-22 10:02:27+00:00,76,6,https://twitter.com/i/web/status/1561655029676888066,Way overdone but i respect it
1561652628769103874,2022-08-22 09:52:55+00:00,140,7,https://twitter.com/i/web/status/1561652628769103874,Heres whats so counterintuitive we go down as much as Germanymaybe even moreeven as we are in such better shape both with natural resources and a better financial scheme We just lack more workers
1561632893037936642,2022-08-22 08:34:30+00:00,124,11,https://twitter.com/i/web/status/1561632893037936642,ship has sailed with Ryan Cohen Now just dealing with his shares that are being sold in the market place Please be careful the patron saint has left the building
1561632575847862272,2022-08-22 08:33:14+00:00,252,21,https://twitter.com/i/web/status/1561632575847862272,How low does Nasdaq want to go based on nothing other than the usual pressures of fedcommoditiesearnings When the market goes down on nothing new the sellers are too aggressive You must let them sell and get out of their way
1561624685120471040,2022-08-22 08:01:53+00:00,55,6,https://twitter.com/i/web/status/1561624685120471040,I think this is the correct perspective if Bed Bath were a sports team and not a stock
1561623472253583360,2022-08-22 07:57:04+00:00,151,8,https://twitter.com/i/web/status/1561623472253583360,I think has done a terrific job changing and improving his shareholders fortunes I have yet to see anything change at Gamestop but i am waitingBBBY Minus 20 comp sales means they need money badly Why dont you band together and offer it to them
1561622742264332289,2022-08-22 07:54:09+00:00,120,5,https://twitter.com/i/web/status/1561622742264332289,The Journal reports that the believers in Bed Bath are still holding strong despite Cohens exit I guess it doesnt bother them that even after he put three people on the board he wouldnt stick around How can that mean nothing to these people
1561507362246098946,2022-08-22 00:15:41+00:00,420,30,https://twitter.com/i/web/status/1561507362246098946,Just sent club members a piece about what we need to see to please the fed I know the market looks down tomorrow But we need some real reasons to sell
1561451766478258183,2022-08-21 20:34:46+00:00,702,16,https://twitter.com/i/web/status/1561451766478258183,staff get ready
1561049620565868545,2022-08-20 17:56:47+00:00,120,12,https://twitter.com/i/web/status/1561049620565868545,I wonder whether Thetzilla thinks this highly unoriginal concept is funny or annoying or just pollutive Is he why Twitter is failing because there is no sense in reading comments any more The destruction of Twitter through Greshams Law Thetzilla google it is palpable
1561048919425048577,2022-08-20 17:53:59+00:00,26,2,https://twitter.com/i/web/status/1561048919425048577,fascinating and definitely worth looking in to
1560752864036790272,2022-08-19 22:17:34+00:00,829,33,https://twitter.com/i/web/status/1560752864036790272,You know why this is Because i have a life
1560752351010603008,2022-08-19 22:15:32+00:00,678,12,https://twitter.com/i/web/status/1560752351010603008,beefsteaks galore
1560752192881033217,2022-08-19 22:14:54+00:00,77,4,https://twitter.com/i/web/status/1560752192881033217,done lunch tomorrow
1560752004011532288,2022-08-19 22:14:09+00:00,187,7,https://twitter.com/i/web/status/1560752004011532288,shooting match
1560751890308243456,2022-08-19 22:13:42+00:00,56,1,https://twitter.com/i/web/status/1560751890308243456,I have and will always be a sweetheart
