id,created_at,favorite_count,retweet_count,url,text
1544606624823885824,2022-07-06 08:58:11+00:00,26,2,https://twitter.com/i/web/status/1544606624823885824,i keep seeing Three Arrows as the debtor on everything here They must have borrowed so much
1544606307159867392,2022-07-06 08:56:55+00:00,121,5,https://twitter.com/i/web/status/1544606307159867392,John Book said we would be safe in Voyager
1544604316492828675,2022-07-06 08:49:01+00:00,30,2,https://twitter.com/i/web/status/1544604316492828675,Its all safe in the Vauld
1544604135932174337,2022-07-06 08:48:18+00:00,33,1,https://twitter.com/i/web/status/1544604135932174337,amen to this
1544603920173043715,2022-07-06 08:47:26+00:00,134,9,https://twitter.com/i/web/status/1544603920173043715,Three Arrows is beginning to look a lot like a miniLong Term Capital when it comes to the crypto bankers When are the other crypto billionaires going to step up to help Sam the Bank Man
1544443375042105344,2022-07-05 22:09:29+00:00,1274,92,https://twitter.com/i/web/status/1544443375042105344,Crypto night in America Maybewatch
1544347445311770624,2022-07-05 15:48:18+00:00,509,12,https://twitter.com/i/web/status/1544347445311770624,A new month
1544308932579049472,2022-07-05 13:15:16+00:00,548,16,https://twitter.com/i/web/status/1544308932579049472,gloomy day but gardens hanging in
1544229104249184258,2022-07-05 07:58:03+00:00,757,67,https://twitter.com/i/web/status/1544229104249184258,If oil were to plunge that would be the answer to the Feds prayers now that housing is rolling over and we would be near done the tightening cycle
1544228329171083264,2022-07-05 07:54:58+00:00,424,38,https://twitter.com/i/web/status/1544228329171083264,Citi says oil could go to 65 in a recession Once oil peaked every single tentative oil bull has started to turn bullish even as it has more to do with supply than demand
1544093448399208448,2022-07-04 22:59:00+00:00,265,9,https://twitter.com/i/web/status/1544093448399208448,If you are a member of the CNBC Investing Club please open your inbox tonight for a special piece on where we are
1543969405243195392,2022-07-04 14:46:06+00:00,882,14,https://twitter.com/i/web/status/1543969405243195392,hidden gems
1543968978837577729,2022-07-04 14:44:24+00:00,206,3,https://twitter.com/i/web/status/1543968978837577729,Beanstocks devoid of beans
1543954843911557120,2022-07-04 13:48:14+00:00,423,7,https://twitter.com/i/web/status/1543954843911557120,boring like consumer packaged goods stocks
1543704558483947525,2022-07-03 21:13:42+00:00,435,11,https://twitter.com/i/web/status/1543704558483947525,Hint from Jimmy Chill
1543704283496988679,2022-07-03 21:12:36+00:00,152,5,https://twitter.com/i/web/status/1543704283496988679,who wins this battle
1543206719756664832,2022-07-02 12:15:28+00:00,262,9,https://twitter.com/i/web/status/1543206719756664832,social climbers
1543200477352951808,2022-07-02 11:50:39+00:00,599,11,https://twitter.com/i/web/status/1543200477352951808,i think it works
1543200147324157955,2022-07-02 11:49:21+00:00,281,6,https://twitter.com/i/web/status/1543200147324157955,the lengths you need to go to keep things at bay
1543199012395819008,2022-07-02 11:44:50+00:00,239,6,https://twitter.com/i/web/status/1543199012395819008,not yet
1542944338702962689,2022-07-01 18:52:51+00:00,296,32,https://twitter.com/i/web/status/1542944338702962689,Make a plan and stick with it
1542857075495157760,2022-07-01 13:06:06+00:00,148,10,https://twitter.com/i/web/status/1542857075495157760,only a reversal up for Micron based on everyone knowing how bad things were would save the SMH though
1542856870062444544,2022-07-01 13:05:17+00:00,131,9,https://twitter.com/i/web/status/1542856870062444544,Try as they may the analysts couldnt get Sanjay to say there was data center weakness only low end cellphone and all pc MU down huge already Anything can go lower in this market though
1542649841632923653,2022-06-30 23:22:37+00:00,256,20,https://twitter.com/i/web/status/1542649841632923653,I have no idea why the street thought Micron could have such a strong quarter Really pathetic They telegraphed it endlessly
1542555339182292993,2022-06-30 17:07:06+00:00,236,55,https://twitter.com/i/web/status/1542555339182292993,And recession started already
1542555268172726272,2022-06-30 17:06:49+00:00,676,33,https://twitter.com/i/web/status/1542555268172726272,if you were on my call with Jensen about Nvidias digital twin AI game changer you would be buying not selling
1542554673240047623,2022-06-30 17:04:28+00:00,403,29,https://twitter.com/i/web/status/1542554673240047623,As i said in the Morning Meeting the sellers were dumb as wood You have to join the club if only for the morning meetings We throw everything at you and said the selling had become ridiculous
1542442953121177605,2022-06-30 09:40:31+00:00,7,0,https://twitter.com/i/web/status/1542442953121177605,Insanity
1542442784526827520,2022-06-30 09:39:51+00:00,171,13,https://twitter.com/i/web/status/1542442784526827520,Fitting worst first half since 1970 given that we are in fighting inflation mode RH and MUscene setters Read this mornings memo on what i am looking at
1542268345117966337,2022-06-29 22:06:42+00:00,1409,62,https://twitter.com/i/web/status/1542268345117966337,i am being shorted by every hedge fund
1542257555115839489,2022-06-29 21:23:49+00:00,144,8,https://twitter.com/i/web/status/1542257555115839489,I am liking this top but this RH news ugh
1542254643560030210,2022-06-29 21:12:15+00:00,144,9,https://twitter.com/i/web/status/1542254643560030210,Are we too negative tonight
1542184972135669761,2022-06-29 16:35:24+00:00,599,23,https://twitter.com/i/web/status/1542184972135669761,i was downgraded by a bunch of firms today
1542184114438258689,2022-06-29 16:31:59+00:00,250,7,https://twitter.com/i/web/status/1542184114438258689,i feel like a semiconductor stock
1542163653448896514,2022-06-29 15:10:41+00:00,100,4,https://twitter.com/i/web/status/1542163653448896514,One Wall Street is coming back to life
1542154499929808896,2022-06-29 14:34:19+00:00,146,9,https://twitter.com/i/web/status/1542154499929808896,Are these analysts trying to cause a run on deposits at Carnival
1542134328133574657,2022-06-29 13:14:09+00:00,184,11,https://twitter.com/i/web/status/1542134328133574657,Lucky Charms
1542130568875442178,2022-06-29 12:59:13+00:00,589,11,https://twitter.com/i/web/status/1542130568875442178,more pals
1542095729547673601,2022-06-29 10:40:47+00:00,7,0,https://twitter.com/i/web/status/1542095729547673601,Bobs from Hammond Proud
1542092207494152193,2022-06-29 10:26:47+00:00,170,7,https://twitter.com/i/web/status/1542092207494152193,Are you ready Skidaddy
1541870748951891972,2022-06-28 19:46:47+00:00,301,23,https://twitter.com/i/web/status/1541870748951891972,Thinking of buying Amazon Then tonights is incredibly important for you because we sit down with Adam Selipsky who is ceo of Amazon Web Services
1541775005167517696,2022-06-28 13:26:20+00:00,482,4,https://twitter.com/i/web/status/1541775005167517696,they are trying to fly today
1541768081931964416,2022-06-28 12:58:50+00:00,1187,87,https://twitter.com/i/web/status/1541768081931964416,Never bet against Elontotal agreement with Schmidt
1541539403096547329,2022-06-27 21:50:08+00:00,245,15,https://twitter.com/i/web/status/1541539403096547329,Nike flat to down margins seems intriguingremember how the street always loves this one
1541530530159755271,2022-06-27 21:14:53+00:00,176,9,https://twitter.com/i/web/status/1541530530159755271,Morgan Stanley club name WOWZA
1541527844056170498,2022-06-27 21:04:12+00:00,825,41,https://twitter.com/i/web/status/1541527844056170498,Nikes got a bullish tone to it for certain
1541396126179512322,2022-06-27 12:20:48+00:00,867,15,https://twitter.com/i/web/status/1541396126179512322,pals
1541167529976119298,2022-06-26 21:12:27+00:00,606,9,https://twitter.com/i/web/status/1541167529976119298,glorious
1540707715630018563,2022-06-25 14:45:19+00:00,1208,19,https://twitter.com/i/web/status/1540707715630018563,a lot to do
1540704603238412288,2022-06-25 14:32:56+00:00,862,11,https://twitter.com/i/web/status/1540704603238412288,nothing like natures perfection
1540702000937160704,2022-06-25 14:22:36+00:00,352,10,https://twitter.com/i/web/status/1540702000937160704,maybe it is up to her
1540701867986092033,2022-06-25 14:22:04+00:00,402,7,https://twitter.com/i/web/status/1540701867986092033,i think they are ready to launch how about you
1540487742970265606,2022-06-25 00:11:13+00:00,329,5,https://twitter.com/i/web/status/1540487742970265606,that was fast
1540486929875193863,2022-06-25 00:07:59+00:00,188,2,https://twitter.com/i/web/status/1540486929875193863,let the games begin
1540447553669529602,2022-06-24 21:31:31+00:00,10,0,https://twitter.com/i/web/status/1540447553669529602,you made my day with this
1540447188899319811,2022-06-24 21:30:04+00:00,125,7,https://twitter.com/i/web/status/1540447188899319811,i want to buy a highyielding oil
1540447026030252033,2022-06-24 21:29:25+00:00,610,29,https://twitter.com/i/web/status/1540447026030252033,Had Jack and Diet Coke last night you will be so into it
1540419352188567555,2022-06-24 19:39:27+00:00,132,11,https://twitter.com/i/web/status/1540419352188567555,truth
1540390762210365442,2022-06-24 17:45:51+00:00,185,8,https://twitter.com/i/web/status/1540390762210365442,Larry Williams gets it right again
1540331416801738752,2022-06-24 13:50:02+00:00,181,6,https://twitter.com/i/web/status/1540331416801738752,This is the show
1540328580227514368,2022-06-24 13:38:46+00:00,109,5,https://twitter.com/i/web/status/1540328580227514368,totally wrong he thinks the stock is ridiculously cheap
1540325835508523021,2022-06-24 13:27:51+00:00,210,4,https://twitter.com/i/web/status/1540325835508523021,I am liking this show with lots of good info
1540293294009229312,2022-06-24 11:18:33+00:00,59,3,https://twitter.com/i/web/status/1540293294009229312,What a blast
1540291181250240512,2022-06-24 11:10:09+00:00,40,4,https://twitter.com/i/web/status/1540291181250240512,great call by you on the oils I imagine there is still no bottom despite the yields
1540241643311403008,2022-06-24 07:53:18+00:00,690,50,https://twitter.com/i/web/status/1540241643311403008,the lack of attention being paid to the collapse of all things commodity is astounding Every tick up was the talk of the town
1540083498718986241,2022-06-23 21:24:54+00:00,112,9,https://twitter.com/i/web/status/1540083498718986241,Joe Papa is out as chair of BHC he is still with BauchampLomb We need answers about what is happening here Icahn with a big position This is just an outrage what has happened
1540067512708206595,2022-06-23 20:21:22+00:00,249,11,https://twitter.com/i/web/status/1540067512708206595,The group think on the semis and on the banks is insane
1540047366354608134,2022-06-23 19:01:19+00:00,435,27,https://twitter.com/i/web/status/1540047366354608134,Amazing selling in the semis nonstop
1539962757772107779,2022-06-23 13:25:07+00:00,127,8,https://twitter.com/i/web/status/1539962757772107779,Darden the way out of the bear
1539960992595120128,2022-06-23 13:18:06+00:00,59,4,https://twitter.com/i/web/status/1539960992595120128,way too cynical WAY
1539960824483258368,2022-06-23 13:17:26+00:00,1,0,https://twitter.com/i/web/status/1539960824483258368,Credible after watchin Davids Doc
1539918323479109632,2022-06-23 10:28:33+00:00,584,42,https://twitter.com/i/web/status/1539918323479109632,We will all be spending hundreds of dollars in the Metaverse one day and the OS will be as important as Apple so privacy issue is obviated
1539698434894188546,2022-06-22 19:54:47+00:00,428,28,https://twitter.com/i/web/status/1539698434894188546,President Biden must watch Davids documentary Things have changed But the president wont speak to them it is beleaguring
1539697987471003657,2022-06-22 19:53:01+00:00,48,1,https://twitter.com/i/web/status/1539697987471003657,has an amazing documentary tonight on Exxon Lots of things you care about and a much watch
1539695508431708160,2022-06-22 19:43:10+00:00,296,42,https://twitter.com/i/web/status/1539695508431708160,My advice invest
1539649733735731200,2022-06-22 16:41:16+00:00,930,71,https://twitter.com/i/web/status/1539649733735731200,Want oil down win the war in Ukraine Plan for it coming tomorrow
1539630520887304192,2022-06-22 15:24:55+00:00,148,13,https://twitter.com/i/web/status/1539630520887304192,Revlon buyers do you really think this is the next Hertz Look at the bonds for heavens sakes
1539608834553028612,2022-06-22 13:58:45+00:00,525,26,https://twitter.com/i/web/status/1539608834553028612,Having watched a relative die of lung cancer i never knew how JUUL could be invented turning around years of lung cancer deaths I wanted to prosecute everyone involved
1539608527941107712,2022-06-22 13:57:32+00:00,346,22,https://twitter.com/i/web/status/1539608527941107712,Tonight join me both in the metaverse and with Mark Zuckerberg about what is really happening at Meta Platforms incredible
1539607986628337666,2022-06-22 13:55:23+00:00,349,18,https://twitter.com/i/web/status/1539607986628337666,Oh man Jay Powells time on the cross Been there painful But Warren raises good points Just done viciously
1539532374463102980,2022-06-22 08:54:55+00:00,1661,473,https://twitter.com/i/web/status/1539532374463102980,Sam BankmanFried doles out credit lines to save crypto institutions Hes the new JP Morgan
1539415262943911938,2022-06-22 01:09:34+00:00,791,57,https://twitter.com/i/web/status/1539415262943911938,META
1539326902892118017,2022-06-21 19:18:27+00:00,413,17,https://twitter.com/i/web/status/1539326902892118017,this Meta seller better know something
1539237470780411909,2022-06-21 13:23:05+00:00,134,5,https://twitter.com/i/web/status/1539237470780411909,Watch AMD it always seems to fail up two
1539237154097864707,2022-06-21 13:21:49+00:00,569,39,https://twitter.com/i/web/status/1539237154097864707,given that there is no reason to be up big why would it be up big
1539235587881828354,2022-06-21 13:15:36+00:00,306,16,https://twitter.com/i/web/status/1539235587881828354,Do we trust a Dow up 400 when the parts are nowhere near that
1539212234429284357,2022-06-21 11:42:48+00:00,117,5,https://twitter.com/i/web/status/1539212234429284357,K dividend stays
1539211454104182785,2022-06-21 11:39:42+00:00,52,7,https://twitter.com/i/web/status/1539211454104182785,K snacks and K plantlots to buy Former Utz latter myriad
1539211200764026881,2022-06-21 11:38:42+00:00,78,6,https://twitter.com/i/web/status/1539211200764026881,Glad Kellogg name not retired Snack worth big plant
1539190223770460161,2022-06-21 10:15:20+00:00,281,17,https://twitter.com/i/web/status/1539190223770460161,that said i think that it is hard to advance if rates just go ever higher Too many people talking about how things dont bottom until the fed starts easing They bottom when rates stop going higher
1539189963639734273,2022-06-21 10:14:18+00:00,895,67,https://twitter.com/i/web/status/1539189963639734273,We are at minus ten on the oscillator i follow the SampPs gauge which has only twice been wrong to buy 20072009 and the first days of the panic of 2020 We could be there again but history says we bounce
1539179481130323968,2022-06-21 09:32:39+00:00,174,11,https://twitter.com/i/web/status/1539179481130323968,Ridiculous disparity between where the Dow futures are and the Dow stocks are trading pre market Stocks like UNH and CAT shouldnt be unchanged Who makes these darned bets Could today be the first time they are right
1538657092051009537,2022-06-19 22:56:52+00:00,777,15,https://twitter.com/i/web/status/1538657092051009537,lotta mouths to feed
1538515313385521152,2022-06-19 13:33:29+00:00,417,10,https://twitter.com/i/web/status/1538515313385521152,wish i like kale
1538514864670490624,2022-06-19 13:31:42+00:00,165,4,https://twitter.com/i/web/status/1538514864670490624,touched the ground lost cause
1538512880605200384,2022-06-19 13:23:49+00:00,373,8,https://twitter.com/i/web/status/1538512880605200384,healthy cukes and zukes
1538512703303696385,2022-06-19 13:23:07+00:00,433,11,https://twitter.com/i/web/status/1538512703303696385,great saucing coming
1538512428794781698,2022-06-19 13:22:01+00:00,210,10,https://twitter.com/i/web/status/1538512428794781698,whats he doing here this beautiful morning
1538512205934632961,2022-06-19 13:21:08+00:00,500,12,https://twitter.com/i/web/status/1538512205934632961,Progress
1538509676580683778,2022-06-19 13:11:05+00:00,1591,26,https://twitter.com/i/web/status/1538509676580683778,glorious
1538495361941118976,2022-06-19 12:14:12+00:00,1257,22,https://twitter.com/i/web/status/1538495361941118976,Happ Fathers Day
1538281837948190725,2022-06-18 22:05:44+00:00,291,8,https://twitter.com/i/web/status/1538281837948190725,the Brave
1538281015617236994,2022-06-18 22:02:28+00:00,845,56,https://twitter.com/i/web/status/1538281015617236994,Who does fortune favor
1538264387710070785,2022-06-18 20:56:24+00:00,476,37,https://twitter.com/i/web/status/1538264387710070785,I wonder what rabbit Michael Saylor can pull out of a hat with his Microstrategy gameplan I wonder when he first raised money if he had this in mind
1538262561560399876,2022-06-18 20:49:08+00:00,590,59,https://twitter.com/i/web/status/1538262561560399876,Ten percent down for Bitcoin and you get some nasty margin calls over the weekend Amazing that there are no big institutions propping this up Is there a 2way market in NFTs right now
1538200012546531331,2022-06-18 16:40:36+00:00,474,10,https://twitter.com/i/web/status/1538200012546531331,my kind of wine
1538170686971191296,2022-06-18 14:44:04+00:00,365,7,https://twitter.com/i/web/status/1538170686971191296,Ragu wants out
1538152973934673920,2022-06-18 13:33:41+00:00,886,20,https://twitter.com/i/web/status/1538152973934673920,its going to be a great day
1537924019952881669,2022-06-17 22:23:54+00:00,211,22,https://twitter.com/i/web/status/1537924019952881669,I thought it could hold But it has no dividend protection In the end none held BUT if oil really breaks down the rest of your portfolio will do well I am saying you must have oil in any diversified portfolio
1537914841058275330,2022-06-17 21:47:25+00:00,22,2,https://twitter.com/i/web/status/1537914841058275330,We werent able to get in and out of oil but the distributions are monstrous above 80 I remain bullish on the group but it is daunting to see them give up everything since the war began i think the group should be a bigger part of the SampP
1537906015005356033,2022-06-17 21:12:21+00:00,195,8,https://twitter.com/i/web/status/1537906015005356033,If you do one thing this evening before hitting the town watch Qualcomms ceo Cristiano Amon MUST WATCH
1537852489831260163,2022-06-17 17:39:40+00:00,582,34,https://twitter.com/i/web/status/1537852489831260163,finally the seller of AMD is done amen
1537850192992542722,2022-06-17 17:30:32+00:00,86,8,https://twitter.com/i/web/status/1537850192992542722,adobe almost unchanged we havent seen that happen much
1537842326856425477,2022-06-17 16:59:17+00:00,306,20,https://twitter.com/i/web/status/1537842326856425477,AMD still is down which makes little sense in terms of how the company is doing
1537842076196524032,2022-06-17 16:58:17+00:00,99,6,https://twitter.com/i/web/status/1537842076196524032,Telling that Adobe is barely down
1537816452555849728,2022-06-17 15:16:28+00:00,763,42,https://twitter.com/i/web/status/1537816452555849728,The idea that you can borrow money and get 10 to one to buy crypto is outrageous but the fed government does nothing
1537801242285572096,2022-06-17 14:16:01+00:00,165,21,https://twitter.com/i/web/status/1537801242285572096,Need to see apparel oil and auto down for a stabilization i think energy and used cars are going to come down repos are up so used cars go down
1537800550544248833,2022-06-17 14:13:16+00:00,491,27,https://twitter.com/i/web/status/1537800550544248833,bulls just need oil to stabilize
1537799275794538496,2022-06-17 14:08:12+00:00,224,19,https://twitter.com/i/web/status/1537799275794538496,Charitable trust name AMD is DOWN It was one week ago when they reiterated it is insane that that stock has fallen like this
1537798976442970112,2022-06-17 14:07:01+00:00,82,10,https://twitter.com/i/web/status/1537798976442970112,Adobe coming back Shantanu is telling the truthhe does have credibility The stock has been cut in half
1537798569515794435,2022-06-17 14:05:24+00:00,170,10,https://twitter.com/i/web/status/1537798569515794435,what does Russia have to do with the price to earnings ratio of BristolMyers
1537785504376279041,2022-06-17 13:13:29+00:00,314,19,https://twitter.com/i/web/status/1537785504376279041,Apple cant rally todayeven when Needham says the brand is worth a trillion dollars Lets key on Apple
1537745253104484352,2022-06-17 10:33:32+00:00,177,16,https://twitter.com/i/web/status/1537745253104484352,Bullish
1537745113568403457,2022-06-17 10:32:59+00:00,33,3,https://twitter.com/i/web/status/1537745113568403457,Hey Coach come on Stay focused
1537743517354708994,2022-06-17 10:26:39+00:00,102,9,https://twitter.com/i/web/status/1537743517354708994,In the old days this would have amounted to a declaration of war against the Soviet Union But now it is a toothless feint against the all powerful Russians
1537730140041625601,2022-06-17 09:33:29+00:00,71,7,https://twitter.com/i/web/status/1537730140041625601,Finallyrest for people who belong to the club or are trialing which stocks already reflect estimates and which ones still need to see estimates and PTs cut
1537729948798144512,2022-06-17 09:32:44+00:00,82,7,https://twitter.com/i/web/status/1537729948798144512,Watch Adobe the quarter was pretty good all things considered The market is trying to figure out what you pay for a company that DOESNT beat and raise but shades down eps est as expected No surprise
1537729683189555206,2022-06-17 09:31:40+00:00,270,23,https://twitter.com/i/web/status/1537729683189555206,the tech seller from yesterday morning presumed now to be the Swiss central bank has gone but no one trusts anyone these days
1537729538918064128,2022-06-17 09:31:06+00:00,130,11,https://twitter.com/i/web/status/1537729538918064128,What if Amazon actually was big enough to cause a spike in EMPLOYMENT that will now unwind and what it will do for the nonfarm payrolls next month with its unwinding Great piece in the WSJ this morning about dialing it back
1537581378803355648,2022-06-16 23:42:22+00:00,578,20,https://twitter.com/i/web/status/1537581378803355648,From what i hear the discussion with was truly constructive GOOD
1537535469205999616,2022-06-16 20:39:56+00:00,58,4,https://twitter.com/i/web/status/1537535469205999616,More Lionel Barrymore less Jimmy Steward please
1537531605769719814,2022-06-16 20:24:35+00:00,83,6,https://twitter.com/i/web/status/1537531605769719814,stark
1537531506234630145,2022-06-16 20:24:11+00:00,2598,182,https://twitter.com/i/web/status/1537531506234630145,Bitcoin that tremendous store hold of value is now down for ten straight days
1537523041865027591,2022-06-16 19:50:33+00:00,456,29,https://twitter.com/i/web/status/1537523041865027591,Bulls v Bears Day 2
1537521455214346241,2022-06-16 19:44:15+00:00,341,20,https://twitter.com/i/web/status/1537521455214346241,Today is total blast zone day The futures kept even the buyers of soft goods down those buyers will be back i have a list of untouchables on tonight
1537444216837591045,2022-06-16 14:37:20+00:00,95,7,https://twitter.com/i/web/status/1537444216837591045,Day two here goes the PG CLX so look for LLY and JNJ to go higherowned by the charitable trust
1537426694889525250,2022-06-16 13:27:42+00:00,162,26,https://twitter.com/i/web/status/1537426694889525250,The Swiss 13F has all of the stocks that were down big a 430 am they would not have been able to sell yesterday afternoon because they were closed Its a huge piece of the puzzle
1537426383709908993,2022-06-16 13:26:28+00:00,1016,72,https://twitter.com/i/web/status/1537426383709908993,why cant we accept that most fed chiefs have not faced a heinous war against a democracy and a large country that doesnt believe in the science
1537426194005729280,2022-06-16 13:25:43+00:00,124,3,https://twitter.com/i/web/status/1537426194005729280,The Jay Powell critics want him to wear a hair suite resign and go coach AA baseball
1537424683641053187,2022-06-16 13:19:43+00:00,32,0,https://twitter.com/i/web/status/1537424683641053187,cant help you jammed
1537424439519891457,2022-06-16 13:18:45+00:00,53,4,https://twitter.com/i/web/status/1537424439519891457,has the right call i believe the Swiss selling I am calling it the Cuckoo Clock Theory
1537376852662272000,2022-06-16 10:09:39+00:00,282,17,https://twitter.com/i/web/status/1537376852662272000,Powell would do best to stick by this script we will do 75s until inflation is stopped then we would not have this undoing of yesterdays bond rally
1537375863892754432,2022-06-16 10:05:43+00:00,207,15,https://twitter.com/i/web/status/1537375863892754432,bond vigilantes want more blood
1537367878944575489,2022-06-16 09:33:59+00:00,576,44,https://twitter.com/i/web/status/1537367878944575489,It would be highly unusual for someone selling Microsoft down 8 points and AMD down 4 and Nvidia down 7 and Qualcomm down 4 if they didnt know about gigantic tech downgrade or a firm going bust Where were these sellers at 330 yesterday
1537364111104872449,2022-06-16 09:19:01+00:00,228,14,https://twitter.com/i/web/status/1537364111104872449,do the tech sellers actually want good prices this is not the way to get themor do they care One gigantic get me out of tech program
1537362565172436994,2022-06-16 09:12:53+00:00,298,30,https://twitter.com/i/web/status/1537362565172436994,the tech sellers are predicting a huge sell off you would need two major firms to go negative in the am to justify this
