id,created_at,favorite_count,retweet_count,url,text
1516902692697915393,2022-04-20 22:12:39+00:00,152,8,https://twitter.com/i/web/status/1516902692697915393,what PampG did despite China is really incredible Wow that China shutdown is crushing them all because they will not use our vaccines
1516896791899299840,2022-04-20 21:49:12+00:00,194,8,https://twitter.com/i/web/status/1516896791899299840,we have some real good ideas on tonights show And some good ideas including some that club members know i like very much
1516869164425793545,2022-04-20 19:59:25+00:00,177,8,https://twitter.com/i/web/status/1516869164425793545,tremendous FANG etf action today There are a ton of them
1516866511939457026,2022-04-20 19:48:53+00:00,72,4,https://twitter.com/i/web/status/1516866511939457026,the return of the blue chip Tonight on
1516863360737976320,2022-04-20 19:36:21+00:00,578,42,https://twitter.com/i/web/status/1516863360737976320,one day after Foreign Minister Lavrov says Russia doesnt want to go nuclear Putin watches a video of a test of a new ICBM with nuke capability He is just such an evil tyrant and he must be stopped before he wipes out Ukraine
1516779429057667078,2022-04-20 14:02:50+00:00,87,6,https://twitter.com/i/web/status/1516779429057667078,considerable numbers of people will use any liftJNJ yesterday PG today to sell its so negative out there
1516757948508291072,2022-04-20 12:37:29+00:00,92,5,https://twitter.com/i/web/status/1516757948508291072,I think any close scrutiny of IBMs q knows it is much better with good guidance and the bears digging in their heels will be wrong
1516719078626500614,2022-04-20 10:03:02+00:00,60,8,https://twitter.com/i/web/status/1516719078626500614,the authorities will go nuts Their doctrine may evolve to something like will it go under if it doesnt get a bid
1516718886208614411,2022-04-20 10:02:16+00:00,38,3,https://twitter.com/i/web/status/1516718886208614411,Ford will need to find these materials to meet its aggressive goals
1516711364898787328,2022-04-20 09:32:23+00:00,116,7,https://twitter.com/i/web/status/1516711364898787328,The key earnings report may have been the ASML semi equipment demand number which is VERY strong AMAT LRCX KLAC to watch there have been several downgrades and lots of shorts
1516702989628624900,2022-04-20 08:59:06+00:00,34,0,https://twitter.com/i/web/status/1516702989628624900,But isnt it possible that they choose NOT to take cities but level them Give orders to evacuate or be killed 19992000 Grozny style leveling
1516702662309384194,2022-04-20 08:57:48+00:00,318,13,https://twitter.com/i/web/status/1516702662309384194,Piper comes out HARD to buy club name NVDA and says Nvidia is going to be buying back a lot of shares I dont think that matters as much as a great show of confidence Good partnership with IBM
1516700157181575169,2022-04-20 08:47:51+00:00,64,3,https://twitter.com/i/web/status/1516700157181575169,Interesting analysis but churn is very low And it is not for lack of individual success
1516699880021970947,2022-04-20 08:46:44+00:00,336,22,https://twitter.com/i/web/status/1516699880021970947,I fear that Putin is launching a 19992000 style offensive as he did in Chechnya after the failed 199596 Yeltsin effort I dont know if we can send enough artillery to stop this
1516699587930738688,2022-04-20 08:45:35+00:00,32,3,https://twitter.com/i/web/status/1516699587930738688,while this is absolutely true remember everything is relative in this world and the US is the clear leader in econ growth this time around
1516589620619796483,2022-04-20 01:28:37+00:00,67,2,https://twitter.com/i/web/status/1516589620619796483,Club members will get a full rundown on the similarities and differences thank you
1516589426020868111,2022-04-20 01:27:50+00:00,179,3,https://twitter.com/i/web/status/1516589426020868111,Just too much out there thanks so much
1516589251202273284,2022-04-20 01:27:09+00:00,87,5,https://twitter.com/i/web/status/1516589251202273284,On Mad tonight I continue to believe that BAC was the best other than MS I like the PLUG for spec and Prologis for consistency Charitable trust owns MS and HAL
1516589013926387718,2022-04-20 01:26:12+00:00,200,8,https://twitter.com/i/web/status/1516589013926387718,IBM did a very good job although there will be confusion over consulting lines I thought Halliburton was amazing this morning and JNJ was pretty good You dont need me to run through Netflix
1516514552279613449,2022-04-19 20:30:19+00:00,698,40,https://twitter.com/i/web/status/1516514552279613449,was that show on Netflix No Hulo Did you see that on Netflix Not Apple
1516506721031757832,2022-04-19 19:59:12+00:00,670,6,https://twitter.com/i/web/status/1516506721031757832,back to work but worth remembering
1516492735473143813,2022-04-19 19:03:37+00:00,197,6,https://twitter.com/i/web/status/1516492735473143813,Weve got a huge three guest day today Bank of America Plug Power and Prologis
1516406866242326531,2022-04-19 13:22:25+00:00,284,17,https://twitter.com/i/web/status/1516406866242326531,lets go
1516399597148594178,2022-04-19 12:53:31+00:00,31,4,https://twitter.com/i/web/status/1516399597148594178,And why nat gas is so high the producers werent worried
1516398185861861383,2022-04-19 12:47:55+00:00,195,10,https://twitter.com/i/web/status/1516398185861861383,The numbers you have put up and value creation v Twitter pretty much make it an easy call
1516397920576188425,2022-04-19 12:46:52+00:00,58,5,https://twitter.com/i/web/status/1516397920576188425,GMs cars and trucks have game
1516397151449931776,2022-04-19 12:43:48+00:00,300,12,https://twitter.com/i/web/status/1516397151449931776,Are you ready Skidaddy
1516325286161354753,2022-04-19 07:58:14+00:00,64,2,https://twitter.com/i/web/status/1516325286161354753,Good piece here by Winkler
1516324752641638404,2022-04-19 07:56:07+00:00,202,9,https://twitter.com/i/web/status/1516324752641638404,I know there was dissension about the bank earnings but i thought that BAC and MS were exceptional and GS very good and we are about to have liftoff
1516322759789449221,2022-04-19 07:48:12+00:00,229,7,https://twitter.com/i/web/status/1516322759789449221,Bullards hawkish comments give Powell lots of cover to go 50 Economy needs it to pilot softer landing
1516085500175699978,2022-04-18 16:05:25+00:00,362,8,https://twitter.com/i/web/status/1516085500175699978,so fabulous
1516084876587548677,2022-04-18 16:02:56+00:00,1007,23,https://twitter.com/i/web/status/1516084876587548677,Spring In Tuscany
1515672095325364229,2022-04-17 12:42:42+00:00,1344,18,https://twitter.com/i/web/status/1515672095325364229,Happy holidays to all
1514713147982159874,2022-04-14 21:12:11+00:00,581,10,https://twitter.com/i/web/status/1514713147982159874,Voice feeling better
1514697846515187717,2022-04-14 20:11:22+00:00,865,23,https://twitter.com/i/web/status/1514697846515187717,Look until GMEAMC i enjoyed almost every single interaction with my followers Since then the endless suggestions of things i do not want to say here have become nonstop I know it wont stop But i lived in my car in the freezing cold for a very long time I am ready
1514695806401589262,2022-04-14 20:03:16+00:00,64,4,https://twitter.com/i/web/status/1514695806401589262,Hey Loser on Twitverse maybe you should talk to the FBI about just this But i guess the truth is an abstraction and believe me when i say bodily harm i mean bodily harm of the worst kind FBI
1514695131840065540,2022-04-14 20:00:35+00:00,38,4,https://twitter.com/i/web/status/1514695131840065540,Ok Mr Magic Eyez let me give you some insight I dont play for dinner I am friendly wCEOAdam and like him very much I have been intrigued and had Gamestop on for years I do my shows because I help people Why do you watch or read me Why take that pain
1514694168534212615,2022-04-14 19:56:46+00:00,26,1,https://twitter.com/i/web/status/1514694168534212615,thank you I have said about ten word since our Morning Meeting show for club members
1514693966238732290,2022-04-14 19:55:57+00:00,34,1,https://twitter.com/i/web/status/1514693966238732290,i will take A B or C if it is from Elon Musk
1514691359701090315,2022-04-14 19:45:36+00:00,73,2,https://twitter.com/i/web/status/1514691359701090315,how can people currently end the endless inciting to injure and maim on Twitter How can the bodily harm suggestions be allowed Can a MuskTwitter have a minder i can pay for
1514690452066349068,2022-04-14 19:42:00+00:00,59,2,https://twitter.com/i/web/status/1514690452066349068,I think a lot of the mentioners who hate the club dont even realize what it is about We have good ones and bad ones but more good than bad and we teach Go to to find out what we do
1514689189815717890,2022-04-14 19:36:59+00:00,49,0,https://twitter.com/i/web/status/1514689189815717890,I have tried and tried
1514689093493477376,2022-04-14 19:36:36+00:00,25,1,https://twitter.com/i/web/status/1514689093493477376,We are up big on WFC and do not want to take the capital gain We want to hold management accountable as they should be making fortunes If you just give them some heat it can matter
1514688648935092233,2022-04-14 19:34:50+00:00,40,1,https://twitter.com/i/web/status/1514688648935092233,thinking same i am at Englewood Cliffs but it is quite annoying
1514688473025949706,2022-04-14 19:34:08+00:00,67,5,https://twitter.com/i/web/status/1514688473025949706,yes the board should represent the shareholders who want to make money and be rewarded for once At the same time there is always room for negotiation even in a best and final
1514688109727957004,2022-04-14 19:32:41+00:00,45,2,https://twitter.com/i/web/status/1514688109727957004,Why didnt he say if the fed raises rates we will raise rates on your deposits higher than any majors and will still do well because of efficiencies Because they cant Come on man
1514685534169444356,2022-04-14 19:22:27+00:00,117,4,https://twitter.com/i/web/status/1514685534169444356,We hold WFC because we expected so much more from Charlie It is time for him to deliver and not talk about Ukraine No more excuses And figure out what the feds want and do it
1514685330951131138,2022-04-14 19:21:39+00:00,9,2,https://twitter.com/i/web/status/1514685330951131138,the talk of Wall Street was how poorly Wells performed in an environment where they have the most communitylike national bank Are they not spending on tech Are they trying to capitalize on their local efforts anymore I bet BAC runs rings around them
1514684487715676165,2022-04-14 19:18:18+00:00,14,1,https://twitter.com/i/web/status/1514684487715676165,Why wasnt this a quarter where they really took advantage of their scale and really lend and help this country grow how could the street be so wrong and so ahead of where you really are Why did WFC not admit to bad execution
1514668994405584903,2022-04-14 18:16:44+00:00,4687,262,https://twitter.com/i/web/status/1514668994405584903,given the success you have had at Tesla why as a heavy user would i not want you to run Twitter You are the most important user and you know more than anyone else how it works What a blessing if you ran it
1514668696513310720,2022-04-14 18:15:33+00:00,67,5,https://twitter.com/i/web/status/1514668696513310720,Chuy you are a great reason why i want to get Twitter You can make your silly drawings and troll us and do it in the ad supported MOSH pit
1514668319625949190,2022-04-14 18:14:03+00:00,65,4,https://twitter.com/i/web/status/1514668319625949190,It is very surprising
1514660193640005645,2022-04-14 17:41:45+00:00,94,3,https://twitter.com/i/web/status/1514660193640005645,love you but you have done well versus the SEC
1514660051184766983,2022-04-14 17:41:11+00:00,357,17,https://twitter.com/i/web/status/1514660051184766983,those bastards the SEC Hello Commission You are being spun and mutilated this is not right
1514644750112116745,2022-04-14 16:40:23+00:00,27,2,https://twitter.com/i/web/status/1514644750112116745,Heres the problem it should be a great time for a bank The execution at Wells was not up to Scharfs standards and he should have just called it that
1514557437180887043,2022-04-14 10:53:26+00:00,408,8,https://twitter.com/i/web/status/1514557437180887043,The idea is for a twotrack the first track is a sub track with real names and the second is the freeforall I would pay a subscription fee of 10 a month for real name people and then you can curse me all you want in my mentions column
1514555062584066053,2022-04-14 10:44:00+00:00,2399,108,https://twitter.com/i/web/status/1514555062584066053,we wish you luck It would be amazing if a heavy user and understander took over
1514554183583772678,2022-04-14 10:40:31+00:00,391,2,https://twitter.com/i/web/status/1514554183583772678,Thanks to all I had just given too many talks and speeches yesterday rested up and once more back into the breach
1514360974173736968,2022-04-13 21:52:46+00:00,721,9,https://twitter.com/i/web/status/1514360974173736968,Did my best to run the table on this show but the vocal cord gods would have none of it
1514325009950457861,2022-04-13 19:29:51+00:00,108,5,https://twitter.com/i/web/status/1514325009950457861,Tonight are the bonds wrong Or just the prognosticators
1514309853761703943,2022-04-13 18:29:38+00:00,811,103,https://twitter.com/i/web/status/1514309853761703943,From the agave plant in Puebla to the bottle take a look at this beautifully crafted video on what sets apart from any other mezcal youve tasted
1514233875458834432,2022-04-13 13:27:43+00:00,5,0,https://twitter.com/i/web/status/1514233875458834432,then Doc why not get a FOURTH shot four months after omicron Good question for tonight
1514217573327556613,2022-04-13 12:22:56+00:00,58,4,https://twitter.com/i/web/status/1514217573327556613,BBBY numbers for this q starting off slowly it is all SOTP v bad earnings
1514214229385138184,2022-04-13 12:09:39+00:00,60,2,https://twitter.com/i/web/status/1514214229385138184,BBBY SOTP is bigger than where it is after the buy back which takes share count to 80 million What will do Q was weak on supply chain but NOT Buy Buy Baby
1514017481324703744,2022-04-12 23:07:51+00:00,73,4,https://twitter.com/i/web/status/1514017481324703744,Its amazing that Carmax was almost up at one point The question is will others follow suit or is KMX an outlier They are very good at what they do
1514015397112074241,2022-04-12 22:59:34+00:00,587,11,https://twitter.com/i/web/status/1514015397112074241,nothing like a hard day that begins at 345 and takes a break when the show is over to looks at the old mentions and then goes back to work inspired by their dripping hatred and nonstop attempts to get me to stop what i do Good luck
1514014778255151111,2022-04-12 22:57:06+00:00,655,10,https://twitter.com/i/web/status/1514014778255151111,I took one day off from reading the attacks on my character so i am sorry if i missed yesterdays assassinations but they are just out in the ether somewhere and they impressed and impacted only fellow haters As a top ten most hated Twitter person i thank you for your support
1514014149956804616,2022-04-12 22:54:37+00:00,1057,20,https://twitter.com/i/web/status/1514014149956804616,I find the behavior of most of these losers so beyond the pale it is shocking They are addicted to me and addicted to attacking me I have bad news for them I am going to continue to work to try to help people and if you dont want to watch or listen or be helped so be it
1514013652852121606,2022-04-12 22:52:38+00:00,1966,30,https://twitter.com/i/web/status/1514013652852121606,So heres what happens I go down my mentions column and the first 40 and yes i counted 40 were all horrendous vicious comments from people who despise me so much you would think i am a war criminal In the meantime there are real war criminals Save it for them
1514012974356340745,2022-04-12 22:49:56+00:00,26,0,https://twitter.com/i/web/status/1514012974356340745,Stewy did you even have the show on I was talking about how good the survey was on consumers and the web
1514012531710386183,2022-04-12 22:48:11+00:00,39,0,https://twitter.com/i/web/status/1514012531710386183,so dumb It will just be sold down tomorrow What a silly thing to do No one said to do that
1514012264352866312,2022-04-12 22:47:07+00:00,216,11,https://twitter.com/i/web/status/1514012264352866312,i think the old inverse cramer attackjoke has really become tiresome Can you come up with something else as loathsome please if only just to make life more interesting
1514011958999232517,2022-04-12 22:45:54+00:00,76,1,https://twitter.com/i/web/status/1514011958999232517,cause it was up 50 points Pal
1514011055424421888,2022-04-12 22:42:19+00:00,95,3,https://twitter.com/i/web/status/1514011055424421888,Highpeak Energy is a very good company but it made no sense to take it up this much after hours and will just bring out sellers tomorrow
1513918549634527234,2022-04-12 16:34:44+00:00,1012,38,https://twitter.com/i/web/status/1513918549634527234,what a beast
1513606138264231939,2022-04-11 19:53:19+00:00,521,7,https://twitter.com/i/web/status/1513606138264231939,please keep pushing for that premium twitter method where we arent trashed endlessly for trying to do a good job
1513605942750978048,2022-04-11 19:52:32+00:00,353,16,https://twitter.com/i/web/status/1513605942750978048,It is difficult to part with the best but as i told club members we want to buy the stocks of great companies that make things and do stuff and sell them at a profit and return some of that capital to shareholders and are NOT TOO expensive
1513604310378164226,2022-04-11 19:46:03+00:00,762,34,https://twitter.com/i/web/status/1513604310378164226,Its been a brutal sell off of big tech and the semis but there are so many nontech stocks that are getting very attractive
1513494875639058432,2022-04-11 12:31:12+00:00,94,3,https://twitter.com/i/web/status/1513494875639058432,please check your bulletin club members follow up from last week as you got the head start
1512826776023674893,2022-04-09 16:16:25+00:00,618,18,https://twitter.com/i/web/status/1512826776023674893,they like the retailers and consumer packaged goods stocks and the action in PG
1512545661434089475,2022-04-08 21:39:22+00:00,91,8,https://twitter.com/i/web/status/1512545661434089475,nine right retailers on tonight
1512449202089082880,2022-04-08 15:16:04+00:00,524,18,https://twitter.com/i/web/status/1512449202089082880,big gardening weekend for many Americans Home Depot and Lowes should have good numbers
1512426702265274370,2022-04-08 13:46:40+00:00,142,7,https://twitter.com/i/web/status/1512426702265274370,RIP Michael Neidorff one of the greatest people i have ever met More healthcare for all And charity A lesson for all
1512378737505021952,2022-04-08 10:36:04+00:00,42,6,https://twitter.com/i/web/status/1512378737505021952,Jimmy Chill notices that the mentions column is often based on the cursory notes from about what i like and dislike same outfit that continues to pretend that they manage my charitable trust Do i rue the day i created the company
1512378326027051008,2022-04-08 10:34:26+00:00,72,3,https://twitter.com/i/web/status/1512378326027051008,Enlighten me because thats not what the data says Where did they go
1512378038247473152,2022-04-08 10:33:17+00:00,80,2,https://twitter.com/i/web/status/1512378038247473152,thank you Ragu is feeling better after cortisone To see a puppys face swell up huge and it not be able to do anything is tough to watch
1512377779073036290,2022-04-08 10:32:15+00:00,40,6,https://twitter.com/i/web/status/1512377779073036290,Their energy needs fund the Russian army which can handle any amount of tank destruction
1512376909203656710,2022-04-08 10:28:48+00:00,514,26,https://twitter.com/i/web/status/1512376909203656710,Goldman takes RobinHood to sell User growth still low Retreat by the Apes Or running out of money I hope not Who will Jimmy Chill joust with
1512247854240342022,2022-04-08 01:55:59+00:00,724,16,https://twitter.com/i/web/status/1512247854240342022,im not feeling well something bit me
1512182179639484422,2022-04-07 21:35:01+00:00,124,8,https://twitter.com/i/web/status/1512182179639484422,Thank you so much And thank you to all of the nice mentioners who really are terrific for saying good things
1512181197090217986,2022-04-07 21:31:07+00:00,104,4,https://twitter.com/i/web/status/1512181197090217986,the pe compression of the banks may mean that they can rally even if they do in line numbers watch tonight
1512162052218970116,2022-04-07 20:15:02+00:00,65,3,https://twitter.com/i/web/status/1512162052218970116,Targeton a recommendation EW downgraded the other day
1512155924290543619,2022-04-07 19:50:41+00:00,433,18,https://twitter.com/i/web/status/1512155924290543619,the banks are going to determine the next level
1512152529429225478,2022-04-07 19:37:12+00:00,151,7,https://twitter.com/i/web/status/1512152529429225478,thanks for the kudos for the call Yeah i pretty much told it as it is
1512152294757998614,2022-04-07 19:36:16+00:00,162,8,https://twitter.com/i/web/status/1512152294757998614,Many negative calls today on Home Depot and Lowes If you are an analyst waiting for a good moment to bull these stocks it is THIS ONE
1512144921926512643,2022-04-07 19:06:58+00:00,127,6,https://twitter.com/i/web/status/1512144921926512643,Behind the CNBC Investing Club is one of the projects Im most proud of the Charitable Trust Im excited to share that 2021 was a record year for the trust with nearly 600000 donated to charity
1512142901719056398,2022-04-07 18:58:56+00:00,64,7,https://twitter.com/i/web/status/1512142901719056398,The playbook sales drop and then used cars follow Sell Lithia
1512070294478893065,2022-04-07 14:10:25+00:00,92,5,https://twitter.com/i/web/status/1512070294478893065,New company will be talked about at our 1230 meeting Stock is bought for my trust which is no longer part of no is no longer a part of the company i founded The obfuscation bugs me
1512069641085997067,2022-04-07 14:07:49+00:00,47,2,https://twitter.com/i/web/status/1512069641085997067,Bull market thesislike at CAG on tonight Sure there was inflation but the stock is saying that inflation will be tamed
1511975607265021952,2022-04-07 07:54:10+00:00,183,9,https://twitter.com/i/web/status/1511975607265021952,Working on a new stock for the charitable trust to be announced at our 1230 pm investing club call today You dont want to miss it Please the charitable trust is ONLY at CNBC nowhere else Others insist it never left my old haunt
1511819723620683782,2022-04-06 21:34:45+00:00,380,14,https://twitter.com/i/web/status/1511819723620683782,A bullish VIX read
1511816758293934087,2022-04-06 21:22:58+00:00,88,4,https://twitter.com/i/web/status/1511816758293934087,This industry has now seen competition at last Rates for freight are coming down which is terrific for the consumer
1511816401652260869,2022-04-06 21:21:33+00:00,324,9,https://twitter.com/i/web/status/1511816401652260869,what if the banks can stop going down
1511792895480811529,2022-04-06 19:48:08+00:00,224,17,https://twitter.com/i/web/status/1511792895480811529,two markets outrageous bull market in Consumer Packaged Goods and Drugs But bear in tech for now
1511790263773110276,2022-04-06 19:37:41+00:00,107,8,https://twitter.com/i/web/status/1511790263773110276,breathtaking moves in the drugs and the cpgs signalling peak in inflation or fed decision to crush inflation or both
1511789181932085259,2022-04-06 19:33:23+00:00,178,10,https://twitter.com/i/web/status/1511789181932085259,If you can buy a bank with no Russian exposure this should be the moment The bear is cordoned to tech
1511788842201853956,2022-04-06 19:32:02+00:00,138,8,https://twitter.com/i/web/status/1511788842201853956,Look the fed created a new bull market in the defensives and hurt tech Bull and bear marketsboth
1511788621988343815,2022-04-06 19:31:09+00:00,33,7,https://twitter.com/i/web/status/1511788621988343815,Doc remember when we did our mask contest because we said it was airborne and the NIH said no thanks
1511788402584215562,2022-04-06 19:30:17+00:00,565,37,https://twitter.com/i/web/status/1511788402584215562,We are seeing two markets The nontech market is out of the bears grip and can be bought The tech market soon enough I like the inexpensive nontech stock portion very very much the bear market in that group has run its course and these stocks are headed to highs
1511787515417669636,2022-04-06 19:26:45+00:00,28,0,https://twitter.com/i/web/status/1511787515417669636,ScottWapner thank you my great friend
1511756142925516804,2022-04-06 17:22:06+00:00,77,5,https://twitter.com/i/web/status/1511756142925516804,i am getting a lot of kudos about the 570000 donation i made from the charitable trust this year but many are from the people who believe my trust still resides with It does not
1511755829527166978,2022-04-06 17:20:51+00:00,285,15,https://twitter.com/i/web/status/1511755829527166978,Working hard on trying to explain how to sell some and not other positions and gearing up to rebuild after raising cash to its highest level since the pandemic began and one of our highest since the start of our charitable trust
1511650613192445953,2022-04-06 10:22:45+00:00,101,5,https://twitter.com/i/web/status/1511650613192445953,sanctions v Switchblades the real debate
1511650498360877059,2022-04-06 10:22:18+00:00,410,18,https://twitter.com/i/web/status/1511650498360877059,the end of the phony inverted yield curve
1511622465868513283,2022-04-06 08:30:55+00:00,173,10,https://twitter.com/i/web/status/1511622465868513283,Working on the investing club talk for tomorrow and i keep coming back to the word paramount fed speak for we are coming for you inflation and we dont care which assets go down as we do it
1511447029721051137,2022-04-05 20:53:47+00:00,125,7,https://twitter.com/i/web/status/1511447029721051137,end of a salute to you and what you can do to rekindle the magic
1511444192018550788,2022-04-05 20:42:31+00:00,106,9,https://twitter.com/i/web/status/1511444192018550788,i believe the feds will stop this deal in its tracks
