id,created_at,favorite_count,retweet_count,url,text
1611093626376839180,2023-01-05 20:13:47+00:00,23,0,https://twitter.com/i/web/status/1611093626376839180,We have Consellation Brands on tonight and we have to get to the bottom of this Overreaction or the beginning of the end of higher beer prices
1611004182571483143,2023-01-05 14:18:22+00:00,265,20,https://twitter.com/i/web/status/1611004182571483143,Ford still not the big competitor in EV Tesla
1611003301176446976,2023-01-05 14:14:52+00:00,59,4,https://twitter.com/i/web/status/1611003301176446976,We were Imperial Margarine people
1610956390268289024,2023-01-05 11:08:28+00:00,40,2,https://twitter.com/i/web/status/1610956390268289024,These are just some of the topics we will talk about in our Morning Meeting show and our new Homestretch call sometime after 2 pm Click on my Avatar to join the Investing Club
1610955946741702658,2023-01-05 11:06:42+00:00,293,20,https://twitter.com/i/web/status/1610955946741702658,We dont need as many comp sci we need more engineers we are short engineers everywhere
1610955810879983616,2023-01-05 11:06:10+00:00,239,33,https://twitter.com/i/web/status/1610955810879983616,I have said endlessly that the epicenter of the layoffs would be in silicon valley We are at the beginning of the layoff cycle and it will be much bigger than anyone thinks because there was so much overhiring
1610955509749751810,2023-01-05 11:04:58+00:00,147,12,https://twitter.com/i/web/status/1610955509749751810,They will continue to purge high multiple stocks and crypto in all of its derivatives will continue to be hammered as long as the fed stays tight or gets tighter
1610935499069456386,2023-01-05 09:45:27+00:00,83,14,https://twitter.com/i/web/status/1610935499069456386,I think Binance can still succeed in buying Voyager but i also believe you dont want the SEC fighting you right now
1610935215228325893,2023-01-05 09:44:19+00:00,219,29,https://twitter.com/i/web/status/1610935215228325893,SEC not letting Binance close the Voyager deal i think the SEC is VERY worried that Binance will prove to be more chimerical than we think I reiterate i do nit like crypto and its defenders are too strident about its need I just dont want people to lose money needlessly
1610791092332515328,2023-01-05 00:11:38+00:00,463,30,https://twitter.com/i/web/status/1610791092332515328,Amazon has 15 million people working for it 17000 people even people in HQ is not enough These tech companies must bite the bullet
1610787616181440515,2023-01-04 23:57:49+00:00,826,57,https://twitter.com/i/web/status/1610787616181440515,As painful as it is to have more firings the 17000 people let go by Amazon is NOT enough They have more than 11 million people working for them
1610776120303001600,2023-01-04 23:12:08+00:00,95,0,https://twitter.com/i/web/status/1610776120303001600,If Marc can do it your other ceos can do it
1610729085889839106,2023-01-04 20:05:14+00:00,45,7,https://twitter.com/i/web/status/1610729085889839106,The best Mad Dash weve had in a while Thanks for stopping by Youre both always welcome at Post 9 and whenever Vale is ready to join the CNBC team let me know
1610724013965443077,2023-01-04 19:45:05+00:00,48,2,https://twitter.com/i/web/status/1610724013965443077,Our twoish Homestretch piece is now up for CNBC Investing Club members only
1610653309890609152,2023-01-04 15:04:08+00:00,357,14,https://twitter.com/i/web/status/1610653309890609152,look who came by Post Nine
1610600429922000900,2023-01-04 11:34:00+00:00,156,16,https://twitter.com/i/web/status/1610600429922000900,Crypto ponzi continues
1610597320575295490,2023-01-04 11:21:39+00:00,507,45,https://twitter.com/i/web/status/1610597320575295490,Beware that while the futures are higher the research is heavily biased against stocks full of downgrades You know since November of 2021 the morning futures have been more wrong than right
1610593810257510400,2023-01-04 11:07:42+00:00,47,3,https://twitter.com/i/web/status/1610593810257510400,We have held on to Wynn for this very reason All explained if you belong to the Investing Club
1610593508779229184,2023-01-04 11:06:30+00:00,47,4,https://twitter.com/i/web/status/1610593508779229184,Why the Investing Club loves SBUXone opens every nine hours in China and EL which can go much higher
1610585727217139715,2023-01-04 10:35:35+00:00,55,1,https://twitter.com/i/web/status/1610585727217139715,Wolfe Research takes the wood to GS buy to hold Again the brokerage house hate winners as they seek to change their stance to a more negative bent for the new year Common theme
1610585178589597698,2023-01-04 10:33:24+00:00,64,7,https://twitter.com/i/web/status/1610585178589597698,The cloud slowdown in fullblown maturation with UBS smackdown this morning Is MSFT losing golden boy status as the last of the safe megacaps I still like it for the trust but you knew they had to come for it in the end Good Homestretch topic
1610576410162216960,2023-01-04 09:58:33+00:00,132,15,https://twitter.com/i/web/status/1610576410162216960,Reading the complaint filed by the government against the CFO of African Gold a SPAC Sell your SPACs people can and will do anything with your money and you can be totally bamboozled by the lack of oversight
1610426194092068866,2023-01-04 00:01:39+00:00,103,8,https://twitter.com/i/web/status/1610426194092068866,Club members candid expectations about our stocks and yours every day now around twoish called Homestretch First day trying to provide as much value as we can
1610360767324340227,2023-01-03 19:41:40+00:00,61,4,https://twitter.com/i/web/status/1610360767324340227,LISTEN NOW The Homestretch is a brand new feature exclusively for Investing Club members where youll be able to access analysis from Jeff and me as we approach the final hour of trading A lot changes between 1020a amp 2p and were going to cover it
1610197668911013888,2023-01-03 08:53:34+00:00,140,7,https://twitter.com/i/web/status/1610197668911013888,Club members check out my missive for 2023 and get ready for something new this afternoon
1610060451819261956,2023-01-02 23:48:19+00:00,92,8,https://twitter.com/i/web/status/1610060451819261956,I usually am not a big believer in this stuff but this ones very good and very helpful
1610060125296889858,2023-01-02 23:47:01+00:00,4932,469,https://twitter.com/i/web/status/1610060125296889858,As i predict another weak year for crypto i do ponder how many people are still involved now many millions of people
1609660472789241858,2023-01-01 21:18:57+00:00,336,7,https://twitter.com/i/web/status/1609660472789241858,My face says it all
1609642707256836099,2023-01-01 20:08:21+00:00,107,4,https://twitter.com/i/web/status/1609642707256836099,needed that not over
1609609375433244674,2023-01-01 17:55:54+00:00,93,4,https://twitter.com/i/web/status/1609609375433244674,Phillys own
1609608983723089921,2023-01-01 17:54:21+00:00,76,4,https://twitter.com/i/web/status/1609608983723089921,great mojo not chill
1609608103644766211,2023-01-01 17:50:51+00:00,852,16,https://twitter.com/i/web/status/1609608103644766211,With Mr Minshew before the big game
1609588844709531649,2023-01-01 16:34:19+00:00,141,6,https://twitter.com/i/web/status/1609588844709531649,real pregaming
1609575397993377792,2023-01-01 15:40:54+00:00,976,29,https://twitter.com/i/web/status/1609575397993377792,Happy New Year from Deuce
1608926123823620097,2022-12-30 20:40:54+00:00,1,0,https://twitter.com/i/web/status/1608926123823620097,the Mighty Dow right to the finish
1608823220253380609,2022-12-30 13:52:00+00:00,105,12,https://twitter.com/i/web/status/1608823220253380609,The alienation of the west continues Putin because of Ukraine Xi because of Covid deliberate covid export without vaccines
1608621413006737411,2022-12-30 00:30:06+00:00,1428,112,https://twitter.com/i/web/status/1608621413006737411,We are talking about 850 million people getting Covid in a short period of timePRC
1608585082318778369,2022-12-29 22:05:44+00:00,260,9,https://twitter.com/i/web/status/1608585082318778369,From vacation checking into the investing club with a couple of pieces Separately market really downplaying the export of covid from China
1608186527384846337,2022-12-28 19:42:01+00:00,3137,309,https://twitter.com/i/web/status/1608186527384846337,Yo do have to wonder if President Xi is unleashing all sorts of covid variants to the rest of the world with his loosening of travel restrictions
1607241312360665088,2022-12-26 05:06:04+00:00,770,18,https://twitter.com/i/web/status/1607241312360665088,Merry Christmas to all and to all a goodnight
1606434066462609408,2022-12-23 23:38:22+00:00,2216,179,https://twitter.com/i/web/status/1606434066462609408,the 5 trillion wipeout in seven stocks amazing
1606369334229598226,2022-12-23 19:21:08+00:00,383,11,https://twitter.com/i/web/status/1606369334229598226,go along get along
1606300307863916544,2022-12-23 14:46:51+00:00,1057,64,https://twitter.com/i/web/status/1606300307863916544,so sorry but we know the truth we are back to buying stocks with low pes that make things do stuff are profitable and return some of those profits to you Thats it
1606288512461918209,2022-12-23 13:59:59+00:00,336,19,https://twitter.com/i/web/status/1606288512461918209,Here we go
1606246179703951362,2022-12-23 11:11:46+00:00,46,1,https://twitter.com/i/web/status/1606246179703951362,down ten in my quest for the Super Bowl in the league to
1606245574692347906,2022-12-23 11:09:22+00:00,49,4,https://twitter.com/i/web/status/1606245574692347906,What we are up against
1606212925017817088,2022-12-23 08:59:37+00:00,102,3,https://twitter.com/i/web/status/1606212925017817088,PCE will be todays binary event Yes just binary no eps to be seen
1605996017941364740,2022-12-22 18:37:43+00:00,18,0,https://twitter.com/i/web/status/1605996017941364740,
1605995874072399872,2022-12-22 18:37:08+00:00,46,7,https://twitter.com/i/web/status/1605995874072399872,This is what Im talking about has been recognized by as one of the 12 best mezcal brands to drink right now Try it for yourself and let me know what you think
1605874311213903872,2022-12-22 10:34:06+00:00,113,1,https://twitter.com/i/web/status/1605874311213903872,Is the entire tech edifice crumbling hardly Micron is a special case but on our Morning Meeting call for CNBC Investing Club members at 1020 you will hear how the quarter impacts our semis
1605873949358886913,2022-12-22 10:32:39+00:00,70,3,https://twitter.com/i/web/status/1605873949358886913,The problem with Micron isnt Micron it is Samsung this morning and the
1605689207711596544,2022-12-21 22:18:34+00:00,49,4,https://twitter.com/i/web/status/1605689207711596544,Proud of the team for being named Best Tobal Mezcal by It is a gentle way to enter the mezcal worldespecially for people who arent sure if theyd like mezcals Theyll like this one
1605678640569671689,2022-12-21 21:36:34+00:00,236,28,https://twitter.com/i/web/status/1605678640569671689,Since there is no football tonight Draftkings having some fun with mock wagering
1605670722176778240,2022-12-21 21:05:06+00:00,519,21,https://twitter.com/i/web/status/1605670722176778240,Great present from the legendary Heather Gaines who knows I always eat lunch on my PC
1605668771795984388,2022-12-21 20:57:21+00:00,1024,40,https://twitter.com/i/web/status/1605668771795984388,Days only get longer from here
1605529941575073794,2022-12-21 11:45:42+00:00,224,10,https://twitter.com/i/web/status/1605529941575073794,We catch a downgrade of Starbucks a winning stock for the Trust to which i say are you kidding me with China about to come back
1605515900290928640,2022-12-21 10:49:54+00:00,62,7,https://twitter.com/i/web/status/1605515900290928640,I put this up because it shows the value of live sports Google getting the NFL package is huge They can do so much with Fantasy and they should just buy Draftkings ESPN for sale Worth fortunes
1605504854545207296,2022-12-21 10:06:00+00:00,63,3,https://twitter.com/i/web/status/1605504854545207296,We will have more insight on The Morning Meeting for Cnbc investing club in fedex and nike and THEIR implications for the trust
1605502829199708160,2022-12-21 09:57:57+00:00,222,12,https://twitter.com/i/web/status/1605502829199708160,Nike and Fedex really killed it Nike showed people China CAN be back and FDX show a great level of discipline on the way to making money per every parcel
1605338205892517894,2022-12-20 23:03:48+00:00,256,21,https://twitter.com/i/web/status/1605338205892517894,Larry Williams did tell us that Santa was coming to town on Thursday Maybe in light of Nike and Fedex big cap stocks its a day early
1605336131133997056,2022-12-20 22:55:34+00:00,196,14,https://twitter.com/i/web/status/1605336131133997056,Fedex now scorching in after hours Many upgrades ahead
1605321511115661312,2022-12-20 21:57:28+00:00,1084,66,https://twitter.com/i/web/status/1605321511115661312,And yes i would buy Fedex here
1605321412318838784,2022-12-20 21:57:04+00:00,72,8,https://twitter.com/i/web/status/1605321412318838784,many upgrades coming
1605319812443525120,2022-12-20 21:50:43+00:00,255,18,https://twitter.com/i/web/status/1605319812443525120,the weakness in tech is NOT extending to nontech thats important
1605319263006359553,2022-12-20 21:48:32+00:00,0,1,https://twitter.com/i/web/status/1605319263006359553,we liked because they are not sending money recklessly We dont want revenues with no profits We want the opposite
1605315272356806656,2022-12-20 21:32:40+00:00,47,2,https://twitter.com/i/web/status/1605315272356806656,Thank you Matt Boss for helping us this morning identifying Nike
1605282395346944001,2022-12-20 19:22:02+00:00,629,37,https://twitter.com/i/web/status/1605282395346944001,You have to admire the love that the crypto buyers have toward their cause Remarkable
1605166649811910656,2022-12-20 11:42:06+00:00,84,6,https://twitter.com/i/web/status/1605166649811910656,ok
1605162245591293953,2022-12-20 11:24:36+00:00,99,5,https://twitter.com/i/web/status/1605162245591293953,Remember on my last conference call what i said about Apple Click on my avatar to get started as a club member
1605150331570192385,2022-12-20 10:37:15+00:00,175,9,https://twitter.com/i/web/status/1605150331570192385,Back to the mighty Dow v the pathetic NASDAQ
1605150082801831939,2022-12-20 10:36:16+00:00,78,8,https://twitter.com/i/web/status/1605150082801831939,Charitable trust bought back some of the stock we sold yesterday much higher Just felt it had come down enough
1605125920032964610,2022-12-20 09:00:15+00:00,65,5,https://twitter.com/i/web/status/1605125920032964610,Relentless and knocked the market back
1605125734565117952,2022-12-20 08:59:31+00:00,926,69,https://twitter.com/i/web/status/1605125734565117952,I know it sems impossible but as per last nights Mad Money Larry Williams does believe we are going to have a Christmas Rally starting Thursday
1605123872617029633,2022-12-20 08:52:07+00:00,48,2,https://twitter.com/i/web/status/1605123872617029633,The Skidaddies are back in the Super Bowl with a triumphant winbut what nowAJ Dillon Stevenson ETN Which two
1604980082002599936,2022-12-19 23:20:45+00:00,272,6,https://twitter.com/i/web/status/1604980082002599936,thank you for all the kind responses to my Sunday night note Had to deviate and tell the story of Pop and understanding what it was like for me as a little boy
1604951499616014362,2022-12-19 21:27:10+00:00,56,4,https://twitter.com/i/web/status/1604951499616014362,Jalen you get better fast Minshew will hold down the fort
1604852933488787457,2022-12-19 14:55:30+00:00,181,8,https://twitter.com/i/web/status/1604852933488787457,Costco seems like they are being cautious about the consumer very good interview with ceo Jelinek
1604830817661947909,2022-12-19 13:27:37+00:00,67,2,https://twitter.com/i/web/status/1604830817661947909,Loved Arturos in Maplewood as always this weekend So fantastic
1604799951720038400,2022-12-19 11:24:58+00:00,34,4,https://twitter.com/i/web/status/1604799951720038400,Are they done Would Coach B ever play them again
1604795395091095554,2022-12-19 11:06:52+00:00,235,26,https://twitter.com/i/web/status/1604795395091095554,Binance up nicely this morning giving you another chance to discover the wonders of JP Morgan BAC and WFC
1604795073459372032,2022-12-19 11:05:35+00:00,104,8,https://twitter.com/i/web/status/1604795073459372032,Uber on strike in NYC this morning Suboptimal
1604787652041007105,2022-12-19 10:36:06+00:00,152,13,https://twitter.com/i/web/status/1604787652041007105,Remember if the SEC sweeps those who dont comply that could include a key stablecoin
1604787480670208002,2022-12-19 10:35:25+00:00,60,3,https://twitter.com/i/web/status/1604787480670208002,To the great Happy Hanukkah and thanks for all you do for small businesses around the world and for your kindness and generosity
1604786702706511873,2022-12-19 10:32:20+00:00,126,10,https://twitter.com/i/web/status/1604786702706511873,I know Elon you said absolutely no to John to run Twitter but if you step down dont file bankruptcy until you give John a chance to fix it
1604700899770761218,2022-12-19 04:51:23+00:00,280,27,https://twitter.com/i/web/status/1604700899770761218,Soon enough Mr Powell Dont believe the cynics who think wages only go up
1604655939402997760,2022-12-19 01:52:43+00:00,610,64,https://twitter.com/i/web/status/1604655939402997760,The runway for the crypto platforms that are not in compliance with US standards is very very short Please be careful as I suspect a sweep is going to happen soon Its been promised too many times not to be
1604642882534756352,2022-12-19 01:00:50+00:00,114,11,https://twitter.com/i/web/status/1604642882534756352,Everyone was just a paid spokesperson I guess thats okay if everyone else is
1604642718168322049,2022-12-19 01:00:11+00:00,69,9,https://twitter.com/i/web/status/1604642718168322049,I think this is a likely problem but have said so for about a year now
1604640602934714369,2022-12-19 00:51:47+00:00,27,1,https://twitter.com/i/web/status/1604640602934714369,thank you so much for another fabulous win
1603886298162515971,2022-12-16 22:54:26+00:00,1451,109,https://twitter.com/i/web/status/1603886298162515971,Checking your Binance account a couple of hours a day I bank with Draftkings
1603871430864691211,2022-12-16 21:55:22+00:00,95,5,https://twitter.com/i/web/status/1603871430864691211,More fifties coming Tonight on Mad
1603806914000961564,2022-12-16 17:39:00+00:00,55,1,https://twitter.com/i/web/status/1603806914000961564,Yesterdays monthly meeting covered a range of topics including a review of our charitable trust and how were preparing for the new year Did you miss yesterdays meeting Become a member of my Investing Club and see how were preparing for 2023
1603769342096773120,2022-12-16 15:09:42+00:00,692,27,https://twitter.com/i/web/status/1603769342096773120,Checked the old mentions column just now just to be sure i am as hated as ever and i was gratified immediately
1603769160558944256,2022-12-16 15:08:59+00:00,110,14,https://twitter.com/i/web/status/1603769160558944256,This stuff is amazing Powell is going to be winning very quickly
1603768715228729345,2022-12-16 15:07:12+00:00,131,4,https://twitter.com/i/web/status/1603768715228729345,Just to be sure i was dodgy about FTX too Mr Evil Carl I see you also go by DiscoPrimate which indicates that you are on a permanent intellectual vacation Do your kids call you Evil Carl What a hoot
1603765998972243968,2022-12-16 14:56:25+00:00,74,6,https://twitter.com/i/web/status/1603765998972243968,ugh
1603733893185781762,2022-12-16 12:48:50+00:00,2105,92,https://twitter.com/i/web/status/1603733893185781762,If i recommended something and was taking money from them and they turned out to be a fraud i think i would be more respectful of tough questions from the Squawk Box crew Or i would choose not to be on
1603731375097520129,2022-12-16 12:38:50+00:00,654,37,https://twitter.com/i/web/status/1603731375097520129,SBF was trying to confess his way out of jail That failed
1603730995861225475,2022-12-16 12:37:19+00:00,530,36,https://twitter.com/i/web/status/1603730995861225475,SBF You are innocent until proven guilty unless you confess to your guilt You have waived your rights This is one of the first principles of criminal law not right
1603722392093728769,2022-12-16 12:03:08+00:00,8542,631,https://twitter.com/i/web/status/1603722392093728769,I would trust my money more in Draftkings than i would binance
1603713934669881344,2022-12-16 11:29:32+00:00,166,12,https://twitter.com/i/web/status/1603713934669881344,What keeps people from saying the obvious what do they fear Who do hey fear
1603713721385291776,2022-12-16 11:28:41+00:00,1319,153,https://twitter.com/i/web/status/1603713721385291776,Why are there no strategists who say that most crypto are worthless so sell them Why cant people in charge just admit that Binance has no real legitimacy after what happened to FTX
1603713253300965376,2022-12-16 11:26:49+00:00,208,12,https://twitter.com/i/web/status/1603713253300965376,Why do people by SPACs other than for that first day squeeze Why do people insist on losing money Why is there no strategist who just gets up and says dont buy any of this crap
1603676105151504384,2022-12-16 08:59:12+00:00,486,36,https://twitter.com/i/web/status/1603676105151504384,Dire is the word that keeps coming up about everything Every situation is dire Beijing the bond market earnings the deficit all dire Reminds me of all of the other times in the last 40 years that things were dire and we ended up making money any way with good stocks
1603453130930372624,2022-12-15 18:13:11+00:00,59,7,https://twitter.com/i/web/status/1603453130930372624,Just wrapped up an awesome Monthly Meeting for the CNBC Investing Club You can catch up on what you missed with the replay at at 230p ET today
1603452820153417741,2022-12-15 18:11:57+00:00,101,10,https://twitter.com/i/web/status/1603452820153417741,important
1603427163641741326,2022-12-15 16:30:00+00:00,43,4,https://twitter.com/i/web/status/1603427163641741326,Coming up in 30 minutes the CNBC Investing Club is hosting its final monthly meeting of 2022 Join now before its too late with our 1Year29999 offer and watch cover all of the stocks in his charitable trust Click here to join the club
1603328727173275648,2022-12-15 09:58:51+00:00,115,6,https://twitter.com/i/web/status/1603328727173275648,As i said last night there are always slow actors who come to work the next day and say Phew i can get out down 12 let me start selling
1603328389703778304,2022-12-15 09:57:31+00:00,684,51,https://twitter.com/i/web/status/1603328389703778304,has to get ahead of this thing and sell a giant block of Tesla to raise all he will need for Twitter or he should take the hit and sell it I think he is on the worse course right now
1603082169777541120,2022-12-14 17:39:07+00:00,42,8,https://twitter.com/i/web/status/1603082169777541120,Our Investing Club monthly meeting exclusively for club members is tomorrow at 12p EST Join the CNBC Investing Club today with our special 1Year29999 offer and tune into the final Investing Club Monthly Meeting of 2022 Click here to join the club
1603039462879109122,2022-12-14 14:49:25+00:00,364,39,https://twitter.com/i/web/status/1603039462879109122,Apesstill too early to average down on Gamestop unless the savor buys some
1603026649528029184,2022-12-14 13:58:30+00:00,911,79,https://twitter.com/i/web/status/1603026649528029184,If you had money in Binance would you keep it there best question of the morning
1603014184433745923,2022-12-14 13:08:58+00:00,280,8,https://twitter.com/i/web/status/1603014184433745923,dont let sleeping dogs lie on fed day
1602964089982033920,2022-12-14 09:49:55+00:00,8361,764,https://twitter.com/i/web/status/1602964089982033920,Do you feel as reassured by Binance as i do
1602870670404337664,2022-12-14 03:38:42+00:00,168,7,https://twitter.com/i/web/status/1602870670404337664,while I hate an up opening like this mornings i thought the close was quite constructive and expect to talk positively about the tape at Thursdays investment club meeting
1602869789705342978,2022-12-14 03:35:12+00:00,559,28,https://twitter.com/i/web/status/1602869789705342978,these stories out of Twitter are insane and would be hilarious if there werent real people involved
1602783237272739840,2022-12-13 21:51:16+00:00,152,5,https://twitter.com/i/web/status/1602783237272739840,Carvana and Bed Bath in some sort of footrace
1602706412450316288,2022-12-13 16:46:00+00:00,151,11,https://twitter.com/i/web/status/1602706412450316288,Have the fungibles gone down as much as the nonfungibles
1602677123239526401,2022-12-13 14:49:37+00:00,151,8,https://twitter.com/i/web/status/1602677123239526401,most important person in our house ahead of me
1602676983841918976,2022-12-13 14:49:03+00:00,191,9,https://twitter.com/i/web/status/1602676983841918976,Idea go watch Its a Wonderful Life You dont want to be the last to get your money
1602676783228354566,2022-12-13 14:48:16+00:00,2742,211,https://twitter.com/i/web/status/1602676783228354566,Not a buyer of coinbase here Too early
1602670137185812482,2022-12-13 14:21:51+00:00,85,12,https://twitter.com/i/web/status/1602670137185812482,truth
1602670080038522881,2022-12-13 14:21:37+00:00,230,15,https://twitter.com/i/web/status/1602670080038522881,you must read the SEC complaint and release to know how much trouble all of these companies are in
1602668225371799552,2022-12-13 14:14:15+00:00,72,5,https://twitter.com/i/web/status/1602668225371799552,House of Cardsclarion call to come into compliance its all happening right now These outfits have avoided compliance for ages
1602586786919841792,2022-12-13 08:50:39+00:00,136,11,https://twitter.com/i/web/status/1602586786919841792,I liked the Oracle quarter A LOT I think Cerner was a brilliant acquisition and they can run the table on large hospital systems and national health services
1602586343506313216,2022-12-13 08:48:53+00:00,96,3,https://twitter.com/i/web/status/1602586343506313216,not yet
