id,created_at,favorite_count,retweet_count,url,text
1575939084190875648,2022-09-30 20:02:11+00:00,3,0,https://twitter.com/i/web/status/1575939084190875648,If you want to call me names or are otherwise disrespectful I dont need you following me here and the space is better devoted to people who arent attacking my integritywhich I have zero patience for 22
1575939007917457408,2022-09-30 20:01:53+00:00,2,0,https://twitter.com/i/web/status/1575939007917457408,I dont see signs were in a global recession just a low growth stagnant period If you want to discuss economic and market realities Im comfortable responding to comments queries and statements here 12
1575938636146933760,2022-09-30 20:00:25+00:00,1,0,https://twitter.com/i/web/status/1575938636146933760,Hence I think the spreads need to come out of the LEI I also think several other components are outdated and not predictive But of course I may be wrong I hope all is well with you Stefan 22
1575938526818226176,2022-09-30 19:59:58+00:00,1,0,https://twitter.com/i/web/status/1575938526818226176,Lots but none that dont sound like Im making excuses The most important tied to this is that with so much of the US lending base at zero cost when the FED raises short rates it causes banks to have more incentive to lend not less like when the lending base cost banks12
1575938058595504129,2022-09-30 19:58:07+00:00,1,0,https://twitter.com/i/web/status/1575938058595504129,Higher prices ahead
1575937904198975489,2022-09-30 19:57:30+00:00,2,0,https://twitter.com/i/web/status/1575937904198975489,In a period of negativity people emphasis whatever seems negative There is no validity at all in todays world for fretting 102 year spreadshas no lending or quantity of money impact
1575937488828628992,2022-09-30 19:55:51+00:00,0,0,https://twitter.com/i/web/status/1575937488828628992,Note however no one notices but since the June bottom and despite the terrible September growth stocks have done a bit better than valuewhile people keep saying value is the place to be 22
1575937422881587202,2022-09-30 19:55:35+00:00,1,0,https://twitter.com/i/web/status/1575937422881587202,Its all positive but increased bank lending tends to impact value stocks being more balance sheet dependant than growth stocks 12
1575937064297988097,2022-09-30 19:54:10+00:00,2,0,https://twitter.com/i/web/status/1575937064297988097,Where are there major sovereign debt crises as opposed to talk about them Spreads remain exceptionally benign by crisis standards seen as recently as during the PIIGS panicswhich oh by the wayled to great market outcomes
1575936777378238465,2022-09-30 19:53:01+00:00,1,0,https://twitter.com/i/web/status/1575936777378238465,They cant kill inflation this way dont have to and dont know any better We do live in funny times 22
1575936680426893317,2022-09-30 19:52:38+00:00,1,0,https://twitter.com/i/web/status/1575936680426893317,Yes banks are flush with reserves and beyond that compared to when I was young when most of reserves cost them money today 93 of US bank lending base costs the banks nothing Resultthe more the banks raise rates the more incentive the banks have to lend 12
1575930012787564545,2022-09-30 19:26:09+00:00,1,0,https://twitter.com/i/web/status/1575930012787564545,but I dont know if she was contrarianjust marching to a different drummer Thanks for asking and of course for following me here Have a great weekend and October 33
1575929915052265473,2022-09-30 19:25:45+00:00,1,0,https://twitter.com/i/web/status/1575929915052265473,And of course she reigned a good notch longer than he has and until she diedwhich probably ends up being his case as well Russia isnt easy to rule You have to give her credit for doing so benignlywhich is why she was the Great 23
1575929791840104448,2022-09-30 19:25:16+00:00,1,0,https://twitter.com/i/web/status/1575929791840104448,She is most commonly seen as enlightened Russia flourished under her expansionary growth vision and were she ruling Russia now there would be none of the brutish nonsense Putin cant get past 13
1575850466059161600,2022-09-30 14:10:03+00:00,73,8,https://twitter.com/i/web/status/1575850466059161600,Quote for the Day It isnt what you have or who you are or where you are or what you are doing that makes you happy or unhappy It is what you think about Dale Carnegie KFQuoteForTheDay
1575588737287065600,2022-09-29 20:50:02+00:00,23,2,https://twitter.com/i/web/status/1575588737287065600,Make sure to tune in to tomorrow
1575504454664654849,2022-09-29 15:15:08+00:00,36,8,https://twitter.com/i/web/status/1575504454664654849,Despite the blather amp while flatter than 3 or 6 months ago GDP weighted global yield curves are about the same as a year ago US much flatter Europe and Asia a bit steeper
1575484301122338819,2022-09-29 13:55:03+00:00,50,9,https://twitter.com/i/web/status/1575484301122338819,Quote for the Day Bad news travels faster than good Catherine the Great KFQuoteForTheDay
1575157141609992192,2022-09-28 16:15:02+00:00,2,0,https://twitter.com/i/web/status/1575157141609992192,So when discernment has a low probably of correctness there is a premium on patience Thanks for the discourse 33
1575157071606996992,2022-09-28 16:14:45+00:00,3,0,https://twitter.com/i/web/status/1575157071606996992,The only thing we really know is that once youre in a bear market officially down over 20 it isnt terribly long in time until the next bull begins and bulls always follow bears 23
1575157018842714119,2022-09-28 16:14:32+00:00,2,0,https://twitter.com/i/web/status/1575157018842714119,May be Could be There are so many ways to see the current period that the likelihood of any one of them being correct is not overwhelming 13
1575156478087876609,2022-09-28 16:12:24+00:00,0,0,https://twitter.com/i/web/status/1575156478087876609,He did have a way about himand with words Martine Always nice to see you here
1575156038348591105,2022-09-28 16:10:39+00:00,0,0,https://twitter.com/i/web/status/1575156038348591105,Great quote Martine Ill have to steal it
1575155806424616960,2022-09-28 16:09:43+00:00,0,0,https://twitter.com/i/web/status/1575155806424616960,The notion that you can predict what will happen to the broad economy because of shortterm interest rate wiggles was always as Milton Friedman said when i was a kid 60 years ago always the height of folly 22
1575155476001566721,2022-09-28 16:08:25+00:00,0,0,https://twitter.com/i/web/status/1575155476001566721,When William McChesney Martin as immediate past FED Chair made his derogatory comments about FED head thinking I dont believe he was singularly focused on just what happens in that function at the FED but to all Central Bank heads 12
1575155010584748033,2022-09-28 16:06:34+00:00,0,0,https://twitter.com/i/web/status/1575155010584748033,Where was the money growth from that Cant see it in the quantity of money over those earlier years which grew a snails pace
1575154796377481216,2022-09-28 16:05:43+00:00,0,0,https://twitter.com/i/web/status/1575154796377481216,They dont drive markets but do impact as you say a huge subset of main street prices Thanks for following me here and commenting 44
1575154713867132928,2022-09-28 16:05:23+00:00,0,0,https://twitter.com/i/web/status/1575154713867132928,Technology evolution will continue to be the tip of the spear in human material well being of all forms as it has been since the steam enginebut the capital market effects are largely prepriced and must be 34
1575154556941369344,2022-09-28 16:04:45+00:00,0,0,https://twitter.com/i/web/status/1575154556941369344,But other forces like Tuomeys Law and more continue in magnetic optics and more not a pun on Moore But i think in this day and age those are priced into markets 24
1575153049680506880,2022-09-28 15:58:46+00:00,1,0,https://twitter.com/i/web/status/1575153049680506880,Yes Edward it always has and for now continues to but of course eventually Moores Law will stumble from diminishing returns for all the reason you know better than do I But Ive always been a Moores Law fan 14
1575152036147929088,2022-09-28 15:54:44+00:00,4,0,https://twitter.com/i/web/status/1575152036147929088,Thanks Sbastien But still wrong is wrong and Ive been not seeing things correctly a lot this year It happens Best to simple about it
1575151507581808640,2022-09-28 15:52:38+00:00,1,1,https://twitter.com/i/web/status/1575151507581808640,Youre more than welcome Thank you for following me here
1575150862858592257,2022-09-28 15:50:05+00:00,16,4,https://twitter.com/i/web/status/1575150862858592257,Wondering how the upcoming midterms will impact stocks Read my latest article in
1575115866110365701,2022-09-28 13:31:01+00:00,22,3,https://twitter.com/i/web/status/1575115866110365701,Quote for the Day Put your name on something it better be the bestyou only get one shot George Foreman KFQuoteForTheDay
1574866973015609345,2022-09-27 21:02:00+00:00,7,0,https://twitter.com/i/web/status/1574866973015609345,For my German speaking followers my latest column in
1574788468852592643,2022-09-27 15:50:03+00:00,48,14,https://twitter.com/i/web/status/1574788468852592643,Leading Indicators of Falling InflationPosition For It Now
1574759771428851715,2022-09-27 13:56:01+00:00,55,8,https://twitter.com/i/web/status/1574759771428851715,Quote for the Day Courage is the most important of the virtues because without it no other virtue can be practiced consistently We cant be kind true merciful generous or honestMaya Angelou KFQuoteForTheDay
1574435496197234693,2022-09-26 16:27:28+00:00,1,0,https://twitter.com/i/web/status/1574435496197234693,To the point of your article Steve has always been a fan of the gold standard But note Gold is down and has been during this entire inflation period 44
1574435425812631552,2022-09-26 16:27:11+00:00,1,0,https://twitter.com/i/web/status/1574435425812631552,So far throughout its actions loan growth has remained robust overall And it is loan growth that is more important than interest rates in my view I doubt the FED can kneecap the economy by raising shortrates like this 34
1574435283650871298,2022-09-26 16:26:37+00:00,1,0,https://twitter.com/i/web/status/1574435283650871298,The FEDs problem is it doesnt know what it is doing never has and isnt good at foreseeing the future while acting as if it is But the FED is far from as powerful as most folks think it is Hard to see why raising short rates is as big a deal as people fear 24
1574435179736993793,2022-09-26 16:26:13+00:00,1,0,https://twitter.com/i/web/status/1574435179736993793,But the dollar is super strong As John Tamny wrote today inflation just to be defined as currency weakness a devaluation of the currency by excess money creation But now the place that has been done the most has the strongest currency in modern history 14
1574434566148100096,2022-09-26 16:23:46+00:00,2,0,https://twitter.com/i/web/status/1574434566148100096,If that werent true people would be better at predicting successfully future shortterm wiggles But Ive never known or heard about anyone who has done that successfully in the longterm 22
1574434510770688006,2022-09-26 16:23:33+00:00,2,0,https://twitter.com/i/web/status/1574434510770688006,Im not sure it isnt just traders shortterm colliding trying to outguess what they think other traders are doing Im not sure it is really about the FED Trying to discern what causes shortterm wiggles is near impossible 12
1574433826197348353,2022-09-26 16:20:50+00:00,3,0,https://twitter.com/i/web/status/1574433826197348353,In this case faith in capitalism will be rewarded although I recognize that any change internally at 79 is tougher than when younger But you can do it 33
1574433681107988480,2022-09-26 16:20:15+00:00,2,1,https://twitter.com/i/web/status/1574433681107988480,Faith in that isnt always easy to achieve like any faith but it is basic What you worry about is more about you than the reality of the future Nothing I can say or do impacts your worrying or anyones relative to what you or that person does internally 23
1574433554888814592,2022-09-26 16:19:45+00:00,3,0,https://twitter.com/i/web/status/1574433554888814592,Of course you will Sandee Bear markets are followed by bull marketssometimes bigger longer and stronger and sometimes shorter and lesser In the long run capitalism wins It is the holy ism of human material well being 13
1574432826543730688,2022-09-26 16:16:52+00:00,3,0,https://twitter.com/i/web/status/1574432826543730688,If everyone is looking for capitulation since the markets want to get most folks it is exactly when you wont get capitulation Does that make sense 22
1574432729596592129,2022-09-26 16:16:28+00:00,1,0,https://twitter.com/i/web/status/1574432729596592129,Thats the capitulation argument well articulated It is the way most but not all bear markets end But the we need part is where your argument isnt perfect 12
1574432319611768835,2022-09-26 16:14:51+00:00,1,0,https://twitter.com/i/web/status/1574432319611768835,Investors views are overall largely myopic I wouldnt waste time thinking PE as it isnt predictive on any time period people make real capital markets decisions upon 55
1574432254478393344,2022-09-26 16:14:35+00:00,1,0,https://twitter.com/i/web/status/1574432254478393344,And if i told almost anyone the market would go one way for 1 3 or 5 years and then be below average the other way for the next five years or so they would still be biased toward the shorter periods 45
1574432163071922177,2022-09-26 16:14:13+00:00,1,0,https://twitter.com/i/web/status/1574432163071922177,for 1 3 and 5 year periods and while there is some indication as per CAPE data that high PEs indicate below average 10 year returns on average still positive 35
1574431995052306432,2022-09-26 16:13:33+00:00,1,0,https://twitter.com/i/web/status/1574431995052306432,For every level of PE history has a similar number of great good blah bad and terrible years relative to the evolution of all years being more up than down 25
1574431871509106688,2022-09-26 16:13:04+00:00,1,0,https://twitter.com/i/web/status/1574431871509106688,I dont believe there is or has ever been a good theoretical or historic statistical basis for believing PE singularly have any predictive power for stocks at any level 15
1574430903039889409,2022-09-26 16:09:13+00:00,1,0,https://twitter.com/i/web/status/1574430903039889409,Thank you for the confidence of your retweet and of course thanks for following me here
1574430589498937345,2022-09-26 16:07:58+00:00,1,0,https://twitter.com/i/web/status/1574430589498937345,Thank you for the confidence of your retweet and of course thanks for following me here
1574428850695684097,2022-09-26 16:01:04+00:00,88,10,https://twitter.com/i/web/status/1574428850695684097,A piece of yestermonths headline anxiety slow fades Used car prices down 13 since January and another 23 in the first half of Septemberas supply chain issues arent over but improve markedly As the rabbit moves through the snake one more vertebrae passed
1574400152357552129,2022-09-26 14:07:01+00:00,69,12,https://twitter.com/i/web/status/1574400152357552129,Quote for the Day It is better to fail in originality than to succeed in imitation Herman Melville KFQuoteForTheDay
1573734511824740354,2022-09-24 18:02:00+00:00,22,3,https://twitter.com/i/web/status/1573734511824740354,ICYMI My latest column explains why Chinese slowdown wont endanger Australias economy
1573413149474275356,2022-09-23 20:45:02+00:00,26,3,https://twitter.com/i/web/status/1573413149474275356,Heres my view on the likely market impact of recently passed legislation
1573336940585558017,2022-09-23 15:42:12+00:00,1,0,https://twitter.com/i/web/status/1573336940585558017,The one sidesteps most all the hidden costs and of course the mortgage 33
1573336813737246720,2022-09-23 15:41:42+00:00,1,0,https://twitter.com/i/web/status/1573336813737246720,Accruing deferred maintenance costs insurance and ongoing expenses of varied kinds are much higher than most folks think So be careful A key question to always ask is the cost of owning fully loaded after tax in an area versus renting there also after tax 23
1573336543129112582,2022-09-23 15:40:37+00:00,0,0,https://twitter.com/i/web/status/1573336543129112582,First thanks for asking and for following me here Second Im no kind of an expert on housing So my views are muted Third it is almost always true that few residential home owners fully account for the costs of home ownership when looking at rate of return 13
1573335403054202880,2022-09-23 15:36:05+00:00,1,0,https://twitter.com/i/web/status/1573335403054202880,Well seemingly not LOL
1573335228634079232,2022-09-23 15:35:24+00:00,1,0,https://twitter.com/i/web/status/1573335228634079232,Are you being presumptuous Are you suggesting I dont believe what I say
1573308459344429056,2022-09-23 13:49:02+00:00,47,5,https://twitter.com/i/web/status/1573308459344429056,Quote for the Day I beg you take courage the brave soul can mend even disaster Catherine the Great KFQuoteForTheDay
1573039256389693440,2022-09-22 19:59:19+00:00,12,6,https://twitter.com/i/web/status/1573039256389693440,For my Canadian followers my latest column is out in the Midterm magic just ahead to goose Canadian stocks
1572997896374743040,2022-09-22 17:14:58+00:00,2,0,https://twitter.com/i/web/status/1572997896374743040,But were coming to Gridlock I sure do hope havent had a negative 3rd year of a presidents term since 1939 as WWII started and it was only down 09and so Im hopeful the obsession isnt long in fading away Patience remains a virtue 44
1572997642984247296,2022-09-22 17:13:57+00:00,1,0,https://twitter.com/i/web/status/1572997642984247296,Meanwhile the inflation rat is getting digested through the snake with some moderate consistency How long the obsession is I dont know 34
1572997477225365506,2022-09-22 17:13:18+00:00,1,0,https://twitter.com/i/web/status/1572997477225365506,Friedman taught and showed when I a boy that it doesnt work Having eliminated effective simple reserve requirements they for sure have no hard levers on inflation and fiddling with rates will get them nowhere fast 24
1572997091773026304,2022-09-22 17:11:46+00:00,1,0,https://twitter.com/i/web/status/1572997091773026304,Indeed Teresa I dont know how long the obsession lasts but it is an obsession Central banks thinking they can know the effect of putting short rates at X Y or Z on GDP versus inflation is the height of arrogance 14
1572995695430324231,2022-09-22 17:06:13+00:00,0,0,https://twitter.com/i/web/status/1572995695430324231,Thank you Mike for the confidence of your retweet and of course for following me here
1572994983975600135,2022-09-22 17:03:23+00:00,4,0,https://twitter.com/i/web/status/1572994983975600135,What a snarky statement What in the world makes you presume my motives or impune my integrity What in the world gives you power to presume I dont say what I actually believe How presumptive of you A competitor maybe I dunno But the world needs fewer of you snarks
1572994678177370113,2022-09-22 17:02:10+00:00,1,0,https://twitter.com/i/web/status/1572994678177370113,
1572946070098919427,2022-09-22 13:49:01+00:00,94,19,https://twitter.com/i/web/status/1572946070098919427,Quote for the Day Discipline is the bridge between goals and accomplishment John Rohn KFQuoteForTheDay
1572608092067569664,2022-09-21 15:26:01+00:00,9,2,https://twitter.com/i/web/status/1572608092067569664,For my Italian speaking followers my latest column in
1572599296993755138,2022-09-21 14:51:04+00:00,29,6,https://twitter.com/i/web/status/1572599296993755138,Heres my view on the relative safety of stocks and bonds
1572597184159170561,2022-09-21 14:42:40+00:00,0,0,https://twitter.com/i/web/status/1572597184159170561,Hey Thanks for the mention
1572597014508216321,2022-09-21 14:42:00+00:00,1,0,https://twitter.com/i/web/status/1572597014508216321,Feelings are always a problem Patience is a virtue
1572577892231438336,2022-09-21 13:26:01+00:00,50,6,https://twitter.com/i/web/status/1572577892231438336,Quote for the Day Today knowledge has power It controls access to opportunity and advancement Peter Drucker KFQuoteForTheDay
1572244197574602758,2022-09-20 15:20:02+00:00,5,1,https://twitter.com/i/web/status/1572244197574602758,For my Dutch speaking followers my latest column in
1572225571853139968,2022-09-20 14:06:01+00:00,66,15,https://twitter.com/i/web/status/1572225571853139968,Quote for the Day Tact is the art of making a point without making an enemy Isaac Newton KFQuoteForTheDay
1571920213175865344,2022-09-19 17:52:38+00:00,46,8,https://twitter.com/i/web/status/1571920213175865344,Nearly a quarter of the US CPI basket is a theoretical estimate called owners equivalent rent OER Keep in mindOER only applies to new buyers and renters and likely overstates the cost of living increase for most people who own or are already renting 22
1571920209270943747,2022-09-19 17:52:37+00:00,59,14,https://twitter.com/i/web/status/1571920209270943747,Digging deeper into last Tuesdays headline CPI print shows persistent price pressures in some categories but the cost of many goods are well off their peaks Monthly CPI data likely remains volatile in the months ahead but always important to look beyond headline numbers 12
1571902945566003200,2022-09-19 16:44:01+00:00,15,3,https://twitter.com/i/web/status/1571902945566003200,Chinese slowdown wont endanger Australias economy I explain in my latest column in
1571885233821155329,2022-09-19 15:33:38+00:00,0,0,https://twitter.com/i/web/status/1571885233821155329,Well that opinion seems ever less common these days LOL Thanks
1571885033580908547,2022-09-19 15:32:50+00:00,2,0,https://twitter.com/i/web/status/1571885033580908547,Good by me Im an introvert and more comfortable the more alone I am
1571884839078445057,2022-09-19 15:32:04+00:00,0,1,https://twitter.com/i/web/status/1571884839078445057,And why do you know before almost anyone else
1571884525591953408,2022-09-19 15:30:49+00:00,9,0,https://twitter.com/i/web/status/1571884525591953408,
1571884043716771841,2022-09-19 15:28:54+00:00,1,0,https://twitter.com/i/web/status/1571884043716771841,Absolutely But how do you get the 2023 part in there I can see the argument for 2021 although technically the start will be defined as January 2022 but whats the 2023 part Kind of fits into a maybe on that
1571861931148943362,2022-09-19 14:01:02+00:00,61,9,https://twitter.com/i/web/status/1571861931148943362,Quote for the Day If you can keep your head when all about you are losing theirs yours is the Earth and everything thats in it Rudyard Kipling KFQuoteForTheDay
1571196789138522112,2022-09-17 17:58:00+00:00,41,10,https://twitter.com/i/web/status/1571196789138522112,ICYMI My latest markets column is out now If You Think Inflation Has Crested Position Yourself For a Rally Now
1570889012138708992,2022-09-16 21:35:00+00:00,33,5,https://twitter.com/i/web/status/1570889012138708992,How do stock and bond returns compare in the long term Heres my take
1570805230157303809,2022-09-16 16:02:05+00:00,2,0,https://twitter.com/i/web/status/1570805230157303809,Hard to beat that Raised with it Carry it with my credit cards
1570804988770910215,2022-09-16 16:01:08+00:00,0,0,https://twitter.com/i/web/status/1570804988770910215,Well you know what my old friend Forrest would say Crazy is as crazy does
1570804789587640320,2022-09-16 16:00:20+00:00,1,0,https://twitter.com/i/web/status/1570804789587640320,Twit Well Bob facts as the old saying goes are themselves stubborn things
1570804682007912451,2022-09-16 15:59:54+00:00,1,0,https://twitter.com/i/web/status/1570804682007912451,I wouldnt go that far Ken Beta is all about the past and with something like this things change But yes tech is inherently more volatile than the market Thanks for everything
1570804537665155072,2022-09-16 15:59:20+00:00,0,1,https://twitter.com/i/web/status/1570804537665155072,Rallies are almost never called for Its what makes them work
1570804435508666374,2022-09-16 15:58:56+00:00,1,0,https://twitter.com/i/web/status/1570804435508666374,Yes over the cycle but usually not in the early months The early months usually see what declined the most bounces the most Why Because too many have been scared out
1570802965547720705,2022-09-16 15:53:05+00:00,0,0,https://twitter.com/i/web/status/1570802965547720705,Thanks for the confidence of your retweet And of course for following me here Great song
1570770483708153856,2022-09-16 13:44:01+00:00,42,9,https://twitter.com/i/web/status/1570770483708153856,Quote for the Day What is now proved was once only imagined William Blake KFQuoteForTheDay
1570479816058753024,2022-09-15 18:29:00+00:00,51,8,https://twitter.com/i/web/status/1570479816058753024,Will tech stocks bounce back Heres my perspective
1570447416876470274,2022-09-15 16:20:16+00:00,0,0,https://twitter.com/i/web/status/1570447416876470274,And of course if something untoward does happen like a bus running you over now wellthen what you have at that point only applies to heirs if you have them and they likely have a longer time span still 22
1570447348568035328,2022-09-15 16:20:00+00:00,1,0,https://twitter.com/i/web/status/1570447348568035328,Seems like it is what you have years down the road that counts If you retired just six years ago you likely shy of something untoward have a long time span ahead 12
1570446508226641925,2022-09-15 16:16:39+00:00,3,0,https://twitter.com/i/web/status/1570446508226641925,markets Sometimes but longer term it likes high but falling uncertainty and dislikes rising uncertainty Of course thats other things being equal which never fully applies Regardless thanks for following me here and commenting
1570445968721715202,2022-09-15 16:14:31+00:00,2,0,https://twitter.com/i/web/status/1570445968721715202,markets Fretting is usually regretting
1570443933158895617,2022-09-15 16:06:25+00:00,0,0,https://twitter.com/i/web/status/1570443933158895617,Hello back Mr Johnson
