id,created_at,favorite_count,retweet_count,url,text
1611484254608805888,2023-01-06 22:06:00+00:00,30,4,https://twitter.com/i/web/status/1611484254608805888,I share my perspective on New Years resolutions for your investment strategy
1611437819389673472,2023-01-06 19:01:29+00:00,0,0,https://twitter.com/i/web/status/1611437819389673472,Please dont promote specific securities here It isnt the place for it nor appropriate and if you do moving ahead Ill have to block you from the site which I would regret
1611436278855393282,2023-01-06 18:55:22+00:00,1,0,https://twitter.com/i/web/status/1611436278855393282,Good actions lead to good feelings bad actions the reverse Most are misled culturally on the issue of their feelings and focus on feelings first Quite self destructive 22
1611436161964335104,2023-01-06 18:54:54+00:00,0,0,https://twitter.com/i/web/status/1611436161964335104,Indeed People believe they should focus on their feelings which become prevalent in the mid1960s with the rise of poppsychology But as I learned a long time ago from study feeling follow actions not the other way around and our culture hasnt come to embrace that 12
1611435821646905345,2023-01-06 18:53:33+00:00,0,0,https://twitter.com/i/web/status/1611435821646905345,Less so on Saturdays and Sundays and global holidays LOL
1611435489940353026,2023-01-06 18:52:14+00:00,0,0,https://twitter.com/i/web/status/1611435489940353026,But you didnt answer my question
1611435350836285441,2023-01-06 18:51:41+00:00,3,0,https://twitter.com/i/web/status/1611435350836285441,Right And no one now sees the strength it seems in stocks overseas since midOctober The big shocker is that being a longer term bottom Almost no one is looking there And of course that is the way bears normally end and with the Pessimism of Disbelief
1611435140429025281,2023-01-06 18:50:51+00:00,2,0,https://twitter.com/i/web/status/1611435140429025281,No If things happen per consensus that is exactly what should be already pricedinto stocks That is what stocks do for a living
1611434968726765569,2023-01-06 18:50:10+00:00,2,0,https://twitter.com/i/web/status/1611434968726765569,Might be but businesses are cutting costs now heavily Should be mitigation to some extent I cant see yet any sign of the roll over but it might be there Media however has no ability to forecast such things never has and has far less capability than it used to
1611433530743218176,2023-01-06 18:44:27+00:00,2,0,https://twitter.com/i/web/status/1611433530743218176,Maybe all of it Things like the LEI US Yield curve and more are too public too long not to freak everyone out Anticipation must be mitigation unless you believe all those in control of the levers are as I said complete idiots 33
1611433437461876738,2023-01-06 18:44:05+00:00,1,0,https://twitter.com/i/web/status/1611433437461876738,How do they expect for so long and not engage in mitigation The course of a normal recession is for businesses and consumers to make up for excesses created in the prior expansion But this time theyre doing at least a lot of it beforehand 23
1611433341357813760,2023-01-06 18:43:42+00:00,1,0,https://twitter.com/i/web/status/1611433341357813760,We disagree Ive never before in my 50plus years as a professional investor seen a recession widely anticipated More than half of CEOs expected one starting last spring It is 98 in America now and over 90 on both Asia and Europe Do you expect theyre all idiots 13
1611367253596950529,2023-01-06 14:21:05+00:00,101,19,https://twitter.com/i/web/status/1611367253596950529,Quote for the Day Dont judge each day by the harvest you reap but by the seeds that you plant Robert Louis Stevenson KFQuoteForTheDay
1611119621930721283,2023-01-05 21:57:05+00:00,25,1,https://twitter.com/i/web/status/1611119621930721283,Another of the same in average annual returns Note anyone can do this Why would anything anyone can do not be already priced unless no one or very few believe it could apply now You must ask yourself is it basic or just the past Yours to decide
1611119617304584192,2023-01-05 21:57:04+00:00,23,2,https://twitter.com/i/web/status/1611119617304584192,Another of the same thing expressing relative outperformance or underperformance If so argues best places for 2023 are IT Consumer Staples and Discretionaries Industrials But anyone with a computer can figure this out So might not apply well
1611119614246912002,2023-01-05 21:57:03+00:00,50,10,https://twitter.com/i/web/status/1611119614246912002,Not necessarily predictive but percent of time each US sector has outperformed by year of Presidents terms since 1927
1611101471482974208,2023-01-05 20:44:58+00:00,1,0,https://twitter.com/i/web/status/1611101471482974208,If youre not good at timing and stuff which almost no one is being patient is a pretty good thing diversifying and making sure not to snatch defeat from the jaws of victory which is patience 22
1611101404248281089,2023-01-05 20:44:42+00:00,1,0,https://twitter.com/i/web/status/1611101404248281089,At 67 you likely have a lot more bull and bear markets ahead of you whether you like that idea or not If youre a couple and both 67 one of you probably lives 20 years could be longer 12
1611101163797221376,2023-01-05 20:43:44+00:00,1,0,https://twitter.com/i/web/status/1611101163797221376,But opinions about the future always vary and the more they dont must be wrong And too much empirically based evidence is too visible so that anyone can do it now allowing folks to get misled by themselves me included for long periods 22
1611101100400332800,2023-01-05 20:43:29+00:00,0,0,https://twitter.com/i/web/status/1611101100400332800,Well Im not disagreeing on the US part Since the bottom foreign stocks and EAFE in particular have done better than US on the upside whether in dollars or local currency and by a lot in dollars 12
1611100809726681088,2023-01-05 20:42:20+00:00,0,0,https://twitter.com/i/web/status/1611100809726681088,Congratulations on that one of the blessings of a semifree marketgood for you customers employees and society
1611100599352987649,2023-01-05 20:41:30+00:00,0,0,https://twitter.com/i/web/status/1611100599352987649,Media today and particularly on TV seems heavily to put you whoever you are on one side or another of something and then the others dont want anything to do with you Everything is sort of boxed 33
1611100529220018176,2023-01-05 20:41:13+00:00,0,0,https://twitter.com/i/web/status/1611100529220018176,The world is so polarized today it is impossible for most to disagree agreeably and I totally dislike the screaming name calling and one sidedness 23
1611100469665107968,2023-01-05 20:40:59+00:00,0,0,https://twitter.com/i/web/status/1611100469665107968,NPR would never have me on I actually used to do three minutes a month of comedy for them in the mid1990s but that world doesnt exist anymore NPR isnt going to be interested in me in the slightest 13
1611100042504597504,2023-01-05 20:39:17+00:00,0,0,https://twitter.com/i/web/status/1611100042504597504,Where do you see actual news as you define it since part of it must come down to defining what is and isnt actual news
1611099907494137858,2023-01-05 20:38:45+00:00,1,0,https://twitter.com/i/web/status/1611099907494137858,Wow Thanks so much for the compliment And again thanks for following me all this time Been a while indeed
1611099739189305344,2023-01-05 20:38:05+00:00,0,0,https://twitter.com/i/web/status/1611099739189305344,How sure are you that youre right on all this stuff Do you contemplate if youre overconfident or not
1611099589880446980,2023-01-05 20:37:29+00:00,0,0,https://twitter.com/i/web/status/1611099589880446980,That said if you despise and think what I say is laughable you might do better to not waste your time following me here I wont miss you much Regardless best of luck 22
1611099530497523712,2023-01-05 20:37:15+00:00,0,0,https://twitter.com/i/web/status/1611099530497523712,Well fine Although you actually dont understand our business modeljust think you do But that said I accept that despise advisorswhile were not an advisor but an adviser a somewhat different kettle of fish 12
1611099054406275072,2023-01-05 20:35:22+00:00,1,0,https://twitter.com/i/web/status/1611099054406275072,From one Ken to another why reveal this LOL Thanks
1611098910088626176,2023-01-05 20:34:47+00:00,0,0,https://twitter.com/i/web/status/1611098910088626176,Very apt
1611078848518447115,2023-01-05 19:15:04+00:00,23,4,https://twitter.com/i/web/status/1611078848518447115,My latest column in Why stock markets including Singapores should boom in 2023
1611049160567930886,2023-01-05 17:17:06+00:00,75,10,https://twitter.com/i/web/status/1611049160567930886,Not significant no predictive value but another of my nearly endless annoying 19662022 comparables The real question of course is whether Ill be able to make nearly as many 19672023 comparables LOL
1610999663703851008,2023-01-05 14:00:25+00:00,90,15,https://twitter.com/i/web/status/1610999663703851008,Quote for the Day Being rich is having money being wealthy is having time Margaret Bonanno KFQuoteForTheDay
1610757762392391680,2023-01-04 21:59:11+00:00,3,0,https://twitter.com/i/web/status/1610757762392391680,Hard to own volatile anythings and be prone to fretting Regardless with stocks when fretting patience is a virtueand for some nearly impossible
1610756961313689618,2023-01-04 21:56:00+00:00,7,0,https://twitter.com/i/web/status/1610756961313689618,For my French speaking followers my latest column in fr
1610702500742705152,2023-01-04 18:19:36+00:00,2,0,https://twitter.com/i/web/status/1610702500742705152,I have great respect for him But that said always true that opinions vary And no one is right all the time as Ive proved abundantly in 2022
1610702334279176194,2023-01-04 18:18:56+00:00,2,0,https://twitter.com/i/web/status/1610702334279176194,Im very happy to have the new New York Post column and lucky and that it has well over twice the online reach Forbes does and more than any other US paper except arguably two Maybe now only one It keeps gaining share 22
1610702261965172737,2023-01-04 18:18:39+00:00,1,0,https://twitter.com/i/web/status/1610702261965172737,Wow Thanks I wish Forbes was still what it used to be But those days are over 12
1610702098550915072,2023-01-04 18:18:00+00:00,0,0,https://twitter.com/i/web/status/1610702098550915072,You and many others are envisioning something different from what theyve traditionally done so if so yes it would be shocker Do you really think theyre prone to that I dont for one big reason 22
1610702014283153408,2023-01-04 18:17:40+00:00,0,0,https://twitter.com/i/web/status/1610702014283153408,Would be a shocker When is the last time China invaded anywhere militaristically China had a minor excursion in Vietnam where they got clobbered and then you have to go to a long long time back in history to find anything like that 12
1610701795399176193,2023-01-04 18:16:48+00:00,0,0,https://twitter.com/i/web/status/1610701795399176193,Well of course now and alwaysopinions vary
1610701694123511809,2023-01-04 18:16:23+00:00,1,0,https://twitter.com/i/web/status/1610701694123511809,Some of us that post on Twitter like followers LOL Thanks
1610701527815159808,2023-01-04 18:15:44+00:00,0,0,https://twitter.com/i/web/status/1610701527815159808,Good luck with that one Pretty sure no one gets elected POTUS and in office for another two years Pretty sure
1610701405261815808,2023-01-04 18:15:15+00:00,1,0,https://twitter.com/i/web/status/1610701405261815808,And bonds Well theyre not going down while the FED keeps playing Darth Vader in their minds 22
1610701359476772865,2023-01-04 18:15:04+00:00,0,0,https://twitter.com/i/web/status/1610701359476772865,Well oil for sure is lower than it was 12 months ago Dollar has backed off some but on a global basis isnt much impact anyway as anything good a falling dollar does is bad for someone overseas 12
1610700956920090626,2023-01-04 18:13:28+00:00,0,0,https://twitter.com/i/web/status/1610700956920090626,As to your wages point wages always follow inflation they dont lead itwas proved over 50 years ago and still not widely recognized 22
1610700899105792001,2023-01-04 18:13:14+00:00,0,0,https://twitter.com/i/web/status/1610700899105792001,Im not suggesting the FED cuts rates any time soon But they will cut rates to some extent when they think they can claim victory over inflation 12
1610700691982680064,2023-01-04 18:12:24+00:00,1,0,https://twitter.com/i/web/status/1610700691982680064,Thanks for the retweet and following me all this time
1610700509136191488,2023-01-04 18:11:41+00:00,1,0,https://twitter.com/i/web/status/1610700509136191488,What channels would you have me on Im guessing my 2019 cancellation pretty much keeps me off of them you might prefer but I might be wrong and maybe there are ones that cover business and market stuff abundantly I havent thought of 22
1610700435475812352,2023-01-04 18:11:23+00:00,1,0,https://twitter.com/i/web/status/1610700435475812352,What do you mean by supportingIm not in the cancelling business 12
1610700235059400705,2023-01-04 18:10:36+00:00,0,0,https://twitter.com/i/web/status/1610700235059400705,Well thatll never happen
1610700102544556032,2023-01-04 18:10:04+00:00,0,0,https://twitter.com/i/web/status/1610700102544556032,Look how often folks criticize my neckties here on Twitter including yesterday LOL 33
1610700048538685440,2023-01-04 18:09:51+00:00,0,0,https://twitter.com/i/web/status/1610700048538685440,Of course yes there are a lot folks I wouldnt quote But it becomes a grey zone very quickly Lot of atheists in the quote zone however And as to a good lookI gave up on that pretty much when I was a kid 23
1610700000119648261,2023-01-04 18:09:40+00:00,0,0,https://twitter.com/i/web/status/1610700000119648261,If you want to pick about the backgrounds of those Ive cited quotes from over the years there is a lot of picking to be done as so many have positives but also perceived negatives I mostly pick the quotes for what I see as their merits 13
1610699510849867776,2023-01-04 18:07:43+00:00,1,0,https://twitter.com/i/web/status/1610699510849867776,all So youre saying this isnt about recession per se Is that right Youre saying its a fed thing right
1610638454383149056,2023-01-04 14:05:06+00:00,71,8,https://twitter.com/i/web/status/1610638454383149056,Quote for the Day Our patience will achieve more than our force Edmund Burke KFQuoteForTheDay
1610356089199136770,2023-01-03 19:23:05+00:00,2,0,https://twitter.com/i/web/status/1610356089199136770,Thanks so much And thanks for following me here
1610355956646547456,2023-01-03 19:22:33+00:00,2,0,https://twitter.com/i/web/status/1610355956646547456,Theyre still getting zero to near zero deposits What are you getting as interest on your bank deposits LOL
1610355780733243392,2023-01-03 19:21:51+00:00,1,0,https://twitter.com/i/web/status/1610355780733243392,But your comment isnt rational If I go on any network and denounce it that is the last time Ill be invited back Why do you want to denounce 22
1610355727062937602,2023-01-03 19:21:38+00:00,0,0,https://twitter.com/i/web/status/1610355727062937602,Id go on Cavutos shows if they were on any network Fox is nice to me however and I appear on Fox Business about three times for every time Im on Cavuto on Fox News 12
1610355466248552449,2023-01-03 19:20:36+00:00,0,0,https://twitter.com/i/web/status/1610355466248552449,Cavuto spans business on Fox Business and Fox News and has me on pretty regularly now Thats about the long and short of it Why is that disturbing to you 22
1610355406068678656,2023-01-03 19:20:22+00:00,0,0,https://twitter.com/i/web/status/1610355406068678656,Im not invited to be on MSNBC or CNN neither of which typically do stock bond or money market commentary I do appear about every other month on CNN InternationalQuest for Business But it is the only show these networks have that go into my wheelhouse Just sayin 12
1610355081467285505,2023-01-03 19:19:05+00:00,0,0,https://twitter.com/i/web/status/1610355081467285505,I have a lot of hideous ties and can keep them coming as long as needed a lot and all stock bond and money market oriented Hideous hideous hideousif in the eye of the beholder Lucas LOL
1610354928853352448,2023-01-03 19:18:28+00:00,3,0,https://twitter.com/i/web/status/1610354928853352448,Thanks Tara Its always fun to be on Ill be on Charles Payne on the 13th and back on Cavuto Coast to Coast on the 23rd Again thanks
1610354756979154944,2023-01-03 19:17:47+00:00,0,0,https://twitter.com/i/web/status/1610354756979154944,Thanks for the confidence of your retweet Steve and for following me here of course
1610354581384605696,2023-01-03 19:17:05+00:00,0,0,https://twitter.com/i/web/status/1610354581384605696,Thanks for the confidence of your retweet and for following me here of course
1610354454817308672,2023-01-03 19:16:35+00:00,2,0,https://twitter.com/i/web/status/1610354454817308672,shah Hopefully thrive in whatever ways you value Thanks for following me here
1610354322373574656,2023-01-03 19:16:04+00:00,0,0,https://twitter.com/i/web/status/1610354322373574656,Interesting point What do you think they have then
1610354129897127937,2023-01-03 19:15:18+00:00,1,0,https://twitter.com/i/web/status/1610354129897127937,Thanks for the confidence of your retweet Dave and for following me here of course
1610353998082740224,2023-01-03 19:14:46+00:00,0,0,https://twitter.com/i/web/status/1610353998082740224,MeOut Thanks for the confidence of your retweet Adam and for following me here of course
1610353880168271872,2023-01-03 19:14:18+00:00,1,0,https://twitter.com/i/web/status/1610353880168271872,Thanks for the confidence of your retweet Norma and for following me here of course
1610353710642892801,2023-01-03 19:13:38+00:00,1,0,https://twitter.com/i/web/status/1610353710642892801,Thanks for your nice comment and for following me here It is nice to have a major organ column again in English in America
1610353514009743360,2023-01-03 19:12:51+00:00,1,0,https://twitter.com/i/web/status/1610353514009743360,isms I have no special housing market insights Sorry Thanks for asking however and for following me Paul
1610353332543193089,2023-01-03 19:12:08+00:00,1,1,https://twitter.com/i/web/status/1610353332543193089,And to you and thanks for following me all this time
1610353140318208000,2023-01-03 19:11:22+00:00,0,0,https://twitter.com/i/web/status/1610353140318208000,I agree on 1 and 2 Number 3 seems like it is a long term patient drive from them Are you thinking they do something militaristic Since they never really have that would be a real shocker
1610352899133181953,2023-01-03 19:10:24+00:00,0,0,https://twitter.com/i/web/status/1610352899133181953,You think the market needs Trump to rise markedly
1610352742157123584,2023-01-03 19:09:47+00:00,2,2,https://twitter.com/i/web/status/1610352742157123584,Long bond yields should weaken as inflation expectation throughout the year continue to weaken Of course if Im wrong on my views on inflation and instead it picks up bond yields will kick up with it
1610351649809371136,2023-01-03 19:05:26+00:00,0,0,https://twitter.com/i/web/status/1610351649809371136,We dont make money if were a bloody disaster If the clients do better we always do better but we like any other business can lose money net Think it through if youre actually concerned and play with math Its the truth Regardless thanks for following me here 33
1610351500878024706,2023-01-03 19:04:51+00:00,0,0,https://twitter.com/i/web/status/1610351500878024706,But if the accounts in aggregate drop a lot percentage wise our revenue drops by the same percent and thats big our profit is gone and if big enough to the point we have to cut headcount etc just to survive 23
1610351417600114688,2023-01-03 19:04:31+00:00,0,0,https://twitter.com/i/web/status/1610351417600114688,What you say is sort of true and sort of untrue I understand why you think that But think it through Youre 100 right about little wiggles 13
1610350738164842498,2023-01-03 19:01:49+00:00,1,0,https://twitter.com/i/web/status/1610350738164842498,Thanks for the confidence of our retweet Richard
1610350521520631809,2023-01-03 19:00:57+00:00,0,0,https://twitter.com/i/web/status/1610350521520631809,Thanks for the confidence of your retweet and of course for following me
1610350318986092544,2023-01-03 19:00:09+00:00,0,0,https://twitter.com/i/web/status/1610350318986092544,Im not understanding your question Do you care to expand on it Is it on regions per my tweet or something else
1610350063376830466,2023-01-03 18:59:08+00:00,0,0,https://twitter.com/i/web/status/1610350063376830466,dave Ive asked Ford to call you If that doesnt work email me and Ill have someone else explain for you 22
1610350010247569408,2023-01-03 18:58:55+00:00,0,0,https://twitter.com/i/web/status/1610350010247569408,dave Without meaning to be argumentative you havent been a client two years This isnt the place but your 2021 lagged slightly 2022 was bad which weve been open about But we do have a strategy and if you dont understand it we should make you understand it 12
1610349255339962369,2023-01-03 18:55:55+00:00,0,0,https://twitter.com/i/web/status/1610349255339962369,Were I you Id seek out a PIABA attorney in your area Website You can search by state once click on the Find an Attorney link Someone in Georgia there should be able to help you or point you to someone better close to you
1610348016946352128,2023-01-03 18:51:00+00:00,21,7,https://twitter.com/i/web/status/1610348016946352128,My newest column is out in Why you shouldnt fret over the Feds decisions
1610273547624095746,2023-01-03 13:55:05+00:00,95,16,https://twitter.com/i/web/status/1610273547624095746,Quote for the Day Intelligence is the ability to adapt to change Stephen Hawking KFQuoteForTheDay
1610045522693210113,2023-01-02 22:49:00+00:00,70,10,https://twitter.com/i/web/status/1610045522693210113,I always enjoy my time on If you missed it live you can watch it here
1609916696046731266,2023-01-02 14:17:05+00:00,111,26,https://twitter.com/i/web/status/1609916696046731266,Quote for the Day The greater danger for most of us lies not in setting our aim too high and falling short but in setting our aim too low and achieving our mark Michelangelo KFQuoteForTheDay
1609591281021329413,2023-01-01 16:44:00+00:00,71,13,https://twitter.com/i/web/status/1609591281021329413,ICYMI my latest column in Why 2023 will be like 1967s Summer of Love for the stock market
1608948047966248962,2022-12-30 22:08:02+00:00,61,9,https://twitter.com/i/web/status/1608948047966248962,The shock and awe 2023 global market rebound approaching My latest in
1608921366413152263,2022-12-30 20:22:00+00:00,47,7,https://twitter.com/i/web/status/1608921366413152263,I share my perspective on higher mortgage rates and recession fears
1608882847003344898,2022-12-30 17:48:56+00:00,23,1,https://twitter.com/i/web/status/1608882847003344898,Sector leadership also rotates irregularlycycling in and out of favor Which sector do you think will perform best in 2023
1608876448504500224,2022-12-30 17:23:31+00:00,51,10,https://twitter.com/i/web/status/1608876448504500224,With 2022 drawing to a close its interesting to reflect on how different regions have performed over the years Taking a global approach can help you diversify your portfolio while reducing country overconcentration risk What region do you think will do best in 2023
1608853089293062145,2022-12-30 15:50:42+00:00,1,0,https://twitter.com/i/web/status/1608853089293062145,The common signs of recession have been so visible so long now and so widely discussed I simply cant believe a recession can be worse than minimal if extant at all The big surprise would be a minor hiccup or none at all 33
1608852869788340224,2022-12-30 15:49:49+00:00,1,0,https://twitter.com/i/web/status/1608852869788340224,ahead yet presume individually acting individually can and will do nothing to try to offset those risks in anticipation is to presume we are all relatively powerless in our own lives individuals amp firms and that everyone else must also be an idiot 23
1608852784929202176,2022-12-30 15:49:29+00:00,2,0,https://twitter.com/i/web/status/1608852784929202176,We just see this differently In my view and after a half century in doing all this I see this period as that of the most widely anticipated recession on record Anticipation is mitigation To believe everyone can see a risk13
1608847826020347904,2022-12-30 15:29:47+00:00,1,0,https://twitter.com/i/web/status/1608847826020347904,You could of course ask internally about this Thomas Happy New Year 22
1608847718574886912,2022-12-30 15:29:21+00:00,1,0,https://twitter.com/i/web/status/1608847718574886912,Mostly just the response to everything that happened in reaction to COVIDlegendary but rarely done mattressing more or less but in low return bank accounts But it is sidelines potential for lots of possibilities from bicycles to bonds to vacations to stocks to 12
1608847169183961090,2022-12-30 15:27:10+00:00,0,0,https://twitter.com/i/web/status/1608847169183961090,If you havent one or your victim doesnt let me know and Ill point you in a reasonable direction to find one 22
1608847094525362178,2022-12-30 15:26:52+00:00,0,0,https://twitter.com/i/web/status/1608847094525362178,Why is this a story for me Ive heard a kajillion such stories in my half century of doing all this If you really believe all this your story is for a good claimants trial lawyer specializing in this kind of thing 12
1608846804958982144,2022-12-30 15:25:43+00:00,2,0,https://twitter.com/i/web/status/1608846804958982144,If youre not in a rush be patient Patience is a virtue But supply chain snarfles continue to unwind
1608845122350845954,2022-12-30 15:19:02+00:00,1,0,https://twitter.com/i/web/status/1608845122350845954,Ditto back at you Heckles and thanks for following me here so interactively all this time
