id,created_at,favorite_count,retweet_count,url,text
1534921699774173185,2022-06-09 15:33:45+00:00,4,0,https://twitter.com/i/web/status/1534921699774173185,Well thats a kind of an insulting question If you look at a lot of my comments you must think Ive got some pretty whacky admin types to be as cryptic as I am My byline is always my byline everywhere The firm has its own voice
1534921337088581632,2022-06-09 15:32:18+00:00,4,1,https://twitter.com/i/web/status/1534921337088581632,Thanks for the retweet and of course for following me here
1534919191081283584,2022-06-09 15:23:47+00:00,1,0,https://twitter.com/i/web/status/1534919191081283584,Truckers raise prices Where there is demand trucks will follow
1534918315004420096,2022-06-09 15:20:18+00:00,2,0,https://twitter.com/i/web/status/1534918315004420096,Actually my view is there are at least 7 I dont see how that changes the outcome other than elongation 22
1534918278824439808,2022-06-09 15:20:09+00:00,1,0,https://twitter.com/i/web/status/1534918278824439808,I think Ive already commented and written in several places on the multifaceted worry factor and how that leads to an elongated correction Of course I could be wrong But there is nothing in the article other than 5 yes 5yesOMGosh5I cant count that high5 12
1534917711498600449,2022-06-09 15:17:54+00:00,2,0,https://twitter.com/i/web/status/1534917711498600449,Well if no one cares they can perhaps be more careful of their language
1534917561111830532,2022-06-09 15:17:18+00:00,0,0,https://twitter.com/i/web/status/1534917561111830532,Great question regardless Jason 22
1534917531042861056,2022-06-09 15:17:11+00:00,2,0,https://twitter.com/i/web/status/1534917531042861056,Its a data point but just oneand one biased because TV producers tend to bring on to their shows what they like so if theyre bearish they tend toward more bearish commenters and vice versa if bullish In many ways it is more a sentiment reflection of them 12
1534898429335375872,2022-06-09 14:01:17+00:00,72,11,https://twitter.com/i/web/status/1534898429335375872,Quote for the Day Remember that a share of stock represents a part of a business and is not just a piece of paper Walter Schloss KFQuoteForTheDay
1534656013458096128,2022-06-08 21:58:00+00:00,20,3,https://twitter.com/i/web/status/1534656013458096128,The latest from Strong Dollar Woes Are Weaker Than Many Fear
1534598655721742338,2022-06-08 18:10:05+00:00,22,0,https://twitter.com/i/web/status/1534598655721742338,The Dangers of Breakevenitis
1534562109974908928,2022-06-08 15:44:52+00:00,1,0,https://twitter.com/i/web/status/1534562109974908928,Thanks Karthik for the retweet mention and for following me here
1534558119459708928,2022-06-08 15:29:01+00:00,14,1,https://twitter.com/i/web/status/1534558119459708928,For my German speaking followers my latest column in trend
1534524653733036032,2022-06-08 13:16:02+00:00,79,13,https://twitter.com/i/web/status/1534524653733036032,Quote for the Day Life has terrible and unfair blows Utilize them in a constructive fashion Charlie Munger KFQuoteForTheDay
1534237521500065792,2022-06-07 18:15:04+00:00,9,0,https://twitter.com/i/web/status/1534237521500065792,For my Danish speaking followers my latest column in
1534163269262495744,2022-06-07 13:20:01+00:00,83,11,https://twitter.com/i/web/status/1534163269262495744,Quote for the Day Id rather regret the things Ive done than regret the things I havent doneLucille Ball KFQuoteForTheDay
1533839837672787968,2022-06-06 15:54:49+00:00,0,1,https://twitter.com/i/web/status/1533839837672787968,I love your overconfidence Thanks
1533839292539076608,2022-06-06 15:52:39+00:00,0,0,https://twitter.com/i/web/status/1533839292539076608,Foreign versus USno preference once you adjust for sectors 22
1533839251464327168,2022-06-06 15:52:29+00:00,0,0,https://twitter.com/i/web/status/1533839251464327168,This year to date up days growth leads overwhelmingly down days are led by value It all comes down to bullish or bearish Without the down market value wouldnt be leading year to date Take your pick up or down market ahead growth or value goes with it 12
1533837384395149312,2022-06-06 15:45:04+00:00,7,2,https://twitter.com/i/web/status/1533837384395149312,For my Chinese speaking followers my latest column in
1533805915379490818,2022-06-06 13:40:01+00:00,47,6,https://twitter.com/i/web/status/1533805915379490818,Quote for the Day Lossaversion combined with ego leads investors to gamble by clinging to their mistakes in the fond hope that someday the market will vindicate their judgment and make them whole Peter Bernstein KFQuoteForTheDay
1532782678520565760,2022-06-03 17:54:02+00:00,43,4,https://twitter.com/i/web/status/1532782678520565760,How should you react to recent market volatility I provide my perspective here
1532753816419913728,2022-06-03 15:59:21+00:00,1,0,https://twitter.com/i/web/status/1532753816419913728,My pleasure Thanks for following me here and commenting Ole
1532753221973708800,2022-06-03 15:56:59+00:00,2,0,https://twitter.com/i/web/status/1532753221973708800,A recession different than a bear market is about a year But of course it varies
1532752499915956224,2022-06-03 15:54:07+00:00,1,0,https://twitter.com/i/web/status/1532752499915956224,Thanks for following me here and commenting 33
1532752466277584897,2022-06-03 15:53:59+00:00,1,0,https://twitter.com/i/web/status/1532752466277584897,But the age old saying that The market is a place where a person with experience gets some money and a person with money gets an experiencemostly applies Many of the younger will fade to other realms and some will become wise old and rich Always23
1532752374560792577,2022-06-03 15:53:37+00:00,2,0,https://twitter.com/i/web/status/1532752374560792577,There have always been a lot of overconfident younger people in markets including me long ago Now Im an overconfident older person 13
1532752205148614657,2022-06-03 15:52:57+00:00,0,0,https://twitter.com/i/web/status/1532752205148614657,My pleasure Thanks for following me here and commenting Jason
1532749703971885059,2022-06-03 15:43:01+00:00,93,14,https://twitter.com/i/web/status/1532749703971885059,Compiled by Research Analyst Rachael Green based on data alone back to 62 the odds of an up market over the next 1 3 6 and 12 months is about 21 Of course stats and history dont necessarily portray any single next time I remain bullish knowing many disagree
1532718751505956866,2022-06-03 13:40:01+00:00,43,4,https://twitter.com/i/web/status/1532718751505956866,Quote for the Day You can do a lot for people around you just by taking the guesswork out of their daytodayBob Iger KFQuoteForTheDay
1532460099142230017,2022-06-02 20:32:14+00:00,43,1,https://twitter.com/i/web/status/1532460099142230017,ICYMI My latest LinkedIn column is out now
1532403800027254791,2022-06-02 16:48:31+00:00,0,0,https://twitter.com/i/web/status/1532403800027254791,Thanks so much for watching following me on Twitter and commenting
1532403188380291081,2022-06-02 16:46:05+00:00,1,0,https://twitter.com/i/web/status/1532403188380291081,He of course is a very unconventional banker in many ways 33
1532403162610446336,2022-06-02 16:45:59+00:00,2,0,https://twitter.com/i/web/status/1532403162610446336,Its hard to know I certainly dont know I only know what I think And I always know that what I think is in midst a wide array of conflicting opinions among others That said Ive never ever looked for advice from conventional bankers about anything 23
1532403144759529474,2022-06-02 16:45:55+00:00,1,0,https://twitter.com/i/web/status/1532403144759529474,Everyone has the right to their own opinion Lord only knows why he believes or says what he does Why does Elon Musk say what he does He might be right or wrong or saying what he believes is good for his bank 13
1532402448605663232,2022-06-02 16:43:09+00:00,1,0,https://twitter.com/i/web/status/1532402448605663232,People almost always see QE and its reverse backwards and have since it was first deployed Ive written on this subject criticizing the common view for why its wrong since 2008 This is not some big negative but arguably a slight positive 22
1532402420440915968,2022-06-02 16:43:02+00:00,1,0,https://twitter.com/i/web/status/1532402420440915968,On the margin this steepens the yield curve which is bullish not bearish because wider spreads between long rates and short rates motivates more bank lending 12
1532391847640850433,2022-06-02 16:01:01+00:00,24,3,https://twitter.com/i/web/status/1532391847640850433,The latest from The Latest Update on the EU and Russian Energy
1532357624053768194,2022-06-02 13:45:02+00:00,61,8,https://twitter.com/i/web/status/1532357624053768194,Quote for the Day The more I learn the more I realize how much I dont know Albert Einstein KFQuoteForTheDay
1532104956546777089,2022-06-01 21:01:01+00:00,11,1,https://twitter.com/i/web/status/1532104956546777089,For my French speaking followers my latest column in fr
1532059773734367233,2022-06-01 18:01:29+00:00,3,0,https://twitter.com/i/web/status/1532059773734367233,kimkimkim Thanks for the retweet and for following me here
1532059254324359168,2022-06-01 17:59:25+00:00,5,0,https://twitter.com/i/web/status/1532059254324359168,Thanks for the retweet and for following me here
1532057676540092417,2022-06-01 17:53:08+00:00,6,0,https://twitter.com/i/web/status/1532057676540092417,Thanks for your views and Im never bothered by views from folks who disagree with me whether a little or a lot but do please try to keep your language away from profanity Thanks
1532057445496811520,2022-06-01 17:52:13+00:00,3,0,https://twitter.com/i/web/status/1532057445496811520,I dont think so Why would you be worried
1532055656290656256,2022-06-01 17:45:07+00:00,1,0,https://twitter.com/i/web/status/1532055656290656256,2030wef If you post promotional stuff like this here again Ill ban you from the site
1532053932209360896,2022-06-01 17:38:16+00:00,1,0,https://twitter.com/i/web/status/1532053932209360896,I dont think so What we know now and in the future is all that really matters right
1532053092438462464,2022-06-01 17:34:56+00:00,2,0,https://twitter.com/i/web/status/1532053092438462464,Whether it gooses inflation in this case comes to how much of the current inflation is traditional monetary inflation versus supply stuff That isnt perfect to discern 22
1532053058233856000,2022-06-01 17:34:47+00:00,2,0,https://twitter.com/i/web/status/1532053058233856000,Yes reversing QE moves on the margin to increase net lending which increases the official money supply and isnt antiinflationary at all 12
1532052723557728256,2022-06-01 17:33:28+00:00,2,0,https://twitter.com/i/web/status/1532052723557728256,Lots of people say lots of stuff and mostly what people say on Cable News is a reflection of current sentiment not a serious lead on it
1531988439607955456,2022-06-01 13:18:01+00:00,55,5,https://twitter.com/i/web/status/1531988439607955456,Quote for the Day The more you know the less you understand Laozi KFQuoteForTheDay
1531705070303289345,2022-05-31 18:32:01+00:00,61,9,https://twitter.com/i/web/status/1531705070303289345,Dont Let the Great Humiliator Scare You From the Coming Rebound
1531634107368755202,2022-05-31 13:50:02+00:00,81,10,https://twitter.com/i/web/status/1531634107368755202,Quote for the Day The more I learn the less I realize I know Socrates KFQuoteForTheDay
1531279516076756995,2022-05-30 14:21:01+00:00,34,4,https://twitter.com/i/web/status/1531279516076756995,ICYMI My interview with on Fox Business
1531271720774115330,2022-05-30 13:50:02+00:00,65,8,https://twitter.com/i/web/status/1531271720774115330,Quote for the Day The more I know the less I understandDon Henley KFQuoteForTheDay
1530312886970527745,2022-05-27 22:19:58+00:00,4,0,https://twitter.com/i/web/status/1530312886970527745,Thanks for the mention and for following me
1530312320248729600,2022-05-27 22:17:43+00:00,0,0,https://twitter.com/i/web/status/1530312320248729600,Happy Memorial Day Weekend Martine Thanks as always Too busy today to respond in French lest I butcher it
1530312129294659585,2022-05-27 22:16:58+00:00,1,0,https://twitter.com/i/web/status/1530312129294659585,Markets are a puzzlement Have a great weekend
1530311977410580481,2022-05-27 22:16:21+00:00,1,0,https://twitter.com/i/web/status/1530311977410580481,Waiting for Tuesday Have a great weekend
1530298422485323776,2022-05-27 21:22:30+00:00,1,0,https://twitter.com/i/web/status/1530298422485323776,Thank you for your advise BinkyCat What do you need to control
1530296743232884737,2022-05-27 21:15:49+00:00,1,0,https://twitter.com/i/web/status/1530296743232884737,I dont think retiring has much to do with the answer The answer stems from how long you need your investment funds to work for you and covers a bigger realm of a financial plan
1530296340969730048,2022-05-27 21:14:13+00:00,3,0,https://twitter.com/i/web/status/1530296340969730048,Certainty is always an enemy It is the partner of overconfidence People who call others fool need be certain they arent
1530295400891961345,2022-05-27 21:10:29+00:00,0,0,https://twitter.com/i/web/status/1530295400891961345,I understand there is more advanced technology It isnt so clear why that gets extended to the rest of your hypothesis although it is often contemplated Why do you think its true if you do
1530295218238418944,2022-05-27 21:09:46+00:00,1,0,https://twitter.com/i/web/status/1530295218238418944,Glad it was helpful Thanks for following me here and commenting Have a great weekend
1530295071332962305,2022-05-27 21:09:11+00:00,0,0,https://twitter.com/i/web/status/1530295071332962305,Thanks for the advise
1530294928361762816,2022-05-27 21:08:37+00:00,1,0,https://twitter.com/i/web/status/1530294928361762816,I cant quite imagine what this period really has in common with the 70s Maybe you can fill me in
1530294722773757953,2022-05-27 21:07:48+00:00,1,0,https://twitter.com/i/web/status/1530294722773757953,knowing it doesnt truncate any ability to get to where need be longer term I hope you can see why that applies to you as well 22
1530294336528650240,2022-05-27 21:06:15+00:00,0,0,https://twitter.com/i/web/status/1530294336528650240,Thanks As you must know I always hope Im right rather obviously but as I say repetitively and have for decades the very best in this realm are only right about 70 of the time so Im always emotionally comfortable being wrong 12
1530294150913851393,2022-05-27 21:05:31+00:00,0,0,https://twitter.com/i/web/status/1530294150913851393,NFTLabs Beauty is in the eye of the beholder Question Why is shorting bad
1530293808935538688,2022-05-27 21:04:10+00:00,0,1,https://twitter.com/i/web/status/1530293808935538688,What do you think is so unusual Where does the word artificially apply
1530248982345269249,2022-05-27 18:06:02+00:00,65,8,https://twitter.com/i/web/status/1530248982345269249,My latest LinkedIn column Its Big and Hidden Right In Front Of Your Eyes
1530228601731403776,2022-05-27 16:45:03+00:00,47,9,https://twitter.com/i/web/status/1530228601731403776,Are we in a period of stagflation I discuss my views in my latest video
1530184555021352961,2022-05-27 13:50:02+00:00,52,6,https://twitter.com/i/web/status/1530184555021352961,Quote for the Day The secret in business is knowing something nobody else knows Aristotle Onassis KFQuoteForTheDay
1529937090808627216,2022-05-26 21:26:41+00:00,67,11,https://twitter.com/i/web/status/1529937090808627216,Stat wise this rsquared visual mostly explains 2022 style On most up days growth beats value amp the reverse for down days particularly big days Not G versus V but up or down market If bearish bet value If bullish growth Its really market direction pure amp simple
1529905893571080192,2022-05-26 19:22:43+00:00,65,15,https://twitter.com/i/web/status/1529905893571080192,Research Analyst Rachel Green created these showing the yield curve range that matters is fully wide and gotten wider this year despite most folks wrongly focused on the 210yr spread That this isnt much noticed makes it doubly bullish Lending will be strong
1529887969598840832,2022-05-26 18:11:30+00:00,107,26,https://twitter.com/i/web/status/1529887969598840832,Corrections rarely last as long as what is happening now But sometimes I still see 2022 as a correctionmost reminding me of just 11 years back Another caused I think by multiple fears info overload 2011 Broke 20 intraday after flirting with it for two months
1529886338228658182,2022-05-26 18:05:01+00:00,25,2,https://twitter.com/i/web/status/1529886338228658182,What Slowing Economic Growth Means for Stocks
1529878343394263045,2022-05-26 17:33:15+00:00,36,2,https://twitter.com/i/web/status/1529878343394263045,
1529878340298866697,2022-05-26 17:33:14+00:00,27,2,https://twitter.com/i/web/status/1529878340298866697,
1529878337186693124,2022-05-26 17:33:14+00:00,16,1,https://twitter.com/i/web/status/1529878337186693124,
1529878334150017029,2022-05-26 17:33:13+00:00,13,1,https://twitter.com/i/web/status/1529878334150017029,
1529878330572275713,2022-05-26 17:33:12+00:00,22,1,https://twitter.com/i/web/status/1529878330572275713,
1529878327615291392,2022-05-26 17:33:11+00:00,54,4,https://twitter.com/i/web/status/1529878327615291392,Generally bears mostly move to 2 per month over their duration 4 per month is mostly too much too fast too long before long I still think this is an elongated correction like 2011 not a bear market But I could be wrong of course
1529878326017372160,2022-05-26 17:33:11+00:00,110,24,https://twitter.com/i/web/status/1529878326017372160,These visuals show that being down 4 per month off the top this far in time is very unusual if its a bear market and where that rarely has happened like 200709 or 1990 there was a lot better time to get out much later on This is a great time for calm clarity
1529814867321954305,2022-05-26 13:21:01+00:00,40,5,https://twitter.com/i/web/status/1529814867321954305,Quote for the Day Start by assuming the market is always wrong so if you copy everybody else on Wall Street youre doomed to do poorly George Soros KFQuoteForTheDay
1529568744128798727,2022-05-25 21:03:01+00:00,48,5,https://twitter.com/i/web/status/1529568744128798727,ICYMI My latest markets column is out now
1529514871150329857,2022-05-25 17:28:56+00:00,0,0,https://twitter.com/i/web/status/1529514871150329857,ken Good luck with that one Mr Kaplan Have fun mean well try hard
1529514001834598401,2022-05-25 17:25:29+00:00,0,0,https://twitter.com/i/web/status/1529514001834598401,Thanks for the mention Barry
1529513618978574336,2022-05-25 17:23:58+00:00,1,0,https://twitter.com/i/web/status/1529513618978574336,Jumping from the specific to the general based on any one signal is always a mistake at least in my view Im guessing since you follow me that youve seen my stinging bee analogy That is pretty much in total what I think the buzz is if you will pardon that pun
1529512983201730563,2022-05-25 17:21:26+00:00,0,0,https://twitter.com/i/web/status/1529512983201730563,Thanks Glad you liked it And thanks for following me here
1529512874090983424,2022-05-25 17:21:00+00:00,2,0,https://twitter.com/i/web/status/1529512874090983424,Not everyone is accusing me of sanity right about now LOL Thanks and thanks for following me here and commenting and for so long
1529512692792320002,2022-05-25 17:20:17+00:00,0,0,https://twitter.com/i/web/status/1529512692792320002,Thanks And thanks for following me here
1529512052703825920,2022-05-25 17:17:44+00:00,1,0,https://twitter.com/i/web/status/1529512052703825920,Thanks so much for the retweet and of course for following me here
1529511973464907777,2022-05-25 17:17:26+00:00,1,0,https://twitter.com/i/web/status/1529511973464907777,Thanks so much for the retweet and of course for following me here
1529511823388528640,2022-05-25 17:16:50+00:00,1,0,https://twitter.com/i/web/status/1529511823388528640,Inv Thanks so much for the retweet and of course for following me here
1529511618773942272,2022-05-25 17:16:01+00:00,1,0,https://twitter.com/i/web/status/1529511618773942272,Thanks so much for the retweet and of course for following me here
1529511385268293632,2022-05-25 17:15:05+00:00,0,0,https://twitter.com/i/web/status/1529511385268293632,Thanks so much for the retweet and of course for following me here
1529509700445741059,2022-05-25 17:08:24+00:00,1,0,https://twitter.com/i/web/status/1529509700445741059,ken That is one of the most amazing revealing and telling comments Ive seen Stunning
1529509479393292288,2022-05-25 17:07:31+00:00,0,0,https://twitter.com/i/web/status/1529509479393292288,jules You have been seriously misinformed somehow How I wouldnt know but that you are lends you my sympathy Great good luck to you
1529508901112061952,2022-05-25 17:05:13+00:00,1,0,https://twitter.com/i/web/status/1529508901112061952,markets Glad you liked it Thanks for following me here and commenting
1529508766827196416,2022-05-25 17:04:41+00:00,1,0,https://twitter.com/i/web/status/1529508766827196416,markets People who think they can call bottoms with clarity eventually learn they cantat least thats my view Thanks for following me here and commenting
1529504919086018560,2022-05-25 16:49:24+00:00,1,0,https://twitter.com/i/web/status/1529504919086018560,Thank for the mention and for following me here Mohammed
1529504298043703296,2022-05-25 16:46:56+00:00,1,0,https://twitter.com/i/web/status/1529504298043703296,Mostly except natural gas because of Russia just recently basic energy prices in dollars have been stable since March 8 In most currencies theyve fallen as the dollar strengthened I think that is what is happening From here new supply comes
1529503775840272384,2022-05-25 16:44:51+00:00,86,4,https://twitter.com/i/web/status/1529503775840272384,
1529502224274993154,2022-05-25 16:38:41+00:00,1,0,https://twitter.com/i/web/status/1529502224274993154,Thanks for following me here and commenting Glad you liked it
1529500908739907584,2022-05-25 16:33:28+00:00,2,0,https://twitter.com/i/web/status/1529500908739907584,About the same Too many things for folks to get their heads around at once
1529500240742494210,2022-05-25 16:30:48+00:00,1,0,https://twitter.com/i/web/status/1529500240742494210,Thanks I have a whole bunch of different ones
1529500084731138048,2022-05-25 16:30:11+00:00,0,0,https://twitter.com/i/web/status/1529500084731138048,And the difference so far is
1529485695785525249,2022-05-25 15:33:01+00:00,9,1,https://twitter.com/i/web/status/1529485695785525249,For my Chinese speaking followers my latest column in
1529449711391866880,2022-05-25 13:10:01+00:00,71,8,https://twitter.com/i/web/status/1529449711391866880,Quote for the Day Ask questions instead of giving orders Dale Carnegie KFQuoteForTheDay
1529208872199667714,2022-05-24 21:13:01+00:00,5,0,https://twitter.com/i/web/status/1529208872199667714,For my Italian speaking followers my latest column in
1529156296103952384,2022-05-24 17:44:05+00:00,54,3,https://twitter.com/i/web/status/1529156296103952384,If you missed it live you can click the link below to watch my interview on Coast to Coast with
1529096886774288385,2022-05-24 13:48:01+00:00,65,10,https://twitter.com/i/web/status/1529096886774288385,Quote for the Day The difference between successful people and others is how long they spend time feeling sorry for themselvesBarbara Corcoran KFQuoteForTheDay
1528880207083581440,2022-05-23 23:27:01+00:00,11,1,https://twitter.com/i/web/status/1528880207083581440,For my Spanish speaking followers my latest column in
1528816802561593344,2022-05-23 19:15:04+00:00,37,2,https://twitter.com/i/web/status/1528816802561593344,Ill be on tomorrow Make sure to tune in
1528747080671449088,2022-05-23 14:38:01+00:00,72,10,https://twitter.com/i/web/status/1528747080671449088,My latest markets column is out now Dont Let the Great Humiliator Scare You From the Coming Rebound
1528733747243270144,2022-05-23 13:45:02+00:00,38,4,https://twitter.com/i/web/status/1528733747243270144,Quote for the Day If I dont get off the mat Ill lose the fight Archie Moore KFQuoteForTheDay
1527708240414445575,2022-05-20 17:50:02+00:00,55,10,https://twitter.com/i/web/status/1527708240414445575,What impact does an economic slowdown have on stock prices I share my thoughts here
1527695067485380609,2022-05-20 16:57:41+00:00,2,1,https://twitter.com/i/web/status/1527695067485380609,Thanks for the retweet
1527694854645436418,2022-05-20 16:56:51+00:00,2,0,https://twitter.com/i/web/status/1527694854645436418,About as common as rattlesnake fatalities Lots of fear a little bite not so much effect as mythologized
1527694304176533505,2022-05-20 16:54:39+00:00,3,0,https://twitter.com/i/web/status/1527694304176533505,Thanks for the confidence of your retweet
1527694143018766341,2022-05-20 16:54:01+00:00,4,0,https://twitter.com/i/web/status/1527694143018766341,The more it is screamed the less downside there can be ahead Just the way of the market
1527693886474158080,2022-05-20 16:53:00+00:00,2,0,https://twitter.com/i/web/status/1527693886474158080,With capitalism there isnt a real top down plan but regardless it is so much more powerful in sneaky ways communists never really figure out If they were so very smart they wouldnt be communists in the first darned place 22
1527693815263264769,2022-05-20 16:52:43+00:00,1,0,https://twitter.com/i/web/status/1527693815263264769,Of course but not much of anything is actually very effective and fortunately they mostly arent very good at discerning those which are If they were we would have all become communist subjects long ago 12
1527693318288683009,2022-05-20 16:50:44+00:00,0,0,https://twitter.com/i/web/status/1527693318288683009,Thanks And thanks for following me here
1527692686802620416,2022-05-20 16:48:14+00:00,1,0,https://twitter.com/i/web/status/1527692686802620416,Sneaks up on folks 44
