id,created_at,favorite_count,retweet_count,url,text
1493635319400329217,2022-02-15 17:16:25+00:00,59,10,https://twitter.com/i/web/status/1493635319400329217,Loan growth continues moderately positive across the western world Hard to link this with the view monetary inflation is runaway considering how the real quantity of money is created
1493581111825518593,2022-02-15 13:41:01+00:00,94,13,https://twitter.com/i/web/status/1493581111825518593,Quote for the Day No matter the situation never let your emotions overpower your intelligenceJean Houston KFQuoteForTheDay
1493290747105185794,2022-02-14 18:27:12+00:00,1,0,https://twitter.com/i/web/status/1493290747105185794,Thanks for the retweet and of course for following me Mike Im pleased you like our stuff
1493286280909635586,2022-02-14 18:09:27+00:00,0,0,https://twitter.com/i/web/status/1493286280909635586,Thanks Edward for the flattering comment Im glad you like my books And thanks for following me here
1493285682789322757,2022-02-14 18:07:05+00:00,0,0,https://twitter.com/i/web/status/1493285682789322757,Merci beaucoup mon ge je ne peux presque plus parler anglais LOL Mais je peux crire un peu suffisamment Et dans une certaine mesure en franais
1493284911272316934,2022-02-14 18:04:01+00:00,36,4,https://twitter.com/i/web/status/1493284911272316934,What does Jerome Powells reappointment as Fed Chair mean for stocks My thoughts here
1493219983425511429,2022-02-14 13:46:01+00:00,66,7,https://twitter.com/i/web/status/1493219983425511429,Quote for the Day Love all trust a few and wrong to noneWilliam Shakespeare KFQuoteForTheDay
1492166037965529096,2022-02-11 15:58:01+00:00,9,0,https://twitter.com/i/web/status/1492166037965529096,For my French speaking followers my latest column in
1492162638834331651,2022-02-11 15:44:30+00:00,1,0,https://twitter.com/i/web/status/1492162638834331651,Yes Barry but those of us that are just no good and just no good to everyone LOLHave a great weekend
1492162381014654976,2022-02-11 15:43:29+00:00,1,0,https://twitter.com/i/web/status/1492162381014654976,Thanks for the retweet and for following me here
1492161471903453188,2022-02-11 15:39:52+00:00,1,1,https://twitter.com/i/web/status/1492161471903453188,
1492160801444040705,2022-02-11 15:37:12+00:00,0,0,https://twitter.com/i/web/status/1492160801444040705,Seems like a pretty normal transition
1492160149259100163,2022-02-11 15:34:37+00:00,1,0,https://twitter.com/i/web/status/1492160149259100163,Pretty good one
1492127785388761089,2022-02-11 13:26:01+00:00,90,22,https://twitter.com/i/web/status/1492127785388761089,Quote for the Day I am not young enough to know everything Oscar Wilde KFQuoteForTheDay
1491783767836475393,2022-02-10 14:39:00+00:00,16,1,https://twitter.com/i/web/status/1491783767836475393,The latest from Revisiting the Trade Deficit
1491768923393515526,2022-02-10 13:40:01+00:00,72,8,https://twitter.com/i/web/status/1491768923393515526,Quote for the Day Keep in mind the true measure of an individual is how he treats a person who can do him absolutely no good Ann Landers KFQuoteForTheDay
1491482280937807879,2022-02-09 18:41:00+00:00,32,2,https://twitter.com/i/web/status/1491482280937807879,What would a regional conflict mean for capital markets Hear my thoughts in this short video
1491450279212253185,2022-02-09 16:33:51+00:00,0,0,https://twitter.com/i/web/status/1491450279212253185,2000 Thanks for the retweet Im glad you liked the quote
1491449678545649666,2022-02-09 16:31:27+00:00,0,0,https://twitter.com/i/web/status/1491449678545649666,Does seem that a lot is lost or forgottennot just these days but pretty much every generation But yes this one now
1491409049618944003,2022-02-09 13:50:01+00:00,42,3,https://twitter.com/i/web/status/1491409049618944003,Quote for the Day Ask yourself if you are happy and you cease to be soJohn Stuart Mill KFQuoteForTheDay
1491084501124284417,2022-02-08 16:20:22+00:00,1,0,https://twitter.com/i/web/status/1491084501124284417,Thanks Ill take a listen this weekend Take care
1491058741290180611,2022-02-08 14:38:01+00:00,20,4,https://twitter.com/i/web/status/1491058741290180611,My latest column is out now A survival guide for early 2022s sharp market swings
1491040120077750273,2022-02-08 13:24:01+00:00,80,15,https://twitter.com/i/web/status/1491040120077750273,Quote for the Day You get recessions you have stock market declines If you dont understand thats going to happen then youre not ready you wont do well in the markets Peter Lynch KFQuoteForTheDay
1490805320280690689,2022-02-07 21:51:00+00:00,7,1,https://twitter.com/i/web/status/1490805320280690689,For my Chinese speaking followers my latest column in
1490710696652423171,2022-02-07 15:35:00+00:00,30,4,https://twitter.com/i/web/status/1490710696652423171,ICYMI My latest article is out now Surprise Why the Bull Market Livesand Should Survive Beyond 2022
1490674208103444487,2022-02-07 13:10:01+00:00,75,15,https://twitter.com/i/web/status/1490674208103444487,Quote for the Day In investing what is comfortable is rarely profitable Robert Arnott KFQuoteForTheDay
1489664553768165381,2022-02-04 18:18:00+00:00,28,5,https://twitter.com/i/web/status/1489664553768165381,Are regional conflicts enough to knock stocks Get my take here
1489627798419304448,2022-02-04 15:51:57+00:00,0,0,https://twitter.com/i/web/status/1489627798419304448,Thanks for the retweet and very nice comment Mike The very best of great good luck with your new book
1489590820588171271,2022-02-04 13:25:01+00:00,33,5,https://twitter.com/i/web/status/1489590820588171271,Quote for the Day Evil lurks where disappointment lodges George Foreman KFQuoteForTheDay
1489338156247834627,2022-02-03 20:41:01+00:00,33,4,https://twitter.com/i/web/status/1489338156247834627,Do you have the right investment income strategy I explain here
1489269564298838017,2022-02-03 16:08:28+00:00,0,0,https://twitter.com/i/web/status/1489269564298838017,Thanks Ive always enjoyed making up words everyone can instantly understand Where are you in SEA
1489269170449485825,2022-02-03 16:06:54+00:00,1,0,https://twitter.com/i/web/status/1489269170449485825,Might be true this time Sometimes pretty much is Sometimes not 22
1489269120356929537,2022-02-03 16:06:42+00:00,1,0,https://twitter.com/i/web/status/1489269120356929537,Regional conflicts never kill bull markets unless global war arrives and with the Ukraine not part of NATO that wont happen What youre referring to above tied to the gulf and many others is the age old saying Sell on the fear Buy on the bullets 12
1489268838692655106,2022-02-03 16:05:35+00:00,0,0,https://twitter.com/i/web/status/1489268838692655106,Falling breadth is normal in the back halves of bull marketslike in every one Ive lived through over the last 50 yearsor measured before that
1489268400509444097,2022-02-03 16:03:50+00:00,1,0,https://twitter.com/i/web/status/1489268400509444097,Nick youre supposed to make lemonade from lemons
1489267844772622336,2022-02-03 16:01:38+00:00,1,0,https://twitter.com/i/web/status/1489267844772622336,The demise of normalized civility seems upon us in many wayswhich has nothing much to do with capital markets And civilization will fall completely Human life will end Just not quite as soon as some fear
1489267559832580098,2022-02-03 16:00:30+00:00,0,0,https://twitter.com/i/web/status/1489267559832580098,zied One stock spooking folks is a lot of spooking How many times has that happened in history LOL 22
1489267538869440514,2022-02-03 16:00:25+00:00,0,0,https://twitter.com/i/web/status/1489267538869440514,zied Just been at it a long time 50 years now so kind of hardened to things I dont think Ive done anything special Sorry I dont have a better answer for you But for example today is a perfect day to stay calm 12
1489225918715469834,2022-02-03 13:15:02+00:00,57,15,https://twitter.com/i/web/status/1489225918715469834,Quote for the Day Dont limit yourself Many people limit themselves to what they think they can do You can go as far as your mind lets you What you believe remember you can achieve Mary Kay Ash KFQuoteForTheDay
1488998163134533641,2022-02-02 22:10:00+00:00,12,2,https://twitter.com/i/web/status/1488998163134533641,For my French speaking followers my latest column in fr
1488969182217605121,2022-02-02 20:14:51+00:00,2,0,https://twitter.com/i/web/status/1488969182217605121,Good thinking and that is exactly the risk Over time those excess unneeded stuff need to be wound down
1488968543060201474,2022-02-02 20:12:19+00:00,2,0,https://twitter.com/i/web/status/1488968543060201474,They lack things necessary to shove final goods out the doorbut inventories are not low
1488968224133636098,2022-02-02 20:11:02+00:00,0,0,https://twitter.com/i/web/status/1488968224133636098,Im not following your question Do you want to expand on it or restate
1488967810336247808,2022-02-02 20:09:24+00:00,0,0,https://twitter.com/i/web/status/1488967810336247808,Where do you get that from
1488945565404741633,2022-02-02 18:41:00+00:00,46,8,https://twitter.com/i/web/status/1488945565404741633,Could 2022 be a strong year for stocks Heres what I forecast for this year
1488900643817287682,2022-02-02 15:42:30+00:00,116,17,https://twitter.com/i/web/status/1488900643817287682,The SampP 500 is today just where it was as December started So all the excited hoopla and wild stories have all been about two months will wiggles aka volatility Two months I do love how much market volatility can whipsaw peoples heads around
1488885923681026048,2022-02-02 14:44:01+00:00,13,2,https://twitter.com/i/web/status/1488885923681026048,For my German speaking followers my latest column in
1488866294858457093,2022-02-02 13:26:01+00:00,66,12,https://twitter.com/i/web/status/1488866294858457093,Quote for the Day Do not be embarrassed by your failures learn from them and start again Richard Branson KFQuoteForTheDay
1488668992176898048,2022-02-02 00:22:00+00:00,28,3,https://twitter.com/i/web/status/1488668992176898048,Does January predict how markets will pan out for the year My thoughts here
1488619418988990467,2022-02-01 21:05:01+00:00,24,2,https://twitter.com/i/web/status/1488619418988990467,What groups are most at risk for financial scams and fraud Check out the Market Insights podcast to find out and learn how to protect yourself
1488583124778844160,2022-02-01 18:40:48+00:00,1,0,https://twitter.com/i/web/status/1488583124778844160,What a nice thing to say Thanks so much
1488582487605321728,2022-02-01 18:38:16+00:00,1,0,https://twitter.com/i/web/status/1488582487605321728,human123 Briefly Just volatility People are naturally prone to be jittery and more so sometimes
1488581820090249217,2022-02-01 18:35:37+00:00,1,0,https://twitter.com/i/web/status/1488581820090249217,In any market there are categories doing well or badly but bear market should apply as a term in my opinion only to markets broad enough where the decline reflects overall market participant sentiment which these more narrow narratives dont 22
1488581782819663872,2022-02-01 18:35:28+00:00,0,0,https://twitter.com/i/web/status/1488581782819663872,Ive always believed that notion created a few decades ago that a sector or a stock is in a bear market is a media machination that has become assumed more broadly that doesnt apply 12
1488581128134873088,2022-02-01 18:32:52+00:00,0,0,https://twitter.com/i/web/status/1488581128134873088,And there the answer to your question is clearly No Its the Investment Advisers Act of 1940spelled with an e But then again there are varied ways a 40 Act Adviser can charge 22
1488581101903757313,2022-02-01 18:32:45+00:00,0,0,https://twitter.com/i/web/status/1488581101903757313,So just being picky the way things evolved technically is that an advisor that deals with liquid securities is a Series 7 salesservice person aka what used to be called a stockbroker or customers man 12
1488580229958230016,2022-02-01 18:29:17+00:00,1,0,https://twitter.com/i/web/status/1488580229958230016,Ive been saying the first half of the year should be choppy grinding sideways so I doubt we get true Vlike qualities for a while The purpose of the first half of 2022 in my mind is to dour sentiment the rest of the way for a great back half
1488579748028506112,2022-02-01 18:27:23+00:00,0,0,https://twitter.com/i/web/status/1488579748028506112,You betcha Phil
1488579480863928320,2022-02-01 18:26:19+00:00,2,0,https://twitter.com/i/web/status/1488579480863928320,Markets Pretty much so Foxy But of course anyone today buying a 100 car would have to be a pretty good trader good mechanic or top tier in the scrap metal businessBut of course the market also wants women Wants em all
1488578855736541184,2022-02-01 18:23:50+00:00,0,0,https://twitter.com/i/web/status/1488578855736541184,Look up my writings on The Great Humiliator Same thing
1488577715175231492,2022-02-01 18:19:18+00:00,1,0,https://twitter.com/i/web/status/1488577715175231492,Pretty much so but Id put that as a bit of semantics Most folks who get made fools of in front of family and friends feel pretty well humiliated But youre right as you know I like the TGH designation
1488577322164756483,2022-02-01 18:17:44+00:00,1,0,https://twitter.com/i/web/status/1488577322164756483,And indeed that probably makes stocks trickier still for them
1488564054721499136,2022-02-01 17:25:01+00:00,65,12,https://twitter.com/i/web/status/1488564054721499136,Surprise Why the Bull Market Livesand Should Survive Beyond 2022
1488545265225134081,2022-02-01 16:10:21+00:00,154,25,https://twitter.com/i/web/status/1488545265225134081,With US inventories at high levels relative to GDP historically this visual depicts probably the biggest single and not well publicized risk to my generally rosy market views being correctthe risk of consumers just fatiguing on goods
1488503907148050438,2022-02-01 13:26:01+00:00,34,6,https://twitter.com/i/web/status/1488503907148050438,Quote for the Day To make headway improve your head BC Forbes KFQuoteForTheDay
1488272380183162885,2022-01-31 22:06:00+00:00,9,1,https://twitter.com/i/web/status/1488272380183162885,For my Japanese speaking followers my latest article in editors
1488230210307002370,2022-01-31 19:18:26+00:00,0,0,https://twitter.com/i/web/status/1488230210307002370,markets Everyone else will worry that to death for you so you dont have tomeaning its pretty much all prepriced The FED has a lot less impact than almost everyone imagines they do 22
1488230168367747075,2022-01-31 19:18:16+00:00,1,0,https://twitter.com/i/web/status/1488230168367747075,markets I write on RCM about once every two to three weeks when I get around to it Ive pretty much covered my thoughts on QE and FED stuff a lot of times and a lot of ways but my best advise to most people is ignore things about the FED 12
1488229937458728965,2022-01-31 19:17:21+00:00,1,0,https://twitter.com/i/web/status/1488229937458728965,Thanks for the retweet
1488229705580826624,2022-01-31 19:16:26+00:00,2,0,https://twitter.com/i/web/status/1488229705580826624,And thats why I Tweet them out posting them for people If you cant then its my gift to you If you can no point in following me I guess
1488229335450337284,2022-01-31 19:14:58+00:00,1,0,https://twitter.com/i/web/status/1488229335450337284,Ive written about this a lot so you must not read me regularly My answers are no and no But then again I might be wrong
1488229193330479107,2022-01-31 19:14:24+00:00,2,1,https://twitter.com/i/web/status/1488229193330479107,Because bouncing around is what stock markets do Not a lot different than when someone yells fire in a crowded movie theaterthe place clears but doesnt stop longer term who sees the movie
1488228990829486080,2022-01-31 19:13:36+00:00,1,0,https://twitter.com/i/web/status/1488228990829486080,Thanks I never would have thought of that
1488228673106767874,2022-01-31 19:12:20+00:00,1,0,https://twitter.com/i/web/status/1488228673106767874,human123 For all the reasons common culture has so much impact on people that they love or hate CNN or FOX and feel exactly the opposite about the other one and more They do because theyve always been told this is the way it is so confirmation bias reinforces it in peoples minds
1488228115373379588,2022-01-31 19:10:07+00:00,0,0,https://twitter.com/i/web/status/1488228115373379588,Should be pretty obvious from my varied writings that I believe stocks will be double digit for the year backend loaded
1488227954236682241,2022-01-31 19:09:28+00:00,0,0,https://twitter.com/i/web/status/1488227954236682241,Seems to me more like a correction that feels like a bear LOL Its only been a minor drop and a month off the top
1488169200342519817,2022-01-31 15:16:00+00:00,43,6,https://twitter.com/i/web/status/1488169200342519817,In this video I explain my stock market forecast and why 2022s outcome may be surprising
1488143532888104966,2022-01-31 13:34:01+00:00,73,8,https://twitter.com/i/web/status/1488143532888104966,Quote for the Day The main purpose of the stock market is to make fools of as many men as possible Bernard Baruch KFQuoteForTheDay
1487186724056809475,2022-01-28 22:12:00+00:00,135,18,https://twitter.com/i/web/status/1487186724056809475,I disbelieve this is the conventional form of monetary inflation but is largely supply chain based Otherwise long rates would be much higher long ago amp GDP is actually growing faster than the quantity of money One liquid market never sees what another misses Basic rule
1487145149075374081,2022-01-28 19:26:48+00:00,79,11,https://twitter.com/i/web/status/1487145149075374081,You can rip this stuff apart pretty much anywhichway you want but the common wisdom that shifts in long rates are predictive is just simply nonsense mythology No correlation no reality That so many believe the false narrative is an amazing statement of theory over reality
1487142527572463618,2022-01-28 19:16:23+00:00,68,6,https://twitter.com/i/web/status/1487142527572463618,Sentiment in motion I love it when people freak out fast Little is more bullish
1487132387418853376,2022-01-28 18:36:05+00:00,0,0,https://twitter.com/i/web/status/1487132387418853376,markets Thanks for following me here and commenting
1487131448674947073,2022-01-28 18:32:21+00:00,1,0,https://twitter.com/i/web/status/1487131448674947073,Thanks for following me here and commenting Without followers there isnt much point in tweeting
1487130884809445376,2022-01-28 18:30:07+00:00,0,0,https://twitter.com/i/web/status/1487130884809445376,all Do you see yourself as a great timer
1487130617582026756,2022-01-28 18:29:03+00:00,1,1,https://twitter.com/i/web/status/1487130617582026756,As Ive said often the notions that initial interest rate hikes in a cycle or the initial pick up in inflation or ending QE are false mythology Id bet this is over pretty soon It just feels like a classic correction But Im may be wrong
1487129500005527555,2022-01-28 18:24:36+00:00,1,1,https://twitter.com/i/web/status/1487129500005527555,amimmahnuel Glad to have you back
1487129008521166851,2022-01-28 18:22:39+00:00,1,1,https://twitter.com/i/web/status/1487129008521166851,veteran What a nice comment Michael Would that it were true Thanks for following me here and commenting
1487128344139341826,2022-01-28 18:20:01+00:00,22,2,https://twitter.com/i/web/status/1487128344139341826,Are you wondering how you will pay for retirement I offer my thoughts on investment income and cash flow here
1487054607733993475,2022-01-28 13:27:01+00:00,61,8,https://twitter.com/i/web/status/1487054607733993475,Quote for the Day Better a diamond with a flaw than a pebble withoutConfucius KFQuoteForTheDay
1486841200393039874,2022-01-27 23:19:01+00:00,45,7,https://twitter.com/i/web/status/1486841200393039874,My latest markets column is out now Dont Fret Rising Rates They Wont Wreck Stocks or the Economy
1486807252635840513,2022-01-27 21:04:07+00:00,62,4,https://twitter.com/i/web/status/1486807252635840513,Enjoyed my time on today If you missed the show live click below
1486746331322327046,2022-01-27 17:02:02+00:00,0,0,https://twitter.com/i/web/status/1486746331322327046,Glad you like it Indeed I am
1486745873627303939,2022-01-27 17:00:13+00:00,1,0,https://twitter.com/i/web/status/1486745873627303939,Youre always more than welcome Thanks for following me all this time Appreciated
1486744974376931334,2022-01-27 16:56:38+00:00,1,0,https://twitter.com/i/web/status/1486744974376931334,Become a teatotalers like me Ken and after a while staying calm gets even easier still A lot of people get pretty emotional smooching the hootch
1486744281977004039,2022-01-27 16:53:53+00:00,0,0,https://twitter.com/i/web/status/1486744281977004039,Pretty sure the great man was referencing a business person being interested in the product or service improving the wellbeing of customers so demand is strong Pretty sure Dang
1486689703374077967,2022-01-27 13:17:01+00:00,80,20,https://twitter.com/i/web/status/1486689703374077967,Quote for the Day In the business world the rearview mirror is always cleaner than the windshield Warren Buffett KFQuoteForTheDay
1486492139752079362,2022-01-27 00:11:58+00:00,0,0,https://twitter.com/i/web/status/1486492139752079362,Thanks for the retweetAnd of course for following me here
1486491747823669257,2022-01-27 00:10:25+00:00,1,0,https://twitter.com/i/web/status/1486491747823669257,Wow Thanks so much for the tweet
1486491584443019265,2022-01-27 00:09:46+00:00,1,0,https://twitter.com/i/web/status/1486491584443019265,Thanks so much for the tweet Im very flattered
1486491309044944898,2022-01-27 00:08:40+00:00,2,0,https://twitter.com/i/web/status/1486491309044944898,And he still does LOL I hope youre well Jesse
1486490981130145798,2022-01-27 00:07:22+00:00,1,0,https://twitter.com/i/web/status/1486490981130145798,zied As a diversification from US growth yes But Chinese stocks dance to their own timing drummer and dont correlate well with the rest of global stocks
1486490102817648641,2022-01-27 00:03:52+00:00,0,0,https://twitter.com/i/web/status/1486490102817648641,Yes but the question is when Its too steep and fast off the top to be much of anything else But it could drop another 10 easy before its over No way to know All sentiment now TGH is having fun
1486345432653766666,2022-01-26 14:29:00+00:00,43,6,https://twitter.com/i/web/status/1486345432653766666,The latest from Correction or Pullback Januarys Swings Call for Calm
1486335620222009346,2022-01-26 13:50:01+00:00,49,11,https://twitter.com/i/web/status/1486335620222009346,Quote for the Day Selfinterest demands that you be interested in the wellbeing of othersBC Forbes KFQuoteForTheDay
1486079684429291522,2022-01-25 20:53:01+00:00,0,0,https://twitter.com/i/web/status/1486079684429291522,Sounds good to me
1486078174039470080,2022-01-25 20:47:01+00:00,0,0,https://twitter.com/i/web/status/1486078174039470080,Demasiadas y muchas preguntas No puedo ser un asesor personal tuyo ni de nadie ms en este detalle en Twitter Lo siento
1486077988290523137,2022-01-25 20:46:17+00:00,0,0,https://twitter.com/i/web/status/1486077988290523137,A largo plazo siempre es importante recordar que puedes equivocarte Y en este mbito todo el mundo se equivoca mucho De ah la razn de la diversificacin de estilos para compensar el riesgo de que tus selecciones estilsticamente puedan estar equivocadas 22
1486077966865993728,2022-01-25 20:46:11+00:00,0,0,https://twitter.com/i/web/status/1486077966865993728,Bueno generalmente ests ms concentrado de lo que yo querra estar Su cartera no est construida con el objetivo de tener un contrapeso para compensar lo que sucede cuando el tipo de cosas que posee no funcionan bien Eres joven 12
1486077317323444227,2022-01-25 20:43:37+00:00,0,0,https://twitter.com/i/web/status/1486077317323444227,will I dont deal well with hypos It isnt a practical question as postured
1486077033222328321,2022-01-25 20:42:29+00:00,0,0,https://twitter.com/i/web/status/1486077033222328321,Y eso siempre es bueno recordarlo Gracias
1486076183611514884,2022-01-25 20:39:06+00:00,0,0,https://twitter.com/i/web/status/1486076183611514884,Youll have to train yourself on this Cindy The kind of market action were having is not what leads to bad but what leads to good Regards to Bill
1486008216551145472,2022-01-25 16:09:02+00:00,13,2,https://twitter.com/i/web/status/1486008216551145472,For my Chinese speaking followers my latest column in
1485960720286162954,2022-01-25 13:00:18+00:00,68,7,https://twitter.com/i/web/status/1485960720286162954,Quote for the Day You need a lot of different types of people to make the world better Joe Louis KFQuoteForTheDay
1485670487053283333,2022-01-24 17:47:01+00:00,11,1,https://twitter.com/i/web/status/1485670487053283333,For my Spanish speaking followers my latest column in
1485633239989600258,2022-01-24 15:19:00+00:00,35,2,https://twitter.com/i/web/status/1485633239989600258,Ken Fisher Looks Back At Markets in 2021
1485604804542009346,2022-01-24 13:26:01+00:00,63,13,https://twitter.com/i/web/status/1485604804542009346,Quote for the Day Do not let your fire go outDo not let the Hero in your soul perishCheck your road and the nature of your battle The world you desired can be won It exists it is real it is yours Ayn Rand KFQuoteForTheDay
1484586342713548803,2022-01-21 17:59:01+00:00,45,11,https://twitter.com/i/web/status/1484586342713548803,What should we expect from the market in 2022 I explain my outlook here
1484567686478635009,2022-01-21 16:44:53+00:00,1,0,https://twitter.com/i/web/status/1484567686478635009,Yet its revs are a small fraction of mine So size in revs or wealth really seems to have little to do with what Congress folk like to attack Its just size gets headlines and we billionaires are easy to attack since few can envision what it is like being one 66
