id,created_at,favorite_count,retweet_count,text
1177241695748050944,2019-09-26 15:21:07+00:00,27,15,upcoming earnings MU MTN UEPS PRGS AGTC DLNG CAMP
1176544111098310656,2019-09-24 17:09:09+00:00,28,18,earnings scheduled after the close today and before the open tomorrow NKE DAVA SNX CTAS WOR ISR CMTL DYNT
1176224081303224322,2019-09-23 19:57:28+00:00,38,23,earnings scheduled before the open tomorrow NIO AZO KMX BB JBL INFO MANU NEOG
1175406967533297664,2019-09-21 13:50:33+00:00,194,122,earnings for the week MU NIO AZO KMX NKE BB RAD CMD ACN UXIN JBL INFO CAG DAVA MANU SNX FDS KBH UEPS ATU CTAS MTN AGTC WOR PIR ISR DLNG CAMP AIR FUL PRGS CMTL DYNT RBZ
1172826583234691072,2019-09-14 10:57:02+00:00,141,83,earnings scheduled for the week ADBE FDX GIS CHWY BBCP SOL DRI CBRL APOG MLHR SANW SCS HX HHR BYSI SCHL MREO
1172152193262264321,2019-09-12 14:17:15+00:00,26,13,earnings scheduled to end the week AVGO PCYG EFOI AMRK LPTH RLGT
1171799240181501955,2019-09-11 14:54:44+00:00,28,19,upcoming earnings ACB KR DLTH MCFT TLRD OXM EPM
1171419167184044032,2019-09-10 13:44:28+00:00,34,19,upcoming earnings ZS RH GME PLAY LOVE GFN FARM
1170294254280880128,2019-09-07 11:14:27+00:00,141,112,earnings for the week ACB ZS KR AVGO RH HDS PLAY GME CTRP MCFT DLTH LOVE LMNR TLRD ASPU ORCL GFN PHR WDG LAKE FARM UEPS PCYG OXM EFOI LPTH AMRK
1169634038535086082,2019-09-05 15:31:00+00:00,39,22,earnings after the close today and before the open tomorrow LULU CRWD ZM DOCU BRC DOMO ZUMZ SAIC GCO PD CDMO GWRE ABM NX TNP also MDLA KFY CULP CTHR VISI
1168882140899106817,2019-09-03 13:43:13+00:00,47,21,earnings scheduled after the market closes today and before the open tomorrow AEO COUP NAV MIK HQY VRA GSM EGAN CSTL CANG SB YRD JFIN
1167776656863453184,2019-08-31 12:30:25+00:00,213,134,earnings for the week LULU AEO CIEN MDB COUP PANW ZM CLDR NAV CRWD CONN MIK BRC NSSC HQY TUFN VRA DOCU WORK HOME SIG KIRK GSM EGAN SMAR BITA ZLAB DOMO PVTL DCI ZUMZ LE GIII AVAV SAIC SCWX CSTL PD GCO JW A
1167096899071107073,2019-08-29 15:29:19+00:00,45,28,earnings scheduled after the market closes today and before the open tomorrow ULTA WDAY DELL BIG MRVL CPB JKS AMBA YEXT COO AOBC SFUN LX AAC LOV MESO SEAC
1166765912562778112,2019-08-28 17:34:05+00:00,48,25,earnings scheduled before the market opens tomorrow BBY DG DLTR BURL ANF TD MBUU SAFM MEI BBW GLNG GMS TECD PDCO TITN DBI KNOP EDAP HAIN SECO GMLP DOOO
1166706024578998272,2019-08-28 13:36:07+00:00,28,18,earnings scheduled after the market closes today OKTA FIVE NTNX WSM GES BOX ZUO PVH HRB OLLI MEIP SCVL GEF ASND TLYS ESTC MTRX SPWH NOAH AMSWA SMTC AMK
1166360403636625415,2019-08-27 14:42:44+00:00,34,30,earnings scheduled after the market closes today and before the open tomorrow VEEV TIF ADSK COTY HPE HEI ITRN EXPR DY CHS DAKT LCI ALOT MOV OOMA BF B PAHC ARCE PSEC
1166053517829844993,2019-08-26 18:23:17+00:00,45,24,earnings scheduled after the market closes and before the open tomorrow MOMO BILI SJM PLAN BNS BMO AMWD CAL JILL CTLT EV RGS LAIX SXI
1165220037403303936,2019-08-24 11:11:20+00:00,187,146,earnings for the week BBY MOMO OKTA DG VEEV ULTA OSIS BILI DLTR TIF NTNX ICLK ADSK SJM PLAN WDAY ANF DELL BURL FIVE BWAY JT MRVL BNS BMO HPE COTY TD ITRN HEI EXPR JILL WMWD MOGU CAL GES CPB BOX PVH BIG CHS
1164535578332995584,2019-08-22 13:51:32+00:00,27,17,earnings releases to close the week CRM FL VMW INTU ROST GPS HIBB HPQ RRGB BKE CAAP STG ATGE RTW CYAD HCAT
1164181209649426437,2019-08-21 14:23:24+00:00,44,19,earnings scheduled after the market closes today and before the open tomorrow SPLK DKS JWN BJ LB FLWS KEYS TTC HRL SNPS PSTG FLY CM WUBA HTHT TUES HMLP ZAYO CTRN SQM LYTS QADA and also YJ SSI OPRA GASS
1163824831261003776,2019-08-20 14:47:17+00:00,62,36,earnings scheduled after the market closes today and before the open tomorrow TGT LOW BZUN PDD ADI URBN LZB JMIA RY TOL CREE PLCE JKHY NDSN SMED KLXE VIOT ALC NNA SCSC AMCR RYB FANH
1163482310366420992,2019-08-19 16:06:13+00:00,35,21,earnings scheduled after the market closes today and before the open tomorrow BIDU HD IQ KSS TJX MDT SE FN MSG TRNX PLAB VNET PINC SFL CTK PPDF BBL
1162691031944577025,2019-08-17 11:41:58+00:00,242,154,earnings for the week BIDU HD CRM TGT EL IQ WB KSS LOW SPLK MDT SINA TJX FL SE VMW JWN DKS BJ PDD MSG FN KEYS INTU LB ADI JMIA FLWS ROST RY SNPS CREE URBN PSTG PINC HRL GPS JKHY HIBB HPQ LZB TOL SMED PLCE
1162006192723582977,2019-08-15 14:20:40+00:00,56,30,earnings after the close today NVDA AMAT PAGS GLOB CRMT ARAY VIAV ARCT ZTO VJET REDU SNDE
1161672487681384453,2019-08-14 16:14:38+00:00,33,19,earnings before the open tomorrow BABA WMT JCP CSIQ TPR BGC ECC CLSN BPTH PNTR IHRT SNWV MSG YI
1161636487559098368,2019-08-14 13:51:35+00:00,52,24,earnings after the close today CSCO CGC STNE A NTAP CACI VIPS PRSP RKDA HYRE SPTN JE HDSN TTNP HOLI GEVO CATS SORL LMB HROW IWSY QRHC AEMD AEYE CPIX CSSE WYY UV OCX SLGG SMTS DARE ZSAN EAST BURG IPWR GVP RPAY
1161327262014291973,2019-08-13 17:22:50+00:00,1,1,506 Inc Ind inc ONTX 8 15
1161309283012755456,2019-08-13 16:11:23+00:00,59,33,earnings before the market opens tomorrow M GOOS LK ERJ NEPT CAE PFGC LIQT AIT AMRH DQ ACST SPCB CRWS ALYA ALT CTRA ONTX LINC OBE CYRN HSON
1161276070458527744,2019-08-13 13:59:25+00:00,27,17,earnings after the close today TLRY YY HUYA CRMD CDK BOXL MYGN REAL KOOL FTEK AXU LEGH PRPL DZSI CPLG DYAI SNES UTSI REED INNV ECOR ADPT CTEK IZEA UROV CYCC FTSV GO CHNG TH METC PHAS PFMT VTSI DMAC DL QMCI
1160968586749501443,2019-08-12 17:37:35+00:00,49,34,earnings after the close amp before the open tomorrow JD AAP TME BEST VFF BE RMBL MGIC GDS EAT IIVI AVYA PSN UMRX VBLT ESTA IDXG LRAD MDWD POLA OPTN ELAN BIOC SCON GNLN LAZY BCLI CYD MTNB VCTR RUBY FENG EC CVET CEPU
1160660113742581760,2019-08-11 21:11:49+00:00,74,36,Upcoming earnings releases with the highest volatility HROW AVYA ARAY BE CPLG GOOS SPTN MYGN EOLS HUYA JCP QD TSG DQ HOLI VIPS IIVI CGC
1160133085972897792,2019-08-10 10:17:36+00:00,349,207,earnings for the week NVDA BABA WMT CSCO JD CGC GOLD SYY AMAT TLRY M GOOS JCP AAP EOLS TSG STNE AZRE LK TME ERJ CSIQ YY HUYA NINE DE TDW CRNT HYGS QD TPR BRC BEST PAGS VFF NTAP RMBL CACI BE CWCO NEPT A
1159906313197019136,2019-08-09 19:16:29+00:00,26,13,Bigger than usual earnings moves today from FTCH MESA CISN DXC PUMP NKTR ASUR SIEN VSLR QNST CNDT VRTU ALTR CYRX NVRO APPN DBX OSTK
1159832765228937217,2019-08-09 14:24:14+00:00,38,22,Monday morning earnings GOLD SYY EOLS AZRE TSG NINE TDW CRNT HYGS BRC KEG CWCO INSE APTX RDCM TRWH JASN PXS
1159545221388152837,2019-08-08 19:21:38+00:00,27,15,Bigger than usual earnings moves today from GTT ICUI GDOT VSI GTHX ANGI WMGI HNGR CVNA JACK VERI QTWO CDLX REPH MMS KOP TPIC VSTO
1159512539610456064,2019-08-08 17:11:46+00:00,34,14,Friday morning earnings DPLO TWIN USCR YRCW ERF SSP MLNT RMR VUZI UPL PGNX SCM CBM VYGR HPT SMLP TGLS PXLP CLNY TGTX TAC TRCO ORGO SQBG CUI ALO AVDL IMV LLEX HCAP URGN TERP BRFS
1159463236565110784,2019-08-08 13:55:52+00:00,49,31,earnings after the close TTD ATVI UBER DBX OSTK HEAR FNKO YELP SYMC ONVO NKTR PBYI CBS AAXN WPRT VSLR PUMP ASUR ELY FSLY WATT DXC ALRM WPM XON PCTY ROAD MESA CLNE AL APPN ADMS MBII MTW OMER TRHC VSAT JYNT BDSI
1159184232788484097,2019-08-07 19:27:12+00:00,31,16,Bigger than usual earnings moves today from NEWR QUOT AXGN BECN MTCH ATNX GTES XNCR LTHM RTRX PE ENLC HUBS SEDG CDXS CTSO EVH FPI
1159140129048584195,2019-08-07 16:31:57+00:00,41,26,earnings before the open tomorrow CRON KHC NBEV AMC LITE CAH KDP LNG VIAB CRBP AXSM CVRS NCLH NICE COMM EPAM GOGO PLX RWLK CVIA ZIOP TW NGL RLGY PRTY FOLD CPK AZUL AKBA GTT MUR LKSD PCRX PRGO SNH ACIA CHAP VSI
1159100308343152640,2019-08-07 13:53:43+00:00,53,31,earnings after the close ROKU STMP BKNG LYFT MELI MRO SWKS CTL IIPR AIG ZG ET SRPT ELF CVNA MNST TRIP TRXC ALB AAOI NTES SONO RUN CPRX PAAS UPLD FOSL DDD CARA JACK CWH AZPN NVAX IAG SENS FLY IAC MFC AERI DVAX
1158818960617410560,2019-08-06 19:15:44+00:00,28,11,Bigger than usual earnings moves today from AVID NPTN GSKY ADNT PODD CRCM TDG IFF IVC BWXT CLAR EVBG OXFD SHAK FRPT MNK PRMW GNMK
1158769626488201216,2019-08-06 15:59:42+00:00,35,19,earnings before the open tomorrow CVS TEVA CYBR DNR LL WEN ICPT IONS CPRI AFMD GTN AG ATHM ARQL INGN ODP HZNP NYT MRNA NRG ATNX SBGI STWD MLNT EYPT FUN BCOR AMAG SPB WWW ARCO CRK LPG GOLF CCLP CLXT CNP ATKR VGR
1158740429413769216,2019-08-06 14:03:41+00:00,50,28,earnings after the close DIS TEUM WYNN GWPH PLNT MTCH WW FANG SWN SEDG NVTA HTZ MAXR GH DVN FTR HUBS PZZA MCHP PXD TXMD PAA NEWR BNFT INSG CARG ADT ICHR CPE EVRI JAZZ PEN PE JCOM FLXN SUPN EDIT CUB LRN LTHM
1158422733698547712,2019-08-05 17:01:16+00:00,33,21,earnings before the open tomorrow CHK BHC PLUG APRN REGN AGN ZTS DISCA SEAS MNK DF ATRS EMR MOS DUK TDG PBI ENDP CAMT TEN TLRA USFD BDX AES ALNY PPL FIS EXPD SAGE TECH ENR ARMK ADNT ACM VCEL VG GDP JLL RHP RCM
1158396066166951936,2019-08-05 15:15:18+00:00,46,38,earnings after the close TTWO SHAK CAR HIIQ MAR ACRX APPS KLAC CZR ARWR THC WWD CYH WPX ADES PODD SWAV AVID CLR CSWC MIME XEC XLRN O COHU ADUS DIOD GAIA STE IPAR CSOD EVBG ATSG CBT ARG ANSS PARR RAMP SNCR
1157656088067616768,2019-08-03 14:14:54+00:00,401,251,earnings for the week DIS ROKU CVS CHK TTD TEVA TSN CRON ATVI KHC CYBR ON UBER STMP MRO TEUM BKNG TTWO MELI NBEV L BHC SWKS WYNN OSTK DBX KOS GWPH OESX PLUG CAR LYFT SHAK CTL HEAR AMC APRN REGN PLNT SOGO WW
1157305380847935488,2019-08-02 15:01:19+00:00,50,36,Monday morning earnings TSN ON KOS OESX L SOGO ATRO DSKE DO ABUS CARS ATH DK LIN UNVR DPLO CNA GLMD SOHU TA TWIN III CYOU CGEN GNE JEC SPNS KMPR QTNT FLMN DKL NERV WEC BCC
1157008870914580480,2019-08-01 19:23:05+00:00,32,15,Bigger than usual earnings moves today from PS WLL CXO MOD ABMD SPWR VNDA RUBI OI EGOV AAWW CRUS NSTG GHL HGV PBF PRU ETH
1156968633689620485,2019-08-01 16:43:12+00:00,48,31,Friday morning earnings XOM CVX S STX RACE NWL ARNC ENB HMC CNK HRC NBL QSR WPC IMGN ABR LYB STML SRE CBOE HMSY GVA MGI VST XRAY FTS OFS SUNW ITT JOUT ESNT DNOW BWEN SNR SEE TU AXL IMO NBLX POR RUTH BIP AEE
1156929787472097280,2019-08-01 14:08:50+00:00,59,27,earnings after the close SQ APHA X ETSY PINS ANET OLED TNDM FTNT FSLR GPRO GLUU EOG XPO HLF GDDY CRC MED VSTM NOG PVG CC GERN EGO BMRN QRVO ZIXI CBLK VKTX RDFN MSI FLR BRKS IPHI CDNA FND EKSO GPOR TDS WIFI
1156652760319873025,2019-07-31 19:48:02+00:00,20,11,Bigger than usual earnings moves today from TWOU ENPH ORBC MGPI WES AGCO LSCC TENB UIS SAIA BDC HUBG DAN NUVA SITE MXIM HT KL
1156615044626604032,2019-07-31 17:18:10+00:00,50,30,earnings before the open tomorrow SHOP VZ YETI W CI GM ABMD MPC CROX DNKN YUM K XEL KEM CLX IRM ABC WING NGD CLVS WRK MT IGT OSK PENN SFM AVP AAWW RPD RDS A RGEN STOR IDXX HFC BLL BTE HBI CNSL PH GNRC BLD
1156578527661187077,2019-07-31 14:53:03+00:00,45,30,earnings after the close TWLO QCOM ZNGA LRCX WDC FIT AYX OXY TDOC DXCM EXEL CTSH KTOS SPWR BOOT WLL CAKE APA NLY FIVN VRTX ACAD PRU EQIX CXO AMED WELL SWIR HABT CRUS VAC MCK OLN HCC ALSN AWK WTI CF SKT MET
1156302809618403329,2019-07-30 20:37:27+00:00,29,9,AAPL guidance calculates to earnings of 2 59 to 2 93 per share compared to the consensus estimate of 2 68 per share
1156286021279059968,2019-07-30 19:30:44+00:00,26,14,Bigger than usual earnings moves today from FRAC MDR CNX SLCA IT OMF SSNC AMKR TREX BERY TBI RIG LGND RNG NOV DORM CVLT CURO
1156254406435856384,2019-07-30 17:25:07+00:00,37,16,AAPL will probably react more to 4th Q guidance than results Estimates are for negative growth but data checks appear to be turning higher
1156229356731211778,2019-07-30 15:45:35+00:00,48,38,earning before the open tomorrow GE AMRN SPOT HUM ECA ADP AMT CME EPD GRMN MEET D SSYS TAP STRA HES LHX SMG SPG FCAU AMCX BHGE SO GIB DIN TKR NYCB CG MCO NMM JCI CDW DAN APTV MTOR KBR SAIA MKL CRTO RDWR STNG
1156201427280236545,2019-07-30 13:54:36+00:00,78,44,earnings after the close AMD AAPL EA GILD ENPH AMGN GRPN FEYE ZEN AKAM PAYC KL LSCC BEAT TWOU MOH MDLZ ALL BYD YUMC OKE COHR CHRW CINF TENB VCYT PSA FMC DENN MXIM NCR TTOO CACC BGFV HA EXR MRCY IMAX MX NUVA
1155875317757689858,2019-07-29 16:18:45+00:00,62,42,Tuesday morning earnings MA PG MO SIRI GRUB MRK UAA SNE LLY RL GLW COP HCA CELG CMI ZBRA WAT DHI INCY WCG NEO WAB XRX GPN NRZ R AME IR ETN ECL ILPT MLM I DORM WYND AOS DSX IPGP LDOS HUN ERJ EQM ARCC MMC
1155840464978923521,2019-07-29 14:00:15+00:00,60,36,earnings after the close BYND AKS ILMN CHGG MDR NXPI RIG PI RNG SSNC TXRH RMBS NBR TACO NBIX TREX CGNX LEG WCN DISH ARE MEDP NTR NOV SBAC ACGL ALIM JBT RGA RE SANM INST JJSF EHC APPF AMKR FRAC VRNS PKI OMF
1155817832057380865,2019-07-29 12:30:19+00:00,1,2,BIDU reports 8 19
1155812570852417536,2019-07-29 12:09:25+00:00,38,24,upcoming earnings releases with the highest volatility TWI TCS ONDK RRD CASA MEET ZIXI CCRN EEX QUAD SXC SBH FLDM RUBI ACCO PI ORBC IMMR
1155086023648534528,2019-07-27 12:02:23+00:00,489,319,earnings for the week AMD AAPL BYND SHOP SQ MA GE PG TWLO APHA MO QCOM AMRN SIRI BAH EA MRK VZ PFE SPOT AKS NSP AWI ENPH UAA SNE AMG XOM SNY ILMN X GILD CTB GRUB CHGG LRCX LLY ZNGA TSEM WDC GLW ONDK RL GM
1154756878464929793,2019-07-26 14:14:28+00:00,51,25,Monday morning earnings BAH SNY NSP AMG AWI CTB ONDK TSEM MCY AMAL RDY SITC OPB OIS CVEO VET
1154471147343249408,2019-07-25 19:19:05+00:00,27,15,Bigger than usual earnings moves today from ALGN ANIK PTC SAVE AIMC OII NXGN MMLP MTH INVA LOB NTGR TREE TSLA SLM LNTH DBD COR
1154420704437256197,2019-07-25 15:58:38+00:00,63,38,Friday morning earnings TWTR MCD ABBV COG PCG PSX GT YNDX CHTR CL SAFE ITW WY AON ABG ABTX ABCB LEA ARLP CIVB ZBH B BSAC AVX VTR WETF SMLR ROCK TYPE VRTS FMX PFS MOG A SBSI FET AMTB BSVN ACRE GHM PJC
1154410931033726977,2019-07-25 15:19:48+00:00,57,43,earnings after the close AMZN INTC GOOGL SBUX TEAM MGM EXPE ALK CY MAT SAM AFL BOOM COLM PFPT SYK JNPR AUY RRC SIVB EHTH FISV DECK RMD VLRS VRSN MHK BJRI UHS SNBR TGE FTV FLEX LPLA EMN OMCL OSPN PFG CUBE IEX
1154107163545165829,2019-07-24 19:12:44+00:00,23,11,Bigger than usual earnings moves today from HCSG MANH TER CSTM BKU MKTX MHO NAVI BOKF ROL IART DFS TRMK TDY WSBC EW LAD TUP
1154044913018781696,2019-07-24 15:05:23+00:00,55,43,earnings before the open tomorrow MMM NOK BMY CMCSA AAL WM LUV RTN VLO HSY BUD STM RCL NEM WWE TREE TSCO ROK BAX APD AZN AIMC HP WH NVCR CVE IP HBAN VMC POL KKR PDS LKQ TECK XEL ALLE LH ODFL GRA AAN TAL AEP
1154025081510727685,2019-07-24 13:46:34+00:00,52,34,earnings after the close FB TSLA F PYPL XLNX NOW ALGN LVS CERN ORLY FFIV SIX SAVE MLNX CTXS NTGR ALGT SU AMP FTI TMK HLX ASGN CLB PKG VAR AEM AGNC HNI GGG CLS CVBF ARI RJF NGVT BANR EGP CLGX NXGN KALU LSTR
1153740080625979394,2019-07-23 18:54:05+00:00,32,19,Bigger than usual earnings moves today from AN PII PHM TRU SHW ZION IRDM EDU ADC KO SFNC AKR LW HAS FITB HXL HOG PNR
1153707791066025984,2019-07-23 16:45:46+00:00,64,43,earnings before the open tomorrow BA T CAT UPS ANTM NOC FCX GD GWW WIX BSX ALXN HLT NSC TMO NDAQ NEE VFC TUP OC KNX CHKP NEP TRVG APH FLIR LAD ROL NTRS BCO BKU EEFT ARCH MDCO MKTX SLAB TDY TEL SC FCFS BPOP
1153660293765111808,2019-07-23 13:37:02+00:00,55,45,earnings after the close SNAP V CMG IRBT TXN EW DFS CNI TER RHI CSL CB CSGP NAVI VMI SPN BXMT FE RNR USNA BDGE HIW MANH NWE WSBC WRB TRMK FMBI HAFC CSFL PSB QCRH UCBI UCFC BHLB AGR FCF FFIC TRNS NBHC RBNC
1153358177624367105,2019-07-22 17:36:32+00:00,49,37,Tuesday morning earnings KO LMT BIIB UTX CNC JBLU HAS HOG SCHW SWK DGX KMB PII TRV ATI LW PHM TRU FITB KEY PCAR CIT AN IRDM RCI PPBI LECO MDSO EDU PNR NEOG GPK ASTE UBS AVY CALX HMST TTS NTB FELE CTG FBC
1153301820254691330,2019-07-22 13:52:35+00:00,53,29,earnings scheduled after the market closes today AMTD CDNS WHR BRO LOGI STLD VBTX CE HXL CR ADC ACC ELS ZION IBTX RNST WSFS HSTM RBB BDN AKR EFSC EQBK FBK FDEF TESS WASH NBTB
1153068542046146560,2019-07-21 22:25:38+00:00,66,42,upcoming earnings releases with the highest volatility DBD SMSI VICR BOOM SNAP CLS VCRA KN LNTH MITK IRBT DMRC TYPE ANIK TUP HZO TBBK HNI
1152668104943636480,2019-07-20 19:54:26+00:00,5,2,Thanks for the love
1152543722510389249,2019-07-20 11:40:11+00:00,601,371,earnings for the week FB AMZN TSLA BA T SNAP PIXY HAL TWTR KO F V LMT GOOGL INTC CAT PYPL BIIB UTX IRBT XLNX UPS ABBV CNC NOK CMG MMM RPM SBUX JBLU BMY GNC MCD CDNS CADE NOW AMTD HAS HOG ANTM WM CMCSA FCX
1152291583443820544,2019-07-19 18:58:16+00:00,20,10,Bigger than usual earnings moves today from EXPO MRTN CFG GNTX SXT FFIN WAL ALV RF ETFC STT KSU
1152216612520509440,2019-07-19 14:00:22+00:00,39,28,earnings scheduled before the market opens on Monday HAL RPM GNC CADE BOH CALM BMRC OFG SALT LII CBU ONB
1151881054577463296,2019-07-18 15:46:58+00:00,64,30,earnings after the close MSFT ISRG SKX CHWY ETFC CRWD COF MVIS OZK WAL RECN MRTN EXPO BEDU INDB FFBC TIGO PBCT GBCI amp before open tomorrow CLF AXP SLB BLK KSU SYF STT RF GNTX CFG MAN IBKC BLX ALV NVR SXT ACU
1151527470396583937,2019-07-17 16:21:57+00:00,65,33,Thursday morning earnings UNH MS BX HON PM ALLY UNP SAP NUE DHR BBT ADS MTB BMI POOL STI SNA GPC DOV GATX SON TSM PPG WNS NVS GTLS EWBC HOMB SBNY WBS STBA NURO PZN ICBK WSO SASR BMTC AMRB AUB
1151486451315617798,2019-07-17 13:38:58+00:00,42,30,earnings scheduled after the market closes today NFLX IBM EBAY URI AA KMI CCI ADTN LLNW PLXS RLI TCBI CCK BXS SLG TBK GSBC CATY EGBN TSC UMPQ CTO CNS PFBC
1151128296836521984,2019-07-16 13:55:47+00:00,50,33,earnings scheduled after the market closes today and before the open tomorrow BAC PGR UAL ABT CSX ERIC PNC CTAS BK USB TXT WIT OMC SGEN CMA ASML FNF IBKR HOPE FULT HWC PNFP UBNK
1150843430450466818,2019-07-15 19:03:50+00:00,46,21,earnings scheduled for the week with the highest increase in expectations relative to last quarter BLK GPC SYF PM STI ADS ADTN DHR PNC KSU ERIC TXT UNP PLD PGR CLF UNH BBT
1150783950962532352,2019-07-15 15:07:29+00:00,47,32,Tuesday morning earnings JPM JNJ GS WFC DPZ SCHW CP PLD SNV FRC FHN CBSH MBWM
1150723814940119040,2019-07-15 11:08:31+00:00,57,28,upcoming earnings releases with the highest volatility LLNW SKX OZK PLXS SGEN FFBC ADTN HOPE STBA CLF ERIC GTLS MRTN SNA SON AA ALV GNTX
1150018774378209280,2019-07-13 12:26:56+00:00,446,336,earnings for the week NFLX MSFT C JPM BAC UNH JNJ MFC DPZ GS CLF PIXY PGR SCHW ABT CP CSX UAL EBAY ERIC PLD ISRG JBHT IBM BX SNV AXP PNC SLB AA FRC HON KMI MS BK ALLY PM URI USB FHN UNP TXT CBSH SKX CTAS
1148974084392456192,2019-07-10 15:15:43+00:00,30,21,upcoming earnings DAL BBBY FAST AIR SLP EXFO PSMT SAR YRD
1148645829156245506,2019-07-09 17:31:21+00:00,25,18,earnings after the close today and before the open tomorrow LEVI MSM WDFC ANGO HELE ASPU
1147597098680049666,2019-07-06 20:04:04+00:00,123,87,earnings for the week PEP DAL AZZ BBBY LEVI FAST MSM INFY LNN ANGO WDFC HELE NTIC PSMT AIR EXFO SLP SAR ASPU YRD
1144916157176131584,2019-06-29 10:30:58+00:00,238,193,top confirmed earnings for July NFLX BA F UNH INTC T CLF BAC PEP GOOGL AEMD DAL JPM C SMPL HAL WFC IRBT AYI JNJ MMM BBBY YRD NOK ISCA CAT CMG ISRG KO MA LEVI BMY SLB INFY OMN GS CSX PGR UPS ERIC ABT AA CNC
1144212653704921088,2019-06-27 11:55:29+00:00,36,17,earnings scheduled after the close today and before the open tomorrow NKE STZ JKS SGH PRGS CAMP FC MPAA
1143849771263844352,2019-06-26 11:53:31+00:00,49,25,earnings scheduled after the market closes today and before the open tomorrow WBA CAG ACN RAD KBH SOL MKC MLHR PIR GMS SJR SKIS PDCO APOG NG FUL WOR
1143604670990049285,2019-06-25 19:39:35+00:00,46,19,upcoming earnings MU FDX BB GIS PAYX SNX AVAV INFO UNF SCHN AITB ATU ACST
1142467354301009921,2019-06-22 16:20:17+00:00,144,103,earnings for the week MU BB FDX NKE GIS WBA STZ LEN FDS PAYX SOL CAG ACN RAD INFO SNX KBH AVAV JKS UNF SCHN MKC ATU PIR MLHR SJR AITB SKIS SGH GMS APOG FUL NG PDCO WOR ACST FC CAMP PRGS
1141711997911863296,2019-06-20 14:18:46+00:00,19,11,upcoming earnings CGC KMX RHT KFY
1141370111372210176,2019-06-19 15:40:14+00:00,30,20,earnings scheduled after the market closes today and before the open tomorrow KR ORCL DRI CMC AOBC MEI SCS AMSWA
1140979555131412485,2019-06-18 13:48:18+00:00,24,18,earnings scheduled after the close today and before the open tomorrow ADBE LZB JBL WGO CHKE ALYA
1139886113672302592,2019-06-15 13:23:22+00:00,97,85,earnings scheduled for the week CGC ADBE KR ORCL KMX DRI LZB AOBC JBL CMC WGO RHT SFUN PSN HX SCS MEI CHKE KFY AMSWA ALYA
1139168143862054915,2019-06-13 13:50:24+00:00,27,14,A few earnings releases to close the week AVGO UROV MMMB
1138845520657563648,2019-06-12 16:28:25+00:00,29,13,earnings scheduled after the market closes today and before the open tomorrow LULU RH HEXO TLRD DLTH SECO NEPT OXM DEST CULP CRWS LIVX TUFN
1138456184376238081,2019-06-11 14:41:20+00:00,14,14,there are a handful of earnings releases coming up after the close today and before the open tomorrow PLAY CPST TMDX SMMT RENN
1138082152250257409,2019-06-10 13:55:04+00:00,34,19,earnings scheduled after the market closes today and before the open tomorrow HRB HDS CHS ASNA AZRE CASY JW A ADXS LMNR CBKC LAKE
1137328848440311808,2019-06-08 12:01:42+00:00,134,97,earnings scheduled for the week LULU THO AVGO UXIN HRB RH PLAY HDS FGP LOVE CHS TLRD SECO DLTH SHLO ASNA CPST JW A AZRE ADXS CASY LMNR BBCP NEPT OXM SPCB DEST TMDX CBKC TUFN LIVX RENN SMMT CRWS UROV CUP
1136639897090088960,2019-06-06 14:24:03+00:00,27,19,earnings scheduled after the market closes today BYND GES DOCU ZM OLLI DOMO MTN ZUMZ PD PRSP THR SEAC
1136276373641793536,2019-06-05 14:19:33+00:00,32,23,earnings after the close today and before the open tomorrow CLDR SFIX MDB CIEN FIVE SMAR SJM UNFI HOME SIG SAIC MIK KIRK ESTC ABM GEF HOV REVG TNP VISI CMTL AMSC DLNG
1135925890507038721,2019-06-04 15:06:51+00:00,30,19,earnings scheduled after the close today and before the market opens tomorrow CRM AEO GME CPB AMBA GWRE PVTL HQY GIII VRA SCWX NX BF B ALOT
1135549816338112514,2019-06-03 14:12:28+00:00,28,18,earnings after the close today and before the open tomorrow BOX TIF COUP CBRL NAV APPS CAL DCI OESX CSWC CMD GSM ITI LE YJ
1134797208795144192,2019-06-01 12:21:52+00:00,151,109,earnings for the week CRM GES CLDR SFIX BOX MDB TIF CIEN COUP FIVE CBRL AEO DOCU CPB SMAR GME APPS CTK ZM NAV AMBA DOMO DCI UNFI GWRE SJM CAL SAIC PVTL SIG CSWC HOME OESX GIII VRA CMD ESTC BYND KIRK OLLI HQY
1134104312471281665,2019-05-30 14:28:33+00:00,36,26,earnings scheduled after the market closes today and before the open on Friday COST ULTA ZS OKTA NTNX MRVL UBER VMW ZUO GPS ASND BIG DELL WSM YEXT BBW COO CONN RRGB GCO CSS YIN MESO
1133769601517576193,2019-05-29 16:18:32+00:00,22,16,earnings scheduled before the market opens tomorrow morning DG DLTR BURL CSIQ EXPR SAFM TECD JILL NGL BITA SPWH TITN DBI MOV DOOO MOGU
1133746653939347463,2019-05-29 14:47:20+00:00,37,22,earnings scheduled after the market closes today PANW VEEV KEYS PVH VRNT TLYS SMTC DSGX QADA UHAL RTW
1133417528452104193,2019-05-28 16:59:31+00:00,44,24,Wednesday morning earnings GOOS DKS ANF BZUN CPRI BMO ICLK WUBA HMLP CMCO BFRA HLNE EVLV DAKT THR TYME BWAY
1133372107184844801,2019-05-28 13:59:02+00:00,28,16,earnings scheduled after the market closes today WDAY YY HEI NXGN RAMP ESEA RYB CANG
1132282795575926784,2019-05-25 13:50:29+00:00,187,127,earnings for the week NIO MOMO GOOS COST PANW ZS OKTA WDAY NTNX ULTA DKS VEEV ANF BZUN DG DLTR BNS YY MRVL ASND CSIQ CPRI BAH BURL VMW AMWD KEYS ZUO BMO PLAN JT HEI GPS NXGN PVH QTNT NM EXPR SAFM BITA CMCO
1131556838791688192,2019-05-23 13:45:48+00:00,41,23,earnings to end the week SPLK FL ADSK INTU HPE ROST HPQ HIBB DECK DXC BKE KNOP AMKBY VSAT GHG LGF A NXGN SVM amp EDRY
1131240989119713280,2019-05-22 16:50:43+00:00,25,15,earnings scheduled before the market opens tomorrow BBY WB MDT TD BJ HRL SINA RY TTC TGP CTRN BRC TK TNK ROLL SSI WMS VIOT LPG PNTR MBT GASS
1131193361677864961,2019-05-22 13:41:28+00:00,41,19,earnings scheduled after the market closes today NTAP CTRP VIPS ONVO LB SNPS SCVL CPRT TARO SBLK HTHT SQM PLUS MOD
1130836701595742209,2019-05-21 14:04:14+00:00,43,27,earnings scheduled after the market closes today and before the open tomorrow TGT LOW AAP ADI VFC JWN URBN SE TOL PSTG CM CRMT AFMD PLAB OOMA SKY ECC GOGL KLXE TRNS ARCE PXS
1130527198811742209,2019-05-20 17:34:23+00:00,44,27,earnings scheduled before the market opens tomorrow HD KSS JCP AZO TJX CAAP ITRN DY DQ MNRO GLNG MDWD SFL EV DAVA XYF GMLP SNWV
1130484096449294338,2019-05-20 14:43:06+00:00,18,9,earnings scheduled after the market closes today NDSN QTT ATTO IPIC
1129686443163627520,2019-05-18 09:53:31+00:00,141,117,earnings for the week HD AZZ TGT JCP KSS LOW AZO BBY SPLK WB IGT TJX FL MDT QD TRNX PDD AAP ONVO CAAP ADSK INTU NTAP SPTN ADI VFC TD TTM VIPS ITRN CGEN HPE URBN SE CTRP SNPS RY QTT SINA HRL JWN BJ NDSN HPQ
1129413334187614208,2019-05-17 15:48:17+00:00,24,16,Monday morning earnings AZZ TRNX GD IGT PDD SPTN CGEN TTM
1129055968875171840,2019-05-16 16:08:14+00:00,22,14,Friday morning earnings DE CAE LX RDY
1129023857204039680,2019-05-16 14:00:38+00:00,37,30,earnings scheduled after the market closes today NVDA IQ BIDU AMAT PINS BOOT AGYS ENS VNET LTM AINV NOAH VJET REDU HUYA ALC SNDE PLMR
1128700675968372736,2019-05-15 16:36:26+00:00,29,18,earnings before the open tomorrow WMT WIX KEM AZZ NICE MGIC BOXL MANU QIWI EXP FRO JMIA MMYT ZEAL NGG
1128677168505081857,2019-05-15 15:03:01+00:00,29,20,earnings after the close today CSCO NTES LMB JACK TTNP SORL ZTO FTCH GPL JE VRTU SNES ACHV EDAP EYES FLO QRHC PYDS BURG CUI SITO CSSE FSI SRAX
1128618801367527425,2019-05-15 11:11:05+00:00,1,1,tx Thanks Patrick
1128618717863120896,2019-05-15 11:10:45+00:00,0,0,tx yeah sorry we missed TCEHY
1128358877328576512,2019-05-14 17:58:14+00:00,38,34,earnings before the open tomorrow BABA M TSG PLCE TSEM MEEC ERJ VBLT UQM PERI ARCO CLSN OLA VERU CTRA FCSC ESTA CHRA PFDF RUBY NFE WINMQ
1128305846142873608,2019-05-14 14:27:31+00:00,51,31,earnings scheduled after the close today ACB TLRY A NEWR PAGS SUNW AUPH EGHT TCS DOX AEYE ROSE NLST PANL CYCC KOOL ENT ECOR CPIX OPGN WYY ZSAN OCX CPLG ROAN SLGG YOGA MOGO IMXI VCTR TCON REED REFR FSM TRWH
