id,created_at,favorite_count,retweet_count,text
1337721433380818947,2020-12-12 11:30:18+00:00,264,107,earnings for the week FDX HEXO RAD NKE after the close on Friday BB CTK GIS ACN TTC LEN WGO JBL DRI UXIN CNTG SAFM MTSC ABM WOR AOUT NDSN APOG DL BLBD AIR ASPU APDN CAMP SCHL QTT SCSC VNCE RFIL CSBR NAV
1337104571391488006,2020-12-10 18:39:06+00:00,85,17,earnings to end the week COST LULU AVGO ORCL PLAY ROAD LAKE MTN SEAC NX PHX MAX
1336790173724647424,2020-12-09 21:49:48+00:00,7,1,Looks like you are right ADBE has reported after the close every quarter for 20 years so we assumed it was just the conference call that was tomorrow morning
1336703108555157505,2020-12-09 16:03:50+00:00,72,16,upcoming earnings ADBE RH CIEN FLR GNSS MESA GEF NCNO ASAN OXM VRNT CMTL JILL ASO SNEX
1336320917002063878,2020-12-08 14:45:08+00:00,78,21,earnings scheduled after the market closes today and before the open tomorrow CHWY GME CPB MDB LOVE UNFI VRA GWRE VERU PLAB DBI PHR AVAV
1335956632707207171,2020-12-07 14:37:36+00:00,85,21,earnings after the close today and before the open tomorrow AZO COUP SFIX HRB TOL THO SMAR HQY CMD CASY GIII LQDT BF B KLXE RYB CONN SUMO JW A
1335252498295255041,2020-12-05 15:59:38+00:00,11,0,We email this calendar to our free members 44 of the companies reporting earnings this week only scheduled their results within the past week so we can t accurately go out a couple of weeks ahead of time
1335247198116868097,2020-12-05 15:38:34+00:00,475,196,earnings for the week JKS ADBE CHWY GME COST LULU COUP AZO AVGO RH SFIX HRB CPB TOL SMAR THO CIEN ALOT ORCL MDB HQY DLHC UNFI VRA CMD LOVE CASY VERU GIII GWRE LQDT ROAD BF B DBI PHR PLAB KLXE RYB AVAV FLR GEF
1334551330803822592,2020-12-03 17:33:26+00:00,98,23,earnings scheduled after the market closes today DOCU MRVL CLDR SWBI ULTA ZUO OLLI PD DOMO SAIC MDLA YEXT ZUMZ TLYS COO AVYA CULP
1334201522230616065,2020-12-02 18:23:25+00:00,56,17,earnings before the open tomorrow DG KR MIK TD DLTH CBRL SIG BBW EXPR MEI CM AZEK DCI EH SCWX GMS LE REX QH
1334145616889442305,2020-12-02 14:41:16+00:00,90,13,earnings after the close today CRWD OKTA SNOW ZS SPLK FIVE SNPS ESTC SPWH PVH DSGX SMTC GES CDMO GHG GHLD
1333785575019532289,2020-12-01 14:50:36+00:00,61,15,earnings scheduled after the market closes today and before the open tomorrow CRM HOME BOX VEEV HPE NTAP RY TCOM SOL ROOT PDCO LU
1333419221942996993,2020-11-30 14:34:50+00:00,73,21,Upcoming earnings ZM MOMO BNS BMO EMKR GBDC NOAH ARCE
1332695636433645574,2020-11-28 14:39:34+00:00,824,255,earnings for the week ZM CRM HOME CRWD DOCU DG OGI MOMO MRVL ATHM NJR ADNT BIG SPLK BNS KR ZS OKTA BOX CLDR BMO MIK SWBI JFIN HPE TD VEEV FIVE SNOW ULTA EMKR NTAP DLTH RY ZUO GBDC ESTC SIG BBW NOAH SNPS CBRL
1332358750095740928,2020-11-27 16:20:54+00:00,63,15,Monday morning earnings OGI ATHM ADNT NJR JFIN AIH GLNG CANF
1331245814086311938,2020-11-24 14:38:30+00:00,144,20,Pre holiday earnings Thank you to all that follow us ADSK DE DELL JWN GPS AEO HPQ FRO VMW PSTG VIOT VNET CBPO FANH DOOO GASS
1330933795642626048,2020-11-23 17:58:39+00:00,86,28,earnings before the open tomorrow BBY DKS DLTR MDT SJM BURL HRL ANF PLAN ADI ICLK AMWD EV TITN J DY CHS TIF MOV CMCM LX
1330903915521576961,2020-11-23 15:59:55+00:00,50,19,earnings after the market closes today A URBN NTNX AMBA ARWR CBT MNR ENTA CNF CANG PLUS CNT MSP
1330148819372306441,2020-11-21 13:59:26+00:00,320,148,earnings for the week BBY NIU DKS DLTR DQ MDT TWST ADSK BZUN DE SJM ANF HRL PLAN BURL ADI A ICLK TNP JWN URBN NTNX DELL DSX WMG GPS AMWD FRO BLRX AMBA HPQ AEO ONE KFY ARWR PSTG CBT and J TITN EV CHS DY CMCM
1329860332223913985,2020-11-20 18:53:05+00:00,83,24,Monday morning earnings NIU DQ TWST BZUN DSX TNP WMG BLRX ONE KFY VTRU LEJU
1329494015390191625,2020-11-19 18:37:28+00:00,46,17,Friday morning earnings FL HIBB GSX BKE HP BNR RMR HHR
1329450653387792384,2020-11-19 15:45:10+00:00,91,29,earnings scheduled after the market closes today WDAY INTU BEST ROST WSM BECN CAL QFIN AMSWA IIIV POST OOMA WWD DLA BRBR MATW NGVC ASYS DADA ESE PNNT JOBS DUO ESEA CLIR HAYN MAXN AZYO MCFE EAR
1329174263685931008,2020-11-18 21:26:53+00:00,119,15,NVDA guidance calculates to earnings of 2 63 to 2 95 per share above the consensus estimate of 2 54 per share
1329109768288526337,2020-11-18 17:10:37+00:00,59,13,earnings before the open tomorrow M BJ CSIQ NTES MMS BERY OPRA OCSL QIWI BRC YI OCSI PLCE ONEW DAO HMLP
1329089328073502727,2020-11-18 15:49:23+00:00,95,25,earnings after the close today NVDA BILI LB KEYS SONO JACK SCVL CPRT UGI ZTO SQM NUAN UTI KLIC PAGS CUB CPA EDAP PFLT BSGM CAAP CD
1328718205955821570,2020-11-17 15:14:41+00:00,111,19,earnings scheduled after the market closes today and before the open tomorrow NIO TGT LOW TJX AVYA LZB SR KC ITRN VREX PAYS BV BWAY SHIP PBIO
1328372556794122240,2020-11-16 16:21:12+00:00,97,31,earnings scheduled before the market opens tomorrow WMT HD SE KSS ARMK LODE CWCO ECC AQUA ITMR PTN MLSS
1328354023288823812,2020-11-16 15:07:33+00:00,96,26,earnings after the close today BIDU SDC CODX MARK NEPT IQ YY BOXL FUV SLP GAN GDS LIVX WYY WTER API CRMT KRUS SBLK AP SNSS IBEX QRHC MSGE CWBR BEKE GMBL NVUS NDRA CRTD PLXP
1327636342034018306,2020-11-14 15:35:44+00:00,661,234,earnings scheduled for the week NIO NVDA JD WMT HD SE TGT LOW TSN PANW BIDU KSS SDC CODX BJ M SOHU VBLT NEPT TJX CSIQ BILI FL MARK MGIC WDAY IQ CSPR NTES SOGO ACM CLSN AVYA VERO SR NTWK AZUL INTU BOXL ARMK LODE
1327635025844703232,2020-11-14 15:30:31+00:00,2,0,Except 45 of the company s reporting earnings this week didn t officially scheduled their announcement until this past week So if we did that it would be very incomplete or error prone
1327370850643959809,2020-11-13 22:00:46+00:00,0,0,ONTX Forward estimates next year s earnings estimates arrows positive negative earnings guidance
1327304487971811328,2020-11-13 17:37:04+00:00,86,21,Monday morning earnings JD TSN PANW VBLT SOHU MGIC CSPR SOGO ACM VERO CLSN CRNC NTWK OEG DSSI AZUL ATEX
1326965701853257728,2020-11-12 19:10:51+00:00,91,21,Friday morning earnings DKNG VIPS VFF SPB MANU VIVO VNRX BPTH PLXP SFUN SII LI WTT VSTA
1326927889497985025,2020-11-12 16:40:36+00:00,83,13,earnings after the close today PLTR DIS CSCO AMAT BLNK FTCH AEYE AGRX ONTX JAMF RKDA LTRX BNGO BZH GLOB AQN ECOR U BIOC CSSE MOTS ALPN GFF DGII DLB ACHV BIOL BRP THMO HOLI YTEN APTX RMED OSS MEG AFIB REV CHRM DDS
1326620258208247809,2020-11-11 20:18:11+00:00,60,14,Bigger than usual earnings moves today from EGAN APD APTO ADPT ASH MODN TXG FOXF SILK COHR FICO DOX VIR OSW VERX LPRO GO LMND
1326618508785029120,2020-11-11 20:11:14+00:00,0,0,corp inc We do not have a confirmed date yet for VXRT
1326597326551572482,2020-11-11 18:47:04+00:00,113,29,earnings before the open tomorrow WIX PDD CELH RDHL DAVA ENR NICE HIMX INMD TCEHY ZEAL SDGR SBH EFOI BAM SPH NVMI TSEM HOOK SSYS TDG INSE NTIC BIOX BTAI FLY DRIO TNK SSRM GDRX MYOV TUFN ICL EPC SWIR DESP ALYA CAAS
1326580165158318082,2020-11-11 17:38:52+00:00,62,15,earnings after the close today GRWG VRM RVLV SPTN SLGG NEPT GOCO HI CCMP HYRE OPGN SMICY NVEE MFC SNES ATO TELA ASND REYN ENS TTEK SLRX CYCC BEDU ONCY XAIR TRVI ATTO PCOM PANL CNFR VEL SB EDRY PTVE KLDI
1326267649316319233,2020-11-10 20:57:03+00:00,59,18,Bigger than usual earnings moves today from VYGR ARNA INO WES APTS XPER ALT NBIX RAMP TLRY DTIL RPAY OSH NCLH ZGNX RVNC DHI GPMT
1326201611467841539,2020-11-10 16:34:38+00:00,82,22,earnings before the open tomorrow HUYA DOYU LMND MCFT XPEL APD LINC RPRX KMDA SANW ARCO VERX GIB SONM APG OSW PYPD CHRA
1326191001476734980,2020-11-10 15:52:28+00:00,1,0,Music Inc Biotech TME not TCEHY
1326174764872904704,2020-11-10 14:47:57+00:00,92,31,earnings after the close RKT DDOG LYFT TME GO RXT GEVO EGAN BRKS FICO VIR HCAT RESN ISR PLMR COHR TXG SILK KRNT ONEM CLSD FUBO FOXF MYO CVET PSTL MODN SANM DOX ADPT ASH INVE STAF VEC CNR EYEN PRSP PNTG APTO ALC
1325858566952148993,2020-11-09 17:51:30+00:00,104,30,earnings scheduled before the market opens tomorrow JMIA DHI AAP CYBR BNTX CRSR HAIN CRBP ROK CHFS ALT XELA AFMD MDWD CAE RDCM GLOG AER FULC BBDC GLOP VITL TCP GMDA RWLK DTIL NOVT SSKN PASG BSY RADA
1325821933653471234,2020-11-09 15:25:56+00:00,106,28,earnings after the close BYND NVAX TLRY NKLA INO NLS RNG NCLH EXPI OXY PEIX ELY ZI WPM DHT NBIX FLGT WTRH WATT APPF MBII VUZI ZIXI XPER MWK GAIA MGNI SNCR EVFM APEI VERI REED SCSC TLND ADMP SWAV RAMP CCXI NHI
1325042541436280832,2020-11-07 11:48:54+00:00,742,295,earnings for the week PLUG WKHS CGC DKNG BYND MCD ACB RKT SPG JMIA NVAX TLRY NKLA DDOG CSCO DHI WIX CARS AMAT DIS INO GRWG NLS AAP DOYU RNG PRTS NBEV LMND TGNA WVE EXPI PRTY ICPT HUYA GOGO NCLH OXY PEIX CYBR
1324749811741020163,2020-11-06 16:25:42+00:00,152,38,Monday morning earnings PLUG WKHS CGC MCD SPG ACB CARS TGNA WVE PRTS PRTY GOGO MTBC ICPT NBEV HL ALE TXMD AVDL IVR KOS ITCI BCOR URGN GFN SMTS BIP PWFL GSL SOHO STXS EQX TH BKI GLT MCRB FPI TSQ CCO III KLR BTU
1324428308340244480,2020-11-05 19:08:10+00:00,71,10,Bigger than usual earnings moves today from REZI UPWK HBI ODP BLUE WK IIPR WSC TTGT YETI CRON TECH MTW QCOM PING WNC PAAS SRCL
1324405825398546432,2020-11-05 17:38:49+00:00,72,16,Friday morning earnings CVS VIAC ENB COTY MAR AMRX HSY MBUU IMGN IEP AES INSW CNTY ELAN TU DISH CWT VIRT EPZM SSP MYL MGA ZBH PLYM PRIM DOC NOG LNG GOLF HMSY SABR GWRS ETM AMPH VTR PFSW SHEN HPR PAR WPR MOG A
1324389346909237250,2020-11-05 16:33:20+00:00,107,31,earnings after the close SQ ROKU PTON NET SPCE TTD DBX UBER AYX TTWO EA TMUS BIGC STMP RUN HEAR INSG ZG GRPN GPRO NVTA HUBS GLUU WYNN BKNG EBS MNST BLDP HLF DVAX PFSI RDFN FLDM APPN BGS TNDM PLNT AAXN REGI XPO
1324081183190360064,2020-11-04 20:08:48+00:00,60,12,Bigger than usual earnings moves today from TRHC SMCI SUPN ALLO ANDE RCKT CLW AKR INN PSN HLT ASTE BTG HTA OCFT MRCY NBR ORA
1324059669170659336,2020-11-04 18:43:19+00:00,3,0,DBX is after the close tomorrow
1324058921749958658,2020-11-04 18:40:21+00:00,3,0,watkins NIO reports 11 17
1324056284920991752,2020-11-04 18:29:52+00:00,116,40,earnings before the open tomorrow BABA GOLD GM AZN BMY PZZA REGN AMRN CRON YETI TEVA CI KL AG AAWW STNG HEAR AEIS ADAP VSTO DUK GOOS NXST RGEN BCRX CLVS APT IIVI ZTS INCY ALNY BLL CNK AGIO CAH WMS NTDOY TREE D
1324033927858802692,2020-11-04 17:01:02+00:00,268,29,I don t know who needs to hear this but it is still earningsseason
1324031258951847937,2020-11-04 16:50:26+00:00,95,29,earnings after the close QCOM ZNGA MELI UPWK QRVO MTCH PAYC GDDY ET EXPE MRO ACAD TTOO PRGO FIT PLUS ELF HOLX PAAS AWK STAA VRSK FNF JKHY CF QLYS APA MNKD SMSI ANSS SCPL PODD ANIK QTWO PING KGC OSUR AXNX QRTEA
1323717304094437381,2020-11-03 20:02:53+00:00,48,9,Bigger than usual earnings moves today from INSP GWPH ESPR SEDG HALO TCPC IT CTLT OXFD DOOR MATX OPCH NSIT RACE ONTO KMT NTR LPX
1323706163427508224,2020-11-03 19:18:37+00:00,76,20,earnings before the open tomorrow WEN SMG HLT BBSI PFGC IONS HLNE AVA BWEN SBGI FUN PRGO ALLO DNOW ES CCJ RDWR CIM GLDD CECE ALLT IMXI TA VST AHCO VRT HAE ENBL ASC GMAB PSN ASTE CLH TAC
1323670516759252992,2020-11-03 16:56:58+00:00,82,29,earnings after the close GWPH PRU BTG MRCY NBR TRHC SUPN HRZN CHCT CLW CC ACOR CORT HTA DS Y MCY SMCI KAR AKR FPRX OMP DAR ANDE ORA TX HBM FSP LFVN NP WTTR CPTA NEX RYAM METC TREC PAYS BRY OCFT AVGR INN NR
1323354722233888770,2020-11-02 20:02:07+00:00,52,13,Bigger than usual earnings moves today from EIGI PARR LL MPC AMCX CNA QTNT MPLX RGS NNN CDW WM
1323319351089528832,2020-11-02 17:41:34+00:00,95,36,election morning earnings W HUM RACE MCK CTLT BHC AGCO SYY BLD SPR KOPN EXPD LPX ZBRA LGIH HSC WEC GCI EMR TRI JCI FOXA NSIT ETN BMCH JELD EXC TTI VSH ALLO AVNT ARCB RCM IT ATH AROC VPG BBU RHP OPCH WBT STAR
1323297973481197570,2020-11-02 16:16:37+00:00,98,34,earnings after the close PYPL SWKS SEDG CPE AMC ANET MDLZ CRUS O FANG RIG FRPT AMRC RMBS ESPR TREX EVER JAZZ MED ICHR ADTN PINC OMI SBAC ADUS NPTN MIME HALO FN DOOR AWR ONTO MOS KFRC MATX FMC EVRI SIMO STRL JCOM
1323234148853665792,2020-11-02 12:03:00+00:00,0,1,PLUG has now scheduled earnings for Monday before the open
1323097327373078540,2020-11-02 02:59:19+00:00,123,40,Upcoming earnings releases with the highest volatility RYAM FLDM VRAY AMRX NPTN AMRS MTRX AQST EB YRCW CPLG PBPB TAST TRUE PAHC MR ARLO
1322876845340168192,2020-11-01 12:23:12+00:00,0,0,alkhalaf BMRN is 11 5 AMC and ETN is 11 3 BMO
1322535663540019200,2020-10-31 13:47:28+00:00,3,0,PLUG hasn t scheduled earnings yet so we now expect them to report next week
1322535104321912835,2020-10-31 13:45:15+00:00,1,0,christman Thanks sorry about that
1322530758796468224,2020-10-31 13:27:58+00:00,811,326,earnings for the week PYPL SQ BABA CLX ROKU W PTON QCOM WING SWKS CVS GOLD NET SPCE GM HZNP LL MPC AZN WM TTD EL DBX AYX ON ZNGA CWH AMCX MELI SEDG REGN CPE LDOS AMRN UBER BMY KPTI LITE HUM WEN BHC MCK CPLP
1322222855023710208,2020-10-30 17:04:29+00:00,104,27,Monday morning earnings CLX WING HZNP LL MPC WM EL ON LDOS AMCX LITE CPLP FE KPTI DEA NI USFD LCII MPLX BCC CRNT CDW CNA EGRX QTNT BWXT RGS TEN NNN INGR NERV PARR MGP HSIC ITRI XENT CCLP EXTN PLOW NSSC IAA JLL
1321856361500737539,2020-10-29 16:48:10+00:00,0,0,AB We fit 48 companies in this graphic SYK is ranked 56 in interest among our users this quarter There are more than 200 reporting after the close today
1321854975048339457,2020-10-29 16:42:39+00:00,86,27,Friday morning earnings ABBV XOM LGND HEXO CVX HON MO UAA CL LHX CHTR WY BAH GT PSX MGI OIIM FLIR FTS PEG CBOE NWL BR RUTH SJR PNW KKR WPC AXL LEA AON IPGP POR IRMD XHR ASIX MMP DSKE LYB WETF TIGO PNM ATRO
1321826406431625217,2020-10-29 14:49:08+00:00,185,57,FAANG earnings day AAPL AMZN FB TWTR GOOGL ATVI SBUX APPS CVNA OPK VRTX TEAM QDEL MGM FTNT X ZEN IPHI SKX BAND AUY WWE FIVN SHAK MVIS CAKE SGEN DECK BLDR LPSN OLED CAR STNE BE PFPT MPWR DLR CDNA KTOS FND ILMN
1321796831144194048,2020-10-29 12:51:36+00:00,44,5,PSA short interest in SPWR is at a record high and nearly double its previous peak in January 2019
1321795609603514368,2020-10-29 12:46:45+00:00,0,0,alkhalaf great 11 5
1321526221960843265,2020-10-28 18:56:18+00:00,64,8,Bigger than usual earnings moves today from CYH UVE CHEF MTDR SUM TUP AKAM CMRE DT EQR GWB FSLR HA LBRT HZO MA AAT GRA
1321525055357112320,2020-10-28 18:51:40+00:00,4,0,tx TWTR changed their time to after the close
1321524403050565634,2020-10-28 18:49:05+00:00,2,0,trader18 HOME is pre announcing third quarter results
1321491101342146561,2020-10-28 16:36:45+00:00,132,48,earnings before the open tomorrow SHOP MRNA NOK SPOT OSTK PENN KHC GPN RCL HOME BUD YUM FLWS NEM K CMCSA AMT ALXN RL APRN NVCR COOP MDC DNKN SNY TAP FIS TPX TROW PCG KDP CMS IDXX CHD BPMC CCC COP TPR BC RDS A
1321467503881629698,2020-10-28 15:02:59+00:00,121,27,earnings after the close FSLY PINS ETSY GILD V TDOC F EBAY LVGO NOW AMGN GRUB WDC ORLY VALE SPWR SU KLAC SFM SAVE EQIX EGHT URI PLXS FORM MOH UCTT GNMK AGI MUSA PTC CGNX AXTI NLY CDE PKI OHI CACI RCII AMED NOVA
1321169255245750276,2020-10-27 19:17:51+00:00,83,14,Bigger than usual earnings moves today from EXAS HOG BEN BHLB SSTK ARI ST RTX ROP FFIV TCF PCH SHOO LLY FBK ABG FIX DTE
1321138077243420673,2020-10-27 17:13:57+00:00,92,36,earnings before the open tomorrow UPS BA GE FVRR MA ANTM SNE SIX DT GNRC TUP MKTX YNDX GD BSX CME FCAU TMHC GRMN BX EPD TW PB IEX GHM ROL PERI ADP ILPT WYND HZO ETR EAT MKL NSC BCPC ERJ MAS OC BG SMP SITE DIN
1321112692107677697,2020-10-27 15:33:05+00:00,100,30,earnings after the close MSFT DXCM ENPH FSLR FEYE AKAM TWOU FISV OKE ZYXI BGFV DENN CB JNPR MKSI MASI UNM RARE TENB MXIM CSGP VECO EIX LSCC ATEN SWI AFL APAM CSV SPFI RRR RCKY EGP UVE CHRW FCPT HA MSTR SUM NCR
1321107382353670146,2020-10-27 15:11:59+00:00,1,0,NIO hasn t scheduled earnings yet but we expect the second week of November
1321086525074006021,2020-10-27 13:49:06+00:00,67,8,For those that have been asking BYND has now scheduled earnings for after the market close on Monday November 9 2020
1320766310679236610,2020-10-26 16:36:41+00:00,143,44,earnings scheduled before the open tomorrow PFE MM CAT LLY RTX SHW JBLU NVS MRK BP LH CROX HOG PII CNC GLW SQNS NEO MSCI XRX SPGI PPBI CMI SWK AUDC MSM COWN TECK TRU SMED QSR SSTK LECO ECL NXRT CAMT IVZ DTE ODFL
1320729053696057345,2020-10-26 14:08:39+00:00,130,43,earnings after the close today TWLO CHGG NXPI FFIV LRN AGNC AMKR BYD BRO PKG ARE CR MEDP PCH ACC FIX VRNS CE SSD KREF HSTM CINF NOV ARI PFG TCF HMST CVLG CATY FRBA HTLF TNET MC HLIT RBB QTS FIBK OMF TBI TGB WSR
1320679802072977408,2020-10-26 10:52:56+00:00,149,34,Upcoming earnings releases with the highest volatility DSKE ZVO SLCA DBD CASA CURO IVC AVID MGI ACCO APRN EXTR RUTH APPS OPK TBBK GSS RES
1320158421644173315,2020-10-25 00:21:09+00:00,0,0,Add some companies to your watch list that are reporting next week and we ll send that calendar to you tomorrow
1320138373202350081,2020-10-24 23:01:29+00:00,0,0,If you get our Saturday email it should show the corrected version
1320023289155227650,2020-10-24 15:24:11+00:00,2,0,alkhalaf CVX reports Friday morning
1320021378855305222,2020-10-24 15:16:36+00:00,4,0,BYND hasn t scheduled yet but we expect next Tuesday
1320019380240076801,2020-10-24 15:08:39+00:00,2,0,There are 346 companies currently scheduled to report on Thursday including SO
1320018841842442241,2020-10-24 15:06:31+00:00,178,43,Corrected for Thursday AAPL AMZN FB SHOP NOK TWTR MRNA SPOT GOOGL OSTK ATVI PENN APPS SBUX KHC OPK VRTX GPN BUD YUM
1320011022548279301,2020-10-24 14:35:27+00:00,4,0,Thanks
1320010887294484481,2020-10-24 14:34:54+00:00,12,0,Thanks corrected on our website
1320010582989340674,2020-10-24 14:33:42+00:00,4,0,Thanks guess we missed that
1320010206139527168,2020-10-24 14:32:12+00:00,3,1,Thanks our bad
1319977329972727810,2020-10-24 12:21:34+00:00,1977,673,earnings for the week AAPL AMZN MSFT AMD UPS FB SHOP BA HAS PFE SMPL MMM TWLO GE FSLY PINS NOK TWTR MRNA CHGG ETSY SAP CAT LGND FVRR SPOT GOOGL LLY GILD RTX TDOC OSTK V ATVI MA XOM ABBV HCA SHW F NVS NRZ MRK
1319642289472495617,2020-10-23 14:10:14+00:00,96,19,Monday morning earnings SMPL HAS SAP HCA NRZ BMRC BOH OTIS CBU AMG ARLP SI HBT KOP
1319341678487011330,2020-10-22 18:15:42+00:00,69,12,Bigger than usual earnings moves today from ALGN WBS RCI TSCO STL ORI SNA HBAN STC GTY TAL CRS LVS UNP T DFS MTB ARCH
1319320045219155968,2020-10-22 16:49:45+00:00,82,18,Friday morning earnings CLF AXP FHN ABB BLMN ALV ITW OFG GNTX GBX FHB AIMC CRI TRTN VRTS INDB SBSI SIFY CIVB
1319304318982508550,2020-10-22 15:47:15+00:00,79,30,earnings after the close today INTC LLNW EHTH SAM COF MAT VRSN STX ABCB CLGX SIVB BJRI VICR OZK WAL RBNC RHI USX MANH CYBE NXGN PBCT BMTC ASB BOOM CSTR GBCI HTH TFII WSFS ACBI FFBC AQMS RNGR MSBI ICBK EIG BY
1318985584094945281,2020-10-21 18:40:43+00:00,86,19,Bigger than usual earnings moves today from SNAP CALX FULT AGR CNI BKR PNFP KEY HWC NFLX WGO SLGN BOKF IRBT EVR AVY REXR WRB
1318935967303192577,2020-10-21 15:23:33+00:00,132,38,earnings before the open tomorrow T KO AAL LUV DGX TSCO FCX NOC CTXS PHM CHKP SAFE ALK STM DOW KMB DHR UNP POOL VLO SIRI LNN WST GWW AEP SON SNA ENTG NUE SASR WSO RCI AMRB SCHN MTB FITB ALLE RS BANC TPH TAL
1318925959114985479,2020-10-21 14:43:47+00:00,153,54,earnings after the close TSLA CMG LRCX XLNX WHR NTGR LVS CSX EFX ALGN KMI MTH DFS CCI EW UFPI VMI SLM SEIC HLX GGG FR GL CVBF WSBC SUI LSTR BCOV LOB WTFC CLB TRN ICLR EGBN TSC RUSHA STC INBK FTI TCBI BDN GSBC
1318605502201401346,2020-10-20 17:30:24+00:00,73,23,Bigger than usual earnings moves today from LOGI CMA BXS CCK UBS PNR IBM IQV TRV CBSH RF STLD volatility
1318573894501060609,2020-10-20 15:24:49+00:00,103,36,earnings scheduled before the market opens tomorrow ABT VZ ERIC WGO TMO NDAQ BIIB NEE NEP LAD AN KEY FBC SLGN BKR APH UNF KNX SCL NTRS CADE TDY EVR AVY BOKF HCSG IPG TZOO MANU USAP
1318551806922862593,2020-10-20 13:57:02+00:00,122,62,earnings after the close today NFLX SNAP TXN IRBT TER CALX WDFC IBKR NAVI CNI THC AGR WRB CSL USNA REXR STXB TCS PNFP HWC FMBI CFB HOPE NBHC UCBI PFC FULT DCT SMBK
1318199516470927362,2020-10-19 14:37:10+00:00,77,20,earnings before the open tomorrow PG LMT PM PLD LGND ACI SYF GPK TRV MAN CMA CP CATC CBSH RF SNV IRDM IQV UBS PCAR GATX PNR MBWM PEBO DOV SBNY NVR CTG CIT
1318184059386892288,2020-10-19 13:35:45+00:00,92,36,earnings scheduled after the market closes today LOGI IBM CDNS PPG ADC CCK STLD ELS ZION HXL WASH FNB BXS SFBS EFSC TBK PFBC
1317839865225072640,2020-10-18 14:48:02+00:00,3,0,The expected times are shown on our calendar at or by clicking on any of the names
1317839550262235137,2020-10-18 14:46:47+00:00,3,0,Imran We email it to you on Saturday with additional information and we send a personalized version on Sunday of companies in your watch list On Monday we send a newsletter with a monthly version
1317443728357937153,2020-10-17 12:33:56+00:00,1480,685,earnings for the week TSLA NFLX PG INTC LMT ABT KO T HAL SNAP PM VZ AAL ERIC LOGI WGO IBM PLD TMO CMG LGND LUV CDNS TSCO DGX LII NDAQ LRCX PHG BIIB CLF ACI ONB TXN SYF NEE GPK TRV SFNC FCX MAN IRBT CMA LLNW
1317058395845906433,2020-10-16 11:02:45+00:00,1,0,tech The arrows represent positive negative earnings announcements
1316741492589895680,2020-10-15 14:03:30+00:00,71,26,earnings to end the week ALLY ISRG SLB BK JBHT KSU TACO VFC STT MRTN CFG SXT BMI RIO
1316428196439564288,2020-10-14 17:18:34+00:00,75,16,If this correlation holds shares of HAL will open higher than it is currently trading on Monday after the company reports earnings
1316387203241725954,2020-10-14 14:35:41+00:00,114,35,earnings scheduled after the market close today and before the open tomorrow TSM APHA WBA MS UAL SCHW SNBR CMC AA TFC HOMB BCLI WNS THTX ACCD WAFD HCCI
1316027272382476289,2020-10-13 14:45:26+00:00,91,34,earnings scheduled before the market opens on Wednesday BAC UNH WFC GS PGR PNC ASML USB INFY
1315649311347298305,2020-10-12 13:43:34+00:00,133,49,earnings scheduled before the market opens tomorrow JPM JNJ C DAL BLK FAST EDU FRC AZZ WIT
1314918126463733761,2020-10-10 13:18:06+00:00,908,429,earnings season starts Tuesday JPM JNJ C BAC PGR DAL BLK UNH WFC GS FAST APHA WBA TSM PNC EDU FRC AZZ USB ALLY CMC MS ISRG UAL INFY AA SLB SNBR ASML BK HOMB TFC KSU MRTN BCLI STT JBHT VFC WABC WNS SCHW TACO
1314592078425460736,2020-10-09 15:42:30+00:00,22,1,Here s what we have confirmed so far for the NDX TSLA AAPL NFLX INTC FAST WBA FB ISRG QCOM MRNA ATVI LRCX CDNS TXN GOOG DXCM CHKP XLNX KHC REGN TTWO SIRI CMCSA ORLY EA ALGN AMGN CHTR CSX NXPI VRSN ADP PCAR FISV KLAC IDXX CTSH MXIM LBTYA
1313837824559415297,2020-10-07 13:45:21+00:00,63,15,earnings after the close today and before the open tomorrow with CCL added for its scheduled guidance announcement DPZ HELE AYI SAR EXFO RGP
1313478146918932485,2020-10-06 13:56:08+00:00,47,11,upcoming earnings RPM LEVI LW LNDC AYTU
1312346074615611393,2020-10-03 10:57:41+00:00,343,96,earnings for the week DPZ PAYX RPM HELE AYI LEVI LW LNDC SAR EXFO RGP
1311303262868512771,2020-09-30 13:53:55+00:00,60,23,upcoming earnings PEP BBBY CAG STZ NG GNFT
1310940813325733889,2020-09-29 13:53:40+00:00,56,15,earnings scheduled after the market closes today and before the open tomorrow MU PRGS SNX EPAC CMTL QK
1309808836488896512,2020-09-26 10:55:36+00:00,260,132,earnings scheduled for the week MU PEP MKC THO BBBY CAG WB STZ NTWK UNFI SINA PRGS INFO SNX PTN CALM ANGO EPAC NG CMTL SGH QK RLGT GNFT
1309129754176630792,2020-09-24 13:57:10+00:00,83,22,The remaining earnings releases scheduled for the week COST TCOM MTN CAMP AIR AIH SCHL FLR IBEX
1309128538096836608,2020-09-24 13:52:20+00:00,0,0,You can send an email to cancel com but really you just need to get us your email address either in an email private message or even a phone call 1 866 EPS GUID
1308764903902261254,2020-09-23 13:47:23+00:00,59,27,earnings scheduled after the market closes today and before the open tomorrow RAD KMX ACN DRI FDS BB JBL NTWK FUL DYNT
1308403679356162051,2020-09-22 13:52:00+00:00,85,33,earnings scheduled after the market closes today and before the open tomorrow NKE ACB GIS SFIX JKS KBH TNP CTAS WOR CNTG SANW
1308043209759653888,2020-09-21 13:59:38+00:00,45,15,upcoming earnings AZO NEOG QTT ERYP
1307270224278941698,2020-09-19 10:48:04+00:00,381,177,earnings scheduled for the week COST AZO NKE ACB RAD GIS KMX SFIX AYTU JKS FDS DRI ACN TNP KBH BB CTAS NEOG WOR JBL QTT CNTG TCOM NTWK MTN FUL CAMP SANW AIR AIH SCHL ERYP
1306263403762257921,2020-09-16 16:07:19+00:00,41,19,upcoming earnings CMD APOG OSH EARS
1306262822972780544,2020-09-16 16:05:00+00:00,2,1,Momentum is a cruel mistress taken from a NKE ad There are a number of versions floating around here s one
1305875466465808386,2020-09-15 14:25:47+00:00,62,16,FDX and ADBE are scheduled to report earnings after the market closes today and BRC is scheduled before the open tomorrow
1305518844719529984,2020-09-14 14:48:42+00:00,68,24,earnings scheduled after the market closes today and before the open tomorrow CBRL LEN ASPU DAVA ICMB VNCE HMY CSBR
1304742386745176064,2020-09-12 11:23:20+00:00,305,124,earnings scheduled for the week FDX ADBE CBRL ASPU LEN DAVA BRC CMD ISR APOG ICMB HMY VNCE CSBR EARS AFIB OSH
1304068012346142722,2020-09-10 14:43:37+00:00,103,39,earnings scheduled after the market closes today PTON CHWY ORCL PLAY ZUMZ LTRX LPTH FARM UEPS AMRK USAT VOLT RFIL VITL
1303718593037770754,2020-09-09 15:35:09+00:00,72,26,earnings scheduled after the market closes today ZS GME RH BIGC MEIP LAKE AVAV DSGX BBCP VRNT LMNR SLQT EPM NCNO
1303410801399803912,2020-09-08 19:12:05+00:00,116,49,earnings scheduled after the market closes today and before the open tomorrow WORK LULU COUP LOVE AEO HQY HDS CASY MCFT NAV REVG SCWX ABM PHR GIII CVGW ALOT AGTC SEAC VERX
1302941388347248641,2020-09-07 12:06:49+00:00,190,61,Upcoming earnings releases with the highest volatility FCEL GIII ZUMZ LOVE COUP REVG ZS MCFT ABM RH SCWX AEO VRNT GME QD AVAV LULU HQY
