id,created_at,favorite_count,retweet_count,text
1460425612129189888,2021-11-16 01:52:53+00:00,2,1,Group Intl Forward earnings estimates For WMT it means earnings estimates for the next fiscal year ending January 2023 have gone from 5 89 per share at the start of May to 6 65 now The arrows are positive negative earnings surprises which tend to change the direction of estimates
1460305520951181318,2021-11-15 17:55:42+00:00,123,40,earnings before the open tomorrow WMT HD SE JMIA NTES DAVA ARMK DG FUV AQUA DOYU HIVE OCSL GDS ITRN RSKD DAO ESEA BNR ECC CWCO GFF MDWD AUVI VOD AIH REAX ONON OMQS IPHA LILM
1460265320359333898,2021-11-15 15:15:57+00:00,75,36,earnings after the close LCID GMBL POWW IDEX AAP DM AXON QFIN MARK DNMR ETON PLBY RMO JJSF RXT ZEV RKLB EVFM XSPA GOEV API DRIO EDR BITF SLGG BOD COOK AYTU IBIO RKDA TALK MVST LUNA ATCX GNLN VERB NEPT FPAY LGIQ
1460236810269908998,2021-11-15 13:22:40+00:00,14,3,It is a bull market
1459501458840240129,2021-11-13 12:40:38+00:00,837,355,earnings for the week BABA NVDA WMT TSN TGT HD LCID SE RAIL M AMAT LOW BIDU JD OEG GMBL ZIM OTLY CSCO HHR POWW RMBL TJX KSS FL STNE BFLY WMG IDEX JMIA KLIC SONO ACM IQ BILI VBLT PTN KALA NTES CSIQ CMAX AAP
1459176033727483937,2021-11-12 15:07:31+00:00,91,32,Monday morning earnings TSN RAIL OTLY OEG BFLY HHR RMBL WMG ACM KALA TRVN VBLT CMAX GREE URGN SOHU TLS YOU AVPT PTN PLX ACRX MLSS PHGE PRTH BMTX BCU VVNT IMPL AREC INFU ATAI ADN CVSI GMDA ONDS BDSX CLSN AMPY DDL
1458860305526792206,2021-11-11 18:12:55+00:00,50,6,Bigger than usual earnings moves today from FIGS BW THRY ROOT BZH BMBL LTRX EPC HARP DHX MSP STNG CAE NICE DIS BHG LIFE SOFI
1458836142065860611,2021-11-11 16:36:54+00:00,76,17,Friday morning earnings AZN CPNG rescheduled SOHO TH PRPH SPB MDNA HYZN GP CASI SDPI MOTS PLXP NYC ITRM CIR VIVO VERO ROLL NGD BPTH TLMD WRBY CAAS USWS RCMT EFOI EMAN FMTX CGEN CRKN FLUX SVIA BRLT OTMO FXLV NEXI
1458821695293304836,2021-11-11 15:39:30+00:00,0,1,usa Diagnostics Sorry we missed CPNG rescheduled earnings to tomorrow morning
1458813744704806914,2021-11-11 15:07:54+00:00,110,30,earnings after the close BLNK SNDL CPNG LAZR RIDE SFT PHUN KRUS CODX PAGS ARRY GAN BEEM XAIR WATT FLO AVIR PVG AQN OPGN JAMF BLFS AEYE AFIB APYX ALTG IRIX IPW ASTR APTO RSSS HYFM LHDX ORGN HYMC XPOF ONTX LIDR
1458811991762550794,2021-11-11 15:00:56+00:00,1,1,C Omega solutions We do cherry pick a little but we just don t want to include 20 images in a single post No whisper for several but we were closer to reported results than the consensus on all but FUBO we expected a miss when the company beat but guided lower
1458487790602264577,2021-11-10 17:32:41+00:00,41,9,Bigger than usual earnings moves today from RNG MCRB PUBM SAIL PDFS SGFY LPRO SHLS PRPL HYLN OLK FTCI FUBO VERI SWIM FOUR VZIO EYE
1458486525449146369,2021-11-10 17:27:39+00:00,6,1,Inc Interest among our users is 14 times greater for SOFI than FIGS
1458469788750159873,2021-11-10 16:21:09+00:00,89,32,earnings before the open tomorrow GRWG PSFE MT HUT YETI WIX CELH TPR WB TXMD BAM UTZ AZUL CAE NICE SBH LIQT SANW OGN MYTE SPH STNG BHG EPC AMTX RWLK RDCM CRC VPG VNRX ALYA STXS PCT BGRY PGTI DCBO IMV TRMR THRY
1458457208006533125,2021-11-10 15:31:09+00:00,107,30,earnings after the close SOFI DIS WISH AFRM BYND OPEN TTCF PROG ROOT GEVO BMBL MQ GDRX HIMS FIGS APPH MBII ADMA HNST BROS TASK SDGR KGC LEV RRGB BRKS ZIP RSI AMWL SMSI ISR LX APP ENS LIFE KMPH MRVI IZEA COMP
1458424317251932162,2021-11-10 13:20:28+00:00,10,2,CSPR reports earnings after the close on Monday November 15
1458423852615274497,2021-11-10 13:18:37+00:00,24,4,What do you think Long or short CSPR ahead of earnings next week after PRPL s results yesterday
1458142122310344705,2021-11-09 18:39:07+00:00,46,7,Bigger than usual earnings moves today from RBLX CMPS NEWR TCMD NVTA AMRS OSH FRPT FIVN BHVN NEWT CSII FSP TREX MWA HAE BEKE VGR
1458126229136150541,2021-11-09 17:35:58+00:00,84,35,earnings before the open tomorrow FVRR WEN AFMD MCFT MNDY PFGC FOUR ENR GSL KRNT ARCO BIOX NMM EYE GIB BBDC WISA AER EVGO PRGO WWW RPRX XERS KELYA MSGS BTAI DFH VYNE VERX HOOK MCRB FLOW STKL CERE FTCI ASC WVE ALT
1458097184587534350,2021-11-09 15:40:33+00:00,165,45,earnings after the close COIN NIO UPST FUBO PLUG U WYNN DASH PRPL ELY PUBM ACB DOCS FLGT VRM RNG HYLN GLBE CARG DNUT POSH SKIN INO SAIL FC TWOU DAR JAZZ NLS VET GOCO ABCL ALTO AEMD TWNK HYRE PAYS CCXI WTER AVID
1457813344417730560,2021-11-08 20:52:40+00:00,60,10,Take note when a stock reacts favorably to negative news Treehouse Foods THS is up today after reporting a miss and providing quite ugly fourth quarter guidance but yet there just doesn t seem to be any sellers below 35
1457796688559497216,2021-11-08 19:46:29+00:00,38,10,Bigger than usual earnings moves today from TTD EHTH KDNY CPLG VSAT PRVA RDUS BEAM GTES EDIT BKI AVDL TGLS USFD PSEC THS
1457758601720832007,2021-11-08 17:15:09+00:00,194,53,earnings before the open tomorrow PLTR BNTX WKHS OCGN DHI UWMC SYY HUYA SEAS VFF PRTY AGEN MSGE PRPL IIVI IGT CAH MLCO FREE BHVN HGV XPEL KNDI VITL CEVA ADT CORR WRK MIDD HAIN CTG EPZM HAE STWD SELB ITCI MRSN TAC
1457739264507224068,2021-11-08 15:58:18+00:00,162,54,earnings after the close PYPL AMC RBLX CLOV SPCE LMND SDC ZNGA DDD TRIP ME NVTA ATER REAL BLDP FIVN AMRS LOTZ DAC TREX BAND SWAV ACAD CBT CARA WPRT CLAR MTRX IFF FRPT SQSP BEKE PRTK UEPS FSK JKHY BRP APPF RCEL
1457326816465719302,2021-11-07 12:39:23+00:00,3,2,Group There are 145 companies scheduled after the close on Wednesday This calendar shows the top 10 based on interest among our users BROS is number 26
1457326090876334080,2021-11-07 12:36:30+00:00,2,1,Group We haven t gotten a date yet for DGLY It will probably be next week
1457325302368161796,2021-11-07 12:33:22+00:00,3,1,Group We haven t gotten a date yet from We expect RIOT to report next week
1456989971408117762,2021-11-06 14:20:53+00:00,1,1,Inc not at the moment
1456989646869569541,2021-11-06 14:19:36+00:00,1277,493,earnings for the week PYPL PLTR TTD AMC BNTX NIO COIN UPST SOFI DIS FUBO COTY WKHS PLUG WISH RBLX CLOV TSEM SPCE GRWG LMND VTRS AFRM VAC USFD OCGN SDC FVRR PSFE DDD NSSC ZNGA OPEN MT EHTH WEN DHI BYND EDIT GTES
1456624039590498306,2021-11-05 14:06:48+00:00,76,21,Monday morning earnings TTD COTY VTRS VAC TSEM USFD EDIT EHTH NSSC GTES TGLS HLIO KOS AXSM RDNT RETA PSEC NERV BKI THS PRVA ATRO LINC WOW AVDL MTNB RDUS CECE OCN LNSR CTRE FA XPRO BRAG
1456580739353432074,2021-11-05 11:14:44+00:00,1,1,
1456580624538644484,2021-11-05 11:14:17+00:00,25,4,Just a reminder
1456572531360641026,2021-11-05 10:42:07+00:00,0,0,
1456566400533811200,2021-11-05 10:17:46+00:00,67,14,For those that have been asking BABA has scheduled earnings for Thursday November 18 2021 before the open
1456335811495006208,2021-11-04 19:01:29+00:00,0,1,AAON
1456333222401486850,2021-11-04 18:51:12+00:00,45,11,Bigger than usual earnings moves today from IMMR UPLD QRTEA RMNI MRNA SGMO RCII PENN MTTR DISH CCRN PLNT QRVO ATGE NKLA MGNI QTWO SSYS
1456293075689648133,2021-11-04 16:11:40+00:00,96,30,Friday morning earnings DKNG CGC XELA GT ENB CNK GOOS MGA D NOG AMCX GRPN JCI KIM HMC INTT AXL FLR ELAN GLP SSP BEP VST TEN FET SRE DSEY ESNT CNTY PAYA PNW TRP BBU DOC HE HSON NPO TIXT AMR MFA ECOL TILE OFS
1456269792323588096,2021-11-04 14:39:09+00:00,157,52,earnings after the close SQ PINS UBER ABNB PTON MELI NET RKT NVAX BNGO SWKS FTNT OXY DDOG RUN FSLR DBX CVNA DVAX SHAK EXPE EOG MCHP BIGC CLNE FNKO QDEL MNST BE RDFN LTHM ATUS GPRO BILL MP APPN AIG AMN LLNW LYV
1455964357351903236,2021-11-03 18:25:27+00:00,29,6,Bigger than usual earnings moves today from PLTK CRTO KPTI ZG PRG ATVI CERS BCRX TCS SGRY MDXG LIVN FMC CPRI MG SMG EXEL CRL
1455918939016503301,2021-11-03 15:24:59+00:00,71,18,earnings before the open tomorrow MRNA PENN VIAC NKLA GOLD REGN W HIMX LSPD BLDR DOCN CI VSTO CYBR LNG PWR RGS PLNT K ERJ FIS DISH PZZA CARS DNB DUK MBUU CTXS AHCO VMC GEO EPAM CHH ABC APD BXRX IRM LITE ABUS SO
1455902359532548097,2021-11-03 14:19:06+00:00,67,23,earnings after the close ROKU QCOM SKLZ ETSY FSLY MRO ET SPWR APA MGNI TTWO CLR EA SAND QRVO MGM FSR CAKE HUBS MTTR ALB BKNG CDEV PXD CPE GDDY RVLV MAXR ASXC CF AVNW ICLR MATX RCII INSG SWN KTOS CTVA SRPT ARAY
1455651562366373904,2021-11-02 21:42:31+00:00,2,1,BABA has not scheduled earnings yet We expect mid November
1455650898978476037,2021-11-02 21:39:53+00:00,1,1,tx
1455578972255817728,2021-11-02 16:54:04+00:00,49,16,Bigger than usual earnings moves today from CAR CHGG CEIX ANET HSC UAA ADCT SABR CVI NBIX BWXT SKT EXTR GPN IAA LXU LGIH IART
1455564898562453511,2021-11-02 15:58:09+00:00,113,29,earnings before the open CVS NCLH BCRX EXPI MAR CWH DISCA AUPH CPRI FUN CVE WING AMRN SMG ATY AAWW HUM SPR HZNP SHOO TUP CLVS LL SUN IONS GTHX SID BWA EAT EVRI CDW MCS EXC CRL PBI RADA VSH ATH HFC EMR JLL ETR
1455539720813957133,2021-11-02 14:18:06+00:00,92,29,earnings after the close APPS ATVI ZG DVN TMUS BGFV LYFT AMGN TX SEDG XPO VRTX AYX AMED MTCH CZR EXAS OKE AKAM PAYC AGRX GRBK MDLZ PACB EGHT OVV LSCC CRK FNF WU HALO SPT AWK EXEL DENN PRTS COUR PRU ZYXI AMCR
1455215761555959818,2021-11-01 16:50:48+00:00,43,5,Bigger than usual earnings moves today from LDI BEN ON AMG AKTS UUUU
1455213745819488263,2021-11-01 16:42:48+00:00,1,1,plc Careers WMB
1455196439458496514,2021-11-01 15:34:02+00:00,90,36,earnings before the open tomorrow PFE CRSR BP UAA COP GNRC EPD RACE EL MPC LPX ARCB GPN CTLT RL BLMN MPLX IDXX NRZ CMI BHC ZBRA IT MGY ESPR DD KKR APO ETN AME MIME ADCT ROK TECH INCY LIND BCC SAGE LGIH IEP LEA
1455193469526413313,2021-11-01 15:22:13+00:00,0,1,BABA has not scheduled earnings yet Likely mid November
1455176813131538434,2021-11-01 14:16:02+00:00,0,1,SKT
1455175558833311759,2021-11-01 14:11:03+00:00,0,2,Note we had COIN wrong
1455175134805958662,2021-11-01 14:09:22+00:00,3,0,BABA has not scheduled earnings yet but we expect some time mid November
1455174822481309700,2021-11-01 14:08:08+00:00,3,0,tx We did not miss DDOG They report after the close on 11 4 as shown at along with 268 other companies This calendar shows the top 10 based on the interest of our users DDOG is 12
1455169301720313856,2021-11-01 13:46:11+00:00,85,27,earnings after the close FANG CHGG CAR RIG NXPI CLX MOS ZI SPG NTR ANET O WMB BSM CRUS RMBS HOLX PSA ADC CVI VNOM FN CSWC AMRC MCK SBAC ADTN TA ADUS VRNS RHP EVER BRX DZSI NSP BRKR AWR GXO GAIA IPI BWXT HLIT
1454982727179063298,2021-11-01 01:24:49+00:00,175,35,The inevitable decline in growth is upon us SPY SP500 earningsgrowth revenuegrowth
1454600916414382080,2021-10-31 00:07:38+00:00,4,1,tx We email it out on Saturdays to free members
1454578546870005760,2021-10-30 22:38:44+00:00,3,1,cush93 Yes positive negative volume on the left earnings estimates shaded in gold
1454562312543682562,2021-10-30 21:34:14+00:00,0,1,Thanks
1454560592296136711,2021-10-30 21:27:24+00:00,6,1,will publish its third quarter 2021 shareholder letter including financial results on its Investor Relations website at on Tuesday November 9 2021 at approximately 1 00 p m PT
1454558023989567489,2021-10-30 21:17:11+00:00,117,20,Sorry Coinbase COIN reports after the close on 11 9 We inadvertently went by the press releases for COIN NE which reports earnings before the open on 11 5
1454413342412529667,2021-10-30 11:42:17+00:00,1017,407,earnings for the week SQ PFE ROKU MRNA PINS ON DKNG UBER COIN APPS QCOM CRSR PENN SKLZ PCG CVS TRVG CRNT ABNB ATVI MRO MELI DVN FANG BP PTON CGC VIAC AMG FSLY UAA EPD ET NET AKTS ZG GNRC ALX CNA TMUS SKC RIG
1454115751875555334,2021-10-29 15:59:46+00:00,43,7,Bigger than usual earnings moves today from CDNA ATEN ASPN ZEN X SPSC FTDR HVT KMPR DVA SBUX WERN LMAT VRSN ASIX TFII GWW HLI
1454098093855629315,2021-10-29 14:49:36+00:00,78,23,Monday morning earnings ON PCG CRNT TRVG AMG CNA ALX SXC TKR JELD LDI OIS ENBL BEN WTRG SBT CHT AKTS
1453771919417913347,2021-10-28 17:13:30+00:00,38,11,Bigger than usual earnings moves today from LC PRLB PI ALNY OSTK MXL CYH ATI UCTT SWI SU DBD WEX TTMI NOC NVT ALDX ORI
1453759750424891392,2021-10-28 16:25:08+00:00,104,28,Friday morning earnings XOM ABBV CVX RCL HEXO HUN PSX CL WY CCJ CHTR LYB AON IMO LHX GWW CERN RUTH B CBOE MGI SJR ASIX BAH COWN IMGN SHLX NWL POR FTS WETF LAZ SIFY DCOM OIIM SLCA CHD PNM WPC IRMD ABR PIPR
1453758641148997632,2021-10-28 16:20:44+00:00,2,1,yes X is today
1453758531597914115,2021-10-28 16:20:18+00:00,2,0,X today PITTSBURGH BUSINESS WIRE United States Steel Corporation NYSE X U S Steel today announced that it will release financial results for the third quarter 2021 on Thursday October 28 2021 following the close of trading on the New York Stock Exchange
1453731230977953794,2021-10-28 14:31:49+00:00,161,48,earnings after the close AAPL AMZN X SBUX SKX WDC GILD TEAM VALE MSTR DECK DXCM ZEN COHU AUY SM TFII SYK GLPI TXRH KNSL AVTR FTV ATEN VRSN HTGC COLM BIO STAG AVT MVIS SPNE CDNA TEX MPWR SGEN SKYW FE POWI EB
1453418434717491201,2021-10-27 17:48:52+00:00,50,4,Bigger than usual earnings moves today from ENPH SLAB FISV GRMN CSTM SIX MAS TMHC EQNR COF ROL V HPP WSBC JNPR HA PAG FBC
1453404935543001101,2021-10-27 16:55:14+00:00,97,32,earnings before the open tomorrow SHOP MA CAT NOK MRK OSTK MO DQ BUD YUM CMCSA SIRI AMT RDS A NEM CHKP RS FLWS SWK HSY BTU TAP TPX STM MDC TREE AVNT TROW ADS NOC CNX CARR IMAX SNY LH OSK SAH CBRE AEP AGCO SNDR
1453367837851062279,2021-10-27 14:27:49+00:00,92,33,earnings after the close F TDOC TWLO NOW EBAY ALGN UPWK LC SU AR XLNX NLY IRBT KLAC SNBR MKSI URI CCS YUMC EW SIMO VICI BMRN CTSH BOOT ORLY NTGR AEM UCTT AFL MXL ALSN RJF EQT NOVA NOA TROX SAVE CACI EXR ALGT
1453088802973573120,2021-10-26 19:59:02+00:00,0,1,alberto CSGP reports after the close today
1453043671494975498,2021-10-26 16:59:42+00:00,43,10,Bigger than usual earnings moves today from PERI CVLT TPB LMT MEDP CR DAN XRX PJT PII GLW SPGI MYOV UHS CDNS HUBB RNR TBI
1453024798276194307,2021-10-26 15:44:42+00:00,118,40,earnings before the open tomorrow BA GM KO MCD SPOT BMY SIX TEVA TMO FISV TECK KHC HOG UMC HLT BSX R HES TDY CSTM ADP CME IP DT GRMN GD PAG NSC BG CHEF APH ODFL TMHC RES AIT TEL SLAB MAS OC CAMT ARES AVY VRTS
1452996574674657298,2021-10-26 13:52:33+00:00,124,38,earnings after the close AMD MSFT GOOGL V TWTR HOOD ENPH TXN QS BYD TER FFIV COF RRC MTDR JNPR AHT AGR WIRE NAVI HA AMP DLR CHRW CSGP NOV BXP IEX CB FBHS HT ACCO NCR TENB NBR FRBA APAM USNA WKR UDR EGP LFUS
1452804233028374532,2021-10-26 01:08:15+00:00,44,5,Whaddya think That short squeeze over yet for AON ahead of its earnings release on Friday
1452712739605028865,2021-10-25 19:04:41+00:00,99,22,earnings before the open tomorrow UPS GE MMM LMT JBLU WM RTX HAS LLY SHW PHM GLW ADM PII CNC NVS PERI MSCI ECL UBS XRX PCAR TRU SPGI CEQP CIT TRTN ENTG SSTK ARCH AAN ABG MMYT PNR FRME HUBB HZO IVZ ST ARCC GPK
1452645462968782859,2021-10-25 14:37:21+00:00,121,38,earnings after the close today FB LOGI PKG CCK AGNC CDNS BRO AMKR PETS CALX PCH SLP ACC CR AXTA SUI AIN MEDP UHS ARE OI TBI TNET HSII EFSC ARI SSD CATY BDN KREF HMST BXS UFI RNR IBTX LXFR HTLF HSTM FSBC HOPE
1452582601940733952,2021-10-25 10:27:34+00:00,96,27,Upcoming eanrings releases with the highest volatility AAN SM DBD RBBN ATEN BCOV COHU IMGN TBI BTU CHEF SPNE MD MGI QS EB TVTX RES
1452251396401664008,2021-10-24 12:31:29+00:00,3,1,There are 142 companies scheduled to report earnings before the open on Thursday This calendar shows the 10 most watched this quarter TAP is currently 22
1451890953468448770,2021-10-23 12:39:12+00:00,2,2,Bing4All Global MO will host a live audio webcast on Thursday October 28 2021 at 9 00 a m Eastern Time to discuss its 2021 third quarter business results Altria will issue a press release containing its business results at approximately 7 00 a m
1451888705040433156,2021-10-23 12:30:16+00:00,1415,550,earnings for the week AAPL AMZN FB AMD MSFT GOOGL UPS BA SHOP F GM GE XOM V OTIS TZOO TWTR KO MA MMM X LMT CAT ABBV MCD KMB JBLU BMY SBUX TDOC SPOT LII RTX ENPH CVX HOOD MRK WM QSR HAS MO PKG TXN LLY TWLO
1451634332595073025,2021-10-22 19:39:29+00:00,93,20,upcoming earnings releases with the highest increases in expectations SPGI KLAC QS ENTG EBAY LC MO CCK CALX KHC HUN AR FISV AVNT BOH CCJ OTIS HAS
1451616671781818385,2021-10-22 18:29:18+00:00,55,19,Bigger than usual earnings moves today from CLF SNAP INTC AXP STX WRB USX SMPL GNTX FFIN SIVB CSL
1451586604179599361,2021-10-22 16:29:50+00:00,79,32,Monday morning earnings TZOO OTIS KMB LII QSR SITC BOH BMRC DORM CBU NWE LKFN HBT FBP AUB HSBC IBA
1451238717486768140,2021-10-21 17:27:27+00:00,36,11,Bigger than usual earnings moves today from IBM THC OMF AN KMI POOL SON DFS NUE EEFT RUSHA UFPI ALLY SNA GPC TSCO REXR TCBI
1451213351057494018,2021-10-21 15:46:39+00:00,68,22,Friday morning earnings CLF AXP SLB HCA HON STX VFC SMPL ALV RF ROP DSKE GNTX AIMC FHB INDB
1451190408885653505,2021-10-21 14:15:29+00:00,97,30,earnings after the close today SNAP INTC CMG SAM OLN MAT WHR CE BJRI SIVB CSL VLRS BOOM PINE RHI WRB VICR OZK USX ASB PBCT CSTR WAL GBCI WSFS TRST PSTV FFBC MYFW BCBP SGLB KB SRCE
1450897034731565059,2021-10-20 18:49:44+00:00,45,7,Bigger than usual earnings moves today from BKR HCSG NDAQ KNX HWC CNI FULT ANTM WTFC MTB LRN UCBI ASML CMA VZ BOKF OMC ABT
1450854309407727619,2021-10-20 15:59:57+00:00,82,24,earnings before the open T AAL NUE CROX FCX LUV VLO BX ALLY DHR TSCO DOW AN ALK UNP SCHN SAP POOL DGX ABB SNA KEY HRI IQV GTLS EEFT GPC RCI MMC SON SAFE BHLB TPH LMN HOMB BANC FAF PDS ALLE IPG EWBC BKU PPBI
1450836206477004807,2021-10-20 14:48:01+00:00,3,1,Morgan GGG There s probably some support at 69 which isn t drawn
1450832837586923526,2021-10-20 14:34:38+00:00,100,36,earnings after the close TSLA LRCX IBM LVS KMI CSX CCI PPG THC HPQ DFS OMF EFX XM KALU UFPI LSTR CVLG GGG STL FTI SLG SLM BANR VMI REXR TBK HLX EGBN RUSHA GSBC TSC RLI UMPQ PFBC HBMD SEIC FR TCBI MMLP INBK FR
1450482526636724232,2021-10-19 15:22:37+00:00,122,28,earnings scheduled before the open tomorrow VZ ASML WGO ABT NEE NDAQ ANTM BIIB LAD CP BKR TZOO KNX MSM NEP DB UNF CFG CMA FHN MTB WSO FCFS SCL NTRS MKTX BPOP USAP OFG BOKF HCSG AKZOY
1450462301149179905,2021-10-19 14:02:15+00:00,118,51,earnings scheduled after the market closes today NFLX UAL ISRG WDFC IBKR CNI MRTN LRN OMC FULT HWC WTFC UCBI SMBK NBHC AMX EQBK
1450128906359541763,2021-10-18 15:57:28+00:00,93,27,earnings before the open tomorrow JNJ HAL ERIC PG SI PM BK MAN KSU SYF TRV IRDM DOV FITB CATC SBNY SNV CBSH MWBM ONB FMBI
1450116185341759496,2021-10-18 15:06:55+00:00,74,22,earnings after the close today STLD ZION HXL PACW SFBS FNB ELS FBK CFB SAND
1449364629994590215,2021-10-16 13:20:30+00:00,9,1,Dollars is wrong then From the company Tesla will post its financial results for the third quarter of 2021 after market close on Wednesday October 20 2021
1449336624014401539,2021-10-16 11:29:13+00:00,1038,428,earnings for the week TSLA NFLX JNJ CLF SNAP VZ ASML T INTC HAL ERIC NUE UAL PG STT LRCX STLD AAL SI ACI FCX WGO ABT CROX ISRG PM LUV PHG AXP CMG NEE KSU MAN ALLY BX NDAQ VLO LVS BK SYF SAM IBM ANTM DHR AN
1449092875623542786,2021-10-15 19:20:39+00:00,44,7,Bigger than usual earnings moves today from DCT AA JBHT GS WAFD TACO
1449009868841566210,2021-10-15 13:50:48+00:00,51,13,Monday morning earnings STT ACI PHG GNTY
1448647554250338304,2021-10-14 13:51:06+00:00,99,20,earnings to end the first week of earnings season GS AA SCHW JBHT PNC PLD TFC DCT SXT TACO BMI WAFD KARO RIO
1448283245368561668,2021-10-13 13:43:28+00:00,107,31,earnings scheduled after the close today and before the open tomorrow TSM BAC WFC C MS UNH WBA DPZ CMC USB GMBL PGR ETWO
1447950002060419076,2021-10-12 15:39:16+00:00,138,30,and so it begins earnings earningsseason JPM DAL BLK FRC INFY WIT SGH THTX PNFP SOTK
1447197815004880899,2021-10-10 13:50:21+00:00,13,7,XLF
1447197468383490079,2021-10-10 13:48:58+00:00,1,1,Thanks for the shout out
1446827525603213313,2021-10-09 13:18:57+00:00,409,188,earnings for the week JPM TSM DAL BAC BLK WFC FAST WBA C DPZ UNH AZZ MS CMC SGH AA FRC USB GS INFY SCHW WIT PNC JBHT THTX PLD TFC PNFP DCT WAFD SXT TACO GMBL BMI PGR SOTK ETWO
1446209756297895936,2021-10-07 20:24:09+00:00,2,1,Global They are guessing as are we when we put 4 05 PM on 10 20 at TOS is using conference call time while we use time of the release but they haven t scheduled it yet so it is just a guess We ll put a checkmark next to the date once it is confirmed
1446089256317984770,2021-10-07 12:25:20+00:00,831,298,Confirmed earnings for October AAPL JPM TSM FB NFLX SNAP CLF BAC DAL SQ PFE BLK WFC WBA INTC GOOGL F C DPZ UNH GM JNJ MS T NUE CMC AA TWTR BA QCOM LRCX FYI AMZN TSLA AMD BABA MSFT have not scheduled earnings yet
1445765421634768900,2021-10-06 14:58:32+00:00,67,9,upcoming earnings TLRY LEVI LW CAG HELE RGP TNP
1445423578657214472,2021-10-05 16:20:10+00:00,49,9,earnings after the close today and before the open tomorrow STZ AYI RPM SAR
1445137884323975169,2021-10-04 21:24:55+00:00,2,1,Companies report quarterly results and tend to report two to six weeks after the close of the quarter which means most companies will report next from mid October to mid November Companies reporting in late September and early October generally had a quarter end in August
1444232786118840322,2021-10-02 09:28:23+00:00,176,72,earnings for the week PEP TLRY LEVI STZ LW RPM NAPA AYI SAR CAG CMTL HELE ACCD BYRN RGP
1443225074392240134,2021-09-29 14:44:06+00:00,58,21,earnings after the close today and before the open tomorrow KMX BBBY PAYX MKC ANGO NG LNDC MLHR GNFT HNNMY
1442940085847035906,2021-09-28 19:51:39+00:00,75,18,upcoming earnings MU JBL CTAS WOR EPAC PTN CALM VWE
1442522296434966530,2021-09-27 16:11:30+00:00,61,16,Upcoming earnings ACB DAVA THO UNFI FDS SNX INFO AYTU CNXC IPW FERG
1442521446010560514,2021-09-27 16:08:08+00:00,1,1,MMJ We don t have a confirmed date for SPOT yet but likely the last week in October
1441716707719008270,2021-09-25 10:50:23+00:00,222,91,earnings for the week MU ACB DAVA KMX BBBY PAYX THO IBIO JBL UNFI FDS MKC SNX INFO CTAS WOR SANW EPAC AYTU CNXC ANGO WWE PTN JEF CALM MLHR IPW NG LNDC FERG GNFT
1441416107378704386,2021-09-24 14:55:54+00:00,28,5,IBIO amp SANW are scheduled to report earnings before the open on Monday SANW already lowered its guidance for the quarter and the stock sold off to retest its December lows but has rallied back for a potential gap fill to at least 3 15
1441047195713671169,2021-09-23 14:29:59+00:00,76,19,earnings to end the week NKE COST CCL MTN TCOM PRGS AIR CAMP AGTC RSSS INM JOBS HIVE
1440681478237474819,2021-09-22 14:16:45+00:00,71,17,earnings after the close today and before the open tomorrow BB DRI ACN RAD KBH FUL SCS DYNT
1440661372375756823,2021-09-22 12:56:52+00:00,57,17,Aurora ACB Vintage Wine VWE and now Endava DAVA have all rescheduled their earnings releases to next week That is often a warning as companies prepare to give bad news Both ACB and DAVA are showing signs of vulnerability ahead of the news
1440363304514248707,2021-09-21 17:12:27+00:00,71,14,upcoming earnings FDX ADBE SFIX GIS ISR INNV GOTU
1440000377890426887,2021-09-20 17:10:18+00:00,47,12,earnings scheduled after the close today and before the open tomorrow CBRL LEN AZO NEOG APOG ERYP IVA
1439712552880115714,2021-09-19 22:06:35+00:00,5,3,MMJ FMOC
1439196016905949186,2021-09-18 11:54:04+00:00,354,148,earnings for the week FDX NKE ADBE CBRL BB LEN COST AZO ACN DRI ACB SFIX RAD CGNT GIS NEOG KBH APOG DAVA TCOM GOTU MTN ISR INNV PRGS FUL SCS AIR VWE CAMP RSSS ERYP AGTC IVA INM
1437800538226188294,2021-09-14 15:28:56+00:00,38,11,earnings after the close today and before the open tomorrow JKS WEBR ASPU SKIL IBEX KSPN HITI EWCZ IPHA
1437415962114936839,2021-09-13 14:00:45+00:00,41,14,earnings after the close today and before the open tomorrow FCEL ORCL ALOT MYTE VOLT AVO RFIL UEPS SEAC MTRX CSBR CNM MXCT EPM BROG
1436652211925307400,2021-09-11 11:25:53+00:00,191,84,earnings for the week FCEL ORCL JKS ALOT MYTE NSSC VOLT UEPS ASPU AVO MTRX RFIL SEAC IBEX SKIL MANU WEBR CNM MXCT KSPN CSBR EWCZ HITI BROG EPM IPHA
1436324875313065989,2021-09-10 13:45:10+00:00,30,7,NSSC is scheduled to report earnings before the market opens on Monday
1436042986115289093,2021-09-09 19:05:02+00:00,33,4,KR amp BYSI are scheduled to report earnings before the open tomorrow
1436038038770143234,2021-09-09 18:45:23+00:00,46,10,Bigger than usual earnings moves today from AVAV LULU LOVE CDMO HQY
1435960597896704001,2021-09-09 13:37:40+00:00,62,17,earnings scheduled after the close today AFRM ZS PLAY AOUT ZUMZ AMRK VRNT FARM SUMO KLXE RXST MMMB PWSC COOK VNCE CXM LPTH RLGT LAKE
1435920807809753089,2021-09-09 10:59:33+00:00,34,6,Remember when everyone thought COVID was over and Quest Diagnostic s DGX earnings would return to pre pandemic levels Looks like there is still room for short interest to return to pre pandemic levels now that we know otherwise
1435632201870323717,2021-09-08 15:52:44+00:00,61,23,earnings scheduled before the open tomorrow ASO LOVE JG BIOX RSKD SOPH TUEM LICY BUR
1435610742695280640,2021-09-08 14:27:28+00:00,78,24,earnings after the close GME LULU RH CPRT ABM S CDMO AVAV HQY DSGX BBCP CVGW
1435240894492553224,2021-09-07 13:57:49+00:00,57,18,upcoming earnings AFMD COUP PATH CASY KFY GENI DADA REVG SMAR CTK DLNG MLNK WDH
1435240219075387392,2021-09-07 13:55:08+00:00,1,1,We don t have analyst coverage for TIGR so it isn t included on this graphic but it is in our calendar and confirmed
1434846327406567424,2021-09-06 11:49:57+00:00,158,31,Upcoming earnings releases with the highest volatility FARM DADA AOUT GME GENI ZUMZ ZS SUMO CDMO LOVE VRNT PATH ABM RH AFRM CVGW SMAR PLAY
1434115504105533443,2021-09-04 11:25:55+00:00,325,150,earnings for the week GME LULU ASO COUP RH AFRM AFMD ZS PATH KR CNTG CASY LOVE KFY PLAY GENI REVG CPRT SMAR DADA CMCM JG CTK ABM BIOX S ZUMZ AVAV HQY CDMO DSGX AOUT CVGW AMRK VRNT FARM DLNG BBCP MLNK RXST SUMO
1433511525478764551,2021-09-02 19:25:55+00:00,36,10,Bigger than usual earnings moves today from NCNO ASAN FIVE PHR SMTC SWBI MEI CHWY AEO DCI CHPT VEEV
