id,created_at,favorite_count,retweet_count,text
1604869400707960835,2022-12-19 16:00:56+00:00,31,7,earnings after the close today and before the open tomorrow HEI GIS SCS FCEL ISPO FDS EMBC CGNT
1604821654617886720,2022-12-19 12:51:13+00:00,37,10,Investor sentiment remains below its August levels as a whole SPY SPX but not for Consumer Staples XLP with GIS reporting earnings before the open tomorrow
1604499536935804928,2022-12-18 15:31:14+00:00,0,0,just something for the kids
1604496317312442369,2022-12-18 15:18:26+00:00,80,12,The week ahead
1604097909691224065,2022-12-17 12:55:19+00:00,352,155,earnings for the week NKE FDX GIS CCL MU RAD FCEL KMX FDS TTC BB PAYX CTAS HEI SCS AIR EMBC APOG CAMP CGNT CVGW QIPT EPAC BLIN EMKR WOR AVO ISPO LMNR MLKN JOB VVOS KNW
1603424522765754368,2022-12-15 16:19:31+00:00,39,7,earnings to end the week ADBE ACN NX DRI WGO
1603408596263477248,2022-12-15 15:16:13+00:00,0,0,trader90 The point is that when Tech rallies it unwinds the long Energy short Tech trade which has been among the best trades of 2022 so you can t buy Energy while Tech is rallying
1603406792813416448,2022-12-15 15:09:03+00:00,89,19,ARKK buyers at 35
1603056201041952771,2022-12-14 15:55:56+00:00,50,12,earnings after the close today and before the open tomorrow LEN JBL TCOM NDSN CLSK RICK PL LIVE TRIB IPA
1603051880187297795,2022-12-14 15:38:46+00:00,34,2,How to be long Energy XLE while Tech XLK is rallying in the current environment
1602815490065309696,2022-12-13 23:59:26+00:00,0,0,
1602791353104191498,2022-12-13 22:23:31+00:00,0,0,
1602680142194778112,2022-12-13 15:01:36+00:00,2,0,we made it on Saturday
1602679190561722371,2022-12-13 14:57:50+00:00,0,0,it s there It s fillable Might take awhile though and another earnings release Statistically the stock should show relative strength up until it s next earnings release Technically our trade was the 331 gap fill The next gap is still 50 away
1602675745305903109,2022-12-13 14:44:08+00:00,47,6,NFLX gap has been filled You can go home now
1602675025357725696,2022-12-13 14:41:16+00:00,32,4,upcoming earnings STNG PHX ABM WEBR REVG BRZE ASPU ARQQ LPTV
1602550351198044161,2022-12-13 06:25:52+00:00,57,7,it is interesting that the leaders are the most hated XLE XOM CVX SLB COP
1602437493701361669,2022-12-12 22:57:25+00:00,0,0,Sorry just double checked this We moved to primarily trading long after earnings at the end of February but we had a couple of more shorts in May
1602436128921247745,2022-12-12 22:51:59+00:00,0,0,Good luck If you ll recall from when you subscribed we trade after earnings based on overall conditions amp w market sentiment so low we are not currently shorting after earnings In fact with the exception of AAPL and MSFT in the Spring those results are all long trades
1602431585143373825,2022-12-12 22:33:56+00:00,0,0,Our after the news trade results in 2022 are up 55 while the S amp P 500 is down 17 and this doesn t include DOCU and AVGO which were closed today
1602430440614379521,2022-12-12 22:29:23+00:00,1,0,The beat the consensus estimate They missed the Earnings Whisper The grades are low because they all reported weak earnings ORCL may be the exception but they still missed while expectations were at a multi year high Probably shouldn t chase the move higher after hours
1602426205025828865,2022-12-12 22:12:33+00:00,0,0,Granted this is a small sample companies reported after the close today but who do you have that is more accurate
1602378212088205315,2022-12-12 19:01:51+00:00,47,15,earnings after the close today and before the open tomorrow ORCL PLAB CNM FLNC JOAN BLBD MMMB APDN VNCE MESA
1601957908924751872,2022-12-11 15:11:43+00:00,82,10,A preview for the week of December 12 2022
1601565806042959872,2022-12-10 13:13:38+00:00,17,1,JBL DRI CNM LEN
1601565659569455105,2022-12-10 13:13:03+00:00,19,2,ORCL ADBE COUP ACN
1601565431520964608,2022-12-10 13:12:09+00:00,261,145,earnings for the week ORCL ADBE COUP UTI ACN JBL DLNG PLAB DRI CNM LEN FLNC PHX BLBD JOAN NOTV MMMB WEBR MESA APDN REVG WGO BRZE ABM RICK TCOM CLSK ASPU STNG VNCE PL NDSN NX ARQQ IPA LPTV LIVE
1601300638087802881,2022-12-09 19:39:57+00:00,19,3,UTI and DLNG are scheduled to report earnings before the open on Monday
1600885956869033985,2022-12-08 16:12:09+00:00,61,18,earnings to end the week COST LI LULU DOCU AVGO CHWY RH MANU DOMO MTN COO PHR CURV CMTL LAKE
1600867617102872576,2022-12-08 14:59:17+00:00,5,1,
1600866380705775618,2022-12-08 14:54:22+00:00,11,1,BILI
1600848469551648774,2022-12-08 13:43:12+00:00,70,9,Just think how much money everyone is going to make once SPY falls below 390
1600603027290947586,2022-12-07 21:27:54+00:00,104,5,DJIA was up 1 58 0 00 We know what you are thinking
1600501370108448778,2022-12-07 14:43:57+00:00,47,12,upcoming earnings GME AI EXPR CIEN GMS GEF MOMO RENT KFY VRNT OXM LQDT SPWH HCP DSGX HOV NAPA CULP
1600454755741933568,2022-12-07 11:38:43+00:00,30,5,First time giving guidance since 2014 and THO gives us a buck thirty range
1600150475235467264,2022-12-06 15:29:37+00:00,48,20,earnings after the close today and before the open tomorrow MDB ASO PLAY CPB S LOVE CASY OLLI SWBI TOL UNFI HQY SFIX THO GWRE VRA AVAV ZUO CXM BF B CDMO WLY SKIL ZFOX
1600142628812599296,2022-12-06 14:58:26+00:00,42,10,It s like d j vu all over again
1599813076143853569,2022-12-05 17:08:55+00:00,56,15,upcoming earnings AZO GTLB SIG HEPS BASE CONN SUMO FERG JILL WDH ALCO LILM KVHI
1599749207875031040,2022-12-05 12:55:07+00:00,2,1,Come Check This by FETISH good luck
1599428026550595584,2022-12-04 15:38:52+00:00,99,14,Preview of the week ahead
1599094164649451520,2022-12-03 17:32:13+00:00,1,1,Companies report earnings throughout the quarter but earnings season is about a four week period it varies shortly after the calendar quarter ends when the majority of companies report results You can generally think of it as the period between JPM s earnings and CSCO s
1599043785245093888,2022-12-03 14:12:01+00:00,24,6,Charts for AVGO SAIC MDB GME
1599043196621058048,2022-12-03 14:09:41+00:00,34,5,Charts for COST AZO LULU DOCU
1599041897997119488,2022-12-03 14:04:31+00:00,364,193,earnings for the week COST AZO LULU DOCU GME VERU MDB SAIC DLHC AVGO CHWY S SIG GTLB LI PLAY ASO RH SWBI HEPS CASY LOVE BASE ICCM CPB EXPR CONN CIEN OLLI AI SUMO RGCO DOMO HGY UNFI SFIX GWRE JILL VRA MANU GEF
1598772512086757390,2022-12-02 20:14:05+00:00,41,12,Monday morning earnings VERU SAIC DLHC ICCM RGCO
1598770627241918464,2022-12-02 20:06:35+00:00,51,3,Unch Thanks for playing
1598670389940559872,2022-12-02 13:28:17+00:00,19,2,AEM is up 27 but little suggests the move is over yet
1598432349343064092,2022-12-01 21:42:24+00:00,1,1,htx Yet it is still so hated
1598429411535392768,2022-12-01 21:30:43+00:00,7,2,probably not from ZUMZ though
1598374539972354048,2022-12-01 17:52:41+00:00,62,20,upcoming earnings ULTA CHPT MRVL ZS CBRL ASAN PATH VEEV AMBA SMAR PD EH SOL GCO AOUT TLYS ZUMZ ARCE CLIR IOT
1598374465259425792,2022-12-01 17:52:23+00:00,1,1,Toro Diablo That s what our website is for
1598328775300743169,2022-12-01 14:50:50+00:00,22,1,So for everyone that has asked how to read our charts these stocks are down an average of 8 5 in early trading today BIG TD BMO CM DLTH LE SCWX trendisyourfriend
1598321807672705029,2022-12-01 14:23:08+00:00,22,1,FIVE failed to go to new lows on weak results last Q while short interest was high Now it is gapping higher 10 on earnings which has generally been overexcitement that takes a week to work off before closing higher on the month 73 of the time
1598173486614474752,2022-12-01 04:33:46+00:00,54,10,maybe just maybe you are getting clothes for Christmas this year ANF AKA AEO ROST URBN
1598043092288176130,2022-11-30 19:55:38+00:00,6,1,Toro Diablo We aren t Sounds like you don t understand what we do
1597995286454239232,2022-11-30 16:45:40+00:00,19,2,FYI you might get lucky buying BIG TD BMO CM DLTH LE or SCWX ahead of earnings but both the fundamental and price trends are down for these and most of the time such trends will continue against you Stick with strength
1597993843030642689,2022-11-30 16:39:56+00:00,48,18,earnings before the open tomorrow DG KR BIG TD BMO DBI CM DLTH LE PDCO MEI SCWX BQ REX GIII
1597964135463276544,2022-11-30 14:41:53+00:00,60,25,earnings after the close SNOW CRM SPLK OKTA FIVE PSTG BOX SNPS VSCO ESTC NTNX NCNO PVH LZB OOMA SMTC ASYS GNSS YEXT CRDO
1597708919056773121,2022-11-29 21:47:44+00:00,3,1,There aren t a lot of examples so far but CRWD has continued lower 75 of the time from its open until a week later with an average decline of 5 2 FWIW
1597642375370637312,2022-11-29 17:23:19+00:00,4,1,can t just be
1597641154170097664,2022-11-29 17:18:28+00:00,82,12,Gotta say it is impressive how you keep buying ARKK at 35
1597613613480833027,2022-11-29 15:29:02+00:00,32,9,It is interesting how little interest there is in TITN and DCI ahead of earnings XLI industrial
1597609736555626496,2022-11-29 15:13:38+00:00,66,14,upcoming earnings CRWD INTU WDAY XPEV WOOF HPE FRO DOOO HRL NTAP GNS BBW NAT RY TITN RNLX LESL CMP CANG STIX and DCI KNOP BEKE ZH SFL
1597260393990479872,2022-11-28 16:05:28+00:00,56,20,earnings after the close today and before the open tomorrow BILI BNS HIBB SJR CTRN ARWR BZUN SFET ESLT AZEK CRNC YTRA YY BZ
1597214384711143425,2022-11-28 13:02:38+00:00,82,20,Earnings season is over If you were short anything chances are you were wrong because most were short just about everything going into earnings BLK LRCX ETSY UHS UAA ISRG FCX WBA AMD GS RL NFLX IPG BKR EFX BA UAL AOS MCHP VTR
1596506662688342016,2022-11-26 14:10:24+00:00,466,205,earnings for the week PDD CRWD SNOW CRM DG KR XPEV CHPT ULTA HTHT MRVL INTU WDAY BILI WOOF GNS SPLK BIG FRO OKTA AVXL HIBB BNS ZS HPE HRL PSTG DOOO RNLX BBW SJR FIVE TITN TD ARWR NTAP SNPS BMO VSCO BOX RY VEEV
1596159785040502785,2022-11-25 15:12:02+00:00,54,16,Monday morning earnings PDD HTHT AVXL HTOO
1595436350974660610,2022-11-23 15:17:22+00:00,35,11,A couple more earnings this week LU BMA
1595285521726689286,2022-11-23 05:18:02+00:00,91,15,What s the opposite of catching a falling knife Asking for a friend SPX SPY VIX
1595147464516173824,2022-11-22 20:09:26+00:00,29,4,BP oops
1595101634023100420,2022-11-22 17:07:19+00:00,42,9,pre holiday earnings DE JWN ADSK HPQ GES KC BBAR VNET
1595084584475148290,2022-11-22 15:59:34+00:00,21,2,AEM is up 20 since short sellers jumped in but they aren t gone yet and there s room to go
1594773257869266955,2022-11-21 19:22:28+00:00,70,25,earnings before the open tomorrow DLTR BBY DKS BIDU CSIQ ADI BURL ADT JACK ANF AEO VIPS CHS AMWD DY IQ WMG MOV CD CAL TNP ROAD IMBI KMDA YSG CNF NM SGHC TDCX
1594752231458623490,2022-11-21 17:58:55+00:00,54,20,earnings after the close ZM DELL A URBN ZTO GDS AFYA NOAH GBDC API SNEX MMS SYM RVYL ERYP FANH ENTA CENT
1593974654737285121,2022-11-19 14:29:06+00:00,284,141,earnings for the week BBY FUTU NIU DLTR ZM SJM DKS DE BIDU J DELL DOYU CSIQ ITRN ADI PGRU MDT A BURL ADSK ANF JACK URBN JWN ASEO HPQ VIPS ZTO AMWD CHS DY WMG GDS MOV IQ TNP NOAH CAL AFYA CD KC ROAD RVYL FANH
1593691490961735684,2022-11-18 19:43:55+00:00,60,13,Monday morning earnings FUTU NIU SJM DOYU J PGRU
1593353513626750977,2022-11-17 21:20:55+00:00,0,1,not bad eh
1593309002875736070,2022-11-17 18:24:03+00:00,0,1,SGML hasn t scheduled earnings yet so that s just an estimate
1593296343421911042,2022-11-17 17:33:44+00:00,44,13,Friday morning earnings JD FL TWST BKE SPB
1593279967571443715,2022-11-17 16:28:40+00:00,69,25,earnings after the close PANW AMAT GPS ROST WSM STNE FTCH CLFD KEYS GAMB GLOB WWD DADA POST HAYN AMSWA DLB BRBR ESE MATW UGI DLA NGVC
1593246996642816001,2022-11-17 14:17:39+00:00,38,7,Just trade these lines for CSCO and M but with a long bias
1593008125275406337,2022-11-16 22:28:28+00:00,1,1,We posted adjusted EPS The revenue is in the link
1592996589684940800,2022-11-16 21:42:38+00:00,2,1,traders NVDA has opened higher 60 of the time when it provided guidance in line with consensus estimates
1592993784316702720,2022-11-16 21:31:29+00:00,2,1,This is basically in line with expectations as we discussed on Monday at We need to see where it opens tomorrow if it sets up for our trade scenario though
1592992868192636929,2022-11-16 21:27:50+00:00,81,10,NVDA guidance calculates to earnings of 0 76 to 0 86 per share in line with the consensus estimate of 0 76 per share
1592943112858451968,2022-11-16 18:10:08+00:00,71,23,earnings before the open tomorrow BABA M BJ KSS DOLE NTES WB DSX JMIA DESP BRC PLCE EVGN CINT CAMT BV NJR SIEGY DAO CLBT
1592915944757948418,2022-11-16 16:22:10+00:00,78,16,earnings after the close NVDA CSCO SBLK SONO BBWI SQM HP GLBE CRMT KLIC CPA BOWL LX HI IIIV EZPW EDAP PFLT PNNT CPRT ZENV MOR
1592879395949400069,2022-11-16 13:56:56+00:00,57,10,How it started vs how it s going RetailSales
1592857317435133953,2022-11-16 12:29:12+00:00,28,3,timing is everything EURUSD SRAD
1592633910034591744,2022-11-15 21:41:28+00:00,37,6,AAP reminding us that laggards in a strong industry are still laggards for a reason
1592575359945277440,2022-11-15 17:48:49+00:00,68,22,earnings before the open tomorrow TGT ZIM LOW TJX ARCO GLNG TCEHY ONON GRAB MCG BNR UCL SRAD REE BWAY SR LX CDRO OTMO SCVL
1592547848000000007,2022-11-15 15:59:29+00:00,10,3,We left off TTCF from this list
1592544859717783553,2022-11-15 15:47:37+00:00,51,14,earnings after the close AAP GSM ATRO LVLU PAVM IBEX QUIK RNW NVGS BLBX ATTO VREX SMWB ALVO TMC
1592515900623945729,2022-11-15 13:52:32+00:00,23,6,prices getting passed along helps make sense of XLI ppi vs cpi
1592511023030095872,2022-11-15 13:33:09+00:00,27,1,WIRE looks like somebody might be wrong
1592234722562027520,2022-11-14 19:15:14+00:00,85,22,earnings before the open tomorrow WMT HD SE DNUT TME ENR ARMK VVV AFMD GP DAVA HUYA BERY WKME AQUA ONEW ISUN CWCO ECC CRLBF VNRX BPTH EXAI ALLT BLRX MDWD QH
1592219360315441152,2022-11-14 18:14:12+00:00,34,5,the easy part of the DXY USDJPY trade is over and potentially those that benefited from it AFL
1592202952345014273,2022-11-14 17:09:00+00:00,66,3,NFLX
1592178859717558272,2022-11-14 15:33:16+00:00,66,31,earnings after the close NU DNA POWW XELA DLO HPK VLTA ASTS FUV SHLS AEMD JJSF CSSE WTER BRDS EGAN IPW DRIO GAN SOLO BZFD CBAY QRHC AXDX WLMS NRDY REPX EGLX ACRX DRTT BIOR RMR AZTA CGRN VERB MOTS HYRE LUCD ADMP
1592152667564179456,2022-11-14 13:49:11+00:00,53,17,a lot of bounces off the bottom this earnings season with MGNI USER TGTX GLYC GRWG seeing the biggest gains since reporting results Other large moves have come from APPS BAND VAPO UFAB CLVS RPAY EVER RDFN TLS OPRT RYAM NEO APYX TSP
1591741192454246401,2022-11-13 10:34:08+00:00,0,1,After the close on 11 14
1591468300063887362,2022-11-12 16:29:45+00:00,5,1,It s a little upsetting you aren t a paying customer but otherwise we re good
1591427912347140097,2022-11-12 13:49:16+00:00,4,1,XPEV doesn t report this week
1591415087801454592,2022-11-12 12:58:18+00:00,654,284,earnings for the week NVDA WMT BABA HD ZIM TSN TGT SNDL SE PANW AMAT MNDY LOW CSCO JD M TSEM SBLK DNUT YOU FREY TJX KSS NU BJ JAGX FL DNA ESEA IMCC BITF IMPL AKTS OTLY CAN NOVN AAP NTIC QFIN ACM SONO FTCH TME
1591155851280412674,2022-11-11 19:48:11+00:00,0,1,
1591152772732571648,2022-11-11 19:35:57+00:00,0,1,
1591152685843378177,2022-11-11 19:35:37+00:00,0,0,We only include companies with analyst coverage in these graphics
1591097765240901635,2022-11-11 15:57:23+00:00,69,30,Monday morning earnings TSN SNDL MNDY FREY TSEM YOU OTLY IMCC BITF EAEA NOVN ACM MASS ARBE IMPL KERN CAN HOOK TWKS JAGX QFIN CAAS NTIC VRDN RMTI ORTX VNTR PDSB ALIM TCRT ROIV SOHU AMPS ADN MNSO HCDI BGRY XRAY
1591087505473871872,2022-11-11 15:16:36+00:00,1,1,Agreed Earnings have been trending higher for four quarters in a row and the stock has been rangebound for three Its time is coming but probably not yet
1591081712129552389,2022-11-11 14:53:35+00:00,28,2,OPRT is up 45 since this tweet 8 fills the gap Does it get filled today
1591076777182445568,2022-11-11 14:33:59+00:00,4,0,Margin expectations are near record lows outside of a recession and the stock has stopped going lower despite weak earnings last quarter We wouldn t get carried away here but this leans bullish ahead of earnings particularly if it holds 11 50
1591074278652653569,2022-11-11 14:24:03+00:00,1,1,
1591066302889615361,2022-11-11 13:52:21+00:00,37,5,something s different going into GPS earnings next week
1590750889178173441,2022-11-10 16:59:01+00:00,42,15,Friday morning earnings AQN PLXP BBDC RGF STRR CRKN ORLA CMMB ADXN CTV DDL IMV
1590736540916817920,2022-11-10 16:02:00+00:00,2,1,TOST
1590727205214384128,2022-11-10 15:24:54+00:00,2,1,you weren t the only one
1590721141555204097,2022-11-10 15:00:48+00:00,62,34,earnings after the close MTTR ACB DOCS PHUN POSH FIGS TOST DUOL KRUS COMP MAXN UGRO INDI SWIR BZH LFG FLO LZ AVPT BEEM BRLT EDR VTRU MCW AKA ITUB LIDR GOCO STN HIPO CODX EXFY SIEN AGTI DAVE AFIB ATHX CDRE AIRG
1590547534904438785,2022-11-10 03:30:57+00:00,2,1,TSLA is hated
1590544163933949957,2022-11-10 03:17:34+00:00,4,2,Why
1590543691541663744,2022-11-10 03:15:41+00:00,3,0,close but AMC is just disliked not hated
1590542888622252033,2022-11-10 03:12:30+00:00,0,0,insurance stocks don t quite meet those criteria but there are worse industries
1590512151764299777,2022-11-10 01:10:21+00:00,1,1,well they re hated at least
1590511520588627969,2022-11-10 01:07:51+00:00,2,2,dude you re doing it wrong
1590509470966509569,2022-11-10 00:59:42+00:00,137,13,thinking about how to trade CPI tomorrow talkingourbook
1590417311760265217,2022-11-09 18:53:30+00:00,2,1,how about CELH
1590400358685507584,2022-11-09 17:46:08+00:00,68,29,earnings before the open tomorrow NIO AZN YETI SIX RL WIX WE AZUL TPR HUT YPF LEV NNOX NICE BAM PSFE USFD MT HNST WRBY HIMX BDX WRK ALT TDG GENI JB CAE BIOX PGTI BXSL UTZ PRMW BHIL KELYA SBH MNMD BRAG EYE SSYS
1590391858332856320,2022-11-09 17:12:21+00:00,73,23,earnings after the close RIVN BYND U APPS BROS WYNN CELH CPNG BMBL VET RNG WISH ADMA MMAT ZIP APP CANO KGC MGNI RDFN CPRX BGS PAAS GOEV MQ DM IDEX RKLB NGL GNK SB VZIO JAZZ FICO REI BARK UHAL PRTS PLBY ROOT
1590358109276753920,2022-11-09 14:58:15+00:00,125,8,SPX at 3 800 again
1590067984633995264,2022-11-08 19:45:24+00:00,85,27,earnings before the open tomorrow RBLX TTD CGC DHI WEN FVRR CPRI RMBL VFF PFGC HGV MCFT SPTN PERI AGFY INVZ ANIP MSGE GSL XERS HBI SEAS IONS WWW DIBS DHG CMAX SWX TBLA ICL STWD ABUS TH RCI XPEL TRP COHR GGB COCO
1590004063672107018,2022-11-08 15:31:24+00:00,20,3,OPRT and now the majority of all short sellers have losses in their positions squeeze
1590003095899373568,2022-11-08 15:27:33+00:00,100,42,earnings after the close DIS OXY AMC UPST PLUG LCID AFRM NVAX MARA BLNK LMND NVTA NOG GEVO ATER ARRY CLNE PUBM WTI DAR AMRS DDD CARG OVV AXON ABCL AKAM TWO HALO GDRX REAL ABST DOX VSAT ASRT EGY JKHY VLDR SFM
1589970950275354626,2022-11-08 13:19:49+00:00,42,4,Don t know who needs to hear this but most short sellers piled into OPRT below 6
1589711173959966720,2022-11-07 20:07:33+00:00,2,1,SWAV
1589708339793235968,2022-11-07 19:56:18+00:00,80,29,earnings before the open tomorrow NCLH WKHS PLNT VTNR BLDR PRTY SPWR SQSP DD COTY INSW CG RIDE NFE LITE OCGN PKI GFS KNDI MRNS CEG RETA VRTV SKIN TAC SSRM IGT MNKD NXST DBD XXII SCSC AHCO ELAN CCO PRGO LYLT NEO
1589644276073627649,2022-11-07 15:41:44+00:00,91,35,earnings after the close LYFT FANG ATVI MOS TTWO SEDG CLOV TRIP SWAV FIVN DOCN VRM VNOM MTRX GRWG PACB PETS GRPN EOSE SDC HIMS FSX AGRX CBT TWOU ASH ADTN DAC FN TASK WELL DOOR APPH FLGT AWR CENX EHTH ALTO AKYA
1589607812401106944,2022-11-07 13:16:50+00:00,0,1,If you are dealing with pre market or after hours trading the only option here is before the open on Monday
1589606517422321664,2022-11-07 13:11:41+00:00,56,11,It isn t exactly defensive when Healthcare is the laggard during earnings season VAPO LUNG DMTK ABMD SRTS RYAM BAND TSP HLX CVNA KAMN LMST NRDS FNKO TUP CROX HLF ENVX GBX GOL CYRX XPO YELL TEAM TWLO TDS VRNS
1588941577216720896,2022-11-05 17:09:27+00:00,2,1,Of the 132 companies scheduled to report after the close on Nov 7 DOCN ranks 17 based on interest among our users This calendar shows the top 10
1588897917431345155,2022-11-05 14:15:58+00:00,7,2,We regularly get people telling us we ve errored because some stock didn t make the list when there are 100s reporting which makes us quick to get defensive when someone is just drawing attention to an earnings release Of the 115 PM reports on 11 9 MMAT is 25 on our list FYI
1588892432237985792,2022-11-05 13:54:10+00:00,6,1,Fair enough please accept our apology
1588887871791853568,2022-11-05 13:36:03+00:00,9,0,and 104 other companies scheduled to report after the close on 11 9
1588880473971097600,2022-11-05 13:06:39+00:00,736,327,earnings for the week PLTR DIS OXY NCLH BNTX TTD RBLX AMC UPST NIO PLUG FANG LCID AMR NVAX RIVN VTRS KOS BRK B Sat CRON LYFT MOS CGC AFRM APRN ATVI AXSM SEDG TTWO CLOV AMG WKHS APPS NRG MARA PRTY VTNR DINO BLDR
1588520475344670720,2022-11-04 13:16:09+00:00,86,33,Monday morning earnings PLTR BNTX VTRS AMR CRON ADSM APRN KOS NRG AMG WHD DINO CGAU DK FOUR NINE HEP BLDP CRNT FNV CECE MRSN FOLD DCO CHH HAE NI GHM THS EGRX HE DKL HLIO OXSQ RBA WTRG OBSV NSSC FWRG CIO OINC
1588210572314681345,2022-11-03 16:44:42+00:00,73,17,Friday morning earnings DKNG FUBO PBR D ACMR ENB DUK CNK HSY CAH MBUU IEP AMCX BEP MGA CBOE ABR FLR NFG AXL EVRG VST GLP GTN HUN UWMC WPC ESNT ASIX IMGN RUTH BBU AES ADNT MDNA TU CNTY BCPC SAMG PPL KOP AMRX
1588188504785408002,2022-11-03 15:17:01+00:00,110,44,earnings after the close PYPL COIN SQ SBUX MELI CVNA TWLO NET EOG WBD DASH BILL EXPE STEM AMGN TEAM SPCE CTRA ILMN OPEN MP SWKS DVAX DBX AOSL RKT EGLE AMN CRSR BNGO MNST BE APPN MCHP BOOM YELP SIGA GPRO FND FDUS
1588188170813841410,2022-11-03 15:15:41+00:00,1,1,bran223 MP reports after the close today
1587843295845179393,2022-11-02 16:25:17+00:00,67,20,earnings before the open tomorrow MRNA RCL PTON DDOG COP LNG CROX BTU NKLA MAR GOLD W K PENN REGN SHAK EPAM CI UAA ADT AUPH H TEVA BHC MUR LNTH LSPD APD CMI FLWS PZZA CYBR CARS FIS WCC WLK WMS APTV SPR ZTS CMRX
1587815740782280705,2022-11-02 14:35:47+00:00,96,41,earnings after the close ROKU QCOM ETSY MRO HOOD ALB APA FTNT BKNG EBAY CF LUMN SU RIG RUN FSLY FSR NTR LAZR IIPR MGM ESTE WES ZG HUBS CPE ACLS O ELF SKLZ EVGO CCRN CLR YELL MET ALL CFLT PDCE QRVO EQIX PAA
1587772850026561538,2022-11-02 11:45:21+00:00,33,11,HUM told us back in September they were going to have good numbers so now that they have reported earnings that trade is over
1587486552808214530,2022-11-01 16:47:42+00:00,3,1,DDD is scheduled to report after the close on Nov 8
1587478048089280515,2022-11-01 16:13:55+00:00,110,34,earnings before the open tomorrow CVS GNRC HUM CVE PARA EL PGR GOOS YUM GSK ASC LIND MGY BRY FUN ENTG SABR RACE CDW EXPI GTHX ATI TUP DT VMC TT ACRE CEQP MLM ALKS HZNP EAT EDIT ROK BDC CRL SMG OSW CWEN CLH ZBH
1587453133399228417,2022-11-01 14:34:55+00:00,122,53,earnings after the close AMD ABNB DVN ET LTHM CHK EA MSTR MCK PAYC CLX CZR OKE CRK ZI MTCH MDLZ CAKE ATEN BGFV AYX SMCI AMRC PSA PRU EXEL HRB CHGG CWH AIG TRVG SKY EXR ENVX AMCR BAND FMC CRUS TA AEIS YUMC TCS
1587146586953601027,2022-10-31 18:16:48+00:00,164,47,earnings before the open tomorrow SOFI UBER PFE BP MPC LLY PSX EPD TM SUN NEM SPG CEIX SONY SIRI SYY BCRX STNG AGCO ECL SON ABMD ZBRA ETN TAP ARCB FOXA WEC MPLX AJRD KKR IT CTLT BLD AME LPX MMYT SAFE NBIX ARNC
1587115606125547520,2022-10-31 16:13:42+00:00,4,1,On this list GT is the most interesting to us
1587093974875049986,2022-10-31 14:47:45+00:00,89,28,earnings after the close today CAR NXPI ANET GT SYK WMB VAC CVI AFL AWK LSCC BSM IMAX HOLX RMBS AMKR HLF TREX SBAC SOI BCC ACHC HLIT AXNX CSWC VRNS ADUS CLW PLOW RRX CSR CHE KFRC VNO TRNS TTI CINF RHP KIDS CNO
1587032081711988741,2022-10-31 10:41:48+00:00,65,17,Most of the releases so far this earnings season have been Financials and most of the Financials have been up since reporting while the Materials have now been fading SPY SPX LMST BLK ARI WRLD HBNC SIVB MNSB CS TECK CLF CSTM TRS TROX
1586914033315287040,2022-10-31 02:52:43+00:00,0,2,BBT now that s a scary costume
1586869069436837894,2022-10-30 23:54:03+00:00,2,1,America We didn t omit it Investors have lost interest this calendar shows the top 90 out of over 1 100
1586773042033836037,2022-10-30 17:32:28+00:00,261,36,You still have time
1586700558723055616,2022-10-30 12:44:27+00:00,7,1,Masarapu America We ve confirmed 1 167 companies scheduled to report earnings this week including BKNG and EXPE This calendar shows the top 90 based on investors interest
1586333918051065857,2022-10-29 12:27:33+00:00,5,1,America No BABA hasn t scheduled earnings yet
1586333747078635522,2022-10-29 12:26:52+00:00,5,1,America There are 206 confirmed earnings releases scheduled before the open on the 3rd including REGN
1586325482227716097,2022-10-29 11:54:02+00:00,997,446,earnings for the week AMD SOFI UBER ON ROKU PFE PYPL DVN ABNB BP FUBO QCOM GPN DKNG RCL ARLP MPC COIN ET SQ PBR MRO NXPI CVS LLY XPO LNG COP CAR MRNA HOOD CROX GNRC ANET BTU DDOG ETSY PSX EPD CNA GT APA MELI
1586115550304178176,2022-10-28 21:59:50+00:00,59,16,Bigger than usual earnings moves today from DVA EGHT EW PFSI CSL DXCM GILD COHU APPF ENVA PTCT KNSL NMRK TBBK PMT LOPE DRQ TFSL EBC ZYXI BIO CMLS VRTX PFS TAL AAPL HTBK AX VRSN FHI PFG LYB IMO NVT AB MERC GLPI INTC
1586032865292079105,2022-10-28 16:31:16+00:00,25,1,Remember that one time when SYK lowered guidance but the stock gapped higher on the news and then subsequently put in a higher low during the quarter
1586030634593845249,2022-10-28 16:22:24+00:00,65,21,Monday morning earnings ON ARLP GPN XPO CNA SAIA NSP SXC SBT JELD ALX HWM PEG RNLX
1586030399389831168,2022-10-28 16:21:28+00:00,2,0,We have a link to it in our newsletter at
1585937089686040576,2022-10-28 10:10:42+00:00,11,3,
